id,media_name,media_url,title,publish_date,url,language,indexed_date
1947e39cce1a863cf2f6f74bcb8492af46020298c354eca3a8400d1a254a0679,variety.com,variety.com,‘The Fall Guy’ Writer Details How Hollywood’s Biggest Stunts Inspired the Movie: ‘We Are Unashamedly Playing the Hits’,2024-04-30,https://variety.com/2024/film/features/fall-guy-writer-drew-pearce-ryan-gosling-impact-1235981471/,en,2024-04-30 17:30:25.934852
20afe7ee495d4eb59d7da4b8e91aef39e1474c016649500e37fbf8e7c7b9fa09,pjmedia.com,pjmedia.com,Dems and Their Lawless Judiciary Psychopaths Are Determined to Make Trump a Living Martyr,2024-04-30,https://pjmedia.com/stephen-kruiser/2024/04/30/dems-and-their-lawless-judiciary-psychopaths-are-determined-to-make-trump-a-living-martyr-n4928657,en,2024-05-01 08:17:40.237298
18fcfd9e94ddf65f3d27cc11b52fbb0743c7afc9a217fbceaed80680b4dd684a,cleveland.com,cleveland.com,"Cleveland Guardians, Houston Astros series preview, pitching matchups",2024-04-30,https://www.cleveland.com/guardians/2024/04/cleveland-guardians-houston-astros-series-preview-pitching-matchups.html,en,2024-04-30 10:33:09.868425
c99fd416c6f4aa83102bafd42f8951694ffb9a3134cceab9873ba6d03fcf56b9,usmagazine.com,usmagazine.com,Vanderpump Rules’ Raquel Leviss Seeing Matthew Dunn After Scandoval,2024-04-30,https://www.usmagazine.com/celebrity-news/news/vanderpump-rules-raquel-leviss-seeing-matthew-dunn-after-scandoval/,en,2024-05-01 03:18:50.877795
e41c75cd85814d7ef8da8b1ef8d133c8432f3b1f91c60de438f05f16700af3fa,businessinsider.com,businessinsider.com,"Barbra Streisand asked Melissa McCarthy whether she used Ozempic, sparking a backlash from fans",2024-04-30,https://www.businessinsider.com/barbra-streisand-melissa-mccarthy-ozempic-fan-backlash-2024-4,en,2024-04-30 12:24:29.932005
a6c87201911776889d8f464038e938d797b14bc2e044e09dc8b2224e6375d702,cbssports.com,cbssports.com,"Cavaliers vs. Magic odds, score prediction, time: 2024 NBA playoff picks, Game 5 best bets from proven model",2024-04-30,https://www.cbssports.com/nba/news/cavaliers-vs-magic-odds-score-prediction-time-2024-nba-playoff-picks-game-5-best-bets-from-proven-model/,en,2024-04-30 23:32:02.164873
264faa3e80feabf89748ac8948c3cadf170bf678d0cd9527ca56f0d86901e3b4,benzinga.com,benzinga.com,Delos Insurance and Lloyd's of London Insurer Partner to Expand Vacant Home Insurance in California,2024-04-30,https://www.benzinga.com/pressreleases/24/04/n38516721/delos-insurance-and-lloyds-of-london-insurer-partner-to-expand-vacant-home-insurance-in-california,en,2024-04-30 18:35:04.763019
410fad10ac990b1e950b255a6f402aa19dd1008d8d15b111c5aa7eb5b8695a06,sportingnews.com,sportingnews.com,Detroit Lions' cap space going into post-NFL Draft free agency,2024-04-30,https://www.sportingnews.com/us/nfl/news/detroit-lions-cap-space-nfl-free-agency-post-draft/93879e77be3c32acc2b028b0,en,2024-04-30 13:27:54.347717
576922a0f04d6aff0fc5d74d13d1677f330ac9731b0a2651da502ad0ad97fcb4,forbes.com,forbes.com,"Why People Hide Their Debt, Its Dangers, And 5 Steps To Recovery",2024-04-30,https://www.forbes.com/sites/truetamplin/2024/04/30/why-people-hide-their-debt-its-dangers-and-5-steps-to-recovery/,en,2024-04-30 19:18:42.784388
5dd762008afa030e90c05a52106a7f17adf28f98567759eda1e949a39f551b26,foxsports.com,foxsports.com,Why LeBron James will remain a Laker next season and beyond,2024-04-30,https://www.foxsports.com/watch/fmc-taw480hw6qnww273,en,2024-04-30 23:26:40.927969
2d6d0ac5785bbde5c7b7bda88565aaeedb79183d2c814d3dd3a904af5abeb3e5,benzinga.com,benzinga.com,"AUTODESK SHAREHOLDER ALERT BY FORMER LOUISIANA ATTORNEY GENERAL: KAHN SWICK FOTI, LLC REMINDS INVESTORS WITH LOSSES IN EXCESS OF $100,000 of Lead Plaintiff Deadline in Class Action Lawsuit Against Autodesk, Inc. - ADSK - Autodesk (NASDAQ:ADSK)",2024-04-30,https://www.benzinga.com/pressreleases/24/04/g38539965/autodesk-shareholder-alert-by-former-louisiana-attorney-general-kahn-swick-foti-llc-reminds-invest,en,2024-05-01 03:21:58.773468
b1cbdc2f01f9fba4560369ea26c7903e5ff60e30074694175d827eab9618be3f,startribune.com,startribune.com,"A gunman kills 6 worshippers inside a Shiite mosque in western Afghanistan, the Taliban say",2024-04-30,https://www.startribune.com/a-gunman-kills-6-worshippers-inside-a-shiite-mosque-in-western-afghanistan-the-taliban-say/600362632/,en,2024-04-30 09:17:18.297876
9a02ae8b9277723c3e422039a8ad78012da35fb2a281b690ab184fc9e53d27b1,bleacherreport.com,bleacherreport.com,Video: Xavier Worthy Gets Chiefs Tattoo After Being 2024 NFL Draft 1st-Round Pick,2024-04-30,https://bleacherreport.com/articles/10119328-video-xavier-worthy-gets-chiefs-tattoo-after-being-2024-nfl-draft-1st-round-pick,en,2024-04-30 23:26:31.506602
61e4a70452dea7e14c9e7862c23fe99d2e0b7e727a33f6fc593d407547862490,staradvertiser.com,staradvertiser.com,Regular mammograms urged for all women ages 40 to 74,2024-04-30,https://www.staradvertiser.com/2024/04/30/breaking-news/regular-mammograms-urged-for-all-women-ages-40-to-74/,en,2024-05-01 03:24:21.634825
b276fc1dfbd51a7a9eb7425f7f7ccc08a2b0581ee7c2c6540d8be48c11589b38,schwartzreport.net,schwartzreport.net,The meat industry’s war on wildlife,2024-04-30,https://www.schwartzreport.net/2024/04/30/the-meat-industrys-war-on-wildlife/,en,2024-04-30 20:43:50.993030
06c1b20c13c99d5bd9cde45e220fc83c4600a78891c8e4527efec732d989d59e,abcnews.go.com,abcnews.go.com,Takeaways from the start of week 2 of testimony in Trump's hush money trial,2024-04-30,https://abcnews.go.com/Politics/wireStory/takeaways-start-week-2-testimony-trumps-hush-money-109806214,en,2024-05-01 05:21:43.650561
15ff3110716080b93d0cd740aaf4fe2a9713f3267fcdb2ce2a5c3b0770c1ac35,benzinga.com,benzinga.com,Looking Into Camden Prop Trust's Recent Short Interest,2024-04-30,https://www.benzinga.com/insights/short-sellers/24/04/38520735/looking-into-camden-prop-trusts-recent-short-interest,en,2024-04-30 14:25:32.989210
2e3fa04c8ca9eff1c41bd9ce5c56a80049c24e541d3a28eb2ef2798b011bbd6f,businessinsider.com,businessinsider.com,The cancer-stricken winner of the $1.3 billion Powerball jackpot in Oregon will get a $422 million lump-sum after taxes and says he'll keep playing the lottery,2024-04-30,https://www.businessinsider.com/winner-jackpot-cheng-saephan-cancer-battle-gets-422m-2024-4,en,2024-04-30 06:20:16.225994
16ecb1e15e3afc786394e440929921b5f5e6237c9ee5085e2c79ea55382e20f3,navytimes.com,navytimes.com,"Burn pits increased risk of asthma, heart problems, new DOD data shows",2024-04-30,https://www.navytimes.com/veterans/2024/04/30/burn-pits-increased-risk-of-asthma-heart-problems-new-dod-data-shows/,en,2024-04-30 20:35:42.811521
e1b4cae609abd7805d78fa5f0a0cc54ffa02e4b8e8ef6a27b4122b34088d7665,dailycaller.com,dailycaller.com,Biden Admin Locks In Regulations Targeting Appliance Owned By ‘Almost Every US Household’,2024-04-30,https://dailycaller.com/2024/04/30/biden-admin-finalizes-water-heater-regulations/,en,2024-04-30 21:32:54.232748
e576dcdbcc9938b85ce303d6b0f444ef01e3c577165c0f97669b5dca885c22e6,benzinga.com,benzinga.com,Celebrate National Barbecue Month with the Flavors of Dickey's Barbecue Pit,2024-04-30,https://www.benzinga.com/pressreleases/24/04/g38531143/celebrate-national-barbecue-month-with-the-flavors-of-dickeys-barbecue-pit,en,2024-05-01 01:26:46.561960
ff8ed72349fee5901f197e77f4e760b911bd1d60df8fa323bab41d616c67cd72,nj.com,nj.com,"Knicks blow late leads, fall to Tyrese Maxey, Sixers in Game 5",2024-04-30,https://www.nj.com/sports/2024/05/knicks-blow-late-leads-fall-to-tyrese-maxey-sixers-in-game-5.html,en,2024-05-01 03:18:03.439181
ca089845661d3029c239fbbb0e4d3cc7fae1f146509c7ba60248752b58f0c344,newyorker.com,newyorker.com,"Daily Cartoon: Tuesday, April 30th",2024-04-30,https://www.newyorker.com/cartoons/daily-cartoon/tuesday-april-30th-challengers-tennis-ball,en,2024-04-30 23:24:08.564615
b97848f1d8ff2484c33e8e8ebd47e36045cf323e550f26af6681fe1b781122ae,politicalwire.com,politicalwire.com,RFK Jr.’s Fans Revel In the Attacks,2024-04-30,https://politicalwire.com/2024/04/30/rfk-jr-s-fans-revel-in-the-attacks/,en,2024-04-30 14:19:32.641413
608ccb73e8116e714ffd37e0bd4c1e3b263602faeb73eda795dc7c5549fe5619,theguardian.com,theguardian.com,Royal Ballet and Opera announces ambitious 2024-25 season – and name change,2024-04-30,https://www.theguardian.com/culture/2024/apr/30/royal-ballet-and-opera-announces-ambitious-new-season-and-name-change-2024-25#new_tab,en,2024-04-30 19:32:30.025064
26a0198f46bc0188b41d04d349886d1a593e6dd50e9d4f46b8288aa11384b7be,theconversation.com,theconversation.com,"What are heart rate zones, and how can you incorporate them into your exercise routine?",2024-04-30,https://theconversation.com/what-are-heart-rate-zones-and-how-can-you-incorporate-them-into-your-exercise-routine-228520,en,2024-04-30 12:20:24.075633
dcb9aeaedad7a858c965e1cd02a1240e310d0735a9e70df508b54cdd0f4d806b,ign.com,ign.com,"Returnal compie tre anni: annunciata la graphic novel ""Fallen Asteria"" e un nuovo artbook",2024-04-30,https://it.ign.com/returnal/210306/news/returnal-compie-tre-anni-annunciata-la-graphic-novel-fallen-asteria-e-un-nuovo-artbook,it,2024-04-30 15:30:44.805807
5f917b3d891d591e5bc671232b031fa204e0cc3bfa2b8089fb941932944f46d0,radaronline.com,radaronline.com,Farha Khalidi Claims Biden Admin Paid Her to Push 'Political Propaganda',2024-04-30,https://radaronline.com/p/onlyfans-farha-khalidi-biden-administration-paid-political-propaganda/,en,2024-05-01 00:20:51.293124
bb30dd92778a17a0ff39bc66fdc9874ebf4af97eca04c79eab8f8ab79c058496,thenation.com,thenation.com,The Grit and Resilience of Student Protesters,2024-04-30,https://www.thenation.com/article/activism/student-protesters-gen-z-resilience/,en,2024-04-30 23:25:00.954415
0a6b24f633153485ffe7c79b3ebe68ee1217ee4b3f023c1521aa5fcb5e3ffc97,latimes.com,latimes.com,Jerry Seinfeld says ‘the extreme left and P.C. crap’ are hurting TV comedy,2024-04-30,https://www.latimes.com/entertainment-arts/tv/story/2024-04-30/jerry-seinfeld-pc-crap-hurting-tv-comedy,en,2024-05-01 23:24:59.510742
7cf687da62a943632b4da0739ae8e8b8464bb2696f2d14e85690d81ce858a1fc,forbes.com,forbes.com,A Small Businesses Roadmap For Safe And Secure AI,2024-04-30,https://www.forbes.com/sites/forbestechcouncil/2024/04/30/a-small-businesses-roadmap-for-safe-and-secure-ai/,en,2024-04-30 14:21:32.608642
c95a442c58687eb9153ffb6de5c8434289b9efe0f99323dc3d4b1c700f05bf52,benzinga.com,benzinga.com,"GCL SI's Net Profit Soars by 142.24% in 2023, Ranking Among Industry's Top Ten in Production and Sales",2024-04-30,https://www.benzinga.com/pressreleases/24/04/n38523641/gcl-sis-net-profit-soars-by-142-24-in-2023-ranking-among-industrys-top-ten-in-production-and-sales,en,2024-04-30 16:18:07.418345
dc022c542312ddbd3df8133166e85f20e1542063b6f6fab4a0a422dfaad2305c,marketwatch.com,marketwatch.com,Tesla shares fall amid reports that Supercharger unit slashed,2024-04-30,https://www.marketwatch.com/story/tesla-shares-fall-amid-reports-that-supercharger-unit-slashed-ac3e800c?mod=mw_rss_topstories,en,2024-05-01 00:22:33.600013
56fdfb81eff11d41091ceb60caa42555b6eacc362e8216bfce3953e80a8808c8,benzinga.com,benzinga.com,SD3IT Earns EDWOSB and WOSB Certifications,2024-04-30,https://www.benzinga.com/pressreleases/24/04/n38515861/sd3it-earns-edwosb-and-wosb-certifications,en,2024-04-30 12:26:32.300050
1045a48dd9a324e177718db4b0a3dd34ddd013283e972ab585885a5946113739,navytimes.com,navytimes.com,April Red Sea recap: Fight against Houthis continues after lull,2024-04-30,https://www.navytimes.com/news/your-navy/2024/04/30/april-red-sea-recap-fight-against-houthis-continues-after-lull/,en,2024-04-30 20:34:53.928841
603c377ecd8351fc65f929950b3bfc1f690684f42d18647e59bbea5cfbc9ea4c,fortune.com,fortune.com,Colorless liquid that emits a toxic vapor known to cause liver cancer and reproductive problems banned from use in paint stripper,2024-04-30,https://fortune.com/2024/04/30/colorless-liquid-toxic-vapor-cancer-pregnancy-epa/,en,2024-05-01 02:22:47.556497
34a132b52264e8b760335abf3ed7511b21b0659c567834f927964741e2c3547b,theguardian.com,theguardian.com,"Ukrainian woman, 98, walks six miles alone to escape Russian-held territory",2024-04-30,https://www.theguardian.com/world/2024/apr/30/ukrainian-woman-98-walks-six-miles-alone-to-escape-russian-held-territory,en,2024-04-30 22:46:04.983800
150fd18b37bb6b46972c69ff53ba3ef473f5915388d5c3d4f9486339b412808e,forbes.com,forbes.com,"Nolah Evolution Mattress Review: A Cooling, Plush And Sturdy Hybrid",2024-04-30,https://www.forbes.com/sites/forbes-personal-shopper/2024/04/30/nolah-evolution-mattress-review/,en,2024-04-30 21:17:51.388956
c15d94575a7e8f04090ac4b76ba74fccf7e68d502893dbff4ff6c023a9049968,nj.com,nj.com,Hudson County Interscholastic Athletic League softball season stat leaders for April 30,2024-04-30,https://www.nj.com/highschoolsports/2024/04/hudson-county-interscholastic-athletic-league-softball-season-stat-leaders-for-april-30.html,en,2024-04-30 14:18:50.235704
909742c7b9b014f76361dcfd278df550a16670f7658632d0d2707689e88d989a,benzinga.com,benzinga.com,Nayax Completes Acquisition of VMtecnologia,2024-04-30,https://www.benzinga.com/pressreleases/24/04/g38534595/nayax-completes-acquisition-of-vmtecnologia,en,2024-04-30 21:20:36.855018
b0b8aea0eb2e9786bcb60749684dc3433cdc8b383793a59ab15159d0c3f5f0a6,foxbusiness.com,foxbusiness.com,Small business owners reveal ‘out of this world’ impact to their bottom lines,2024-04-30,https://www.foxbusiness.com/economy/small-business-owners-reveal-out-world-impact-bottom-lines,en,2024-04-30 21:26:11.063517
acdacb608ed89912a65853dafd5395d5a64899da37e919d4b60c78aa7eed6ccd,stltoday.com,stltoday.com,"Top 10 schedule, results",2024-04-30,https://www.stltoday.com/sports/high-school/boys-basketball/top-10-schedule-results/article_af8117b4-57a5-5907-bc2c-c80e4e528790.html,en,2024-04-30 13:35:07.002720
19630035d012ba9458bdc37eab888adb64fb9f2fd836756323bc7b7ca6185516,cnet.com,cnet.com,"Beats Solo 4 Review: Big Performance Upgrades, but Wait for a Sale",2024-04-30,https://www.cnet.com/tech/mobile/beats-solo-4-headphones-review/#ftag=CADf328eec,en,2024-04-30 15:28:22.947496
034cd1c344a83d1cbc8aecfc53cfd8ecd48e78ddd4d2e5a92d7ce3d4f8087419,nytimes.com,nytimes.com,Text of April 30 Letter From Columbia’s President to N.Y.P.D.,2024-04-30,https://www.nytimes.com/2024/04/30/nyregion/columbia-nypd-letter-text.html,en,2024-05-01 04:21:19.426080
c22f7d654bf57a588f1596da4f62768f519e9cf2680f597df9f90ee2600c38ea,npr.org,npr.org,4 N.C. law enforcement officers were shot and killed trying to serve a warrant,2024-04-30,https://www.npr.org/2024/04/30/1248014489/4-n-c-law-enforcement-officers-were-shot-and-killed-trying-to-serve-a-warrant,en,2024-04-30 16:27:37.149876
47a4357369553a3f819b9cdc2b1e421fba8e4dade7ed92c577b79444767d8e00,salon.com,salon.com,"""Pecker was a partner in crime"": DA ""couldn't have asked for a better narrative"" to open Trump trial",2024-04-30,https://www.salon.com/2024/04/30/pecker-was-a-in-crime-da-couldnt-have-asked-for-a-better-narrative-to-open-trial/,en,2024-04-30 13:29:21.259639
57506a6f5c005e6dea156cbc72a99114c0b6a4d036943006ca106806f82ae208,dailykos.com,dailykos.com,Rachel Maddow exposes the GOP’s ‘sprawling nationwide scandal’,2024-04-30,https://www.dailykos.com/stories/2024/4/30/2238185/-Rachel-Maddow-exposes-the-GOP-s-sprawling-nationwide-scandal?pm_campaign=blog&pm_medium=rss&pm_source=main,en,2024-05-01 02:17:36.058039
1e5c891ccca7d4d05f960051ef9d2a16cf7354cf82325c342ff60a84619f4c44,observer.com,observer.com,One of the Most Coveted Banking Jobs In the World Is Up for Grabs,2024-04-30,https://observer.com/2024/04/hsbc-ceo-noel-quinn-resign/,en,2024-04-30 22:42:01.109176
39897e03a761f2ee219c45241b917a110ef59429c1db02f1dc9d81b636731e43,nj.com,nj.com,Which teams are the betting favorites for where LeBron James play next season?,2024-04-30,https://www.nj.com/sports/2024/04/which-teams-are-the-betting-favorites-for-where-lebron-james-play-next-season.html,en,2024-04-30 16:22:12.682706
fdf40a1d447312168e033e9369e46aaaac5800cf5a98a5ab4cbc9f01b26db1b3,startribune.com,startribune.com,"Shootout that killed 4 law officers began as task force tried to serve a warrant, police say",2024-04-30,https://www.startribune.com/shootout-that-killed-4-law-officers-began-as-task-force-tried-to-serve-a-warrant-police-say/600362670/,en,2024-04-30 13:29:44.001805
28249eabe80e635a506ab1d2604e641347e9de121b6da5fbf02418ef98a5067a,radaronline.com,radaronline.com,"Donald Trump Lashing Out About His Lawyers in Private Chats For Not Being Aggressive, Refusing to Pay Certain Legal Fees: Sources",2024-04-30,https://radaronline.com/p/donald-trump-lashing-out-lawyers-in-private-upset-about-legal-fees-not-aggressive-enough-court/,en,2024-04-30 17:31:10.343675
3aaacf129ce2dec1dbbfa3224e61f418be4d9437ef5546115069bba3864a5ce6,npr.org,npr.org,More Chinese asylum seekers are crossing the U.S. southern border,2024-04-30,https://www.npr.org/2024/04/30/1196980661/here-now-anytime-04-30-2024,en,2024-04-30 22:18:44.645394
d3631416c1b2eb779aba737ced8f3d5d5365c1a1762145c10b4b16bd9145b103,fortune.com,fortune.com,Jim Beam’s Japanese parent thinks it can double sales by 2030 with a focus on ‘ready to drink’ canned cocktails,2024-04-30,https://fortune.com/2024/04/30/jim-beam-suntory-ready-to-drink-canned-cocktails/,en,2024-04-30 20:25:25.810693
48393d1e6d4ce682060e9a9f9a32a3c4d9148a0a9ba4b35f4166fd6dd4b0704b,abcnews.go.com,abcnews.go.com,H.R. McMaster writes about his time in Trump administration in upcoming 'At War with Ourselves',2024-04-30,https://abcnews.go.com/US/wireStory/hr-mcmaster-writes-time-trump-administration-upcoming-war-109781561,en,2024-04-30 13:30:52.510608
713ebf165f2e7f3afa51ea334706855f1043ca5764dcaa0cd2ab0543d55f0d05,stltoday.com,stltoday.com,Recap: Warrenton topples Union,2024-04-30,https://www.stltoday.com/sports/high-school/baseball/recap-warrenton-topples-union/article_1ca994ee-d25c-567d-aafe-9d8c1917d385.html,en,2024-05-01 18:30:26.593837
118015a065430ece568e45a0ac53a94a5c1ac4cb179718226b01eb7bcea7b3fc,bizjournals.com,bizjournals.com,"I Street Bridge replacement, Sac-West Sac streetcar on Cap-to-Cap request list",2024-04-30,https://www.bizjournals.com/sacramento/news/2024/04/30/i-st-bridge-west-sac-streetcard-cap-to-cap.html?ana=RSS&s=article_search,en,2024-05-01 05:18:46.882802
69f7581f2950d7282ad11b2590cfc9cc75fe57bbb38ef410466a00260024bf2b,benzinga.com,benzinga.com,PENSKE AUTOMOTIVE GROUP REPORTS QUARTERLY RESULTS,2024-04-30,https://www.benzinga.com/pressreleases/24/04/n38514406/penske-automotive-group-reports-quarterly-results,en,2024-04-30 19:24:54.354880
fcac41f0f31764aa9bfc7c2867857576fbc3d22d629c8ef8bab6fe690d760a99,sportingnews.com,sportingnews.com,Two Rams rookies named to 'best picks' list by ESPN's Yates,2024-04-30,https://www.sportingnews.com/us/nfl/news/two-rams-rookies-named-best-picks-list-espns-yates/9a328b8ebbc8928669d01509,en,2024-04-30 20:20:40.139205
b5cc01664ed48a06102b9e363e2b68048781215d32f24c62167545a7c6a5d27b,nypost.com,nypost.com,Jets draft pick Braelon Allen appears to buy his mother new car: ‘Get mama right’,2024-04-30,https://nypost.com/2024/04/30/sports/jets-draft-pick-braelon-allen-appears-to-buy-mother-new-car/,en,2024-05-01 01:17:44.857771
425f191567a92d9c8f56b4b88f5c55c2f466f5a49af0f8de89fba6a8ef9da8fe,syracuse.com,syracuse.com,Biden condemns Columbia University student pro-Gaza occupation of Hamilton Hall,2024-04-30,https://www.syracuse.com/us-news/2024/05/biden-condemns-columbia-university-student-pro-gaza-occupation-of-hamilton-hall.html,en,2024-05-01 02:23:27.039779
b7ca562b25430913987de8c5b80bf88a8bb7af330dfe0c8d4f23a35da972b05a,nbcnews.com,nbcnews.com,"Biden administration plans to reclassify marijuana, easing restrictions nationwide",2024-04-30,https://www.nbcnews.com/politics/joe-biden/biden-administration-plans-reclassify-marijuana-easing-restrictions-na-rcna149424,en,2024-04-30 19:21:02.040480
5c18a4d0845dca9ff328a2afeb7abef9259591fc36d75bb5b263bc8d5c617db1,arkansasonline.com,arkansasonline.com,Nation's top transfer guard Johnell Davis commits to Calipari and Arkansas basketball,2024-04-30,https://www.arkansasonline.com/news/2024/apr/30/nations-top-transfer-commits-to-calipari-and-arkansas/,en,2024-05-01 09:20:34.844977
467f354d8cefcb69ce1ace020c4942792aecf8bce552cedd7749db4b5e845698,syracuse.com,syracuse.com,Kentucky Derby 2024 tickets are selling fast: Here are the cheapest seats available for Saturday’s Triple Crown race,2024-04-30,https://www.syracuse.com/sports/2024/04/kentucky-derby-2024-tickets-are-selling-fast-here-are-the-cheapest-seats-available-for-saturdays-triple-crown-race.html,en,2024-04-30 20:21:57.328838
6e8c3fe0572c653bee660288b3e50795bee3b91bb19ea8760a3f34da51e81a79,engadget.com,engadget.com,Instagram's algorithm overhaul will reward ‘original content’ and penalize aggregators,2024-04-30,https://www.engadget.com/instagrams-algorithm-overhaul-will-reward-original-content-and-penalize-aggregators-130018977.html?src=rss,en,2024-04-30 22:28:22.993512
3856056c07c9119f73118a439e3771a0a381e8118d31d989c8667b4543f3df38,wsj.com,wsj.com,"Stocks Slip, Extending April Pullback",2024-04-30,https://www.wsj.com/finance/stocks/global-stocks-markets-dow-news-04-30-2024-0f6022cd,en,2024-05-01 04:19:44.798298
12cca7e3eb9a49d5df723cbfa44c4ef1853373e651aa249f525ef6f3a2752235,abcnews.go.com,abcnews.go.com,"Portuguese-flagged ship is hit far in Arabian Sea, raising concerns over Houthi rebel capabilities",2024-04-30,https://abcnews.go.com/International/wireStory/portuguese-flagged-ship-hit-arabian-sea-raising-concerns-109795007,en,2024-04-30 18:23:51.165857
d49f8aed402316e49073edfadfa82151e70af213f26f18cd35b182930884d5d3,forbes.com,forbes.com,5 Big Financial Stocks Trade Below (Or At)Book Value And Pay Dividends,2024-04-30,https://www.forbes.com/sites/johnnavin/2024/04/30/5-big-financial-stocks-trade-below-or-atbook-value-and-pay-dividends/,en,2024-05-01 00:18:25.533817
ce0cc0acd9a573924ee7dde42e8f192906d8ac5c69c97368683237f992cb0854,wsj.com,wsj.com,"China Hints at Rate Cuts, Property-Market Support as it Warns of Rising Uncertainties",2024-04-30,https://www.wsj.com/world/china/china-calls-long-delayed-policy-meeting-warning-of-rising-uncertainties-032fb571,en,2024-04-30 09:27:07.227942
bbd76e17a3be78363e5f85170412c215c1594025b1b4755c9dbb3568a9e43194,nbcnews.com,nbcnews.com,Tony Nominations 2024: Alicia Keys' Musical 'Hell's Kitchen' and 'Stereophonic' lead with 13 nods apiece,2024-04-30,https://www.nbcnews.com/pop-culture/pop-culture-news/tony-nominations-2024-hells-kitchen-stereophonic-lead-rcna149985,en,2024-04-30 19:19:10.356327
f9483026486e21d8f19f0f7efc0fa1b4a6aff419d346a7603cddb6abca0b7119,rttnews.com,rttnews.com,Asian Shares Gain Led By Japan; Chinese Stocks Slip,2024-04-30,https://www.rttnews.com/3443018/asian-shares-gain-led-by-japan-chinese-stocks-slip.aspx?type=ts,en,2024-04-30 23:30:20.995849
6a1934709accab127860c193c87400470a40bb000bf75673372112de46bc1d33,rawstory.com,rawstory.com,'Hell freezing over': Liberals shocked to agree with Jeanine Pirro on dead dog take,2024-04-30,https://www.rawstory.com/i-d-retire-internet-laughs-as-fox-news-pundit-slams-kristi-noem-s-dog-execution/,en,2024-04-30 03:19:15.957917
5dd70601fa0fec68b3460ad49929e8978310a51f2d5b3a1a841ed3b6e776a943,ign.com,ign.com,"Xbox Game Pass, ecco i giochi di maggio: entro metà mese arrivano Tomb Raider e Brothers: A Tale of Two Sons",2024-04-30,https://it.ign.com/xbox-game-pass/210308/news/xbox-game-pass-ecco-i-giochi-di-maggio-entro-meta-mese-arrivano-tomb-raider-e-brothers-a-tale-of-two,it,2024-04-30 15:31:04.724978
c06ae87a3e04f69789716053b03a30980ff62009427a387a83f8e26e9c9532d3,upi.com,upi.com,"7 killed, at least 36 injured in wave of Russian aerial attacks across Ukraine",2024-04-30,https://www.upi.com/Top_News/World-News/2024/04/30/Ukraine-Russian-strikes-several-killed-dozens-injured/7811714465371/,en,2024-04-30 11:34:50.555871
53c3b31faf0119c1ced6d0938bddb326f0e28d432427a4c16c46ecdcdbff8f51,latimes.com,latimes.com,Column: Climate change is a star in some of Hollywood's most popular movies,2024-04-30,https://www.latimes.com/environment/newsletter/2024-04-30/column-climate-change-is-a-star-in-some-of-hollywoods-most-popular-movies-boiling-point,en,2024-04-30 23:36:03.771686
9651ff4040012406253b20843921e2acc55d1b6fdeed57b60acf6b0ef35ff0a9,baltimoresun.com,baltimoresun.com,How to escape from a money rut,2024-04-30,https://www.baltimoresun.com/2024/04/30/how-to-escape-from-a-money-rut/,en,2024-04-30 19:24:53.120428
d0451681dc3952a8625d7a6423c0361325563b515f283edb700f6eecc942149e,newsday.com,newsday.com,How Columbia University became the driving force behind protests over the war in Gaza,2024-04-30,https://www.newsday.com/news/nation/israel-palestinian-campus-protests-timeline-g68818,en,2024-05-01 00:06:03.839908
6220b973bcb76845bb113ce57df5797fef6f8a9b938c05bb388fd39195376dd0,newsweek.com,newsweek.com,"Ukrainian engineers' new submarine could shape ""future of naval warfare""",2024-04-30,https://www.newsweek.com/ukrainian-engineers-new-submarine-could-shape-future-naval-warfare-1895811,en,2024-05-01 04:25:08.851463
28cd38800b48338123bd5c3924b26eb2b9470e77367a0a81833077f3b6ad9e3f,mlive.com,mlive.com,Latinos suffer increasing gun violence in U.S.,2024-04-30,https://www.mlive.com/palabra/2024/04/latinos-suffer-increasing-gun-violence-in-us.html,en,2024-04-30 17:32:36.798733
dea36867d07aa842e2de9c09b81f033ab699834c508fa61290e211f66774e763,wsj.com,wsj.com,HSBC CEO Noel Quinn Is Stepping Down,2024-04-30,https://www.wsj.com/finance/banking/hsbc-ceo-noel-quinn-is-stepping-down-43359d25,en,2024-04-30 05:27:38.436870
213a0bb4800c73877fff41f63043e5afa56a8e4607d0fe2a0050ea5b4d047025,foxnews.com,foxnews.com,House Dems say they’ll block Marjorie Taylor Greene from ousting Speaker Johnson,2024-04-30,https://www.foxnews.com/politics/house-dems-say-theyll-block-marjorie-taylor-greene-ousting-speaker-johnson,en,2024-04-30 16:25:20.366182
