id,media_name,media_url,title,publish_date,url,language,indexed_date
6f690334cb78d94f52f08c8ba9cd915845b1a47ffe1ba327a5fe49cddcceca1d,gazettenet.com,gazettenet.com,"Pro-Palestinian encampment disperses at UMass, but protests continue",2024-04-30,https://www.gazettenet.com/UMass-Encampment-UPDATE-54950240,en,2024-05-01 02:22:37.417702
c02fb335b21a8ee46b5fe414c97f0a231208cb53f7fc5c7edf184dcb151b9a4d,newsweek.com,newsweek.com,Campus protesters spotted wearing Hamas headbands–what we know,2024-04-30,https://www.newsweek.com/campus-protesters-spotted-wearing-hamas-headbandswhat-we-know-1895202,en,2024-04-30 14:18:37.420208
b52cb77aff972fbeabd6acc93d745dda09da513886e5e02febf941fc158a734c,nypost.com,nypost.com,Democrats torpedo Marjorie Taylor Greene push to oust House Speaker Mike Johnson,2024-04-30,https://nypost.com/2024/04/30/us-news/democrats-torpedo-marjorie-taylor-greene-push-to-oust-house-speaker-mike-johnson/,en,2024-04-30 19:17:25.750679
cd4dcb0be94a641fb97b5198729f45907afb6839c2ac7cb9ebab02c6049477f3,cbsnews.com,cbsnews.com,"Fort Worth ISD offering free breakfast, lunch over the summer",2024-04-30,https://www.cbsnews.com/texas/news/fort-worth-isd-offering-free-lunch-over-the-summer/,en,2024-04-30 23:39:30.479129
4726ae6cd851af68ebf5eea6fd3a8dcebdb7198b6df17f18523a43b8c47730f3,qz.com,qz.com,Amazon stock is up as its AI platform stands to challenge Google and Microsoft's,2024-04-30,https://qz.com/amazon-q1-earnings-aws-ai-cloud-computing-google-micros-1851447143,en,2024-05-01 01:20:02.199623
d22974bfafe991cf345ca6ad11af4af5c2a4c50f1fb4cfccd2514a3735c5abdd,cleveland.com,cleveland.com,"See all homes sold in Lakewood, April 22 to April 28",2024-04-30,https://www.cleveland.com/realestate-news/2024/04/see-all-homes-sold-in-lakewood-april-22-to-april-28.html,en,2024-04-30 18:20:42.339748
8a9feb7834d551d645ce2c410675c25800985b63c59b11bbe5158999ba028752,nypost.com,nypost.com,"‘Possessed’ murder suspect ate victim’s eye, ear after killing him near Las Vegas Strip: report",2024-04-30,https://nypost.com/2024/04/30/us-news/murder-suspect-ate-victims-eye-ear-after-killing-him-near-las-vegas-strip/,en,2024-05-01 02:24:02.695169
4304f5230a9793bedf44db6531400da13c859f1d99986332808ed13c9773cd43,denverpost.com,denverpost.com,"Chef Amos Watts, weeks from reopening The Fifth String, dies at 43",2024-04-30,https://www.denverpost.com/2024/04/30/chef-amos-watts-dies-fifth-string-restaurant-denver/,en,2024-04-30 23:31:55.881186
df0293fd45b1976f6a8e90673f8b952b379c5022933379640cb572ed61b8432c,benzinga.com,benzinga.com,"SHAREHOLDER ACTION ALERT: The Schall Law Firm Encourages Investors in Ocugen, Inc. with Losses to Contact the Firm",2024-04-30,https://www.benzinga.com/pressreleases/24/04/g38528421/shareholder-action-alert-the-schall-law-firm-encourages-investors-in-ocugen-inc-with-losses-to-con,en,2024-04-30 18:36:13.642363
ba0a2c50cabf4adf0d80359c7870d932997b57ed769ec2262f741e526dea0071,newsweek.com,newsweek.com,Former Pro Bowl Wide Receiver Attempting NFL Comeback in Unique Way,2024-04-30,https://www.newsweek.com/sports/nfl/former-pro-bowl-wide-receiver-attempting-nfl-comeback-unique-way-1895835,en,2024-05-01 01:27:30.223850
5e14cdeeee355ef208ce8d73dc9187acb80c561a309f4edb95e90a33707b4cb0,newsweek.com,newsweek.com,Where Is Rafah? Map Shows Israel's Next Attack,2024-04-30,https://www.newsweek.com/rafah-map-israels-next-attack-1895723,en,2024-04-30 19:25:04.829063
70bf342661c882fcfb55086bf902eba63f2e3e92ad568f2467a52a1ed69edaf7,bleacherreport.com,bleacherreport.com,"NBA Rumors: Wolves HC Chris Finch Set for Surgery on Injury, Uncertain for Nuggets G1",2024-04-30,https://bleacherreport.com/articles/10119216-nba-rumors-wolves-hc-chris-finch-set-for-surgery-on-injury-uncertain-for-nuggets-g1,en,2024-04-30 15:23:10.400437
5b1585c471b7a4c01262d9a9fec819614cd2611f9a2b2646f3609c9b1a755d31,cbsnews.com,cbsnews.com,The best smartphone deals ahead of Memorial Day mean big savings on feature-packed devices,2024-04-30,https://www.cbsnews.com/newyork/essentials/memorial-day-smartphone-deals/,en,2024-04-30 21:20:27.549708
1288488321dc8d628ecde1246fc37d2aa7129748be37545e23780e627a581efb,nbcnews.com,nbcnews.com,Illinois Gov. J.B. Pritzker's pro-abortion rights group sinks money into Florida ballot question,2024-04-30,https://www.nbcnews.com/politics/2024-election/illinois-gov-jb-pritzker-abortion-florida-ballot-rcna150039,en,2024-04-30 19:20:52.143107
4476c9c0284481ec245c3fc438ba4f86630480ebefa29ed88eb4db3dffa15b5c,rawstory.com,rawstory.com,Elise Stefanik hits Jack Smith with ethics complaint for 'illegal election interference',2024-04-30,https://www.rawstory.com/elise-stefanik-2668096822/,en,2024-04-30 16:19:14.941734
08ddce7419ae00e1691ab56f180237a2a4f002be6f72d614f02895dae2ca017d,theguardian.com,theguardian.com,At least 50 people feared drowned after boat from Senegal sinks off Canary island,2024-04-30,https://www.theguardian.com/world/2024/apr/30/senegal-boats-sinks-off-canary-island-atlantic,en,2024-04-30 22:18:13.804433
9773937d870b575dd6d4f6ddf26bb0e13b22322d978657ac82423c7b02a4d040,cbsnews.com,cbsnews.com,White Sox lose second game to Twins,2024-04-30,https://www.cbsnews.com/chicago/news/white-sox-lose-second-game-twins/,en,2024-05-01 06:22:28.426282
a37d2dc63fad4d0143b6c44f23e0c9225b7332e2dbb34dab531b38e14e9298fc,armytimes.com,armytimes.com,"With promotion still blocked, Air Force officer’s eligibility extended",2024-04-30,https://www.armytimes.com/news/your-military/2024/04/30/with-promotion-still-blocked-air-force-officers-eligibility-extended/,en,2024-04-30 22:29:02.996736
be459677266b777ce3f31fc899571a1192a2bca9e5572590874c126d1fe7c587,theconversation.com,theconversation.com,"Australians lose $5,200 a minute to scammers. There’s a simple thing the government could do to reduce this. Why won’t they?",2024-04-30,https://theconversation.com/australians-lose-5-200-a-minute-to-scammers-theres-a-simple-thing-the-government-could-do-to-reduce-this-why-wont-they-228867,en,2024-04-30 20:41:21.716988
62a367e7ed207555b2b79b78290ab15fad665f00492dbb9527dfc489eb9e44d6,cbsnews.com,cbsnews.com,"Trump held in contempt for violating gag order in ""hush money"" trial. Here's how much he owes.",2024-04-30,https://www.cbsnews.com/chicago/news/trump-trial-contempt-gag-order-new-york-judge/,en,2024-04-30 15:30:54.050032
89200c92fb367b6a8f5e4e1af25d7026f4347fc3897c66694b3d25bb8054f7da,seattletimes.com,seattletimes.com,Seattle City Council rejects more density for affordable housing,2024-04-30,https://www.seattletimes.com/business/real-estate/seattle-city-council-rejects-more-density-for-affordable-housing/?utm_source=RSS&utm_medium=Referral&utm_campaign=RSS_all,en,2024-05-01 02:26:27.101329
aeabcd4feeca5fe041d7a3bd1b4e30268f883013ef836afa15ba81ffd6be9737,theguardian.com,theguardian.com,"Big oil privately acknowledged efforts to downplay climate crisis, joint committee investigation finds",2024-04-30,https://www.theguardian.com/us-news/2024/apr/30/big-oil-climate-crisis-us-senate-report,en,2024-04-30 22:19:23.574458
46b290feb7f519e5c19344c41b6eddafd2b38e6720511bbce1c3c49acb3b1fef,ign.com,ign.com,"Netflix Working on New Live-Action Scooby-Doo Show, Matthew Lillard Immediately Starts Trending",2024-04-30,https://www.ign.com/articles/netflix-scooby-doo-tv-show-matthew-lillard,en,2024-04-30 01:26:47.811925
7f0cff5adadc028ffc21f12f7f72dc3d22e36e9c645dbfb665fcb36aeb0ca349,zdnet.com,zdnet.com,The 5 GIMP features I depend on most when editing images (and how I use them),2024-04-30,https://www.zdnet.com/article/the-features-i-depend-on-most-with-the-gimp-image-editor/#ftag=RSSbaffb68,en,2024-04-30 18:22:01.133895
c240ec7051a3cc1da7bd8b2d57a8ca1dfab42a202744608ec62c9d75c202b0b9,nj.com,nj.com,Northwest Jersey Athletic Conference softball season stat leaders for April 30,2024-04-30,https://www.nj.com/highschoolsports/2024/04/northwest-jersey-athletic-conference-softball-season-stat-leaders-for-april-30.html,en,2024-04-30 15:20:41.127340
1d53a096234567851946b3822f4eca6e02eaefbbfe2d95c9a6b50f332a46eb23,benzinga.com,benzinga.com,Global Infrastructure Projects Drive Low Density Polyethylene Market Growth- Read the Latest Trends and Understand What Opportunities Await Investors till 2034,2024-04-30,https://www.benzinga.com/pressreleases/24/04/n38521870/global-infrastructure-projects-drive-low-density-polyethylene-market-growth-read-the-latest-trends,en,2024-04-30 15:24:47.360514
0e529e2eac478f83145ed4fcb4917cdce0391227a421dedfffac73a6d6dc3733,sbnation.com,sbnation.com,LaMelo Ball has the worst NBA tattoo ever,2024-04-30,https://www.sbnation.com/nba/2024/4/30/24145711/lamelo-ball-tattoo-back-new-wtf-charlotte-hornets-worst,en,2024-05-01 00:19:31.111934
b3639a6ce2b3bd826665863a9b2289779e20ace516741e9288f4babd638c4413,sandiegouniontribune.com,sandiegouniontribune.com,"A missing Utah cat with a fondness for boxes ends up in Amazon returns warehouse, dehydrated but OK",2024-04-30,https://www.sandiegouniontribune.com/news/california/story/2024-04-30/a-missing-utah-cat-with-a-fondness-for-boxes-ends-up-in-amazon-returns-warehouse-dehydrated-but-ok,en,2024-04-30 22:38:15.223304
2c64d8f9ccab1608fac295bbc3d9d628ec03a7fcb50d14ef442836736c672c59,arkansasonline.com,arkansasonline.com,"Panthers dominate Lightning, move on",2024-04-30,https://www.arkansasonline.com/news/2024/apr/30/panthers-dominate-lightning-move-on/,en,2024-04-30 14:25:27.357983
c949e602f0b1e31df8fd9cb25d4e36b8e20ae0c440afe585f0ed16f8835ce2d4,cbssports.com,cbssports.com,"ACC spring football overreactions: Miami has 'the one' in Cam Ward, Florida State defense will key title run",2024-04-30,https://www.cbssports.com/college-football/news/acc-spring-football-overreactions-miami-has-the-one-in-cam-ward-florida-state-defense-will-key-title-run/,en,2024-04-30 21:22:05.629779
1ed519d852a02ad8e25b633144c054e4a1a583a4cb019e6c999580c6411fc353,oregonlive.com,oregonlive.com,Oregon City faith-healing parents accused of failing to care for newborn who died,2024-04-30,https://www.oregonlive.com/clackamascounty/2024/04/oregon-city-faith-healing-parents-accused-of-failing-to-care-for-newborn-who-died.html,en,2024-04-30 15:28:54.190292
d5ae3f774afc95a24ac48706a71ef7cd17e737aade30330346e6bea81fa944b4,newsday.com,newsday.com,Walmart to close its 51 health centers and virtual care service,2024-04-30,https://www.newsday.com/business/Walmart-w93721,en,2024-04-30 22:52:47.211308
6cfa90550d518046531dcc507e12b36d7c476c9941c5e168c7f07f2b45f742eb,businessinsider.com,businessinsider.com,"First-class American Airlines passenger complains of racial discrimination, saying she was made to use economy bathroom",2024-04-30,https://www.businessinsider.com/first-class-american-airlines-passenger-alleges-racial-discrimination-2024-4,en,2024-04-30 18:30:06.113921
fe899f90e481110ddf80b613a1711fa467e6744b375f76cd6e57a5f179d67c52,rttnews.com,rttnews.com,Hungarian Economy Expands 1.1%,2024-04-30,https://www.rttnews.com/story.aspx?Id=3443274,en,2024-04-30 17:26:42.548388
2cd2ae05bea118d8b8aa6adc85a490afaa758154cbc5597bb3d85035471ac8ab,cbssports.com,cbssports.com,"Kentucky Derby 2024 predictions, odds: Best expert picks for win, place, show, exacta, trifecta, superfecta",2024-04-30,https://www.cbssports.com/general/news/kentucky-derby-2024-predictions-odds-best-expert-picks-for-win-place-show-exacta-trifecta-superfecta/,en,2024-04-30 17:19:50.046462
df9f8813488c2d7799db13e92c52039e568f26e51bfb90fd52951bc173ea380f,espn.com,espn.com,Celtics' Porzingis suffers calf injury in Game 4,2024-04-30,https://www.espn.com/nba/story/_/id/40053249/celtics-kristaps-porzingis-doubtful-return-calf-injury,en,2024-04-30 02:17:12.383828
0e28db941385a9b9d6a019c4f7f24059e32ace200547604cb9aaa79af3330c9c,foxsports.com,foxsports.com,Alex Bowman to drive Jimmie Johnson-inspired Lowe's scheme at Darlington,2024-04-30,https://www.foxsports.com/stories/nascar/alex-bowman-drive-jimmie-johnson-lowes-scheme-car-darlington,en,2024-04-30 18:32:46.793911
5823759f7b9f542b8df2eea541cf00332c3f27c8a0a8d12e189a95160015d9d5,stripes.com,stripes.com,"After an ATF ruling, bottom falls out for Minnesota firearms manufacturer",2024-04-30,https://www.stripes.com/theaters/us/2024-04-30/atf-braced-pistols-disabled-owners-13707868.html?utm_source=flipboard&utm_content=KeithKirby1m71%2Fmagazine%2FMilitary+,en,2024-05-01 14:25:13.593318
5bb4e3138b243999e8e31e7b07ada588bf038cfbacc431d1bf80eadc33dd621a,marketwatch.com,marketwatch.com,Seven bank-stock picks as industry nears ‘positive inflections’,2024-04-30,https://www.marketwatch.com/story/seven-bank-stock-picks-as-industry-nears-positive-inflections-85f2e9a3?mod=mw_rss_topstories,en,2024-04-30 15:36:13.050560
44ac53be751c8dacc16939f8b836b4b8d0880e3d8b347bce1c5cc85940f17402,forbes.com,forbes.com,"Finally, A Big ‘Ginny And Georgia’ Season 3 Update",2024-04-30,https://www.forbes.com/sites/paultassi/2024/04/30/finally-a-big-ginny-and-georgia-season-3-update-release-date/,en,2024-04-30 13:31:56.819579
8f51f177e54da4a608a06b77df5d9fce64eca41c3affc4ebb63fa09dc18f339e,airforcetimes.com,airforcetimes.com,"Burn pits increased risk of asthma, heart problems, new DOD data shows",2024-04-30,https://www.airforcetimes.com/veterans/2024/04/30/burn-pits-increased-risk-of-asthma-heart-problems-new-dod-data-shows/,en,2024-04-30 20:34:52.736060
68620cfa600e545f10e51990125c96e9ccd56c4d3a150ac22973fd25be309a73,fortune.com,fortune.com,"HSBC CEO Noel Quinn, who pivoted Europe's largest bank back towards Asia, unexpectedly steps down",2024-04-30,https://fortune.com/asia/2024/04/30/hsbc-ceo-noel-quinn-steps-down-pivot-to-asia-europes-largest-bank/,en,2024-04-30 08:24:30.511576
137809dcccd7eaa811d0ce213ddfa2b60ab8514a1200139de82ca0b673d23ca7,benzinga.com,benzinga.com,What's Going On With Post-It Maker 3M Shares Today?,2024-04-30,https://www.benzinga.com/news/earnings/24/04/38522440/whats-going-on-with-post-it-maker-3m-shares-today,en,2024-04-30 14:38:47.458880
44697b6612c843b731b00a2c25ad130a42ded02fb2c00b222f55efbc49c19755,newsday.com,newsday.com,"Trump says he'll use National Guard to deport migrants, doubling down on anti-immigration rhetoric",2024-04-30,https://www.newsday.com/news/nation/immigration-Trump-deport-migrants-National-Guard-l21889,en,2024-04-30 22:56:48.731489
39582660b2ec00790977d60b6d294cadc04f566d9296bafc537fa97089b4e80a,cnn.com,cnn.com,"Live updates: University unrest and protests disrupt Columbia, UCLA, campuses across the US",2024-04-30,https://www.cnn.com/business/live-news/university-protests-palestine-04-30-24/index.html,en,2024-04-30 23:30:51.235158
759090de12d32474c37611ebf8c03a4c168c38fb871c1dae4b38b996dea2c5be,armytimes.com,armytimes.com,"Army says fitness plan cut injuries and drug use, aids mental health",2024-04-30,https://www.armytimes.com/news/your-army/2024/04/30/army-fitness-plan-cuts-injuries-and-drug-use-boosts-mental-health/,en,2024-04-30 22:30:03.070473
b651f92381ca45106af9da636f4325f51dfbec9380bbbcfa08e29782fe4c83d4,benzinga.com,benzinga.com,AZZ Inc. Announces Closing of its Public Offering of Common Stock and Full Exercise of Underwriters' Option,2024-04-30,https://www.benzinga.com/pressreleases/24/04/n38533762/azz-inc-announces-closing-of-its-public-offering-of-common-stock-and-full-exercise-of-underwriters,en,2024-05-01 23:34:06.709921
211d87bb9acdca92217487baa1b9bc3248475ba87254461993f134a831ded217,nytimes.com,nytimes.com,The Secret Push That Could Ban TikTok,2024-04-30,https://www.nytimes.com/2024/04/30/podcasts/the-daily/tiktok-ban.html,en,2024-04-30 11:20:07.249128
6d5162988b3744699d1f245a9f1884fd2d231c5ea2073ea10cb56611b5d64ded,baltimoresun.com,baltimoresun.com,Tony Award nominations whiff on ‘The Wiz’ but other Baltimore standouts earn nods,2024-04-30,https://www.baltimoresun.com/2024/04/30/tony-award-nominations-baltimore-ties/,en,2024-04-30 22:21:02.205515
ea6f98d69fbb72b29955f359a86dad6d2c50bfde7292f915c407678dd7791840,rollingstone.com,rollingstone.com,Training for a Marathon? Here's All the Gear You'll Need,2024-04-30,https://www.rollingstone.com/product-recommendations/lifestyle/marathon-training-gear-esssentials-checklist-1235011482/,en,2024-04-30 19:25:55.803593
83838c8671d28bd0c5b0cceaace033598b07c1b68502f12381ce786abd55a03f,foxbusiness.com,foxbusiness.com,Home prices surge to another record high in February,2024-04-30,https://www.foxbusiness.com/economy/home-prices-surge-another-record-high-february,en,2024-04-30 21:27:25.687350
f4084f47d9cc6954007dc77be46dbe028cf629a5ddcd19f7eec3f2259f8e6ba4,cbsnews.com,cbsnews.com,U.S. pilot accounted for 57 years after vanishing during Vietnam War spy mission,2024-04-30,https://www.cbsnews.com/news/us-pilot-vietnam-war-disappearance-spy-mission-accounted-for-john-c-g-kerr/,en,2024-04-30 18:27:19.445250
dcedf3a41e1b71b1895efe19d7031e0fc64a86b420956bebe5ec939088d2e4e1,upi.com,upi.com,"Christian Slater, Max Greenfield, Sarah Cooper toned down 'Unfrosted' performances",2024-04-30,https://www.upi.com/Entertainment_News/Movies/2024/04/30/Christian-Slater-Max-Greenfield-Unfrosted/4501714417418/,en,2024-04-30 11:35:39.179463
3efff688672f5acc3ed9ab39885218274d0c558840d43ae5e29361c27ce56046,mercurynews.com,mercurynews.com,San Jose: Affordable housing project with 64 units for homeless people opens downtown,2024-04-30,https://www.mercurynews.com/2024/04/30/san-jose-affordable-housing-project-with-64-units-for-homeless-people-opens-downtown/,en,2024-04-30 21:39:56.694964
e3c522f68ad1868f0291cb727b783697fda4a832b46fd5f077dbcdf032d0823b,abcnews.go.com,abcnews.go.com,"Trump says states should decide on prosecuting women for abortions, has no comment on abortion pill",2024-04-30,https://abcnews.go.com/Politics/wireStory/trump-states-decide-prosecuting-women-abortions-comment-abortion-109796629,en,2024-04-30 20:34:20.594034
2536abc21502a5ebb1038870c531d4beb694e86355a550c4ebf904502c9a7ae0,cbsnews.com,cbsnews.com,'Jane Fonda Day' in Los Angeles will celebrate her climate activism,2024-04-30,https://www.cbsnews.com/losangeles/news/jane-fonda-day-in-los-angeles-will-celebrate-her-climate-activism/,en,2024-04-30 16:30:55.475016
10a9bdcf5eac4de00c8890761c6e666323f62cd5a8923bb8cb11023e1b0a20f5,seattletimes.com,seattletimes.com,How Columbia University became the driving force behind protests over the war in Gaza,2024-04-30,https://www.seattletimes.com/nation-world/nation/how-columbia-university-became-the-driving-force-behind-protests-over-the-war-in-gaza/?utm_source=RSS&utm_medium=Referral&utm_campaign=RSS_all,en,2024-04-30 21:26:04.581207
9f1ab94cdc3ad0531ff0232abf3be18dc4550163231691e29338bd2179aef7f7,sun-sentinel.com,sun-sentinel.com,"Energy-sucking cryptocurrencies good for criminals, bad for consumers",2024-04-30,https://www.sun-sentinel.com/2024/04/30/energy-sucking-cryptocurrencies-good-for-criminals-bad-for-consumers-opinion/,en,2024-04-30 15:26:46.395471
a00dde84000f5f31a31da2776b123936fce37cb8ab96d0c6280277e22e855b91,newsday.com,newsday.com,Astros to option slumping 2020 AL MVP José Abreu to their spring training facility in Florida,2024-04-30,https://www.newsday.com/sports/baseball/astros-abreu-optioned-h87576,en,2024-04-30 22:52:29.046267
f3c50eaa628743a4a7f7ed9ea37f11c903721df74c04fa1c5c2ec5618c43a397,wsj.com,wsj.com,Jean Paul Gaultier Owner Puig Brands Prices IPO at Upper End of Range,2024-04-30,https://www.wsj.com/business/retail/jean-paul-gaultier-owner-puig-brands-prices-ipo-at-upper-end-of-range-b1e316c7,en,2024-04-30 17:35:10.840598
fe208fabdde43a16e225a4f9dfdd99301e1c333712d12b241a822f31beaa8258,oregonlive.com,oregonlive.com,"Police shoot and kill Happy Valley man after standoff, sheriff’s office says",2024-04-30,https://www.oregonlive.com/crime/2024/04/police-shoot-and-kill-happy-valley-man-after-standoff-sheriffs-office-says.html,en,2024-04-30 15:29:03.326925
38be7ac2457a595c50e5e1ecc23aa3ab21889c4dd1cf4b940127cb32cadc6074,nytimes.com,nytimes.com,Millions of New Yorkers Wait to Hear How Much Their Rent Will Go Up,2024-04-30,https://www.nytimes.com/2024/04/30/nyregion/new-york-board-rent-increases-vote.html,en,2024-04-30 17:21:03.154838
b67bbd893610365fd1f1c902fe5f72596bd05f0904eba6cf0565ab57531e6cd6,syracuse.com,syracuse.com,Former Super Bowl champion arrested for 2nd time in less than a year,2024-04-30,https://www.syracuse.com/sports/2024/04/former-super-bowl-champion-arrested-for-2nd-time-in-less-than-a-year.html,en,2024-04-30 12:22:09.610748
dee8708f16dc2384e13837a4bef5eb5ba79b672cbc44d6fa10a5f279f930536d,pbs.org,pbs.org,Why many universities are rejecting protester calls for divestment from Israel,2024-04-30,https://www.pbs.org/newshour/show/why-many-universities-are-rejecting-protester-calls-for-divestment-from-israel,en,2024-05-01 02:23:24.063380
16addbc1fe5a0f827bc7fc9d7ef90f15892277b499ff32ac41a084ff12b7970f,stltoday.com,stltoday.com,Recap: St. Louis Patriots waltzes over Fairfax Hawks,2024-04-30,https://www.stltoday.com/sports/high-school/baseball/recap-st-louis-patriots-waltzes-over-fairfax-hawks/article_ed618092-a4f2-5d3c-b440-2bdcf7089567.html,en,2024-05-01 13:34:56.711682
16ffc550db80632d6ce3e2adabcf44c4d7d862d5b120ea2fa65bd9ced784bd48,usmagazine.com,usmagazine.com,Shop Universally Flattering Milkmaid Dresses,2024-04-30,https://www.usmagazine.com/shop-with-us/news/shop-universally-flattering-milkmaid-dresses/,en,2024-05-01 07:23:21.305993
ae2d5cf428c41789d5544af1f7c2dc015160286cc7aa070e32b84182694fa65d,dailysignal.com,dailysignal.com,That Was Fast: 3 Federal Lawsuits Challenge New Title IX Rule,2024-04-30,https://www.dailysignal.com/2024/04/30/well-that-was-fast-3-federal-lawsuits-dropping-simultaneously-challenge-education-departments-new-title-ix-rule/,en,2024-05-01 05:17:23.591005
edbcc8e8270413aa93ec64caeeb564781dbf2eb6bd7e51a9b2ec9a86751cdd87,ign.com,ign.com,Get Over 50% Off the Jurassic World Ultimate Collection on 4K,2024-04-30,https://www.ign.com/articles/get-over-50-off-the-jurassic-world-ultimate-collection-on-4k,en,2024-04-30 17:17:21.640978
7c07de4865be709268dc67b2af27167cca425d642b2f10a9bdf2fd0d8c68a146,newsday.com,newsday.com,5 takeaways from the global negotiations on a treaty to end plastic pollution,2024-04-30,https://www.newsday.com/business/plastic-pollution-treaty-negotiations-Ottawa-United-Nations-k40174,en,2024-05-01 00:01:45.014183
2a1679e7545ed378ffa47503e3dadeefb724d861303d54424935479048c2e971,reuters.com,reuters.com,レーザーテック、仙洞田副社長が社長昇格へ 岡林氏は会長に,2024-04-30,https://jp.reuters.com/business/AWA325QHAFJW7PN3EVPPC2U5BY-2024-04-30/,ja,2024-04-30 08:29:17.645043
ce54cad155ca6d04f0ab431ef8d2fa2e987910771b8dc8f1380e3668410a9a15,cbsnews.com,cbsnews.com,Golden Gate Ferry service from Sausalito to San Francisco to resume after pier repairs,2024-04-30,https://www.cbsnews.com/sanfrancisco/news/golden-gate-ferry-service-from-sausalito-to-san-francisco-to-resume-after-pier-repairs/,en,2024-04-30 21:19:02.638280
4b633e96429174936acb7bbec6a3392e59da7dca82a25aae3e319cab7b5b1599,benzinga.com,benzinga.com,"AMD Investors Pull Back After Modest Q1 Beat, Lukewarm Guidance; CEO Touts AI Chip Ramp-Up (UPDATED)",2024-04-30,https://www.benzinga.com/news/earnings/24/04/38534910/amd-investors-pull-back-after-modest-q1-beat-ceo-touts-ai-chip-ramp-up,en,2024-04-30 21:20:57.568785
93fc2eb1a732e3ecffd270d14791c3cc3ae496eca4f2b760512ec5781436f415,wsj.com,wsj.com,A Chance for Congress to Stave Off Tyranny,2024-04-30,https://www.wsj.com/articles/a-chance-for-congress-to-stave-off-tyranny-insurrection-act-trump-786ea4da,en,2024-04-30 17:34:52.376317
2d8ebe8d0880847ccded353d698507cd3acff7a83c43e35a06a42b6c532b42f1,cbsnews.com,cbsnews.com,"Congestion pricing discounts approved for some LIRR, Metro-North riders",2024-04-30,https://www.cbsnews.com/newyork/video/congestion-pricing-discounts-approved-for-some-lirr-metro-north-riders/,en,2024-04-30 21:20:12.645485
f074b554ed8833b451777e4fb3dba86b529da8567ae03770c3aa210717102363,thewrap.com,thewrap.com,"Warner Bros. in Talks for Rights to 'Avengelyne,' With Margot Robbie Eyeing Lead Role",2024-04-30,https://www.thewrap.com/warner-bros-in-talks-for-rights-to-avengelyne-with-margot-robbie-eyeing-lead-role/,en,2024-04-30 18:32:22.432694
9a123d245d3adebeebf91da95e46abe0c705dc5726f9b100c403609160fd8d78,latimes.com,latimes.com,"Tesla sales have peaked in California, industry group predicts",2024-04-30,https://www.latimes.com/business/story/2024-04-30/tesla-sales-have-peaked-in-california-industry-group-predicts,en,2024-04-30 23:37:33.203169
6e61937d3a415ee718c264c7a97f758e6a6f7d59e4904c061d2bbe55c7589cea,post-gazette.com,post-gazette.com,Walmart launches store-label food brand as it seeks to appeal to younger shoppers,2024-04-30,https://www.post-gazette.com/business/money/2024/04/30/walmart-store-label-food-brand-younger-shoppers/stories/202405010012,en,2024-04-30 20:40:31.799465
b47744518b77e79dcb7ecfb22b1ba8baf82b037799eb2ff7a78483a87e73c417,bleacherreport.com,bleacherreport.com,Lakers Rumors: Bronny James Eyed for LeBron in 2024 NBA Draft to 'Fulfill His Dream',2024-04-30,https://bleacherreport.com/articles/10119197-lakers-rumors-bronny-james-eyed-for-lebron-in-2024-nba-draft-to-fulfill-his-dream,en,2024-04-30 12:32:55.270594
0b3ae08e77848772a625aa34f680d3253698a2e059ec691848166085cb95626a,realclearpolitics.com,realclearpolitics.com,"Judge Holds Trump in Contempt, Warns of Jail Time",2024-04-30,https://www.realclearpolitics.com/2024/04/30/judge_holds_trump_in_contempt_warns_of_jail_time_622755.html,en,2024-04-30 20:31:16.461616
c81e8d4e020aff41f897fa2fc883ef68298d6e1c1c869aadacecd3dee879e796,benzinga.com,benzinga.com,What 7 Analyst Ratings Have To Say About CACI International,2024-04-30,https://www.benzinga.com/insights/analyst-ratings/24/04/38521823/what-7-analyst-ratings-have-to-say-about-caci-international,en,2024-04-30 15:23:47.253198
3cb9b6eea533eb78d59e6b56674bba7b4d3ffe84212b3f7b5891141cee853e05,jezebel.com,jezebel.com,Could a United Condé Nast Rain on the Met Gala's Parade?,2024-04-30,https://www.jezebel.com/could-a-united-conde-nast-rain-on-the-met-galas-parade,en,2024-05-01 22:39:33.507323
