id,media_name,media_url,title,publish_date,url,language,indexed_date
abf43c82b9b8e6def87728817cb200df0fda09ad0cb18f2ab987ec314500fd78,espn.com,espn.com,Fantasy women's basketball waiver wire: Look to Tiffany Hayes,2024-09-03,https://www.espn.com/fantasy/womens-basketball/story/_/id/41107682/fantasy-womens-basketball-wnba-streamers-pickups-waivers-guards-scoring,en,2024-09-04 10:57:50.473782
6081eca8d68d19a7f79a71f0e40b2ee52fea29509b7d2686271d45b249d4847f,latimes.com,latimes.com,Cristiano Ronaldo quiere más con Portugal y la nueva generación de España reina en Europa,2024-09-03,https://www.latimes.com/espanol/deportes/articulo/2024-09-03/cristiano-ronaldo-quiere-mas-con-portugal-y-la-nueva-generacion-de-espana-reina-en-europa,es,2024-09-04 11:34:36.449645
b7d02efcdd20d940def2d508a2056c7a27eea8ba7df95c8476adbe181500009a,foxsports.com,foxsports.com,Nationals vs. Marlins Highlights,2024-09-03,https://www.foxsports.com/watch/fmc-lw4ocp9yosxf8op8,en,2024-09-05 11:23:36.334117
dc66125c58c01e9dc321d07d111aaece62a8e46e15b946fb12f89e6de75377d1,theconversation.com,theconversation.com,Cancers les plus fréquents,2024-09-03,https://theconversation.com/cancers-les-plus-frequents-le-role-du-gras-dans-leur-prevention-et-leur-evolution-232329,fr,2024-09-04 10:45:14.931664
4b0b68d48451f7bfcf66316b70630733b21cc1d4d335993369b5c6466ec96af9,benzinga.com,benzinga.com,Personalized Support And Cutting-Edge Tools: What Sets EdgeClear Apart In Futures Trading,2024-09-03,https://www.benzinga.com/partner/futures/24/09/40685369/personalized-support-and-cutting-edge-tools-what-sets-edgeclear-apart-in-futures-trading,en,2024-09-05 10:38:54.339491
b43b953cef0149716809aad0d67dcdd4f176aa7f8484320d983fd9a3aa89f09f,mongabay.com,mongabay.com,Famous ‘spy’ beluga whale found dead in Norway,2024-09-03,https://news.mongabay.com/short-article/2024/09/famous-spy-beluga-whale-found-dead-in-norway/,en,2024-09-05 06:22:37.552039
08b38735d99b3e012cd576b2eca18fde09ed90b2d4ccc2183676910798cd7297,newsday.com,newsday.com,"New Northwestern AD Jackson aims to help school navigate evolving landscape, heal wounds",2024-09-03,https://www.newsday.com/sports/mark-jackson-northwestern-athletic-director-k20744,en,2024-09-04 11:16:09.327867
012f907198beab8e651c00862f9c557ec45e00c620972438f727225f52dddf53,deadspin.com,deadspin.com,Florida State falls out of AP Top 25 after two upset losses,2024-09-03,https://deadspin.com/florida-state-falls-out-of-ap-top-25-after-two-upset-losses/,en,2024-09-04 15:39:46.410017
7dcc765a6c528897eff64ea5704671d5f85f1ce30d36cd63c7f5e21c0ecc0eee,opednews.com,opednews.com,Three things are really bugging me,2024-09-03,https://www.opednews.com/populum/page.php?f=Three-things-are-really-bu-Addictions_Arlington-National-Cemetery_Astronauts_Boeing-240903-658.html,en,2024-09-04 20:25:15.674149
5c62e173614320cb37a06a4257007adf0395b55e092e2f4b8bb80cf9fc2155bb,newsday.com,newsday.com,Engine troubles for airline Cathay Pacific force the cancellation of dozens of flights this week,2024-09-03,https://www.newsday.com/business/cathay-pacific-rollsroyce-airbus-p54086,en,2024-09-04 11:08:27.975472
d04af7154d8b5b263b4a524f9c3cbde36b1d4d5c979e9761b8c742625c72dbb0,theblaze.com,theblaze.com,WATCH: Resurfaced clip of Kamala Harris CNN regrets now,2024-09-03,https://www.theblaze.com/shows/the-rubin-report/kamala-harris-2669121794,en,2024-09-04 11:20:35.613451
976fdae006f29d914514da2d497e7397861a12c1ebae5ceff49db82300e1f8b9,benzinga.com,benzinga.com,"Specialty Food Association and Tastemaker Conference to Connect Creators, Bloggers, and Influencers at 49th Winter Fancy Food Show",2024-09-03,https://www.benzinga.com/pressreleases/24/09/n40692712/specialty-food-association-and-tastemaker-conference-to-connect-creators-bloggers-and-influencers-,en,2024-09-05 11:30:23.763312
f6f4c9387adadaf476bda57112fce1ff1890e8a4805651b37439a6fb8bb1685a,newsday.com,newsday.com,"The Ravens get another shot at the Chiefs, but the stakes aren't nearly the same this time",2024-09-03,https://www.newsday.com/sports/football/baltimore-ravens-lamar-jackson-e25191,en,2024-09-04 11:10:13.163669
77cf23735b0c64e2a98d6984b34cf21cadf20600a7d124807f1755f7431fadf7,cbsnews.com,cbsnews.com,Sacramento police issue 49 citations during crosswalk sting to kick off Pedestrian Safety Month,2024-09-03,https://www.cbsnews.com/sacramento/news/sacramento-crosswalk-sting-pedestrian-safety-month/,en,2024-09-04 15:27:05.224024
91f6a067752c2ee9174d99a67dbad1dde46ebc8399c10d9dd6c1f997cb10614a,deadspin.com,deadspin.com,Astros try to beat Reds for first time since 2016,2024-09-03,https://deadspin.com/astros-try-to-beat-reds-for-first-time-since-2016/,en,2024-09-04 15:36:56.544952
15d0a3008aaa59903a08c63831d8dc4e39a95ca5e5a4b99429c683572876772c,newsday.com,newsday.com,Philadelphia woman who was driving a partially automated Mustang Mach-E charged with DUI homicide,2024-09-03,https://www.newsday.com/news/nation/mach-e-fatal-crash-philadelphia-driver-charged-j16722,en,2024-09-04 10:22:31.024730
d75f7285457729115faa9b3f3df39e3353af820f6db492216c7dd08b55b7a1d5,newsday.com,newsday.com,"Hyundai unveils 2025 electric SUVs aiming for broader appeal with improved range, charging options",2024-09-03,https://www.newsday.com/business/hyundai-2025-ioniq-5-unveiled-electric-vehicle-w02276,en,2024-09-04 10:19:35.700606
232583e5387b5cfa02eeacc369912909e962738b84267e1af98a8d84aebab919,latimes.com,latimes.com,San Francisco Fed study signals housing cost slowdown through end of year,2024-09-03,https://www.latimes.com/business/story/2024-09-03/san-francisco-fed-study-signals-housing-cost-slowdown-through-end-of-year,en,2024-09-04 11:33:55.326218
bf99324318aef92d0c18329b54cd05be4c5f1ba4124182ce82e56eb453616425,nj.com,nj.com,South Brunswick over St. Joseph (Met.),2024-09-03,https://www.nj.com/highschoolsports/2024/09/south-brunswick-over-st-joseph-met-boys-soccer-recap.html,en,2024-09-04 08:31:37.550800
7ca6a009ef48c93a436f40edee1878625325b06bfb7cf7d3791e06ed880f9386,upi.com,upi.com,Hewlett Packard Enterprise to pursue $3.94B judgment against late British tech mogul Mike Lynch,2024-09-03,https://www.upi.com/Top_News/World-News/2024/09/03/Hewlett-Packard-Enterprise-to-pursue-394B-judgment-against-late-Mike-Lynch/7821725370212/,en,2024-09-04 10:58:01.977153
62383271ff2cfa0615b2b7351fc76ef94fa0c301a5f9ea6a2dcfaf2e5e13040e,newsday.com,newsday.com,Alabama sets mid-October execution date for man who killed 5 in ax and gun attack,2024-09-03,https://www.newsday.com/news/nation/alabama-death-penalty-lethal-injection-execution-s76312,en,2024-09-04 11:08:03.298000
2b2b6f9178d58e584232eab8ae7e9625e61d23db574f363cd38549efd85906c1,theconversation.com,theconversation.com,Apprendre à désapprendre,2024-09-03,https://theconversation.com/apprendre-a-desapprendre-le-nouveau-defi-de-lintelligence-artificielle-237579,fr,2024-09-04 10:37:04.708664
6ab2c2d614910a56e28f138b2c92fc0f9ed29eaf81ca4a42574493089dd59661,benzinga.com,benzinga.com,Restaurant Brands International Inc. Announces Pricing of First Lien Senior Secured Notes Offering,2024-09-03,https://www.benzinga.com/pressreleases/24/09/n40697963/restaurant-brands-international-inc-announces-pricing-of-first-lien-senior-secured-notes-offering,en,2024-09-05 00:20:49.932258
fff31eb741383a235d9b5cab91487e008614a0f04b5372e717507f7cf39eca21,chicagotribune.com,chicagotribune.com,Kane County shares in-depth health data through new website,2024-09-03,https://www.chicagotribune.com/2024/09/03/kane-county-shares-in-depth-health-data-through-new-website/,en,2024-09-04 08:19:15.391578
572305dd8bd06177587ec37625197b768e6ceb9c820a358b425c67584858eae1,thenation.com,thenation.com,Shirley Chisholm,2024-09-03,https://www.thenation.com/article/culture/shirley-chisholm-2/,en,2024-09-04 10:20:01.400889
d350e35bfde1523d4a29892f131306db5188284352325687c17dec80a09910e4,latimes.com,latimes.com,Los Angeles Times to Highlight Films Shaping Awards Season at TIFF,2024-09-03,https://www.latimes.com/about/pressreleases/story/2024-09-03/the-l-a-times-to-highlight-films-shaping-awards-season-at-toronto-international-film-festival,en,2024-09-04 15:24:56.110691
0c5e2e03b0bc3225a66d05fae90b8f2e507f495133ee9391fa067ab37c809ea9,tmz.com,tmz.com,"College Wrestler Arrested For Murder, Accused Of Killing Gymnast",2024-09-03,https://www.tmz.com/2024/09/03/college-wrestler-murder-gymnast-kara-welsh-chad-richards/,en,2024-09-04 08:25:00.178104
5bdb81f0804c7ab4f0ec71effd7ad9b4bc1469d9bedd081bdc7a45967b35a350,benzinga.com,benzinga.com,"Pioneering ethical AI: P insurers to play a critical role, say Triple-I and SAS",2024-09-03,https://www.benzinga.com/pressreleases/24/09/n40689156/pioneering-ethical-ai-p-c-insurers-to-play-a-critical-role-say-triple-i-and-sas,en,2024-09-04 11:40:11.005212
128c207a84114d0a3f30773668ae579e13ab40a62f8693aac9266d50d32c7a06,buzzfeed.com,buzzfeed.com,Test: Dime cómo estás y te daré el mensaje que debes escuchar,2024-09-03,https://www.buzzfeed.com/mx/bety_lara/test-dime-como-estas-y-te-dare-el-mensaje-que-debes-escuchar,es,2024-09-04 10:25:42.434920
0c427b91da02a43e4e98796f2cc649246006a76d7c13d1b066dd165dcf0ec27b,nypost.com,nypost.com,"Jealous ex accused of killing former wife, new beau inside LI mansion tried to commit suicide in jail: sources",2024-09-03,https://nypost.com/2024/09/03/us-news/jealous-ex-accused-of-killing-former-wife-new-beau-inside-li-mansion-tried-to-commit-suicide-in-jail-sources/,en,2024-09-04 15:25:28.495970
d086025d943e307a6d3557ffe5bbb3e3c9d502df40ccb748986ebe346c74c796,fansided.com,fansided.com,"Best MLB Player Props Today: Predictions for Colton Cowser, Ramon Laureano on Monday",2024-09-03,https://fansided.com/betsided/posts/best-mlb-player-props-today-predictions-colton-cowser-ramon-laureano-on-monday-01j6w7c0pc79,en,2024-09-06 22:00:00.041944
b0b39e77c114cc03979be21b7b6a9f56b20c21fd19950f59515fa258dd4b3840,cleveland.com,cleveland.com,Guardians rolling as rookie Brayan Rocchio drives in four runs in 7-1 win against Royals,2024-09-03,https://www.cleveland.com/guardians/2024/09/guardians-rolling-as-rookie-brayan-rocchio-drives-in-four-runs-in-7-1-win-against-royals.html,en,2024-09-04 11:35:02.531666
544c7aa18e03ff159d15f1b52f4f8bd1693da51712ef4619473bddc4e68df8ca,staradvertiser.com,staradvertiser.com,California looks to crown first world surf champion since 1990,2024-09-03,https://www.staradvertiser.com/2024/09/03/sports/sports-breaking/california-looks-to-crown-first-world-surf-champion-since-1990/,en,2024-09-04 08:31:47.367559
08693d40122ad35c8e13f7f7472f75fab12b4a3878fd3ea076ae892ee3fed49e,newsday.com,newsday.com,Harris to propose tenfold startup tax incentive increase she says will spur small business creation,2024-09-03,https://www.newsday.com/business/harris-small-business-tax-plan-new-hampshire-l97196,en,2024-09-04 11:11:54.134923
2dcd28b3d209ce40e0f1acf1c2ac1f3f48720ad49feb8d25da5d86cfd005ee5b,upi.com,upi.com,"Cathay Pacific grounds fleet of Airbus A350s, cancels dozens of flights",2024-09-03,https://www.upi.com/Top_News/World-News/2024/09/03/Cathay-Pacific-grounds-fleet-of-Airbus-A350s-cancels-dozens-of-flights/9511725365692/,en,2024-09-11 11:05:05.536580
3680cccb28bb38f7a6f26cbf1f15a66bacb75e4563be4ef67d51234c19dbeee9,cbsnews.com,cbsnews.com,Phoenix hits 100 degrees Fahrenheit for a record 100th straight day as heat scorches western U.S.,2024-09-03,https://www.cbsnews.com/detroit/news/phoenix-arizona-hits-100-degrees-fahrenheit-for-a-record-100th-straight-day/,en,2024-09-04 15:26:35.317987
2246d04a0c7318bd78d4661e6dfe7486ba2a705f8906601c338f2ae09a51e598,tmz.com,tmz.com,"Ice Spice Ex-Friends Cleotrapa, Baby Storme Unify Against Her",2024-09-03,https://www.tmz.com/2024/09/03/cleotrapa-exposes-ice-spice-tiktok/,en,2024-09-04 08:17:57.156125
eb33563d1bf07205be606bfb937d11361512e9de12c33812f74afa3ec95c7be3,oregonlive.com,oregonlive.com,"Now healthy and reloaded, Tualatin football looks like an offensive powerhouse",2024-09-03,https://www.oregonlive.com/highschoolsports/2024/09/now-healthy-and-reloaded-tualatin-football-looks-like-an-offensive-powerhouse.html,en,2024-09-04 07:28:46.429243
2e2a87dc6f05f7a0ce1826ae217fb8a97406de1ba9000d8541e2bdb8a92c845d,foxsports.com,foxsports.com,Phillies vs. Blue Jays Highlights,2024-09-03,https://www.foxsports.com/watch/fmc-uhfk8sceo5wn3y9i,en,2024-09-05 11:22:50.309533
d4fa7db08586909a3cb404e9f5483124d933241376d94608849ee8a5355ac59c,cbsnews.com,cbsnews.com,"North Texas girl sex trafficked from a Dallas Mavericks game shares her story of survival: ""I'm not afraid""",2024-09-03,https://www.cbsnews.com/news/north-texas-girl-sex-trafficked-from-a-dallas-mavericks-game-shares-her-story-of-survival-i-am-not-afraid/,en,2024-09-04 12:23:52.203474
f8cfdc9a1c4ef3e44b65bd216e5c84d9166eb75584704287236361bb4d75415a,newsday.com,newsday.com,Lebanon's former central bank governor detained in corruption probe,2024-09-03,https://www.newsday.com/news/nation/lebanon-salameh-central-bank-corruption-v80973,en,2024-09-04 11:45:32.201246
91a7ed48a24f43922b0695f2c34f42065e309f0495867f64332b0fe19061bc4d,foxsports.com,foxsports.com,Shohei Ohtani or Francisco Lindor for MVP? MLB's best team? Smoltz weighs in,2024-09-03,https://www.foxsports.com/stories/mlb/shohei-ohtani-francisco-lindor-mvp-mlbs-best-team-smoltz-weighs,en,2024-09-05 11:22:00.612790
ede5aaa97dcb653e00970d91862ab8b76d87b2d8d76c0240263592f40e2f0afa,newsday.com,newsday.com,O'Connor keeps Spanish Vuelta lead by just 5 seconds over Roglič in mountains. Van Aert crashes out,2024-09-03,https://www.newsday.com/sports/spanish-vuelta-oconnor-roglic-van-aert-h30330,en,2024-09-04 11:46:07.083475
af7a3003e25526e7c660c9f6fd9d6e68a5343a744a45f8f02d84df7a23cd8177,upi.com,upi.com,Airline to rebalance planes as new first class seats make aircraft 'nose-heavy',2024-09-03,https://www.upi.com/Top_News/World-News/2024/09/03/Airline-to-rebalance-planes-as-new-first-class-seats-make-aircraft-nose-heavy/5441725420377/,en,2024-09-12 10:57:22.918418
a4c77555e14445318cb58fc7d217341e7240c41a425f4301f610efef82a2e97e,tmz.com,tmz.com,"French Man Accused of Inviting Strangers to Rape Drugged Wife, Trial Begins",2024-09-03,https://www.tmz.com/2024/09/03/france-50-men-rape-drugged-wife-trial-begins/,en,2024-09-04 07:31:50.728522
dd0e57215f97f11cbe5e2d3a2ef5e46041603f9057bfc7f5db6fae4fc4a692b2,fansided.com,fansided.com,3 equipos que pueden firmar a Anthony Rizzo si los Yankees no ejercen su opciÃ³n de contrato,2024-09-03,https://fansided.com/es/posts/3-equipos-pueden-firmar-anthony-rizzo-yankees-no-ejercen-opcion-contrato,es,2024-09-06 20:18:56.787359
f4c27046a9dd6e508ae4e2ecc024c31eabb7b8a40be885f17b8d84cec70c892e,npr.org,npr.org,Why farmers worry about the costs of long-term care,2024-09-03,https://www.npr.org/2024/09/03/nx-s1-5096814/why-farmers-worry-about-the-costs-of-long-term-care,en,2024-09-04 10:45:20.533035
87fa7c7d71e0ed4f4642a219bb4ede7ec2325e89fc5928c4e606cf3b26983843,deadspin.com,deadspin.com,"Taylor Fritz breaks through at U.S. Open, nabs first Grand Slam semifinal",2024-09-03,https://deadspin.com/taylor-fritz-breaks-through-at-us-open-nabs-first-grand-slam-semifinal/,en,2024-09-04 15:39:01.529253
3fd47cee732b2fe9b1475ed128da790371ba15698f69e6ee14b9a7b9020cfd45,fansided.com,fansided.com,Latest Brandon Aiyuk admission is proof that he wasted everybodyâs time with contract holdout,2024-09-03,https://fansided.com/posts/latest-brandon-aiyuk-admission-is-proof-that-he-wasted-everybody-s-time-with-contract-holdout-01j6wzzkwv3z,en,2024-09-06 20:55:45.878579
fae88842e4ec2c1802a13184ec71dbcd2b937f2a5192e73e57f78f1f4138361e,theconversation.com,theconversation.com,Cinq raisons d’adopter la semaine de travail de quatre jours,2024-09-03,https://theconversation.com/cinq-raisons-dadopter-la-semaine-de-travail-de-quatre-jours-235748,fr,2024-09-04 11:21:21.277408
478f6ed46511921d8fac51fd92a3ef2c971cf47f505a9a531d11d73300bc5435,stripes.com,stripes.com,"Veterans groups, lawmakers call on Supreme Court to hear Air Force vet’s suit on military medical malpractice",2024-09-03,https://www.stripes.com/veterans/2024-09-03/supreme-court-feres-doctrine-military-medical-malpractice-15061539.html?fbclid=IwY2xjawFFQYNleHRuA2FlbQIxMQABHWuEGsHhPoams7GWo6OOxAmX02JPHlcOlPR6iuVF-jsRCfEHV4kdrZAMBQ_aem_bUJByxy-t0zXVvatF_Ng6A,en,2024-09-05 04:27:11.607365
23fd3c21009b274e4638ad1010a8d384abc2c4e7b24ab7a34b03eb04f554b70b,fansided.com,fansided.com,"Chris Jones flat-out disrespected in NFL trade value rankings, not that Chiefs would ever",2024-09-03,https://fansided.com/posts/chris-jones-flat-out-disrespected-in-nfl-trade-value-rankings-not-that-chiefs-would-ever-01j6wpfayaft,en,2024-09-06 23:08:53.664284
50c9f257d096c5e9bc4f2bcc5cb8665f66e8e4acfcdcce2399e28d5be39a7a5a,fansided.com,fansided.com,3 equipos que pueden firmar a Anthony Rizzo si los Yankees no ejercen su opciÃ³n de contrato,2024-09-03,https://fansided.com/es/posts/3-equipos-pueden-firmar-anthony-rizzo-yankees-no-ejercen-opcion-contrato/3,es,2024-09-11 15:25:38.380346
b0346c4aeae545e5c34e702d6694ef6d71ef5a3d3b18f8d602bc927efcc588ef,fansided.com,fansided.com,Counting on Quality: Best MLB Quality Start Picks for September 3 (Back Sale and Rodon),2024-09-03,https://fansided.com/betsided/posts/counting-on-quality-best-mlb-quality-start-picks-september-3-back-sale-rodon,en,2024-09-06 22:53:08.890377
3411623e5f5d5f46b2bf1ac0e3a6126b53c396db69268d151ea9337495c1acf7,mlive.com,mlive.com,3-vehicle crash on I-75 in Saginaw County leaves local man dead,2024-09-03,https://www.mlive.com/news/saginaw-bay-city/2024/09/3-vehicle-crash-on-i-75-in-saginaw-county-leaves-local-man-dead.html,en,2024-09-30 19:34:35.587849
01ed239e110885455c328daaf5fb30ee117a93fe506eb54cae12e956ffafc247,cleveland.com,cleveland.com,3 Reasons to see Neko Case at the Kent Stage September 21,2024-09-03,https://www.cleveland.com/entertainment/2024/09/3-reasons-to-see-neko-case-at-the-kent-stage-september-21.html,en,2024-09-17 22:18:55.273031
56c7a469406859fce0fb1d1504ee942d818e50119fc55198f4b5c1baaa5da1e9,fansided.com,fansided.com,3 NFL Best Bets for Ravens vs. Chiefs in NFL Week 1 (Ride With 2 Solid Defenses Thursday),2024-09-03,https://fansided.com/betsided/posts/3-nfl-best-bets-for-ravens-vs-chiefs-in-nfl-week-1-ride-with-2-solid-defenses-thursday-01j6wa0py6d8,en,2024-09-06 22:03:24.934070
93b6099cac38f6d3c53f0c93c914250916e011b133a5109b64f82564f08c930b,fansided.com,fansided.com,NFL en vivo: Baltimore Ravens vs. Kansas City Chiefs en TV y streaming,2024-09-03,https://fansided.com/es/posts/nfl-en-vivo-baltimore-ravens-kansas-city-chiefs-tv-streaming,es,2024-09-06 20:39:09.461791
cb72d492f79b2c03bd902a5cff10578b679786e20ce944f314380b8a711d4ef5,foxnews.com,foxnews.com,"Biden-Harris admin needs 'more aggressive' plan to take on Iran-backed Houthis, experts warn",2024-09-03,https://www.foxnews.com/world/biden-harris-admin-needs-more-aggressive-plan-to-on-take-iran-backed-houthis-experts-warn,en,2024-09-06 10:21:18.248522
e9c3a256a358b35720fed312c0545e82e9f0ced96d69b9e80ad91c846412d1b9,theblaze.com,theblaze.com,Louisville officer shot in Breonna Taylor raid shares the UNTOLD story,2024-09-03,https://www.theblaze.com/shows/fearless-with-jason-whitlock/breonna-taylor-racial-hoax,en,2024-09-04 11:19:15.122247
77fa0f1024a7fcfedde3f599a75a143f17920492dc997d31b144928490a3b002,espn.com,espn.com,Cincy's Corleone cleared to play after blood clots,2024-09-03,https://www.espn.com/college-football/story/_/id/41108509/cincinnati-dontay-corleone-cleared-play-blood-clots,en,2024-09-04 15:32:45.684571
03b00c76b54743047816bf65a1198de69fdfa10f62c4322add062f67982afd98,nj.com,nj.com,3rd head coach named in 3 weeks for N.J. football team in turmoil,2024-09-03,https://www.nj.com/highschoolsports/2024/09/3rd-head-coach-named-in-3-weeks-for-nj-football-team-in-turmoil.html,en,2024-09-20 18:26:33.869935
f3b2ad9e6148c322b1f3d1f5bbca93256fc17f6a7224c3f02fc003ccdb13e694,latimes.com,latimes.com,Netanyahu rechaza la nueva oleada de presión para alcanzar acuerdo de cese del fuego con Hamás,2024-09-03,https://www.latimes.com/espanol/internacional/articulo/2024-09-03/netanyahu-rechaza-la-nueva-oleada-de-presion-para-alcanzar-acuerdo-de-cese-del-fuego-con-hamas,es,2024-09-04 11:35:41.503010
bfad33738119c6ed4977b43ac01291b2f695a04ea909220dd943081a1fdc96a7,newsday.com,newsday.com,"Trial begins in Florida for activists accused of helping Russia sow political division, chaos",2024-09-03,https://www.newsday.com/news/nation/russia-meddling-political-chaos-trial-florida-activists-h30441,en,2024-09-04 10:18:55.779026
d889e14c940d8e4376dcd1d85045cc3dcbcd58d21988e4850ff9b44a5f0ecd75,eonline.com,eonline.com,Below Deck Mediterranean Crew Devastated by Unexpected Death of Loved One,2024-09-03,https://www.eonline.com/news/1406719/below-deck-mediterranean-crew-devastated-by-unexpected-death-of-loved-one?cmpid=rss-syndicate-genericrss-us-tv,en,2024-09-11 07:30:14.030980
408f27efe4d076e61e7e8b2a771ad38ca073e8b12a066fb0d5cbd5b6684cf2f2,benzinga.com,benzinga.com,EXCLUSIVE: Investor Ross Gerber On How Cannabis Rescheduling Could Slash Costs For Companies,2024-09-03,https://www.benzinga.com/markets/cannabis/24/09/40688353/exclusive-investor-ross-gerber-on-how-cannabis-rescheduling-could-slash-costs-for-companies,en,2024-09-05 11:22:36.365852
bb3aee3f6cdf7c41f5412810125eecf873c3ab5bcedb70f2906f9d45f6cb0282,nj.com,nj.com,Scocco’s four goals power Harrison to victory,2024-09-03,https://www.nj.com/highschoolsports/2024/09/scoccos-four-goals-power-harrison-to-victory-girls-soccer-recap.html,en,2024-09-04 08:32:50.812216
63e07bb3897ac8de0175e3186bfbfb40b8f18554521201c66e3b224e775166b5,rttnews.com,rttnews.com,Australia Services Sector Accelerates In August,2024-09-03,https://www.rttnews.com/3472655/australia-services-sector-accelerates-in-august-judo-bank.aspx?type=alleco,en,2024-09-04 08:29:43.324388
c942552baeea335475f7e689cb063e1ad45703695e3e0c7ccf3dd64dbd6f72b2,benzinga.com,benzinga.com,"The Overlooked Power Of Hemp: Ross Gerber Discusses Legal, Economic Benefits",2024-09-03,https://www.benzinga.com/markets/cannabis/24/09/40692775/the-overlooked-power-of-hemp-ross-gerber-discusses-legal-economic-benefits,en,2024-09-04 11:31:30.666783
bff27333a095f4a26be50b998379f280caabcd1611f3249c04b25e36fb77c718,fansided.com,fansided.com,4 equipos que pueden darle un contrato multianual a Anthony Santander en 2025,2024-09-03,https://fansided.com/es/posts/4-equipos-pueden-darle-contrato-multianual-anthony-santander-2025/3,es,2024-09-11 15:26:39.073733
7d38b31edc76a073cd6a3e50fad979d3681114d6ed71f023a795577392e32694,fansided.com,fansided.com,3 New York Mets that need to step up for the team to secure a postseason berth,2024-09-03,https://fansided.com/posts/3-new-york-mets-step-up-postseason-berth,en,2024-09-06 22:54:44.137289
bb69bcb3638d4a4c71ee8d69d98092bc23d22206373faa1fc4b00886be726f0b,newsday.com,newsday.com,Young Palestinian journalist who reported on Gaza's destruction now continues education in Lebanon,2024-09-03,https://www.newsday.com/news/nation/lebanon-gaza-israel-hamas-palestinians-journalism-d78649,en,2024-09-04 10:20:50.947605
501f59ebb20ca9fd0afa7c074ec9c027f401614f6d86794bc164ad71dcd54a7d,nj.com,nj.com,"3 men sue N.J. church for $10M, say they were sexually abused as children",2024-09-03,https://www.nj.com/cape-may-county/2024/09/3-men-sue-nj-church-for-10m-say-they-were-sexually-abused-as-children.html,en,2024-09-17 18:39:13.897286
856d45d7c1a440fd8e9966402317ccbb8e6e665fa892792a7f5b8126eced2a1b,cleveland.com,cleveland.com,3-day Christmas Connection holiday market coming up with new features,2024-09-03,https://www.cleveland.com/entertainment/2024/09/3-day-christmas-connection-holiday-market-coming-up-with-new-features.html,en,2024-09-17 15:38:11.302557
d7307e6b087e3748bff2b995f8f21355380ce626e92d156cb12f87254be3169a,rttnews.com,rttnews.com,"Randy Houser, Justin Moore Team Up On 'Country Round Here Tonight'",2024-09-03,https://www.rttnews.com/story.aspx?Id=3472612,en,2024-09-04 11:19:01.478344
97b01ae0ecad11a4ebd1b55335b7ce5f110ce765ecfd394f3196064f726c535b,marketwatch.com,marketwatch.com,Big Tech is shutting out our access to crucial data. Why does Congress allow it?,2024-09-03,https://www.marketwatch.com/story/big-tech-is-shutting-out-our-access-to-crucial-data-why-does-congress-allow-it-43d1b9e1?mod=mw_rss_topstories,en,2024-09-07 14:23:10.378505
41dcbd1065a86acf582f5a82b2a6371f5a3da58782328bb804bb52803d04a079,newsday.com,newsday.com,Nicaraguan congress gives legal footing to practice of prosecuting exiles and seizing their property,2024-09-03,https://www.newsday.com/news/nation/nicaragua-daniel-ortega-exile-repression-w99253,en,2024-09-04 11:08:13.919356
48a0acfb4beb8260f49b04ec676d923ac1104402660bc23b92d1ca5c67851a65,nj.com,nj.com,Florence edges past Palmyra to win season opener,2024-09-03,https://www.nj.com/highschoolsports/2024/09/florence-edges-past-palmyra-to-win-season-opener-boys-soccer-recap.html,en,2024-09-04 08:32:20.919199
55aff5fe15b92bbe76b8389e53f53e0762b0478e418cd5e4684e8db6c27948a5,theblaze.com,theblaze.com,Oculus creator fires back at ;politically obsessive journalists ; as hit-piece culture dies,2024-09-03,https://www.theblaze.com/return/palmer-luckey-gizmodo-hit-pieces,en,2024-09-04 11:20:59.373993
e79b9d0888fa3f2d51b32f410e04431fd83740961f338053f409e237ed996472,newsday.com,newsday.com,"Granados, Argueta link up for goals to spur Brentwood boys soccer",2024-09-03,https://www.newsday.com/sports/high-school/boys-soccer/brentwood-newfield-boys-soccer-epe21ezz,en,2024-09-04 11:10:40.123745
9c52a1ed65b94a028233c5f1624d3fc5e2903016e9131b920f6ab523fcac580d,nytimes.com,nytimes.com,U.S. Market Slump Fuels Global Sell-Off,2024-09-03,https://www.nytimes.com/2024/09/03/business/stocks-us-economy-nvidia.html,en,2024-09-04 10:53:33.266438
fca63e61290c5c10b0feba394a0cd363e7472252e25d39fe90de1f398326a58d,vanityfair.com,vanityfair.com,Don’t Fall for Trump’s 2024 Pivot,2024-09-03,https://www.vanityfair.com/news/story/dont-fall-for-trumps-2024-pivot,en,2024-09-04 14:22:29.140302
