id,media_name,media_url,title,publish_date,url,language,indexed_date
7c013ab06fc781ea101d5cd5af38c032afdd5669124f618b8a64edea9d747569,usmagazine.com,usmagazine.com,"Taylor Swift y Travis Kelce siguen firmes en su relación: ""Nada ha cambiado""",2024-10-01,https://www.usmagazine.com/enespanol/celebridades/taylor-swift-y-travis-kelce-siguen-firmes-en-su-relacion-nada-ha-cambiado/,es,2024-10-02 03:27:44.715236
6d61f5532e2b00eb1bdd9e27e75c41366533b68ca0fcc1967cc5aa504dc148c3,benzinga.com,benzinga.com,"A Gala For Cannabis Justice: Inside The Last Prisoner Project's NYC Event, Featuring Damian And Stephen Marley",2024-10-01,https://www.benzinga.com/markets/cannabis/24/10/41127605/a-gala-for-cannabis-justice-inside-the-last-prisoner-projects-nyc-event-featuring-damian-and-ste,en,2024-10-02 11:34:28.744297
f3e3f70c13bbe41d7998c050fd16d108f08d15f2d56a08cf866acd2fb2513384,fortune.com,fortune.com,Current price of Bitcoin: Oct. 1. 2024,2024-10-01,https://fortune.com/recommends/investing/current-bitcoin-price-10-01-2024/,en,2024-10-02 02:18:45.287325
f02b614d0c47dd601cba7be2db6a3a2bde12045b5cf9849be07632a72d5e6155,breitbart.com,breitbart.com,"Vance Backs Trump’s Abortion Position: U.S. Must Be ‘More Pro-Baby, Pro-Family’",2024-10-01,https://www.breitbart.com/politics/2024/10/01/jd-vance-backs-trump-abortion-position-more-pro-baby-pro-family/,en,2024-10-02 15:30:10.192305
456045374b782fbd7824a1249c85aa48c7281ecfcf0e0535d7bef887778c526f,theverge.com,theverge.com,Microsoft gives Copilot a voice and vision in its biggest redesign yet,2024-10-01,https://www.theverge.com/2024/10/1/24259187/microsoft-copilot-redesign-vision-voice-features-inflection-ai,en,2024-10-02 03:23:09.885729
351535e80368f2cdc1022d69a16566cd9017b4d7799a7b05e532fe5c8890779e,freep.com,freep.com,"Kamala Harris returns to Detroit, Flint for campaign events Friday",2024-10-01,https://www.freep.com/story/news/politics/elections/2024/10/01/kamala-harris-returns-to-detroit-flint-for-campaign-events-friday/75475144007/,en,2024-10-02 06:17:26.531853
4e4a4c4ee2b52de4af04ed82a4294f5ab68e213878e1b7191ada55d34715e792,cbsnews.com,cbsnews.com,"Sean ""Diddy"" Combs will face 120 accusers for alleged sexual misconduct, attorney says",2024-10-01,https://www.cbsnews.com/sanfrancisco/news/sean-diddy-combs-to-face-120-accusers-alleged-sexual-misconduct/,en,2024-10-02 03:26:09.736703
3928357e6ad88d0c1ba6d1c59c247a354b756e51366c8a27212547c1740f1dfb,thenation.com,thenation.com,Wind and Solar Energy Use Surpasses Gas and Coal…,2024-10-01,https://www.thenation.com/article/environment/wind-and-solar-energy-use-surpasses-gas-and-coal/,en,2024-10-02 01:27:32.858163
d4c1599d7601bf86fd697c619073ff1bed49a41464e15a1c8b83da797bbae854,cnn.com,cnn.com,Ella es Claudia Sheinbaum: su trayectoria académica y política,2024-10-01,https://cnnespanol.cnn.com/video/ella-es-claudia-sheinbaum-su-trayectoria-academica-y-politica,es,2024-10-02 04:27:45.287002
822c4a1ab7093da4530b8231a8ce6fcd5df151ff57e0f6f47379ae46dec29651,billboard.com,billboard.com,Post Malone Debuts Bold UGGs in New Campaign That’s Ready to Disrupt Your Shoe Rotation,2024-10-01,https://www.billboard.com/culture/product-recommendations/post-malone-ugg-collection-buy-online-1235789769/,en,2024-10-02 02:21:15.051386
2bb9845217fc8ea66b40ff48e3ff63229d8e6db03c4ed6e3ad71376ae9349fd1,arkansasonline.com,arkansasonline.com,Bentonville Planning Commission shoots down rezoning request to develop neighborhood shops,2024-10-01,https://www.arkansasonline.com/news/2024/oct/01/bentonville-planning-commission-shoots-down/,en,2024-10-02 07:17:14.947460
6be85e342fd3d7218fbe603161d41d42761e5548719c98c35647c1068d8d722f,cnet.com,cnet.com,Insurance Premiums Spike as Natural Disasters Strike. What Homeowners Can Do,2024-10-01,https://www.cnet.com/personal-finance/insurance-premiums-spike-as-natural-disasters-strike-what-homeowners-can-do/#ftag=CADf328eec,en,2024-10-02 02:17:19.242645
0d1f073260acce7af729e1e998ca305715f6d147dd9814c6ab08968987824087,nytimes.com,nytimes.com,Fantasy football: Who to drop ahead of Week 5? Caleb Williams comes to mind.,2024-10-01,https://www.nytimes.com/athletic/5809237/2024/10/01/fantasy-football-who-to-drop-ahead-of-week-5-caleb-williams-comes-to-mind/,en,2024-10-02 04:28:58.891230
b408f3b120802150159a7460aeec691b9917edb8748ea603fc9018d01c94b774,breitbart.com,breitbart.com,Fact Check: JD Vance Says Reshoring Manufacturing Is Good for Environment,2024-10-01,https://www.breitbart.com/politics/2024/10/01/fact-check-jd-vance-says-reshoring-american-manufacturing-is-good-for-the-environment/,en,2024-10-02 06:17:26.914385
f6bc94c6fedae35d8ac26ba85d7dbc91c3562060ebead81ce7706cb27477efe3,cbsnews.com,cbsnews.com,Squirrels causing serious damage to Queens residents' cars,2024-10-01,https://www.cbsnews.com/newyork/video/squirrels-causing-serious-damage-to-queens-residents-cars/,en,2024-10-02 05:19:05.267623
aaddc190d1cc85f171165f4c4f294dd41c561433ef8d43990b43396a71e5caa7,nytimes.com,nytimes.com,"Diplomacy, Conducted in the Nude",2024-10-01,https://www.nytimes.com/newsgraphics/card-story/sauna-finnish-embassy-washington,en,2024-10-02 04:30:23.950932
d9eb0471d1b7b661f9e6dbe0f5b2fbf8a85841627d8c0ca962d55dc1e981fded,espn.com,espn.com,"Day later, record-setting Goff given game ball",2024-10-01,https://www.espn.com/nfl/story/_/id/41557686/lions-give-goff-game-ball-day-record-setting-outing,en,2024-10-02 05:20:07.306309
bf34c06ec9abdd0a2e9abde6423b3b48093062e23764dd37df94b86d67d162e5,benzinga.com,benzinga.com,Cold Stone Creamery Partners with Freeform's '31 Nights of Halloween' for a Frightfully Delightful October,2024-10-01,https://www.benzinga.com/pressreleases/24/10/n41125652/cold-stone-creamery-partners-with-freeforms-31-nights-of-halloween-for-a-frightfully-delightful-oc,en,2024-10-02 07:23:52.479515
989f1658fddf2f864517ab183694ef6d7e5cd74728bb24b01d180c5421e78942,thrillist.com,thrillist.com,I Spent a Romantic Week in Montreal and This Is What It Cost,2024-10-01,https://www.thrillist.com/travel/nation/montreal-quebec-cost-vacation-spending,en,2024-11-05 10:34:10.281193
9fae36d34144c1263166565f2b1b007515430def9a805a878dfc0a8a485b859e,nypost.com,nypost.com,Sam Darnold set to face Jets in midst of QB’s Vikings breakout,2024-10-01,https://nypost.com/2024/10/01/sports/sam-darnold-set-to-face-jets-in-midst-of-qbs-vikings-breakout/,en,2024-10-02 05:17:17.765827
1c59b89d1d6678214454d2de6fc93831b91fd21b4a09e72cf34458655591696f,berkshireeagle.com,berkshireeagle.com,"Austerlitz, N.Y.: Historical Society hosting craft workshop & talk",2024-10-01,https://www.berkshireeagle.com/news/community-news/austerlitz-historical-society-workshop-talk-old-austerlitz/article_4c713fa6-804f-11ef-aa6f-ef5e632df4ef.html,en,2024-10-02 09:31:41.977351
4707b83aeab4f946ff6f1517f3c34a38722e18cb7745ce782975718a79564ba9,cnn.com,cnn.com,CVS Health despedirá a 2.900 empleados para reducir gastos,2024-10-01,https://cnnespanol.cnn.com/video/eeuu-farmacias-cvs-health-despedira-empleados-reducir-gastos-cnn-dinero-tv,es,2024-10-02 04:27:35.614832
054a01d963554a021af805aea2098b93129af25f15df66d20d45602242cf0478,ajc.com,ajc.com,What to know about Israel's ground invasion in southern Lebanon,2024-10-01,https://www.ajc.com/news/nation-world/what-to-know-about-israels-ground-invasion-in-southern-lebanon/JOVETMPCMZBFHOWT74HJJH6I4M/,en,2024-10-09 23:21:20.821344
e6f3d62633ff9300b4d724cd9ca059bdf0eb4f01be6fd2fa4588554de176fd32,forbes.com,forbes.com,Leadership Lessons From Bruce Springsteen,2024-10-01,https://www.forbes.com/sites/johnbaldoni/2024/10/01/leadership-lessons-from-bruce-springsteen/,en,2024-10-02 04:28:12.304802
f20ff0d4db19ee9c47695d7e03da053e262432983483afde07f214147cb248bc,cleveland.com,cleveland.com,"‘Caught in the Act: Unfaithful’ season 3, episode 3: Watch for free today",2024-10-01,https://www.cleveland.com/tv/2024/10/caught-in-the-act-unfaithful-season-3-episode-3-watch-for-free-today.html,en,2024-10-02 02:25:28.495363
fa877050f7f8090638949b162c23824795072dd96b9569dd4ee83e0699c9c42f,thestreet.com,thestreet.com,Norwegian Cruise Line makes big changes many don’t like,2024-10-01,https://www.thestreet.com/travel/norwegian-replaces-a-cruise-package-angering-some-passengers,en,2024-10-02 06:30:30.520173
4f9120e6c7a38327e08288357b7875d4699069c61180e5e02d02925e3ff35c70,thedailybeast.com,thedailybeast.com,Taylor Lorenz Quits Washington Post for Surprising New Gig,2024-10-01,https://www.thedailybeast.com/tech-columnist-taylor-lorenz-quits-washington-post-for-surprising-new-substack-gig,en,2024-10-02 05:21:30.780774
b07915284ca7fb4de5b02fb470c332d5628cb928b3ac819681ad6b7525c7bd95,hotair.com,hotair.com,Zelensky: Putin is 'Afraid' to Use Nukes,2024-10-01,https://hotair.com/jazz-shaw/2024/10/01/zelensky-putin-is-afraid-to-use-nukes-n3795271,en,2024-10-02 04:27:04.293329
9e1b6f225550e0919164ca7f60fe1467ddef50710abc8d5a5eb34064e7e7bd1a,oregonlive.com,oregonlive.com,Fishing guide’s death prompts huge outpouring of financial support for family,2024-10-01,https://www.oregonlive.com/pacific-northwest-news/2024/10/fishing-guides-death-prompts-huge-outpouring-of-financial-support.html,en,2024-10-02 05:23:55.830798
e78d31f62087ee0d2235ec657ebc67ed32a6d487c1af6b2b0b90160112ad7b69,cnet.com,cnet.com,Nab The Wild Robot for Kindle for Just $3 Right Now,2024-10-01,https://www.cnet.com/deals/nab-the-wild-robot-for-kindle-for-just-3-right-now/,en,2024-10-02 05:20:35.737914
92a6279d0c645cf602943d75e3878b5af1ede7dd5ad13e7595b584ec6544be2a,stltoday.com,stltoday.com,Ursuline pulls out emotional four-set win over Cor Jesu,2024-10-01,https://www.stltoday.com/sports/high-school/girls-volleyball/ursuline-pulls-out-emotional-four-set-win-over-cor-jesu/article_cf81d9b4-805e-11ef-a803-7f97dc5e9ee3.html,en,2024-10-02 10:56:56.028618
3ad6a21c75f99469b33a2e071d4c6ef66700848e4227ac63effb9305e319a3ee,abcnews.go.com,abcnews.go.com,"College football Week 6: Missouri-Texas A&M is the only Top 25 matchup, but other games loom large",2024-10-01,https://abcnews.go.com/Sports/wireStory/college-football-week-6-missouri-texas-top-25-114425940,en,2024-10-02 16:20:33.815858
7b0a141d8e2811942ede5db00abf44ebb92e951561e3e1250ead90b9e60a4901,cnn.com,cnn.com,Olivia Nuzzi accuses ex-fiance of orchestrating blackmail campaign amid RFK relationship,2024-10-01,https://www.cnn.com/2024/10/01/media/olivia-nuzzi-ryan-lizza-rfk-relationship/index.html,en,2024-10-02 04:27:14.894151
702a6c7ca761fc13bac15f5336ac70b6eee335ad5e4b6ee764ef3e9108a83ba3,nytimes.com,nytimes.com,"Bills’ Von Miller, Browns’ Mike Hall suspended by NFL for personal conduct violations",2024-10-01,https://www.nytimes.com/athletic/5810580/2024/10/01/nfl-bills-browns-hall-miller-suspensions/,en,2024-10-02 04:28:33.871476
8cba098872bdeaf1a71d639d40e1455a7d677623ce694e5689ba9d33651ba16a,tmz.com,tmz.com,Raven-Symoné Mourns Dad Christopher B. Pearman's Death With IG Tribute,2024-10-01,https://www.tmz.com/2024/10/01/raven-symone-mourns-dad-death-christopher-pearman/,en,2024-10-02 03:20:29.853575
42f23208cd8e517c9e179eb02265b517770453c2a6180348818800200edbf5e4,buzzfeed.com,buzzfeed.com,Discover Your Inner Dinosaur Personality Quiz,2024-10-01,https://www.buzzfeed.com/creativesealion87/dinosaur-personality-quiz,en,2024-10-05 22:21:35.265449
be51aa80125b82ecedf71912ea55163a5c3c9e2ec64d898f524f1680ee5f82f5,cleveland.com,cleveland.com,Lake County man accused of shooting wife surrenders after SWAT standoff,2024-10-01,https://www.cleveland.com/crime/2024/10/lake-county-man-accused-of-shooting-wife-surrenders-after-swat-standoff.html,en,2024-10-02 05:22:40.739000
f5a0fb3c8eea2cd7b8d764ba49fa2cfeea30be03e989e7629f73962ab9f032de,freep.com,freep.com,Case against Crumbley's parents gets mention at VP debate,2024-10-01,https://www.freep.com/story/news/politics/elections/2024/10/01/vp-debate-crumbleys-parents-gets-mention/75477193007/,en,2024-10-02 06:18:35.156510
b2b78c4da4f707db08e588808a9176819599f1e845bc8d9f01c9eef4d02e88f6,latimes.com,latimes.com,We need more street shade in L.A. Why aren’t we planting native trees?,2024-10-01,https://www.latimes.com/lifestyle/newsletter/2024-10-01/we-need-more-street-shade-in-la-why-arent-we-planting-native-trees-lat-plants,en,2024-10-02 03:19:40.170419
891ac8131c5fdf557d69dcdfca8709d5a25d247d7d5e34fdb5e9171166a75062,cnn.com,cnn.com,Speaking times during the vice presidential debate,2024-10-01,https://www.cnn.com/2024/10/01/politics/speaking-times-vance-walz-debate-dg/index.html,en,2024-10-02 04:28:24.710243
0c92aa3e05bade12cee33f5ab45618688d9d75c6518da7dcb4304356a938462f,syracuse.com,syracuse.com,1 dead in crash in rural Madison County,2024-10-01,https://www.syracuse.com/news/2024/10/1-dead-in-crash-in-rural-madison-county.html,en,2024-10-21 04:20:59.168167
e3b7e6f8cf8747064a9f1f36df3614501e2748013e707c31de396bd7a62424c3,elnuevodia.com,elnuevodia.com,Sheynnis Palacios anuncia que habrá nueva corona para Miss Universe 2024,2024-10-01,https://www.elnuevodia.com/entretenimiento/farandula/notas/sheynnis-palacios-anuncia-que-habra-nueva-corona-para-miss-universe-2024/,es,2024-10-02 06:33:53.392367
4ec6d1aa77da55051de64d9ed95d0d421d611cf88715accb2bb1c91029e8d85b,cbsnews.com,cbsnews.com,"Some mail-in ballot return envelopes may already be sealed, warns Pennsylvania Department of State",2024-10-01,https://www.cbsnews.com/philadelphia/news/pennsylvania-department-of-state-mail-in-ballot/,en,2024-10-02 03:27:44.642129
e088ec374e29c66946319558fa323281b4fb209e3a6a2c4b26a494b5371d5f8f,thrillist.com,thrillist.com,I Spent 4 Days at Machu Picchu and This Is What It Cost,2024-10-01,https://www.thrillist.com/travel/nation/machu-picchu-peru-cost-vacation-spending,en,2024-11-05 10:34:20.078026
9527f907e4f776c7a0e781e4e9ef48d8a82be4198cf1ae0920e47dd012831726,cincinnati.com,cincinnati.com,Donald Trump posts about Pete Rose during vice presidential debate,2024-10-01,https://www.cincinnati.com/story/news/politics/2024/10/01/donald-trump-posts-pete-rose-vp-debate/75476832007/,en,2024-10-02 06:28:30.865367
65d7e7defd0977a5f8d79779c32fcdbdb76185f1da3b4cc6244ee6046a9eef44,benzinga.com,benzinga.com,"Bitcoin, Ethereum, Dogecoin Crack On Israel-Iran War Fears: Legendary Trader Flags Significance Of King Crypto's Close Above $71K",2024-10-01,https://www.benzinga.com/markets/cryptocurrency/24/10/41133816/bitcoin-ethereum-dogecoin-crack-on-israel-iran-war-fears-legendary-trader-flags-significan,en,2024-10-02 02:28:19.347023
51f5ddcd53e537f9e2c56f3a3cd9cc7fc3814d8042c61fd8dd6e419f99d6548f,salon.com,salon.com,Green Day banned from Vegas radio stations after bashing city,2024-10-01,https://www.salon.com/2024/10/01/green-day-banned-from-vegas-radio-stations-after-giving-the-city-an-expletive-riddled-review/,en,2024-10-02 02:18:31.634428
b4a344b16342c3b278b6b3555cb23bacaa279a3c0d136819d1837dc740375995,dailykos.com,dailykos.com,RNC nepo baby dismisses Trump’s deadly abortion bans as ‘niche’ issue,2024-10-01,https://www.dailykos.com/story/2024/10/1/2274020/-RNC-nepo-baby-dismisses-Trump-s-deadly-abortion-bans-as-niche-issue?pm_campaign=blog&pm_medium=rss&pm_source=,en,2024-10-02 16:31:02.636501
fb91f4d0603f1a4b6fbffe28e54460b758f645710cd5d51c9a87657c0271bcbb,cleveland.com,cleveland.com,"Lorain County prosecutor charged with tampering, attempted bribery involving office romance",2024-10-01,https://www.cleveland.com/court-justice/2024/10/lorain-county-prosecutor-charged-with-tampering-attempted-bribery-involving-office-romance.html,en,2024-10-02 02:26:33.182507
6ddf1f86043f1ddf825629a361345066253f950fb7f9cb4e555904deb5a66855,people.com,people.com,'Welcome to Plathville': Moriah Reveals She’s Back with Her Ex but Ethan Is Furious and Asks 'You Got Any Bail Money?',2024-10-01,https://people.com/welcome-to-plathville-recap-moriah-reveals-she-is-back-with-her-ex-ethan-is-furious-8721671,en,2024-10-02 04:18:26.838465
a994ab3d940e18e79ed736065688b4f60d520688a34cee5b2d4c8f0c6dadd56c,cbsnews.com,cbsnews.com,Jessy J plays the sax and talks Desert Jazz Festival,2024-10-01,https://www.cbsnews.com/losangeles/video/jessy-j-plays-the-sax-and-talks-desert-jazz-festival/,en,2024-10-02 06:20:46.477404
091b27dd6c8d022012abbb3dfb9467f02491d4bfc85d288f5b9086a01b9377f7,elnuevodia.com,elnuevodia.com,Bobby Witt Jr. sigue caliente y los Royals derrotan a los Orioles en Baltimore,2024-10-01,https://www.elnuevodia.com/deportes/beisbol/notas/bobby-witt-jr-sigue-caliente-y-los-royals-derrotan-a-los-orioles-en-baltimore/,es,2024-10-02 06:29:16.667711
9b0ccfcaabd014aa1ccf645aca363ecdc973be455d713681b8140b9dfcd2cb8a,thestreet.com,thestreet.com,Amazon is selling a 'fluffy and warm' $90 fleece comforter set for only $48 with an exclusive coupon,2024-10-01,https://www.thestreet.com/deals/bedelite-sherpa-fleece-comforter-set-amazon-sale,en,2024-10-02 06:29:30.530952
581d8f9e5b59212ab3498dff41ab9253c1c0767b6eac5c9f1bbc5f8ffa4d5592,marketwatch.com,marketwatch.com,5 Best Homeowners Insurance Companies in Los Angeles (2024),2024-10-01,https://www.marketwatch.com/guides/insurance-services/homeowners-insurance-los-angeles/,en,2024-10-02 03:24:17.716921
3204437484312f478823d8826c1241e12d190f1757d4946603d8f1dbcdc0e977,people.com,people.com,Martha Stewart’s Beauty Routine Is ‘Easier Than Making a Pot of Soup’ — and Hilary Duff Uses the Same Mascara,2024-10-01,https://people.com/martha-stewart-merit-beauty-lengthening-mascara-8721566,en,2024-10-02 02:19:36.061841
c4fcb1fb99a91f36412ac3ff7a6ec37dcefe14a3f354bc25e30bb4bb2545b50e,benzinga.com,benzinga.com,How to Profit from Trading the News in Forex,2024-10-01,https://www.benzinga.com/money/trading-the-news-in-forex,en,2024-10-02 03:20:49.732793
8a7e5caaab0a093f7ce0104d24ded53be18b2d655f184350ad1808f753ceca5d,rttnews.com,rttnews.com,United Natural Foods Initiates FY25 Adj. EPS In Line With Estimates,2024-10-01,https://www.rttnews.com/3478696/united-natural-foods-initiates-fy25-adj-eps-in-line-with-estimates-update.aspx?type=ern,en,2024-10-09 11:23:09.911079
d330adc052a2ad864485b37feaf5c9350f13a98589a76b09fee5ef8d2c37aef5,abcnews.go.com,abcnews.go.com,Inflation in Europe falls below 2% and opens the way for faster rate cuts,2024-10-01,https://abcnews.go.com/International/wireStory/inflation-europe-falls-below-2-opens-faster-rate-114375920,en,2024-10-02 04:27:35.479011
371147d85924a5c9b5320dd05d74972b0d8b9b8a0fd946d2b1758cdd464796ea,fansided.com,fansided.com,Davante Adams pours gasoline on Antonio Pierce trade rumors,2024-10-01,https://fansided.com/posts/davante-adams-trade-rumors-gasoline-antonio-pierce-raiders,en,2024-10-02 03:29:41.993499
75bb9b293e946e751d2f3d9a79ee7b0e63e3d3c5f1db03b355bd0ba00b71291e,dispatch.com,dispatch.com,Why is Iowa defense so tough? Ohio State football hopes to solve riddle,2024-10-01,https://www.dispatch.com/story/sports/college/football/2024/10/01/ohio-state-football-iowa-game-preview-ncaa-predictions/75466055007/,en,2024-10-02 05:18:11.659953
cd58692e3046a4202ee0aa9033be8c03f0a3443cd79bb77ba87e591f9b00c5cb,thedailybeast.com,thedailybeast.com,Spirit Halloween Fires Back at ‘SNL’ Sketch Roasting Its Products,2024-10-01,https://www.thedailybeast.com/spirit-halloween-fires-back-at-snl-sketch-roasting-its-products,en,2024-10-02 05:23:34.967466
df2d49075b76587e838ecd7d59df45e11df4f127a8cc5cc3d667522fb357fbaf,benzinga.com,benzinga.com,Strategic Play: Sarah O Moore Acquires Cracker Barrel Old Stock Options to Portfolio,2024-10-01,https://www.benzinga.com/insights/news/24/10/41121229/strategic-play-sarah-o-moore-acquires-cracker-barrel-old-stock-options-to-portfolio,en,2024-10-02 11:36:58.381828
bdf9566d8d93c194f3bf4421fb2c14a0ab4b6fdf6768675c03fd5e208ae560ce,cnn.com,cnn.com,Top 5 best heat pumps: Our picks of 2024,2024-10-01,https://www.cnn.com/cnn-underscored/home/best-heat-pumps,en,2024-10-02 04:30:29.888394
3eba2e3886488f1a097ad910d7db6080d24ecf1327d9a20aa292e061d2fa3777,nypost.com,nypost.com,Mets display same winning vibe as team that went to 2015 World Series,2024-10-01,https://nypost.com/2024/10/01/sports/mets-display-same-winning-vibe-as-team-that-went-to-2015-world-series/,en,2024-10-02 04:26:27.278569
f6c4afe08374effd0735c8b9aac49bf51b71e79759cd5b87b67d058eb74d09da,cleveland.com,cleveland.com,‘Expedition X’ Season 8: Stream episode 8 free online today,2024-10-01,https://www.cleveland.com/tv/2024/10/expedition-x-season-8-stream-episode-8-free-online-today.html,en,2024-10-02 02:26:08.540498
e44fdbd1458670b53bc53f3c6b943c7e435a323e4379c0a00cf18f9a441c0210,ncregister.com,ncregister.com,Synod’s Gag Rule Not the Way to Go,2024-10-01,https://www.ncregister.com/blog/shaw-synod-gag-rule,en,2024-10-02 06:32:09.426470
2c373f42499ae3149699c35657be7a1dcffb7e662b33f620295392f8befc7b94,cbsnews.com,cbsnews.com,Magnitude 3.5 earthquake strikes near Ontario,2024-10-01,https://www.cbsnews.com/losangeles/video/magnitude-3-5-earthquake-strikes-near-ontario/,en,2024-10-02 06:19:55.979199
1d93dbd13ee45ab7f9af9b4ce9a4427813657e70c936bf7b8713e69c5b8c292a,armytimes.com,armytimes.com,Iran fires missiles at Israel,2024-10-01,https://www.armytimes.com/global/mideast-africa/2024/10/01/iran-fires-missiles-at-israel/,en,2024-10-02 10:57:23.601550
d1bccce17df3b8fb35ee17c9a8917b7ac9e62f5b9e36f420bc08c58c2613c0c0,rttnews.com,rttnews.com,Teva Pharma Launches Octreotide Acetate For Injectable Suspension,2024-10-01,https://www.rttnews.com/3478758/teva-pharma-launches-octreotide-acetate-for-injectable-suspension-quick-facts.aspx,en,2024-10-02 09:29:10.024448
3581b2c3dbbd516676988dd9440e75469db0553413b84c9ca1ecc87a4141a279,variety.com,variety.com,‘The Substance’ Becomes Mubi’s Biggest Box Office Success to Date as Company Plants Theatrical Flag in U.S. (EXCLUSIVE),2024-10-01,https://variety.com/2024/film/news/the-substance-mubi-biggest-box-office-us-1236160040/,en,2024-10-02 02:21:23.351762
9b45a4ffec2824295f1f304871d085079f9d97da47c03749fed779f2847b0af9,cnet.com,cnet.com,"EcoFlow Early Prime Day Sale Reduces Up to $2,899 Off Power Stations, Accessories and More",2024-10-01,https://www.cnet.com/deals/ecoflow-early-prime-day-sale-reduces-up-to-2899-off-powerstations-accessories-and-more/,en,2024-10-02 05:18:44.939735
0af0de332bc5c841ce417badf1e2d21c375dc3453d31b5342f38921c8db3bf05,usmagazine.com,usmagazine.com,Ariana Grande niega ante un detector de mentiras que tenga cirugías plásticas,2024-10-01,https://www.usmagazine.com/enespanol/estilo/ariana-grande-niega-ante-un-detector-de-mentiras-que-tenga-cirugias-plasticas/,es,2024-10-02 03:28:02.305005
f459c299e436990a386ff86d85382f054a7a2858ebc7b1ff68a1eb446df7729c,businessinsider.com,businessinsider.com,Delta Community Credit Union Review 2024,2024-10-01,https://www.businessinsider.com/personal-finance/banking/delta-community-credit-union-review,en,2024-10-02 02:21:07.683156
8b2ef0478fa34c118b371d865ec7ae48fd2f784890a10bc0802d30fe7d45d50f,elnuevodia.com,elnuevodia.com,“Podemos soñar sin que nuestro sexo determine nuestro destino”: Claudia Sheinbaum asume la presidencia de México,2024-10-01,https://www.elnuevodia.com/noticias/mundo/notas/podemos-sonar-sin-que-nuestro-sexo-determine-nuestro-destino-claudia-sheinbaum-asume-la-presidencia-de-mexico/,es,2024-10-02 06:34:08.316351
1d1c46fd43b699dacf82771d45ca8337a0f68ad0d7abbd35e633131e121a6730,rutlandherald.com,rutlandherald.com,Rutland Free Library launches eclectic speaker series,2024-10-01,https://www.rutlandherald.com/news/local/rutland-free-library-launches-eclectic-speaker-series/article_7f02d9b0-8028-11ef-a86a-f7d3633e1e14.html,en,2024-10-02 04:26:54.940507
4f1b0c7edd21e51833370c4d019cba92cfa46fd4189ff4e11ec1b1bd969e3525,deadspin.com,deadspin.com,Mountain West finalizes addition of UTEP,2024-10-01,https://deadspin.com/mountain-west-finalizes-addition-of-utep/,en,2024-10-02 02:22:27.691439
93c737a48578aa1bc358b70097d2f3fbffbec7e5dbb082feb8eb7d06bf115f0a,benzinga.com,benzinga.com,"Bitcoin Miner Marathon Digital 'Inexplicably Expensive,' While Riot Platforms 'Cheap,' Says Analyst",2024-10-01,https://www.benzinga.com/markets/cryptocurrency/24/10/41116750/bitcoin-miner-marathon-digital-inexplicably-expensive-while-riot-platforms-cheap-says-anal,en,2024-10-02 11:30:50.340206
8713851cd7b3f3ff4033ec245869a5053409c618f69a10c0a93e8b8a73b046da,post-gazette.com,post-gazette.com,5 debate takeaways that might get traction in Pennsylvania,2024-10-01,https://www.post-gazette.com/news/election-2024/2024/10/01/debate-walz-vance-trump-harris-pennsylvania/stories/202410010097,en,2024-10-02 06:20:19.411358
ef01ed4f0e5b10d6a8707d16813c5c64ecb25c4cf5a63a3a8627f064565cbc80,realclearpolitics.com,realclearpolitics.com,"Watch Live: Donald Trump Expected To Speak In Waunakee, Wisconsin",2024-10-01,https://www.realclearpolitics.com/video/2024/10/01/watch_live_donald_trump_expected_to_speak_in_waunakee_wisconsin.html,en,2024-10-02 12:32:09.647447
40f28f6837df209df7bcc76a55727640f0386f81583aeb43da23dd4c15aafef9,theguardian.com,theguardian.com,Israel orders evacuation of southern Lebanon villages as ground raids begin,2024-10-01,https://www.theguardian.com/world/2024/oct/01/israel-order-evacuation-southern-lebanon-border-villages-incursion,en,2024-10-02 05:19:05.090865
1dec9f295e43e04827ed29356d3bdaf6c168d8ee63800dd7e450a2888e89e127,latimes.com,latimes.com,Newsom quashed bill. Now lawsuit aims to open UC jobs to undocumented students,2024-10-01,https://www.latimes.com/california/story/2024-10-01/lawsuit-seeks-to-open-uc-jobs-to-undocumented-students-after-newsom-vetoes-bill,en,2024-10-02 08:28:47.624894
d1ac8bfdba295783ad201ed2b2839ad7507029d1185273bd44eaa0d462a89e2e,freep.com,freep.com,Detroit Tigers win: Dan Dickerson's final call of AL playoffs Game 1,2024-10-01,https://www.freep.com/story/sports/mlb/tigers/2024/10/01/detroit-tigers-astros-radio-call-dan-dickerson-game-1-final-out-playoffs/75472388007/,en,2024-10-02 06:17:35.237753
