id,media_name,media_url,title,publish_date,url,language,indexed_date
29c3bc73b7accbc736a0d87cae7c0f5f521e4eefad65dc0f0d80f019cbcc0fc4,techradar.com,techradar.com,Metal Gear Solid star Solid Snake comes to Fortnite alongside his trademark box,2024-01-23,https://www.techradar.com/gaming/consoles-pc/metal-gear-solid-star-solid-snake-comes-to-fortnite-alongside-his-trademark-box,en,2024-01-25 09:06:56.000000
72d2025942ad8cc00648c4d745107b638811f8023125bdf2c0b992ee099a3cd5,thedailybeast.com,thedailybeast.com,California Mom Arrested After Toddler Found Abandoned on Boat,2024-01-23,https://www.thedailybeast.com/california-mom-arrested-after-toddler-found-abandoned-on-boat,en,2024-01-25 03:26:56.000000
a41194b26b96ef6542e018ad4b5ffac7ec5ee139e390418d549913ab67787b71,mercurynews.com,mercurynews.com,Could Georgia’s Willis be removed from Trump election case?,2024-01-23,https://www.mercurynews.com/2024/01/23/could-georgias-willis-be-removed-from-trump-election-case/,en,2024-01-26 04:00:58.000000
b660050276c0e0e2def8315e23bccff2d762e58d9c95a8234df118c86bc2b4ba,foxnews.com,foxnews.com,New Mexico faces opposition to governor's water recycling initiative over concerns of increased fracking,2024-01-23,https://www.foxnews.com/us/new-mexico-faces-opposition-governors-water-recycling-initiative-concerns-increased-fracking,en,2024-01-25 04:01:08.000000
58176cd81b09a5947fbdc5d2dd6b3e72c816ccc01740b24d8247ce93d0ddc180,abcnews.go.com,abcnews.go.com,"Lions agree to sign 3-time Pro Bowl tight end Zach Ertz, AP source says",2024-01-23,https://abcnews.go.com/Sports/wireStory/lions-agree-sign-3-time-pro-bowl-tight-106587048,en,2024-01-25 02:20:50.000000
287073b14c97e965232e8de136733e1fbd27f402eeb1bd58f445b9f20b82a1b7,benzinga.com,benzinga.com,Why FaZe Holdings Stock Is Racing Higher,2024-01-23,https://www.benzinga.com/news/24/01/36741428/why-faze-holdings-stock-is-racing-higher,en,2024-01-25 00:27:13.000000
cdfae30129d0c6e89ca497cf7fdd6e0080455b07f43a899cdadf416556376cb2,foxnews.com,foxnews.com,Arizona's $10B clean energy transmission project challenged in court,2024-01-23,https://www.foxnews.com/us/arizonas-10b-clean-energy-transmission-project-challenged-court,en,2024-01-25 04:01:05.000000
0fb542d4952266afff07315fbd574d6139cbf7a08defc546f9c30509b1719d38,baltimoresun.com,baltimoresun.com,"One day, 22 overtime hours: Baltimore Police’s flawed oversight led to ‘excessive’ overtime, state audit finds",2024-01-23,https://www.baltimoresun.com/2024/01/23/baltimore-police-excessive-overtime-state-audit/,en,2024-01-25 05:42:50.000000
2f078f9f1590f663d49e7601f398ab5c6638432fb9761c8c1bd74daa28792ac8,benzinga.com,benzinga.com,ASML Stock: Top Analyst Pick As A 'FIFO' Beneficiary With 21% Upside Ahead Of Q4 Earnings,2024-01-23,https://www.benzinga.com/analyst-ratings/analyst-color/24/01/36749218/asml-stock-top-analyst-pick-as-a-fifo-beneficiary-with-21-upside-ahead-of-q4-earnin,en,2024-01-26 00:28:17.000000
165f6cebd9f48bac248dcfa0c414d7a1e82b9f8e6fecc51c90bedb4e8c1c27a1,marketwatch.com,marketwatch.com,GameStop shares slide as original meme stock’s struggles continue,2024-01-23,https://www.marketwatch.com/story/gamestop-shares-slide-as-original-meme-stocks-struggles-continue-c0036a6a?mod=mw_rss_topstories,en,2024-01-25 04:15:42.000000
8eb42d688f0f6b9ebf35903545f9f5a079700cf4891239b4948de15bd38c24fd,gazettenet.com,gazettenet.com,Ballot Law Commission tosses Trump challenge,2024-01-23,https://www.gazettenet.com/Ballot-Law-Commission-Tosses-Trump-Challenge-53789166,en,2024-01-25 08:16:49.000000
5fb3525f2ad500e0b4b3d3d9e6947f3f14f27d1840c4569932613a6dcac11ebf,nypost.com,nypost.com,"Middle-aged NYC subway surfer killed after ‘going nuts,’ hanging on side of rush-hour train: NYPD",2024-01-23,https://nypost.com/2024/01/23/metro/nyc-subway-surfer-killed-after-going-nuts-on-rush-hour-train/,en,2024-01-25 00:20:20.000000
915f9cf47515cfd9a3ab5c07e27b4c54fa6ea12634aa623b7fa77cb0762b519c,vanityfair.com,vanityfair.com,Oscars 2024 Nominations: The Most Shocking Snubs and Surprises,2024-01-23,https://www.vanityfair.com/hollywood/oscars-2024-noms-snubs-and-surprises,en,2024-01-25 06:07:18.000000
4216f6c97c20768ad044847207458a01bbb4df8b4edaf56aabdc326db0a0814c,benzinga.com,benzinga.com,Munch Survey Reveals TikTok Not Among Top 3 Preferred Video Distribution Platforms for Businesses in 2024,2024-01-23,https://www.benzinga.com/pressreleases/24/01/n36737246/munch-survey-reveals-tiktok-not-among-top-3-preferred-video-distribution-platforms-for-businesses-,en,2024-01-25 00:28:17.000000
3844c110ce4c895f353a46a839f6a55e754cb9288a3082224aa9ea19a4b92152,baltimoresun.com,baltimoresun.com,Trump will appear on Maryland’s primary ballot; state received scores of messages questioning eligibility,2024-01-23,https://www.baltimoresun.com/2024/01/23/trump-will-appear-on-marylands-primary-ballot-state-received-scores-of-messages-questioning-eligibility/,en,2024-01-25 05:42:49.000000
c84346f46d7b3597b47baa54fd3406a9894a536c8eea212befc22f6e71545168,startribune.com,startribune.com,Suit: Son of Penumbra's Louis Bellamy begged for help while in severe pain but was left to die in jail,2024-01-23,https://www.startribune.com/louis-bellamy-penumbra-theatres-founder-sues-hcmc-and-the-county-over-his-sons-death-in-jail/600337839/,en,2024-01-25 05:54:45.000000
7f3cb735254c180aed7c0a2cb4309ac69577df4832503fea74f9d4da15f19b06,twincities.com,twincities.com,Chicago Bears working on a deal to hire Shane Waldron as their new offensive coordinator,2024-01-23,https://www.twincities.com/2024/01/23/chicago-bears-working-on-a-deal-to-hire-shane-waldron-as-their-new-offensive-coordinator/,en,2024-01-24 03:35:32.000000
dd681e0607a98291dff61e42838da8b4f7d58c3540e05036c65d3a32e117bf19,nypost.com,nypost.com,Tyreek Hill denies filing for divorce after 76 days in bizarre marriage twist,2024-01-23,https://nypost.com/2024/01/23/sports/tyreek-hill-denies-filing-for-divorce-in-bizarre-marriage-twist/,en,2024-01-26 00:56:22.000000
b825bdd676136e2492e76d1dd89a026e96ec54c2fda6b3f3dff7884bd7476ee5,chicagotribune.com,chicagotribune.com,Daniel DePetris: The war is an albatross around Netanyahu’s neck,2024-01-23,https://www.chicagotribune.com/opinion/commentary/ct-column-gaza-war-israel-benjamin-netanyahu-depetris-20240123-5brekmx6t5hb5czttlzen55pni-story.html,en,2024-01-25 01:52:34.000000
df668200399def78bbf6606bc6916c4b8c1a2a22e63e9605a5ebd9fc0a37c10d,arkansasonline.com,arkansasonline.com,"Top 2 unbothered as others rise, drop",2024-01-23,https://www.arkansasonline.com/news/2024/jan/23/top-2-unbothered-as-others-rise-drop/,en,2024-01-25 06:07:57.000000
a4eeae5a3433a40337380bdf38874276aa736bd9d97063470cd81389ca0f7962,motherjones.com,motherjones.com,Florida man facing 91 criminal counts wins New Hampshire primary,2024-01-23,https://www.motherjones.com/mojo-wire/2024/01/trump-haley-new-hampshire-republican-primary-results/,en,2024-01-26 05:46:52.000000
e242d101829c9d74c2a0467b5cc320393c34fa5c75628ea6fbab204781b7db9a,benzinga.com,benzinga.com,"US Stocks Mixed; Johnson Johnson Posts Upbeat Earnings - FaZe Hldgs (NASDAQ:FAZE), Etao International Co (NASDAQ:ETAO)",2024-01-23,https://www.benzinga.com/news/earnings/24/01/36739183/us-stocks-mixed-johnson-johnson-posts-upbeat-earnings,en,2024-01-25 00:29:37.000000
4a5332e26ce250e5086578635bd57694867fe8ed5218cd7a865b428c0d549c6f,reuters.com,reuters.com,〔表〕展望リポート：経済・物価見通し,2024-01-23,https://jp.reuters.com/economy/bank-of-japan/AVZA3A363ZMGNJCGUMYASD4FXA-2024-01-23/,ja,2024-01-25 02:54:07.000000
a52b0d8a74a25e64fb12bfd64986cdc19a8b497a064391e1946ce884b83db4a1,benzinga.com,benzinga.com,"ROSEN, SKILLED INVESTOR COUNSEL, Encourages Assertio Holdings, Inc. Investors to Secure Counsel Before Important Deadline in Securities Class Action – ASRT",2024-01-23,https://www.benzinga.com/pressreleases/24/01/g36741120/rosen-skilled-investor-counsel-encourages-assertio-holdings-inc-investors-to-secure-counsel-before,en,2024-01-25 00:24:38.000000
3c64d1bedd562fc9ea628234c52f48f83ca37f843bbf092e75245954d3508e29,benzinga.com,benzinga.com,Global Consumer Products Company Selects Kneat,2024-01-23,https://www.benzinga.com/pressreleases/24/01/n36735137/global-consumer-products-company-selects-kneat,en,2024-01-25 00:23:52.000000
474357702a332b934b12047aa720f7db1416a92bef8dfa5a39afdd346ae16a2f,benzinga.com,benzinga.com,Nigeria's Country Night Illuminates the World Economic Forum with Cultural Splendor,2024-01-23,https://www.benzinga.com/pressreleases/24/01/n36739893/nigerias-country-night-illuminates-the-world-economic-forum-with-cultural-splendor,en,2024-01-25 00:24:40.000000
9418ad23ce9dff5caa03fa4cb882a3a97ef788f6e838be0bb9fed590c0110abe,foxnews.com,foxnews.com,"Georgia football announces death of Uga X, winningest mascot in school history: 'A Damn Good Dawg'",2024-01-23,https://www.foxnews.com/sports/georgia-football-announces-death-uga-x-winningest-mascot-school-historydamn-good-dawg,en,2024-01-26 01:30:06.000000
4ddd9d05e431cecc937be2cf28f5ffb6c1b919181594a40754a007aff5f20e49,cleveland.com,cleveland.com,A ‘massive chasm’ exists between patients and medtech companies: This startup has a solution,2024-01-23,https://www.cleveland.com/news/2024/01/this-bedford-heights-startup-connects-patients-with-the-companies-making-their-products.html,en,2024-01-25 02:15:07.000000
aea3a48e2615481b7190ef96774ba098dd8fadc8de498ec1088043a38b03f1a1,zdnet.com,zdnet.com,Samsung is trying to beat Apple to these two life-changing health tracking features,2024-01-23,https://www.zdnet.com/article/samsung-is-trying-to-beat-apple-to-these-two-life-changing-health-tracking-features/,en,2024-01-26 05:31:39.000000
aacaf76f49baee817fbd04b31189ad910ee15fdcfb785472b4887829098e1811,schwartzreport.net,schwartzreport.net,Shame': 3 Democrats Join GOP to Advance Backdoor Attack on Social Security,2024-01-23,https://www.schwartzreport.net/2024/01/23/shame-3-democrats-join-gop-to-advance-backdoor-attack-on-social-security/,en,2024-01-25 03:29:04.000000
459c2ef52fb0e71c7c387fe0996454fcfd71313b665e0e966f5d6142df5a384a,ibtimes.com,ibtimes.com,'Doomsday Clock' Remains At 90 Seconds To Midnight,2024-01-23,https://www.ibtimes.com/doomsday-clock-remains-90-seconds-midnight-3722783,en,2024-01-25 03:09:00.000000
1c1a052ea4a17e428f4c7eca2b02f9cabb8329820bb561446997b262405707d7,businessinsider.com,businessinsider.com,A restaurant owner claims a job candidate stole money from the tip jar while they were waiting to be interviewed,2024-01-23,https://www.businessinsider.com/job-candidate-stole-tip-money-jar-restaurant-interview-virginia-beach-2024-1,en,2024-01-25 00:53:50.000000
ba01a26bedee5c60db15718810248c340413dada1bf951587974303b883848e7,businessinsider.com,businessinsider.com,Dolly Parton says she didn't take a day off work for her 78th birthday: 'Nothing wrong with working on your birthday',2024-01-23,https://www.businessinsider.com/dolly-parton-78th-birthday-working-snowed-in-chocolate-cake-2024-1,en,2024-01-25 00:53:51.000000
57c3fa6ac444d94354b1c0357aa1d00fea57f5cfa9fc0ece5d6111083d19efce,ibtimes.com,ibtimes.com,"Beware Teeth-fixing Products Touted By Influencers, Dentists Warn",2024-01-23,https://www.ibtimes.com/beware-teeth-fixing-products-touted-influencers-dentists-warn-3722756,en,2024-01-25 03:08:59.000000
1a2b2c23a92bcd9622e14797ba44214927d10a23aac9b634a469565b75b65333,gizmodo.com,gizmodo.com,I’m So Frickin’ Sick of These Cups,2024-01-23,https://gizmodo.com/stanley-quencher-tumbler-viral-mania-tiktok-arrest-1851185403,en,2024-01-25 04:17:35.000000
617a705854e450423d1fc4eb1cf9d12afa3709cf1a57ecb393bb375b60009ff2,rollingstone.com,rollingstone.com,"The New York Nazis Who Loved Hitler, Hated Jews, and Packed MSG",2024-01-23,https://www.rollingstone.com/tv-movies/tv-movie-reviews/nazi-town-usa-german-american-bund-new-york-hitler-antisemitism-pbs-doc-1234951919/,en,2024-01-25 06:46:07.000000
7e9341bf0c6e2ce0c8a508dcc96ca53db9ad0583fbc26e5f66a1c32c9aa86d1e,abcnews.go.com,abcnews.go.com,Mississippi restrictions on medical marijuana advertising upheld by federal judge,2024-01-23,https://abcnews.go.com/Business/wireStory/mississippi-restrictions-medical-marijuana-advertising-upheld-federal-judge-106616455,en,2024-01-26 01:54:35.000000
3633a3981e529883c83606dee7761d1a2dd42d45e24a9e1379462841ee943fff,techradar.com,techradar.com,Palworld update addresses several bugs and crashes on Xbox and Microsoft Store PC,2024-01-23,https://www.techradar.com/gaming/consoles-pc/palworld-update-addresses-several-bugs-and-crashes-on-xbox-and-microsoft-store-pc,en,2024-01-25 09:06:56.000000
695125d4884f7aa018eafd5be4fcdde9d8cf77d0cd4ce31fdbaf01fc90a28a4c,nj.com,nj.com,Dear Abby: I was told my stepdaughter’s baby will never be my grandchild ... I’m crushed,2024-01-23,https://www.nj.com/advice/2024/01/dear-abby-i-was-told-my-stepdaughters-baby-will-never-be-my-grandchild-im-crushed.html,en,2024-01-25 01:58:06.000000
14f9a0a82c78b0b776265c175ad040831689d00f403fc9643f292291ae86c71b,theblaze.com,theblaze.com,Androids are marching onto the production line at BMW,2024-01-23,https://www.theblaze.com/news/androids-are-marching-onto-the-production-line-at-bmw,en,2024-01-25 09:30:56.000000
71a57895a64627fb65f7a4e55df897ff919f52e2845f4b455620b8f307925491,cbsnews.com,cbsnews.com,Lily Gladstone makes Oscars history as first Native American to be nominated for best actress,2024-01-23,https://www.cbsnews.com/news/oscars-lily-gladstone-first-native-american-nominated-best-actress-killers-of-the-flower-moon/,en,2024-01-25 00:22:10.000000
ad860c622fc44e13368294bb0d03bbe60d8d61ef9e75e0b362a29abac7143be9,techradar.com,techradar.com,Another Code: Recollection review,2024-01-23,https://www.techradar.com/gaming/another-code-recollection-review,en,2024-01-25 09:06:56.000000
ebf102cccab2eb8573d03bcc3df829531cff55a21178273048316f044b4b9e72,seattletimes.com,seattletimes.com,Notebook: Road-weary Husky men return home for crucial three-game stretch,2024-01-23,https://www.seattletimes.com/sports/uw-husky-basketball/notebook-road-weary-husky-men-return-home-for-crucial-three-game-stretch/?utm_source=RSS&utm_medium=Referral&utm_campaign=RSS_all,en,2024-01-26 00:42:55.000000
3853dbb4d9bc5629b789c808cb2cb04316a325cce55ce879fc2c185904ff49ee,benzinga.com,benzinga.com,"Electric Fabric Shaver Market Growth Forecast at 6.7%, Targeting US$ 3.7 Billion by 2030, According to Persistence Market Research",2024-01-23,https://www.benzinga.com/pressreleases/24/01/g36741275/electric-fabric-shaver-market-growth-forecast-at-6-7-targeting-us-3-7-billion-by-2030-according-to,en,2024-01-25 00:24:33.000000
6e3c501e90c81c483ca0135a4ae5d79221c2be34973a75989be251af0eb9b2df,sandiegouniontribune.com,sandiegouniontribune.com,"Los Angeles Times to lay off 20% of newsroom, one of the largest staff reductions in paper's history",2024-01-23,https://www.sandiegouniontribune.com/news/california/story/2024-01-23/los-angeles-times-to-lay-off-one-fourth-of-newsroom-staff-starting-this-week-union-head-says,en,2024-01-25 07:35:12.000000
3a52476f4f2ad610ec0423cb582c15b37259d88c03c3469f18d168427a4df7fb,patriotpost.us,patriotpost.us,Meta Looks to Appease Parents,2024-01-23,https://patriotpost.us/articles/103788-meta-looks-to-appease-parents-2024-01-23,en,2024-01-25 05:19:25.000000
4f08c8d000597aff056c0f4a4899c22872417f7c5c93dd7e93327dc2449aae1d,billboard.com,billboard.com,Noah Kahan Set to Extend U.K. Chart Streak With ‘Stick Season’,2024-01-23,https://www.billboard.com/music/chart-beat/noah-kahan-extend-uk-chart-week-4-stick-season-1235586893/,en,2024-01-25 04:17:23.000000
28a3c60e2b9b3c81e70935f878ec02eade9fea1f50b713b6807d1a57027eb57f,eater.com,eater.com,A Big New Roberta’s Pizza Is Opening Near Madison Square Garden,2024-01-23,https://ny.eater.com/2024/1/23/24046747/robertas-pizza-opening-madison-square-garden,en,2024-01-25 03:23:35.000000
59752e56d07e8548261b496fa0c8f53e47008cd1b4b5e489545bce425719aa7c,benzinga.com,benzinga.com,How Verizon's Latest Earnings Could Boost Other Telecom Giants,2024-01-23,https://www.benzinga.com/real-estate/24/01/36740817/how-verizons-latest-earnings-could-boost-other-telecom-giants,en,2024-01-25 00:26:09.000000
616c8aaa5efb2ebf821c8b7dce5b36f33e179356b5727ca56f373c36727063ef,theguardian.com,theguardian.com,Jeremy Hunt has room for £20bn tax cuts after borrowing halves year on year,2024-01-23,https://www.theguardian.com/business/2024/jan/23/jeremy-hunt-tax-cuts-borrowing-deficit,en,2024-01-25 01:16:08.000000
758815ebfdaf4b86d29e1a91e89bc7801f9ead01dfefc6927e34f679bf1645a3,staradvertiser.com,staradvertiser.com,Dwayne Johnson gets rights to famous entertainment nickname,2024-01-23,https://www.staradvertiser.com/2024/01/23/breaking-news/dwayne-johnson-gets-rights-to-famous-entertainment-nickname/,en,2024-01-25 02:41:22.000000
fa411a3ac0d291dcf5b45b09bf14cbbb69d861afac6a0087ff87a4cab2b91351,nytimes.com,nytimes.com,"Delta Air Lines Boeing 757 Lost Nose Wheel Before Takeoff, F.A.A. Says",2024-01-23,https://www.nytimes.com/2024/01/23/business/delta-boeing-plane-nose-tire.html,en,2024-01-26 02:16:59.000000
45cc6ecbc5ee0ba42ef4828cf4622d002b933fde679e56df626968924af44607,hollywoodreporter.com,hollywoodreporter.com,"Oscars: Christopher Nolan, Bradley Cooper, Emma Stone Nominated for Multiple Awards",2024-01-23,https://www.hollywoodreporter.com/movies/movie-news/bradley-cooper-christopher-nolan-nominated-multiple-oscars-1235804881/,en,2024-01-25 05:27:41.000000
b6e2cf7f66a8aeb05f224bf989294b2aab41033067d3ba3c6649e90749e9ca3c,nytimes.com,nytimes.com,"Two Men, Including Murder Suspect, Escape From Arkansas Jail",2024-01-23,https://www.nytimes.com/2024/01/23/us/arkansas-jail-escape-manhunt.html,en,2024-01-25 00:09:26.000000
a1459f4f2db1145373714648f3e9ab56552248e3d67ef61437560133cc4bba79,forbes.com,forbes.com,Jeremy Wertheimer Speaks About The Power Of AI For Today’s Youth,2024-01-23,https://www.forbes.com/sites/johnwerner/2024/01/23/jeremy-wertheimer-speaks-about-the-power-of-ai-for-todays-youth/,en,2024-01-25 01:48:36.000000
d46026084f447040438241a8a0ff8ebdeff0c49506b7e4e4f60d2919edea2367,mlive.com,mlive.com,Hanover-Horton comes back from 12 points down to beat Leslie,2024-01-23,https://www.mlive.com/highschoolsports/2024/01/hanover-horton-comes-back-from-12-points-down-to-beat-leslie.html,en,2024-01-26 02:20:48.000000
0def779b15a01f70fd7f82471f89aa50296508a906363357ccacd205233bff62,sportingnews.com,sportingnews.com,Timberwolves coach Chris Finch blasts team's 'disgusting' loss to Hornets despite Karl-Anthony Towns' 62 points,2024-01-23,https://www.sportingnews.com/us/nba/news/chris-finch-timberwolves-loss-karl-anthony-towns-62/87479d2207f479800d7e673c,en,2024-01-25 05:04:12.000000
670d82b0517ff045a4083bfcc0cc3a343de9296607c2e273998411b6d7711ab5,redstate.com,redstate.com,We've Seen Enough: Donald Trump Wins NH GOP Primary,2024-01-23,https://redstate.com/jenvanlaar/2024/01/23/breaking-donald-trump-wins-nh-gop-primary-n2169131,en,2024-01-26 04:17:52.000000
e6d3ba04eb470e6c000364775ccae550d47652a8ef80a3f169b7b70bcb3576ad,armytimes.com,armytimes.com,$50M+ improperly spent on DOD credit cards during COVID pandemic,2024-01-23,https://www.armytimes.com/news/your-military/2024/01/23/50m-improperly-spent-on-dod-credit-cards-during-covid-pandemic/,en,2024-01-25 10:41:20.000000
86410b941d61a756446c7ee753c4abc41de74d7d23b18c0c767e3cdbb8490e8c,benzinga.com,benzinga.com,"ROSEN, A LEADING LAW FIRM, Encourages AlloVir, Inc. Investors to Secure Counsel Before Important Deadline in Securities Class Action – ALVR",2024-01-23,https://www.benzinga.com/pressreleases/24/01/g36742658/rosen-a-leading-law-firm-encourages-allovir-inc-investors-to-secure-counsel-before-important-deadl,en,2024-01-25 00:25:47.000000
801ce5cca6c3ddc11749dac21f690ffe2c3d76e33392cd5942da11635fdd861a,eonline.com,eonline.com,How America Ferrera’s Sisterhood of the Traveling Pants Costars Celebrated Her Oscar Nomination,2024-01-23,https://www.eonline.com/news/1393697/how-america-ferreras-sisterhood-of-the-traveling-pants-costars-celebrated-her-oscar-nomination?cmpid=rss-syndicate-genericrss-us-top_stories,en,2024-01-25 04:45:37.000000
75c0d7a7a01801685425d26662c6931c7f4c5a3a952efae68c35f967271e373b,benzinga.com,benzinga.com,FedTec Launches With Expanded Leadership,2024-01-23,https://www.benzinga.com/pressreleases/24/01/g36740088/fedtec-launches-with-expanded-leadership,en,2024-01-25 00:24:08.000000
6cd3bd82c3703fb026e62864d5b26ec4824e1e797e81c2ce486f5ef1c2b99811,abcnews.go.com,abcnews.go.com,"Turkey’s parliament approves Sweden’s NATO membership, lifting key a hurdle",2024-01-23,https://abcnews.go.com/International/wireStory/turkeys-parliament-agrees-hold-long-delayed-vote-swedens-106599539,en,2024-01-25 02:20:54.000000
6ebf19239332df3c0c5425931dccaa838575f12708f9f443803a63b2057e06eb,variety.com,variety.com,"Women Directors Have Three Best Picture Nominees, Setting Oscar Record",2024-01-23,https://variety.com/2024/film/awards/best-picture-women-directors-oscars-history-1235880035/,en,2024-01-25 02:58:43.000000
0cf44a4aeabac7f8fd7eef36bc86a6100b101511b558069f41d30446830cf3ff,benzinga.com,benzinga.com,Veteran's Health Administration Joins Pulse by NABP,2024-01-23,https://www.benzinga.com/pressreleases/24/01/g36742348/veterans-health-administration-joins-pulse-by-nabp,en,2024-01-25 00:25:30.000000
0062a8e3d74c0c1b83efcc11dd2c828094e8bfbf9ef9181762608277424e06cf,cnn.com,cnn.com,أول تعليق من نتنياهو بعد مقتل 21 جنديا إسرائيليا دفعة واحدة في غزة,2024-01-23,https://arabic.cnn.com/middle-east/article/2024/01/23/netanyahu-comments-deaths-of-21-soldiers-gaza,ar,2024-01-25 01:52:36.000000
73ffff2a7bcb4b2b7dccac3ff36ed17d70a6fdc0a83891004ffd2253fdab7c46,theguardian.com,theguardian.com,"Blood test could revolutionise diagnosis of Alzheimer’s, experts say",2024-01-23,https://www.theguardian.com/society/2024/jan/23/blood-test-could-revolutionise-diagnosis-of-alzheimers-experts-say,en,2024-01-25 01:15:54.000000
9ef2915da6cceeb781b370b2c221d9ed74d1aeb9d5dac4cb819837358071d261,newsday.com,newsday.com,Rishi Sunak's Rwanda migration bill suffers a blow in Britain's Parliament,2024-01-23,https://www.newsday.com/news/nation/uk-rwanda-migrants-plan-house-of-lords-b87366,en,2024-01-26 04:11:24.000000
90ffb833cff65eb38f1af6ca4aa494f901627edebc4f1b669aad8937f996dcd4,redstate.com,redstate.com,OPINION: Why Not Elise Stefanik for Vice President?,2024-01-23,https://redstate.com/jerrywilson/2024/01/23/why-not-elise-stefanik-for-vice-president-n2169135,en,2024-01-26 04:17:54.000000
56ad611465d9cda0f8ba9bf4c1d11da28f2a30bc04d128143067a8b3253703d0,ibtimes.com,ibtimes.com,FTX's Billion-Dollar Exodus: Major Sell-Off Shakes Up Grayscale Bitcoin Trust ETF,2024-01-23,https://www.ibtimes.com/ftxs-billion-dollar-exodus-major-sell-off-shakes-grayscale-bitcoin-trust-etf-3722700,en,2024-01-25 03:08:53.000000
c423bcf4a10a556ad5fed31419854fce453678d6c3b4b254b9db5c801e846310,seattletimes.com,seattletimes.com,The Chiefs’ winning formula is to surround their immense star power with draft steals,2024-01-23,https://www.seattletimes.com/sports/nfl/the-chiefs-winning-formula-is-to-surround-their-immense-star-power-with-draft-steals/?utm_source=RSS&utm_medium=Referral&utm_campaign=RSS_all,en,2024-01-25 08:09:10.000000
f2fb2bf92bc7df2cfbe99b66576a17aec7fed2acca363bf1d43c9045e9c95589,dailycaller.com,dailycaller.com,Sharon Osbourne Opens Up About Attempting Suicide,2024-01-23,https://dailycaller.com/2024/01/23/sharon-osbourne-attempted-suicide-affairs-infidelity-ozzy-pills-overdose/,en,2024-01-25 01:50:53.000000
1e26b5b586d093b5c316a1379342ece68b7b46ae3679ce30729e5963d9ca0400,cbsnews.com,cbsnews.com,"Charles Osgood, veteran CBS newsman and longtime host of ""Sunday Morning,"" dies at 91",2024-01-23,https://www.cbsnews.com/losangeles/news/charles-osgood-veteran-cbs-newsman-and-longtime-host-of-sunday-morning-dies-at-91/,en,2024-01-26 01:07:07.000000
a15d67e4d57b6cc1b45104e3307c9a72bc6703a28e33dbfc07ccfd6e3d323659,techradar.com,techradar.com,Sketch-a-site: Hatch launches no-code drawing tool for web design,2024-01-23,https://www.techradar.com/pro/website-building/sketch-a-site-hatch-launches-no-code-drawing-tool-for-web-design,en,2024-01-25 09:06:59.000000
041dcbf8116f34f1ab060850214776dffbbac7470a27d78de676b8cd065e739d,washingtonpost.com,washingtonpost.com,"The Republican primary is over. Get ready for the long, grim rematch",2024-01-23,https://www.washingtonpost.com/opinions/2024/01/23/biden-trump-2024-rematch-after-new-hampshire/,en,2024-01-26 02:14:39.000000
884f3508512a31bd13c60c71e22e5430695cbde3cbc66ff905b57dd0c96732bb,ign.com,ign.com,Best Soundbar 2024: Amplify Your Home Theater Experience,2024-01-23,https://www.ign.com/articles/best-soundbar,en,2024-01-25 08:14:48.000000
29bc1ffa43c702bb2fe2e2231d5976eb557a270417a3a3464b7a4dbcff410f18,businessinsider.com,businessinsider.com,"You can boost your longevity with 7 habits that take 5 minutes or less a day, according to a doctor",2024-01-23,https://www.businessinsider.com/tips-easy-simple-boost-longevity-live-longer-healthier-habits-2024,en,2024-01-25 00:53:49.000000
71ea61d416f780beaf586e8d241b4c7f40580bf64edb4514dc9b261dd6f93cae,benzinga.com,benzinga.com,Independent Bank Corporation Announces 4% Increase in Quarterly Cash Dividend on Common Stock,2024-01-23,https://www.benzinga.com/pressreleases/24/01/g36739773/independent-bank-corporation-announces-4-increase-in-quarterly-cash-dividend-on-common-stock,en,2024-01-25 00:29:40.000000
36423d6746a03b7e2e886e0ec81dc3af9460f50adf3956c4838ac219a5325904,eonline.com,eonline.com,The Best Fitness Watches Trackers for Every Kind of Activity,2024-01-23,https://www.eonline.com/news/1393604/the-best-fitness-watches-trackers-for-every-kind-of-activity?cmpid=rss-syndicate-genericrss-us-top_stories,en,2024-01-25 04:45:33.000000
