id,media_name,media_url,title,publish_date,url,language,indexed_date
4122b8dfa13538beb342c3115fc7ac17f89456d7b3d8fdce519cd6b440a3c451,ign.com,ign.com,Activision Threatens to Ban Call of Duty Warzone Players Using Boosting Services,2024-03-26,https://www.ign.com/articles/activision-threatens-to-ban-call-of-duty-warzone-players-using-boosting-services,en,2024-03-28 01:05:04.425273
be53346021ab3fef1a5dc8bdd644134a52e2aed66e184ab2b54a6952ba0a56d2,seattletimes.com,seattletimes.com,Russia extends arrest of US reporter Evan Gershkovich. He has already spent nearly a year in jail,2024-03-26,https://www.seattletimes.com/nation-world/nation/russia-extends-arrest-of-us-reporter-evan-gershkovich-he-has-already-spent-nearly-a-year-in-jail/?utm_source=RSS&utm_medium=Referral&utm_campaign=RSS_all,en,2024-03-28 04:04:30.629787
e81415a68e86d341d0dfacb1b6cf5037657c758e9dd2f8308f7b8bf9787e9bce,rttnews.com,rttnews.com,U.S. Consumer Confidence Index Edges Slightly Lower In March,2024-03-26,https://www.rttnews.com/story.aspx?Id=3434926,en,2024-03-28 04:18:21.291299
59e5723d05583f4e4fe6d70a5113275cb0908efdd57dfc98b710b3de64efbebf,oann.com,oann.com,"California Food Chains Lay Off Workers, Raise Prices Ahead of April Minimum Wage Hike",2024-03-26,https://www.oann.com/newsroom/calif-food-chains-lay-off-workers-begin-to-raise-prices-before-minimum-wage-hike-in-april/,en,2024-03-29 07:09:30.103220
fca700ce7990ad513ebc69de6945c66e1c07a37c77cfe662bcb22aea7bda7d4b,benzinga.com,benzinga.com,"Dogecoin's GigaWallet To Simplify Integration Of Transactions Across Platforms: 'Beginning Of A Strong Bullish Move,' Says Trader",2024-03-26,https://www.benzinga.com/markets/cryptocurrency/24/03/37948548/dogecoins-gigawallet-to-simplify-integration-of-transactions-across-platforms-beginning-of,en,2024-03-28 00:35:40.376708
8cccc01bee34167e14a842fe69a9badf805e19c6f3ea36979e934684052a1599,benzinga.com,benzinga.com,"Premier Pharmacy Services Founder, Stephen Samuel, Drives Innovation in Construction with Evolve Realty Development Corp.",2024-03-26,https://www.benzinga.com/pressreleases/24/03/g37950261/premier-pharmacy-services-founder-stephen-samuel-drives-innovation-in-construction-with-evolve-rea,en,2024-03-29 00:21:07.873011
66a3bb1f5cb51d56bd206b3920c56190f2a66778ca5ed39a74708c4a744bb569,ign.com,ign.com,Helldivers 2 Patch 1.000.104 Makes Arc Weapons and Stratagems Safe to Use Again,2024-03-26,https://www.ign.com/articles/helldivers-2-patch-1000104-makes-arc-weapons-and-stratagems-safe-to-use-again,en,2024-03-28 01:05:02.795264
b1f2474aeb0eb313c36120157cbae5dafb9f7f0221bc8d1c19f17e9102f06394,forbes.com,forbes.com,Grammy Award Winner Alicia Keys Has Advice For Up-And-Coming Artists,2024-03-26,https://www.forbes.com/sites/mayarichard-craven/2024/03/26/grammy-award-winner-alicia-keys-has-advice-for-up-and-coming-artists/,en,2024-03-28 03:05:58.844748
02979202c2743cf736a274ed86cd9b778fd2e364963eef95d6d82a02b1451035,ign.com,ign.com,Rise of the Ronin Walkthrough - Final Boss and Ending (The Veiled Edge),2024-03-26,https://www.ign.com/videos/rise-of-the-ronin-walkthrough-final-boss-and-ending-the-veiled-edge,en,2024-03-28 01:05:15.753411
f8f2bcfeaa6eca1d95b66022de731c87daf45ef88b790381314fb71f4b896dc7,nypost.com,nypost.com,Left-wing activist who hired one of Farrakhan’s ‘top soldiers’ has visited Biden White House 7 times,2024-03-26,https://nypost.com/2024/03/26/us-news/left-wing-activist-who-hired-one-of-farrakhans-top-soldiers-has-visited-biden-white-house-7-times/,en,2024-03-28 00:48:31.184637
8692fa96153f64d5f9e89ee0864a95a76caf129ad8225ed83faf7bd417f56071,jezebel.com,jezebel.com,Justices Alito and Thomas Actually Brought Up a Dormant Abortion Ban During Supreme Court Hearing,2024-03-26,https://www.jezebel.com/justice-alito-and-thomas-actually-brought-up-a-dormant-abortion-ban-during-supreme-court-hearing,en,2024-03-28 05:51:55.449846
19d72c6785282d4e0a6e41311fa8eb9380f5c508c38c7071ad54637a701f7b54,benzinga.com,benzinga.com,"FSD Free Trial For Canada On The Horizon? Tesla Exec Pledges Parity With US, Blames Provincial Laws For Delay",2024-03-26,https://www.benzinga.com/markets/equities/24/03/37927761/fsd-free-trial-for-canada-on-the-horizon-tesla-exec-pledges-parity-with-us-blames-provincial-law,en,2024-03-28 00:28:11.304972
1cfa60e35a761d253a9345c2faf9e7f55bf1a69fcbcc13a226b4de9f93ad952d,bustle.com,bustle.com,"The 8 Best Beauty Tools Of 2024, From Skin To Hair",2024-03-26,https://www.bustle.com/beauty/best-beauty-tools-skin-hair-2024,en,2024-03-29 06:29:57.670006
f0d89de2948a8f1afe6940da238c39ac6ae22d819f225a606f3e43ab3680aba1,mlive.com,mlive.com,Book review: ‘Housing the Nation’ is informative introduction to complicated topic,2024-03-26,https://www.mlive.com/business/2024/03/book-review-housing-the-nation-is-informative-introduction-to-complicated-topic.html,en,2024-03-28 02:40:26.641415
769d3d1f055166180e67163040d5466fc60c5e49d08bbd0c1e8158644f7910d7,foxnews.com,foxnews.com,Super Bowl hero Malcolm Butler arrested for suspicion of drunk driving,2024-03-26,https://www.foxnews.com/sports/super-bowl-hero-malcolm-butler-arrested-suspicion-drunk-driving,en,2024-03-28 00:53:20.333807
845046c0dc1af08cb58dfe7b9b85770bb0f4c588e583634dc5edcf28b5a21c02,newsweek.com,newsweek.com,"Solar eclipse could unlock ""elusive"" knowledge of sun",2024-03-26,https://www.newsweek.com/solar-eclipse-could-unlock-elusive-knowledge-sun-1883709,en,2024-03-28 02:16:40.956396
18a5bc52b6d9039a0dbc959d3099f5978c64faf9497b9db39bfb8e14924c8984,cbsnews.com,cbsnews.com,"Federal agents raid two homes of music star Sean ""Diddy"" Combs",2024-03-26,https://www.cbsnews.com/chicago/video/federal-agents-raid-two-homes-of-music-star-sean-diddy-combs/,en,2024-03-28 00:49:55.118790
31fc675e64e831137e43ac259a90dc6535d18cd85c6db4344e3d12b2c2dc2bba,benzinga.com,benzinga.com,Intact Financial Corporation Chief Executive Officer Charles Brindamour to participate in fireside chat at National Bank of Canada's Annual Financial Services Conference,2024-03-26,https://www.benzinga.com/pressreleases/24/03/n37947634/intact-financial-corporation-chief-executive-officer-charles-brindamour-to-participate-in-fireside,en,2024-03-29 00:28:37.094318
f2f09909227e912636b3a5635568c819d25c18b65bf67363d07ea4f24180529f,redstate.com,redstate.com,NYC Mayor Eric Adams' Prepaid Debit Cards for Illegal Immigrants Spark Debate,2024-03-26,https://redstate.com/jeffc/2024/03/26/nyc-mayor-eric-adams-prepaid-debit-cards-for-migrants-sparks-debate-n2171968,en,2024-03-29 04:26:26.412213
6d9e0e4d41e34a63139a3ec8736b50f1287b8cc87059d002d0deb39735ddda5c,forbes.com,forbes.com,Supreme Court Suggests It Won’t Restrict Abortion Drug Mifepristone,2024-03-26,https://www.forbes.com/sites/alisondurkee/2024/03/26/supreme-court-suggests-it-wont-restrict-abortion-drug-mifepristone/,en,2024-03-28 03:05:59.844139
a6663cd44ae344ba6bf4a960b6c3a9b7d1d3995bafd6433a52f064a0660008df,pbs.org,pbs.org,Bridge failures can cause major disruptions. How do agencies plan for disaster?,2024-03-26,https://www.pbs.org/newshour/science/how-bridge-collapses-other-disasters-test-transportation-agency-emergency-plans,en,2024-03-28 05:23:42.540713
b933c3661442a4089f9a599fa7008af7cb9944571e7db5d8a3529eab109ee53a,breitbart.com,breitbart.com,Exclusive — Sen. Bill Hagerty: Democrats Blocked Bill to Stop Taxpayers from Flying Illegals into U.S.,2024-03-26,https://www.breitbart.com/politics/2024/03/26/exclusive-sen-bill-hagerty-democrats-blocked-bill-to-stop-taxpayers-from-flying-illegals-into-u-s/,en,2024-03-29 04:09:01.246209
9261f294a99d8bce9b25d8d819549b5ccea376abf0c95e5f4aaf58e4333c4736,foxnews.com,foxnews.com,Germany to enact security checks on frontiers during summer European soccer tournament,2024-03-26,https://www.foxnews.com/sports/germany-enact-security-checks-frontiers-during-summer-european-soccer-tournament,en,2024-03-28 00:53:12.194751
db2de48e5ac0b7041c791e3b4049435b00e0953af208dfd28020f96da7f77551,benzinga.com,benzinga.com,Vigil Neuroscience Reports Fourth Quarter and Full Year 2023 Financial Results and Provides Business Update,2024-03-26,https://www.benzinga.com/pressreleases/24/03/g37929839/vigil-neuroscience-reports-fourth-quarter-and-full-year-2023-financial-results-and-provides-busine,en,2024-03-28 00:30:15.668380
34bab893a688d55db34352292e575d1910e8904d3c64366fc0d075d5c02c943b,theconversation.com,theconversation.com,Les guerres d’Ukraine et de Gaza vont-elles redynamiser le droit international ?,2024-03-26,https://theconversation.com/les-guerres-dukraine-et-de-gaza-vont-elles-redynamiser-le-droit-international-226253,fr,2024-03-28 02:18:21.490245
7f8a5bd531e9c3b998fa07ab3c58a0e011d71ad3b0e371792cd97f91a6dd2531,syracuse.com,syracuse.com,"Man accused of fatally shooting pregnant woman found competent to stand trial, prosecutor says",2024-03-26,https://www.syracuse.com/crime/2024/03/man-accused-of-fatally-shooting-pregnant-woman-found-competent-to-stand-trial-prosecutor-says.html,en,2024-03-28 02:16:18.283786
0dcf2cb242fe959c4214de80779da3a746e1eb84401cfc891beb7be91294b9ee,nypost.com,nypost.com,Evan Fournier not surprised Donte DiVincenzo is erasing his Knicks records,2024-03-26,https://nypost.com/2024/03/26/sports/evan-fournier-not-surprised-donte-divincenzo-is-erasing-his-knicks-records/,en,2024-03-28 00:48:20.824247
1ed9c6c607040b258da79d6796137f4ccc896628abace2fbd0b7a866db4769af,salon.com,salon.com,How to unlock Instagram's political content settings in 3 easy steps,2024-03-26,https://www.salon.com/2024/03/26/how-to-unlock-instagram-political-content-preference-settings/,en,2024-03-28 03:34:25.877099
2f7725720a74317fbb88ceeb1bb6523ddd1f589b1e73e5260063e104da29a9ea,forbes.com,forbes.com,Miley Cyrus Is The First Musician To Manage A Landmark Chart Feat,2024-03-26,https://www.forbes.com/sites/hughmcintyre/2024/03/26/miley-cyrus-is-the-first-musician-to-manage-a-landmark-chart-feat/,en,2024-03-28 03:05:57.685448
74f35d465b7b2a556dece019acd5429b9a98ec2102601e25e96fc07bb942455b,benzinga.com,benzinga.com,"Apple Faces DOJ Scrutiny, but Not These 3 Under the Radar Names",2024-03-26,https://www.benzinga.com/news/24/03/37936693/apple-faces-doj-scrutiny-but-not-these-3-under-the-radar-names,en,2024-03-28 00:33:55.916022
0694f3be4b55ac6a8c2a2a3ee769688bda419b5632b507a721bd91c05dab4c73,cbsnews.com,cbsnews.com,"Rams continue secondary overhaul, sign former Bills CB Tre'Davious White",2024-03-26,https://www.cbsnews.com/losangeles/news/the-la-rams-are-signing-former-bills-cb-tredavious-white-continuing-their-secondary-overhaul/,en,2024-03-29 01:05:19.520967
18685aaf04f046e33611966cf7bbf8e55683da0edecdb7e6ff2fc0342ee6642b,hollywoodlife.com,hollywoodlife.com,Diddy Spotted in New Video at an Airport After His Miami & L.A. Homes Were Raided by Feds,2024-03-26,https://hollywoodlife.com/2024/03/26/diddy-spotted-at-airport-in-video/,en,2024-03-28 04:30:28.859013
d2c56c2c0331a59a47494cf50665ae62f7aa5c7f8d1aba83352427d1c725effd,ibtimes.com,ibtimes.com,Social Media Forces British Royal Family To Adapt,2024-03-26,https://www.ibtimes.com/social-media-forces-british-royal-family-adapt-3728174,en,2024-03-28 02:19:38.953994
69529cbebbfa1c7af1b012c79e8410867f3990425d34d83a7f66fe44e81e2b5f,sandiegouniontribune.com,sandiegouniontribune.com,"Sparks paying ex-police officer $525,000 to settle a free speech lawsuit over social media posts",2024-03-26,https://www.sandiegouniontribune.com/news/california/story/2024-03-26/sparks-paying-ex-police-officer-525-000-to-settle-a-free-speech-lawsuit-over-social-media-posts,en,2024-03-28 08:10:12.332251
b9387dfe35a0ec9c4476eb5c1892d8fe515bc533d4381284108eedfcbef23c8b,arkansasonline.com,arkansasonline.com,Kansas City Royals defeat Northwest Arkansas Naturals in exhibition at Arvest Ballpark in Springdale,2024-03-26,https://www.arkansasonline.com/news/2024/mar/26/kansas-city-royals-defeat-northwest-arkansas/,en,2024-03-28 02:02:31.691386
772d9c3f2d23ad6a4992d6769fffc4068e509bd1a7205e1f65744a9ae6665185,rttnews.com,rttnews.com,"Sean 'Diddy' Combs' Homes In Los Angeles, Miami Reportedly Raided By Federal Agents",2024-03-26,https://www.rttnews.com/story.aspx?Id=3434980,en,2024-03-28 04:18:21.905111
e4bf76429f9acf1e7c6af7dd2ef742a09029cd4335d9443b5379797c902695cb,bustle.com,bustle.com,Robert Pattinson Is A Dad! He & Suki Waterhouse Welcome Their First Child,2024-03-26,https://www.bustle.com/entertainment/robert-pattinson-suki-waterhouse-first-child,en,2024-03-29 06:29:57.744578
1bf0a4f768090b9ace76b67c8af8dfdff54b00c9c917627c41e502cd1cd89e9b,benzinga.com,benzinga.com,"Purpose Investments Inc. Announces Final March 2024 Distribution Rate for Purpose High Interest Savings Fund, Purpose US Cash Fund, Purpose Cash Management Fund, and Purpose USD Cash Management Fund",2024-03-26,https://www.benzinga.com/pressreleases/24/03/g37929666/purpose-investments-inc-announces-final-march-2024-distribution-rate-for-purpose-high-interest-sav,en,2024-03-28 00:30:45.139605
dd5d9b5aa92ed67af16384ecfedf3c4dfcfe414bb14f7fcf34fcc3caae4ae562,buzzfeed.com,buzzfeed.com,「夢みたい…」リンツのチョコレート詰め放題イベントが期間限定で復活！ リンドール75周年記念フレーバーも「絶対行かなきゃ」,2024-03-26,https://www.buzzfeed.com/jp/shionkataoka/lindt-event,ja,2024-03-28 06:00:39.965030
92b8b22c7a35fa4f9fdf86e838488aa6e5a28a7accf3bf00a3117debfad689aa,foxnews.com,foxnews.com,Whoopi Goldberg calls out audience member using camera during 'The View',2024-03-26,https://www.foxnews.com/media/whoopi-goldberg-calls-out-audience-member-using-camera-during-view,en,2024-03-28 00:53:19.958884
fad1614cc24e4487ec250d9758b048dbf9ca0e6ce9130ed0cc498c6a0a1d0b57,startribune.com,startribune.com,US and Israeli defense chiefs meet to discuss plans for Gaza as tensions between the allies spike,2024-03-26,https://www.startribune.com/us-and-israeli-defense-chiefs-to-meet-tuesday-as-tensions-rise-over-gaza/600354037/,en,2024-03-28 03:22:08.784034
6878964440e3369b68317dafd781918c396b1f3433b52763f5b3f7bd34a1867f,theatlantic.com,theatlantic.com,Trump’s lucky break,2024-03-26,https://www.theatlantic.com/newsletters/archive/2024/03/trumps-lucky-break/677890/?utm_source=feed,en,2024-03-28 03:58:15.044792
1e44e680496b80fc67ed23548d9058dcbff1c1661df0ebf027c5aee98fca3093,latimes.com,latimes.com,A timeline of allegations against Sean 'Diddy' Combs,2024-03-26,https://www.latimes.com/entertainment-arts/story/2024-03-26/diddy-allegations-controversies-timeline-sean-combs,en,2024-03-29 08:19:01.881054
f82328da93e828d54feaa664064ad34e21c1e397e5c2537940ec9355bd80b31d,bleacherreport.com,bleacherreport.com,Patriots Rumors: Jayden Daniels to Have 'Lengthy Meeting' with Team Before Pro Day,2024-03-26,https://bleacherreport.com/articles/10114442-patriots-rumors-jayden-daniels-to-have-lengthy-meeting-with-team-before-pro-day,en,2024-03-28 02:11:13.153791
f207a51d70abe8dfed569d54725840b11893f689a0e1d1636862624d2fdfc8cc,latimes.com,latimes.com,Stocks edge back further from their all-time highs on Wall Street,2024-03-26,https://www.latimes.com/business/story/2024-03-26/stock-market-today-wall-street-edges-back-further-from-its-all-time-highs,en,2024-03-28 06:04:04.754698
fde4ecfd30403ecbbea4930e1a4bf5a82493927240e86aa4fcde488502acf1bc,ocregister.com,ocregister.com,Lakers’ LeBron James sits out vs. Bucks with ankle injury,2024-03-26,https://www.ocregister.com/2024/03/26/lakers-lebron-james-sitting-out-vs-bucks-with-ankle-injury/,en,2024-03-28 07:48:31.142388
168167bc83450b3f31016df8f2c74ea63aa8ec48644c59b1387cb0025a5a039d,cbsnews.com,cbsnews.com,Could the Baltimore bridge disaster happen at LA County's ports?,2024-03-26,https://www.cbsnews.com/losangeles/video/could-the-baltimore-bridge-disaster-happen-at-la-countys-ports/,en,2024-03-29 01:06:02.929322
f9857ef1914ed83e4fd221c32226551ebe5b28f0557589ee78431fef514ccfba,theguardian.com,theguardian.com,16-year-old Lily Yohannes called up to USWNT SheBelieves squad,2024-03-26,https://www.theguardian.com/football/2024/mar/26/16-year-old-lily-yohannes-called-up-to-uswnt-shebelieves-squad,en,2024-03-28 01:06:11.202263
a429de34628613c0078e5c3a8085218a9150797ee83376257e96ad93b134710e,chicagotribune.com,chicagotribune.com,NBC says it will cut ties with former RNC head Ronna McDaniel after days of employee objections,2024-03-26,https://www.chicagotribune.com/2024/03/26/a-vocal-revolt-msnbc-personalities-object-to-nbc-news-hiring-of-ronna-mcdaniel-as-a-contributor/,en,2024-03-28 03:00:58.562852
78fbb2fc189c0b7c64fea71f22823525f8a960572e3384e372b11e111fa73cec,nbcnews.com,nbcnews.com,Kids as young as 14 were found working at a Tennessee factory that makes lawn mower parts,2024-03-26,https://www.nbcnews.com/news/us-news/child-labor-tennessee-kids-young-14-lawn-mower-tuff-torq-john-deere-rcna144938,en,2024-03-28 16:44:42.728759
4faf5e8f35754e844cefa94c830cd8043953b8d9b778e3afdfb0625dd48e6142,foxnews.com,foxnews.com,Structural engineer 'surprised' cargo ship was able to take down Baltimore's Francis Scott Key Bridge,2024-03-26,https://www.foxnews.com/media/structural-engineer-surprised-cargo-ship-able-take-baltimore-francis-scott-key-bridge,en,2024-03-28 00:53:15.521097
6741c63ae7bf8b6b2040ea6734fe5855a542f799f0665195a01f111ce9f43563,benzinga.com,benzinga.com,Milk Partners and The Sandbox signed the MoU for expanding the blockchain ecosystem,2024-03-26,https://www.benzinga.com/pressreleases/24/03/n37927613/milk-partners-and-the-sandbox-signed-the-mou-for-expanding-the-blockchain-ecosystem,en,2024-03-28 00:28:11.892998
472e4da29b3905582406ec5c1065a6c28cab028571cd1b1b99dba0e920f983a6,nbcnews.com,nbcnews.com,Trump is selling $60 Bibles with ‘God Bless the U.S.A.’ singer Lee Greenwood,2024-03-26,https://www.nbcnews.com/business/business-news/trump-selling-60-bibles-god-bless-us-singer-lee-greenwood-rcna145189,en,2024-03-28 16:44:45.573848
587677e3df4bfee78f6016eb717bb2a0eaac5cab5c8fbaf06f5247495a32676d,cleveland.com,cleveland.com,Officer unconvinced that woman’s ex is spying on her: Strongsville Police Blotter,2024-03-26,https://www.cleveland.com/community/2024/03/woman-claims-ex-boyfriend-spying-on-her-officer-disagrees-strongsville-police-blotter.html,en,2024-03-28 05:27:00.348603
0529c6e392501f85fe6af0df79471654b499e9d7a1184f7c6f2b09fac8eff276,fortune.com,fortune.com,The U.S. is simplifying how to report crypto on your taxes in 2025. But what about this year?,2024-03-26,https://fortune.com/crypto/2024/03/26/crypto-2024-tax-bill-explainer-irs-internal-revenue-service/,en,2024-03-28 04:16:34.551084
28cc3c5123b31f8f2ea8c83c86355169b5d9928c9ee39c1de952497257859b23,baltimoresun.com,baltimoresun.com,Ellicott City celebrates springtime with egg hunts and brunches,2024-03-26,https://www.baltimoresun.com/2024/03/26/ellicott-city-celebrates-springtime-with-egg-hunts-and-brunches-mostly-main-street/,en,2024-03-28 02:08:04.891543
03c57a10d364128b398420f71ab4f4552b91f9bef87db44c8da594f505a255bf,benzinga.com,benzinga.com,"Alibaba Halts Ling Shou Tong Operations, Proposes $3.75B Cainiao Share Purchase Amid Global Expansion Plans",2024-03-26,https://www.benzinga.com/news/24/03/37933945/alibaba-halts-ling-shou-tong-operations-proposes-3-75b-cainiao-share-purchase-amid-global-expansion,en,2024-03-28 00:31:44.688725
bff09ddb2e0c07f28febff59052ffa9b74dbc40daa1957a01c0156f834715afa,mashable.com,mashable.com,Hurry to snag a $100 DoorDash gift card for just $85,2024-03-26,https://mashable.com/article/march-26-doordash-deal,en,2024-03-28 16:39:25.004207
70bef8703b8dea93c2ca11b0d767f136f7477aa5e94a8245f8d75adeecfe51e9,ocregister.com,ocregister.com,"Niles: Grown-ups can enjoy Legoland, too — but respectfully",2024-03-26,https://www.ocregister.com/2024/03/26/niles-grown-ups-can-enjoy-legoland-too-but-respectfully/,en,2024-03-28 07:48:23.483056
dc932e274176c36974d2725d09ac47ead9f2ac444517b5c95996f90a003c78b6,cbsnews.com,cbsnews.com,"Cold mornings, mild days ahead for North Texas",2024-03-26,https://www.cbsnews.com/texas/news/cold-mornings-mild-days-ahead-for-north-texas/,en,2024-03-28 00:49:53.401311
809a74362dc41c5aa7de4dbdb51a53d682cb5ed36198632add50b84683a9dd63,cbsnews.com,cbsnews.com,Mother calls for help finding killer of two Dallas teens,2024-03-26,https://www.cbsnews.com/texas/video/mother-calls-for-help-finding-killer-of-two-dallas-teens/,en,2024-03-29 01:05:23.714701
c60c38760344f938175de58d52f92925fc29da3806031432441094b382764a9a,cbsnews.com,cbsnews.com,"Severe storms possible Tuesday in Chicago area, Northwest Indiana",2024-03-26,https://www.cbsnews.com/chicago/news/severe-storms-possible-tuesday-in-chicago/,en,2024-03-28 00:49:54.887184
42d83ec92447d72a98edde2823fd9f7939494473e861745ef5ef880653feb1ce,cbsnews.com,cbsnews.com,Family of badly injured 18-year-old files notice of claim against Newark Board of Education,2024-03-26,https://www.cbsnews.com/newyork/video/family-of-badly-injured-18-year-old-files-notice-of-claim-against-newark-board-of-education/,en,2024-03-28 00:50:04.814639
4dbcc7da435d194bc33e5d8fe133c171c3c8633fdefcfb7ae75f697ed9b12b8a,newsday.com,newsday.com,Raptors' Jontay Porter at center of NBA investigation into gambling activity,2024-03-26,https://www.newsday.com/sports/basketball/johntay-porter-nba-investigation-m07484,en,2024-03-28 00:58:43.050325
6655b87aaf701a5b456eaa0d49c877cb9595ddf2eb7222b34d979efbb043e8af,newsday.com,newsday.com,Texas AG Ken Paxton reaches deal to end securities fraud charges after 9 years,2024-03-26,https://www.newsday.com/news/nation/Ken-Paxton-texas-securities-fraud-b60830,en,2024-03-28 00:58:30.393168
4d5e41eb233e08ba49ffafba9935316c1bf6a3325799d296e67b15c333210a8e,benzinga.com,benzinga.com,"Expert Raises Alarm As Apple, Tesla, Amazon And Other Magnificent 7 Fall Behind Amid Speculative Stock Surge: 'It's The Greater Fool Theory'",2024-03-26,https://www.benzinga.com/analyst-ratings/analyst-color/24/03/37927505/expert-raises-alarm-as-apple-tesla-amazon-and-other-magnificent-7-fall-behind-amid-,en,2024-03-28 00:29:57.518570
1b9364c84b2455d416bc5eccc4c626795dab57f2b839dd8fe9a26dee6dbf5183,cbsnews.com,cbsnews.com,"Miami Life: A Closer Look At The Crisis In Haiti, and What That Means Intergenerationally.",2024-03-26,https://www.cbsnews.com/miami/video/miami-life-a-closer-look-at-the-crisis-in-haiti-and-what-that-means-intergenerationally/,en,2024-03-29 01:05:12.626930
13192a2062cd2a65eac923c71cbb37ace395cc99d51aa0af3a3cf54fc18d9aff,bleacherreport.com,bleacherreport.com,Ranking the Cities Most Likely to Get a NHL Team Next,2024-03-26,https://bleacherreport.com/articles/10114320-ranking-the-cities-most-likely-to-get-a-nhl-team-next,en,2024-03-28 02:11:17.028925
dbf23c1425d53cf449be0d2eb3e954632e5438ef474bb2d1ca79e9fae6caf94b,baltimoresun.com,baltimoresun.com,Robert F. Kennedy Jr. picks Nicole Shanahan as his running mate for his independent White House bid,2024-03-26,https://www.baltimoresun.com/2024/03/26/robert-f-kennedy-jr-is-expected-to-announce-his-vp-pick-for-his-independent-white-house-bid/,en,2024-03-28 02:08:03.228024
41746b68327670304275b8c50b3bd73de6481b139ea294a66c214446d6e74da4,variety.com,variety.com,Nickelodeon Actor Allie DiMeco Says She Was Forced to Kiss Older Co-Star on 'Naked Brothers Band' Set: 'I Told Them Many Times I Didn’t Want to Do It',2024-03-26,https://variety.com/2024/film/news/allie-dimeco-forced-kiss-man-naked-brothers-band-set-nickelodeon-1235952406/,en,2024-03-28 03:37:37.640089
ddc9004e00e547ec7f424384bae833b5df3c576fbe2f429fade21f8a427949cb,centralmaine.com,centralmaine.com,Braves ace Spencer Strider adds curveball to already nasty repertoire,2024-03-26,https://www.centralmaine.com/2024/03/26/braves-ace-spencer-strider-adds-curveball-to-already-nasty-repertoire/,en,2024-03-29 03:45:35.609206
0b0f5afd8a1a24c86b2318d17bb8f82bf5db298a07e101ac6437530cbfaa00c4,benzinga.com,benzinga.com,Gardners Candies Unveils Ambitious National Grocery and Convenience Store Growth Plan,2024-03-26,https://www.benzinga.com/pressreleases/24/03/g37933066/gardners-candies-unveils-ambitious-national-grocery-and-convenience-store-growth-plan,en,2024-03-30 00:41:33.446412
6173afe55efa1b847d71bb9db808c310985593dc9d1582f64690f4857d994bdb,rawstory.com,rawstory.com,Water and dust: How much can your smartphone handle?,2024-03-26,https://www.rawstory.com/water-and-dust-how-much-can-your-smartphone-handle-2667599771/,en,2024-03-28 02:13:51.505789
045686830d9b466d0d107767e1022a2fa2e2917c2616a863249d5fd050afa2f9,nypost.com,nypost.com,Texas teacher unhappy with Biden and Trump changes name to Literally Anybody Else to run for prez,2024-03-26,https://nypost.com/2024/03/26/us-news/teacher-changes-name-to-literally-anybody-else-to-run-for-prez/,en,2024-03-28 00:48:22.982848
41a2ad44eec7284d402d15e22465c86f06be887f883df41d06540f079cfc9acc,centralmaine.com,centralmaine.com,"Franklin County commissioners vote to provide $310,500 for projects",2024-03-26,https://www.centralmaine.com/2024/03/26/franklin-county-commissioners-vote-to-provide-310500-for-projects/,en,2024-03-29 03:45:38.353275
04f3c0422ae4f01ff2ffa17a1f3ec30d918c3f52a7cdf62a923d91523f83a2ae,bleacherreport.com,bleacherreport.com,Kirby Smart: Georgia RB Trevor Etienne Could Face Suspension After DUI Arrest,2024-03-26,https://bleacherreport.com/articles/10114517-kirby-smart-georgia-rb-trevor-etienne-could-face-suspension-after-dui-arrest,en,2024-03-28 02:11:22.712242
ed4479f60f64305aa08ca0519dec6a739fb239ae7ed8b54cfa4d808b11091753,businessinsider.com,businessinsider.com,Credit-card points might be entering a new era,2024-03-26,https://www.businessinsider.com/visa-mastercard-merchants-agreement-impacts-credit-cards-reward-programs-2024-3,en,2024-03-28 11:19:28.134928
5ed0165bff4c2ec89baa67ebdd3e39889c2f22bfad15e47419f2f412f364b0c1,cbsnews.com,cbsnews.com,Sacramento man accused of sexually abusing passenger aboard South Korea-to-SFO flight,2024-03-26,https://www.cbsnews.com/sanfrancisco/news/sacramento-man-accused-of-sexually-abusing-passenger-aboard-south-korea-to-sfo-flight/,en,2024-03-28 00:50:01.386735
