id,media_name,media_url,title,publish_date,url,language,indexed_date
4cf98616a383d8b664bfcd5d1dfff364d34c7413579d8220209aeefa293c31d4,centralmaine.com,centralmaine.com,"Future of Vassalboro mill in question amid storm damages, fire code violations",2024-03-26,https://www.centralmaine.com/2024/03/26/future-of-vassalboro-mill-in-question-amid-storm-damages-fire-code-violations-2/,en,2024-03-28 04:20:43.500214
ed3929a52113bec5223f7aa7f7fe181f09c7aa29388a378de168bc71d320084e,benzinga.com,benzinga.com,Portage Biotech Completes Monetization of Intensity Therapeutics (INTS) shares,2024-03-26,https://www.benzinga.com/pressreleases/24/03/g37931292/portage-biotech-completes-monetization-of-intensity-therapeutics-ints-shares,en,2024-03-28 00:30:05.093580
eede6e465f158f3168694afd4516409f0de8a2b26dc897b3fd629198ee270e5f,cbsnews.com,cbsnews.com,"Recap: Francis Scott Key Bridge in Baltimore collapses, 6 presumed dead",2024-03-26,https://www.cbsnews.com/chicago/live-updates/francis-scott-key-bridge-baltimore-collapse-live-updates/,en,2024-03-28 00:50:06.582869
bfafe99be49c0a4f2ca902112187ce4c9eb492e48d83fa521f6e34d6523e6df9,reuters.com,reuters.com,ＵＢＳ、アジアの顧客資産を全体の2割に引き上げへ＝ＣＥＯ,2024-03-26,https://jp.reuters.com/markets/japan/funds/ZA3XFCUJFZLZZEIQ5XL25YEKC4-2024-03-26/,ja,2024-03-28 01:54:47.430972
132c39b207004210ce73d40a83d78ffb72aae7d2d7da22709b55b9f77a07d552,rttnews.com,rttnews.com,U.S. Durable Goods Orders Jump In February Amid Rebound In Aircraft Demand,2024-03-26,https://www.rttnews.com/story.aspx?Id=3434921,en,2024-03-28 04:18:21.297907
eb0b7fff886bbae0ba8a39be6acd588a55d808c323ff03d4552b0f1cb122c7ed,mercurynews.com,mercurynews.com,49ers brace for Brock Purdy to reset quarterback market in 2025: CEO York,2024-03-26,https://www.mercurynews.com/2024/03/26/49ers-jed-york-bracing-for-brock-purdy-to-reset-quarterback-market-in-2025/,en,2024-03-28 01:07:19.328925
ee9beecf374944030c2e657eaa4e9c2fd7c541e06c895b66dd224b3304457640,foxnews.com,foxnews.com,"Stephen Colbert apologizes for Kate Middleton jokes before she revealed cancer diagnosis, wishes her recovery",2024-03-26,https://www.foxnews.com/media/stephen-colbert-apologizes-kate-middleton-jokes-before-revealed-cancer-diagnosis-wishes-recovery,en,2024-03-28 00:53:15.875014
f7608a8d1268ee320c6459496cd7f89e9a11821e3750a0ab5c02d448335ae542,cbsnews.com,cbsnews.com,"2 rescued after Baltimore bridge collapse, search continues for others",2024-03-26,https://www.cbsnews.com/video/2-rescued-after-baltimore-bridge-collapse-search-continues-for-others/,en,2024-03-28 00:49:56.276199
9f8ed722961816d68322f5456fc7393b2dadc28ddb5e309eac442fbeacebcb71,cbsnews.com,cbsnews.com,KDKA-TV Nightly Forecast (3/26),2024-03-26,https://www.cbsnews.com/pittsburgh/video/kdka-tv-nightly-forecast-326/,en,2024-03-29 01:05:20.374924
13c5ebc122efd9470b3a6a78272fd428ba54546ae4a1a39f6a50f0355e6aec6c,cbsnews.com,cbsnews.com,Maryland state of emergency declared after Baltimore bridge collapse,2024-03-26,https://www.cbsnews.com/video/maryland-state-of-emergency-declared-after-baltimore-bridge-collapse/,en,2024-03-28 00:50:11.938826
d701b09e13a2372bba13ae126ea7012079b1027639ac07f12aa446f304e963b5,benzinga.com,benzinga.com,BOPP Packaging Film Market Poised for US$ 44.6 Billion at 5.6% CAGR by 2034: Fact.MR Study,2024-03-26,https://www.benzinga.com/pressreleases/24/03/g37927601/bopp-packaging-film-market-poised-for-us-44-6-billion-at-5-6-cagr-by-2034-fact-mr-study,en,2024-03-28 00:29:32.390551
5c873a8e00b39fc4aa88d3b7bf27ece84b3ee7eea5223486a70df669274423b3,npr.org,npr.org,"The Francis Scott Key Bridge in Baltimore collapses, 6 feared dead",2024-03-26,https://www.npr.org/2024/03/26/1240857704/francis-scott-key-bridge-collapse-baltimore,en,2024-03-28 02:31:52.906283
b98c7b19b299b0598698f703df40308742cefff23086e73e6d5533733cc73440,variety.com,variety.com,Netflix's 'Fear Street: Prom Queen' Sets Ensemble Cast,2024-03-26,https://variety.com/2024/film/news/fear-street-prom-queen-ensemble-cast-netflix-1235951994/,en,2024-03-28 03:37:36.723329
439f7ffa341678b3c6980a0777cf54c233899fc61c107d111a6d369381e85281,cnet.com,cnet.com,Get Your Hands on a High-End Samsung Monitor With Up to 39% Off,2024-03-26,https://www.cnet.com/deals/get-your-hands-on-a-high-end-samsung-monitor-with-up-to-39-off/,en,2024-03-28 01:45:19.821356
3fd5bdf570cf1994beca3851f8f367cf57ad2c25a24411ce9bd8db349afb82e6,theconversation.com,theconversation.com,Why did modern humans replace the Neanderthals? The key might lie in our social structures,2024-03-26,https://theconversation.com/why-did-modern-humans-replace-the-neanderthals-the-key-might-lie-in-our-social-structures-195056,en,2024-03-28 02:18:19.430802
40a8ada80b1bfb6d7a9dabd525dfc6c33ac60a80bfd93431dafc360381faf46a,startribune.com,startribune.com,"Minnesota Senate approves $110,000 settlement with former DFL chief of staff",2024-03-26,https://www.startribune.com/minnesota-senate-approves-settlement-with-former-dfl-chief-of-staff/600354234/,en,2024-03-28 03:21:15.111211
51f76f1deaa9bad37310774ab2ea64ed86daff0e529588fa2beed3876db7062b,mlive.com,mlive.com,Dusty May on rebuilding Michigan’s roster: ‘We have a lot of work to do’,2024-03-26,https://www.mlive.com/wolverines/2024/03/dusty-may-on-rebuilding-michigans-roster-we-have-a-lot-of-work-to-do.html,en,2024-03-28 02:40:44.897673
cc9fd0d561292205c8485b1539761b03709603aa8813b488f95f16cd43ce2a2a,nbcnews.com,nbcnews.com,Anne Hathaway says she had a miscarriage in 2015,2024-03-26,https://www.nbcnews.com/news/us-news/anne-hathaway-opens-up-about-miscarriage-2015-vanity-fair-interview-rcna145176,en,2024-03-29 03:30:46.917046
a1d185a279d00fb6c196ccd467b2dc3a8dbda0d2b6cdc70bb365e8f17e819265,foxnews.com,foxnews.com,Berkeley abandons landmark natural gas ban after court battle,2024-03-26,https://www.foxnews.com/politics/berkeley-california-abandons-climate-action-banning-gas-buildings,en,2024-03-28 00:53:21.026487
fe511c5ecae45a94b9155bff22e54a805b12306e752a8562212846d64eacef5b,cbsnews.com,cbsnews.com,300 former patients sue hospital system over sex abuse by OB/GYN,2024-03-26,https://www.cbsnews.com/chicago/video/300-former-patients-sue-hospital-system-over-sex-abuse-by-obgyn/,en,2024-03-29 01:05:06.125257
7da954ec6da754ed1b7a642f9609fa63c4516282ce84a4eba120cdfc4f824ab4,cbsnews.com,cbsnews.com,"2 teens shot outside New Jersey high school, police seek gunman",2024-03-26,https://www.cbsnews.com/newyork/video/2-teens-shot-outside-new-jersey-high-school-police-seek-gunman/,en,2024-03-29 01:05:09.895858
7526cd2841ac666af8f40de80366156f965ae24161171b134e2993eab852b182,cbssports.com,cbssports.com,'Special recovery team' returns stolen Jaromir Jagr bobbleheads to Penguins,2024-03-26,https://www.cbssports.com/nhl/news/special-recovery-team-returns-stolen-jaromir-jagr-bobbleheads-to-penguins/,en,2024-03-28 01:05:39.018678
9a772bacad2b70a58c7babf70a0aa9c0439fd00aea3ba537e731b2d490a95f06,benzinga.com,benzinga.com,Why Is UPS Stock Shooting Higher Today?,2024-03-26,https://www.benzinga.com/markets/equities/24/03/37930833/why-is-ups-stock-shooting-higher-today,en,2024-03-28 00:30:02.893474
f2b844d354f103b284e2799e0457174db330de15b4939b754a5df6c50e3334f3,foxsports.com,foxsports.com,Iowa's Caitlin Clark is inspiring a younger generation of players,2024-03-26,https://www.foxsports.com/stories/womens-college-basketball/iowas-caitlin-clark-is-inspiring-a-younger-generation-of-players,en,2024-03-29 05:54:07.432345
0833979a56b4032f01c19e80e001fc67cab20b82649948d1439bc06e045c775f,ign.com,ign.com,Bulwark: Falconeer Chronicles - Official Launch Trailer,2024-03-26,https://www.ign.com/videos/bulwark-falconeer-chronicles-official-launch-trailer,en,2024-03-28 01:05:08.858313
cd135ef86f9c0308dd8688a71dd483265ba543b0ee98c1de9cb8fb014c27b36f,nypost.com,nypost.com,Why Calvin Ridley’s wife preferred he not sign with Patriots,2024-03-26,https://nypost.com/2024/03/26/sports/why-calvin-ridleys-wife-preferred-he-not-sign-with-patriots/,en,2024-03-28 00:48:28.907776
e9b66648785e71bb6d6827926bf5dd681f820a0c75f4de497c9229f51dcb2e52,seattletimes.com,seattletimes.com,Pickup truck driver charged for role in crash that left tractor-trailer dangling from bridge,2024-03-26,https://www.seattletimes.com/nation-world/nation/pickup-truck-driver-charged-for-role-in-crash-that-left-tractor-trailer-dangling-from-bridge/?utm_source=RSSutm_medium=Referralutm_campaign=RSS_all,en,2024-03-28 04:04:37.327665
ea9fa2c58acec3cc145a00a00c142b8886242892d9b7498ca45b90a7ddea9cab,cbsnews.com,cbsnews.com,RFK Jr. announces Nicole Shanahan as running mate for independent presidential bid,2024-03-26,https://www.cbsnews.com/sanfrancisco/news/rfk-jr-running-mate-kennedy-president-2024/,en,2024-03-28 00:50:08.459764
eda936e66cf5c2f379a77790b2317ad0c2ead777335fbf51945955b9881c3a28,seattletimes.com,seattletimes.com,Wisconsin Supreme Court lets ruling stand that declared Amazon drivers to be employees,2024-03-26,https://www.seattletimes.com/business/wisconsin-supreme-court-lets-ruling-stand-that-declared-amazon-drivers-to-be-employees/?utm_source=RSSutm_medium=Referralutm_campaign=RSS_all,en,2024-03-28 04:04:34.813984
c26f2c804276c1cd0db2eb55f24ff09090aa41aca0b536441d652c6619a79a23,wsj.com,wsj.com,Seeing a Doctor Doesn’t Have to Be So Frustrating,2024-03-26,https://www.wsj.com/health/wellness/doctor-visits-appointments-frustration-1c88eb9a,en,2024-03-28 05:55:26.970063
8bc35784f871ab00de01d208b59c6967bc7c706ad0484dd9862c452d4aa69e12,startribune.com,startribune.com,Minnesotans are collateral damage in DOT challenge to Delta-Aeromexico partnership,2024-03-26,https://www.startribune.com/minnesotans-are-collateral-damage-in-dot-challenge-to-delta-aeromexico-partnership/600354268/,en,2024-03-28 03:21:48.795130
bb14a3af492c49cfe9303e70b6e10d2a01fec57ab760809f08b2ceee87de9483,billboard.com,billboard.com,50 Cent Mocks Diddy After Federal Agents Raid His Homes: 'It's Diddy Done',2024-03-26,https://www.billboard.com/music/rb-hip-hop/50-cent-mocks-diddy-home-raids-1235641360/,en,2024-03-28 13:45:57.522507
b3b1c22160842494a3e113b62aa5b5afd9a9c60387c98569eed26a018a2def9f,benzinga.com,benzinga.com,Viper Networks Delivers First Major LED Lights Order to Sri Lanka,2024-03-26,https://www.benzinga.com/pressreleases/24/03/g37934442/viper-networks-delivers-first-major-led-lights-order-to-sri-lanka,en,2024-03-28 00:32:02.694656
9ff533410cdf41f446260a4b62bce791f847933526aec3f52413c21077cf79c7,startribune.com,startribune.com,"Minnesota hosts Detroit, aims for 50th win of season",2024-03-26,https://www.startribune.com/minnesota-hosts-detroit-aims-for-50th-win-of-season/600354054/,en,2024-03-28 03:19:35.286388
d5a372fbd7621a10c1dc750ae01e2f265cc2f2e75547c30f0393c97201d1616a,npr.org,npr.org,Photos: Baltimore's Key Bridge collapses; search and rescue efforts continue,2024-03-26,https://www.npr.org/sections/pictureshow/2024/03/26/1240914033/photos-baltimore-key-bridge-collapses,en,2024-03-29 03:17:44.538635
2de0e7571318b7bfba6d3be778f1c4c7fb914a189ccd3d209392133a846252dd,theblaze.com,theblaze.com,Ship that obliterated Baltimore bridge was involved in a previous collision; managed by DEI-captive company,2024-03-26,https://www.theblaze.com/news/ship-that-demolished-baltimore-bridge-was-involved-in-a-previous-collision-managed-by-dei-captive-company,en,2024-03-28 03:04:07.014760
a87a1e15b9dad1102924860aef12f8e921eefa1a682b02c99e170a3e3688e18c,benzinga.com,benzinga.com,EXP to provide design-build services for MTA escalator replacement project,2024-03-26,https://www.benzinga.com/pressreleases/24/03/g37938997/exp-to-provide-design-build-services-for-mta-escalator-replacement-project,en,2024-03-28 00:32:28.198006
6b6d31b15acd5fbe37d3c48a5ee17d60d7a1eaf74a2195c06bb8694c2ba7f8ba,cbssports.com,cbssports.com,"NBA DFS: Top DraftKings, FanDuel daily Fantasy basketball picks for Tuesday, March 26 include Anthony Davis",2024-03-26,https://www.cbssports.com/nba/news/nba-dfs-top-draftkings-fanduel-daily-fantasy-basketball-picks-for-tuesday-march-26-include-anthony-davis/,en,2024-03-27 06:24:07.861444
778d6697dc6deef7bec6c766782fe3957945e6ba49e683be18bc22757c2ef2c1,latimes.com,latimes.com,This California congressional race is currently divided by one vote,2024-03-26,https://www.latimes.com/california/story/2024-03-26/california-congress-district-16-anna-eshoo-seat-simitian-low-liccardo,en,2024-03-28 06:04:03.959272
2f66e2fe39a4a32e68014754bf03b5f67fa18d10708efe7162c38c2b5cb4c397,startribune.com,startribune.com,US-Audiobooks-Top-10,2024-03-26,https://www.startribune.com/us-audiobooks-top-10/600354221/,en,2024-03-28 03:21:05.284445
63657b2bfe2d04e1ae9d6e620076d45d6f5649e0d962baa3c93ff37445926f68,salon.com,salon.com,"""All business"" NY judge imposes gag order on Trump in criminal case",2024-03-26,https://www.salon.com/2024/03/26/ex-prosecutor-ny-shows-hes-all-business-after-imposing-gag-order-on/,en,2024-03-28 03:34:26.904057
f2803ee6c2d1cc9a569b12c4bb438e3ae234a4fee564f2be6a0e3ce57169529d,benzinga.com,benzinga.com,"Better Choice Company Initiates Legal Action Against Alphia, a Portfolio Company of Private Equity Firm PAI",2024-03-26,https://www.benzinga.com/pressreleases/24/03/g37933872/better-choice-company-initiates-legal-action-against-alphia-a-portfolio-company-of-private-equity-,en,2024-03-28 00:31:49.916730
87382d042d11c4f502a0648ae456d9e7b34da81b8114cc6b62f9853522708a80,theverge.com,theverge.com,"Wyze’s cheap and questionable security cam levels up with Wi-Fi 6, edge AI, and 2.5K video",2024-03-26,https://www.theverge.com/24112530/wyze-cam-v4,en,2024-03-28 03:29:04.903173
78aa5885555e0bad31e52ec454691d26a5668b5818534df8c4a28092cb2ea84a,newsday.com,newsday.com,Wisconsin Supreme Court lets ruling stand that declared Amazon drivers to be employees,2024-03-26,https://www.newsday.com/news/nation/Amazon-Wisconsin-delivery-drivers-v34177,en,2024-03-28 00:58:12.184392
4a7f468db426670361eb6d512a1cfb7284c6a89a451dacd412af7c0648f5f789,nj.com,nj.com,Book review: ‘Housing the Nation’ is informative introduction to complicated topic,2024-03-26,https://www.nj.com/business/2024/03/book-review-housing-the-nation-is-informative-introduction-to-complicated-topic.html,en,2024-03-28 01:27:45.960145
6db250b679125e3dfddd136424a025a3a0c4f8f1c09ddd6b88939f603294251f,billboard.com,billboard.com,The 10 Best Moments of Ultra Music Festival 2024,2024-03-26,https://www.billboard.com/lists/ultra-music-festival-miami-2024-best-moments/,en,2024-03-28 13:46:07.150921
c558a0bb5a6af7259b160be20c596e1f0ea45662066c78485d59f1fb1fc5788b,cbsnews.com,cbsnews.com,"Garland firefighters' new life-saving device, quick actions save 5-month-old baby",2024-03-26,https://www.cbsnews.com/texas/video/garland-firefighters-new-life-saving-device-quick-actions-save-5-month-old-baby/,en,2024-03-29 01:05:23.617445
27c89d9fdcaf1fcc6162c5d8da2b92953c69b3edaa33e1e5d4a2f4448315c52c,abcnews.go.com,abcnews.go.com,Robert F. Kennedy Jr. chooses Nicole Shanahan as his running mate for his independent White House bid,2024-03-26,https://abcnews.go.com/Politics/wireStory/robert-kennedy-jr-chooses-nicole-shanahan-running-mate-108519929,en,2024-03-29 01:21:34.084288
1df83a05cd6401300792c8ff786f508319afa2f4fadf49e25f287af42b370588,baltimoresun.com,baltimoresun.com,Carnival cruise passengers to return to Norfolk instead of Baltimore after Key Bridge collapse,2024-03-26,https://www.baltimoresun.com/2024/03/26/carnival-cruise-passengers-rerouted-from-baltimore-to-norfolk/,en,2024-03-28 02:08:14.272742
ed4b76c5e4f160cedd3c24e9e5ba55e522cac81f0008eafc5b5bd37243029eb2,sportingnews.com,sportingnews.com,Kyrie Irving's improved play with and without Luka Doncic is what Mavericks need to reach championship potential,2024-03-26,https://www.sportingnews.com/us/nba/news/kyrie-irving-without-luka-doncic-mavericks-potential/82f2bcbf98e3a9c34b4bd3f9,en,2024-03-28 03:37:54.466345
a1286f42f94cee058c6916bc6bc4ad07f245ce2163761c618cf2fb32df91d895,newsday.com,newsday.com,"In the Kansas House, when lobbyists ask for new laws, their names go on the bills",2024-03-26,https://www.newsday.com/news/nation/open-government-transparency-Kansas-Legislature-p26805,en,2024-03-28 00:58:36.052426
b8b7972143d4b56c16cec0f8bf3b11df98fae9580f686c17a7bfca2775e6df1c,benzinga.com,benzinga.com,Peering Into PDD Holdings's Recent Short Interest,2024-03-26,https://www.benzinga.com/insights/short-sellers/24/03/37933172/peering-into-pdd-holdingss-recent-short-interest,en,2024-03-28 00:32:29.803802
e487c5c605c62e5581f111238bc6768703fdf2241e33489945129d9fca722d12,latimes.com,latimes.com,Where is the nation's lowest job growth? Look no further than rural California,2024-03-26,https://www.latimes.com/california/story/2024-03-26/where-is-the-nations-lowest-job-growth-look-no-further-than-california,en,2024-03-28 06:04:09.936416
6ddd6c201c7f6a0d1d06b1010bbdee6d12b6a86c9727918a89d559df36cfb654,startribune.com,startribune.com,Clark scores 32 as top seed Iowa holds on to beat West Virginia 64-54,2024-03-26,https://www.startribune.com/clark-scores-32-as-top-seed-iowa-holds-on-to-beat-west-virginia-64-54/600354018/,en,2024-03-28 03:20:04.403865
6cccd2402fe77d404792abb1a5c1e759fae2c440f72e5ad69baff14d55d0343e,billboard.com,billboard.com,Charli XCX Plots 2024 International 'BRAT' Tour Dates,2024-03-26,https://www.billboard.com/music/pop/charli-xcx-2024-international-brat-tour-dates-1235641253/,en,2024-03-28 13:45:55.303134
acfd61826231fbb263725a8cadbb839719560f6df6538d99d779367549a7d526,benzinga.com,benzinga.com,Deadline Reminder: Law Offices of Howard G. Smith Reminds Investors of Looming Deadline in the Class Action Lawsuit Against Innoviz Technologies Ltd. (INVZ),2024-03-26,https://www.benzinga.com/pressreleases/24/03/b37937908/deadline-reminder-law-offices-of-howard-g-smith-reminds-investors-of-looming-deadline-in-the-class,en,2024-03-29 00:33:17.343295
edcc4addfa0b74d6c4a0fe6ce718985f4c9a442ba605eb761ec874eff4459e48,buzzfeed.com,buzzfeed.com,「誰か駅のホームでSuica落としてるよ」→とんでもない光景に驚きの声「えらい真っ赤で…」これは二度見するわ！,2024-03-26,https://www.buzzfeed.com/jp/ayahoshino/suica-naze,ja,2024-03-28 06:00:41.659742
3407292cf1baf267b08e0ae2156dab611d7fccd634e53af49c15895f28836c01,seattletimes.com,seattletimes.com,Hurry up and wait: Trump’s classified documents case is mired in delays that may run past election,2024-03-26,https://www.seattletimes.com/nation-world/nation/hurry-up-and-wait-trumps-classified-documents-case-is-mired-in-delays-that-may-run-past-election/?utm_source=RSS&utm_medium=Referral&utm_campaign=RSS_all,en,2024-03-29 00:54:44.682377
4985170d999331f3e9e93ab6c94c08ccae3056edb669e1bee949ed7be5c41c51,latimes.com,latimes.com,Dodgers players surprised by Shohei Ohtani's composure: 'Betrayal is hard',2024-03-26,https://www.latimes.com/sports/dodgers/story/2024-03-26/dodgers-players-surprised-shohei-ohtani-composure,en,2024-03-28 06:04:08.451112
0c48d5fbd9a1d205e1f4f06ebffbc07b0723c421d37dd956ddd2d1e4ef696351,thedailybeast.com,thedailybeast.com,Ken Paxton Snags Deal to Avoid Securities Fraud Charges,2024-03-26,https://www.thedailybeast.com/ken-paxton-snags-deal-to-avoid-securities-fraud-charges,en,2024-03-28 08:00:14.837594
553ed84063818b213cb204c3babd8228ce0e63273f068f101afb7366b9e9e8de,seattletimes.com,seattletimes.com,"France will soon deliver 78 howitzers to Ukraine to meet Kyiv’s urgent needs, defense minister says",2024-03-26,https://www.seattletimes.com/nation-world/world/france-will-soon-deliver-78-howitzers-to-ukraine-to-meet-kyivs-urgent-needs-defense-minister-says/?utm_source=RSSutm_medium=Referralutm_campaign=RSS_all,en,2024-03-28 04:04:40.018413
dc2653a919bf9dabf94afb6a0764ab6dfcdf810410d843dbf7e2c62f21b74d2f,politicalwire.com,politicalwire.com,Judge Places Limited Gag Order on Trump,2024-03-26,https://politicalwire.com/2024/03/26/judge-places-limited-gag-order-on-trump/,en,2024-03-28 04:51:16.934096
53927d35c378747262909664fab10cbfadde4f84100684bf585692ad796aeee6,seattletimes.com,seattletimes.com,"‘Diarra from Detroit,’ created by Diarra Kilpatrick, offers a fresh take on the detective genre",2024-03-26,https://www.seattletimes.com/entertainment/diarra-from-detroit-created-by-diarra-kilpatrick-offers-a-fresh-take-on-the-detective-genre/?utm_source=RSSutm_medium=Referralutm_campaign=RSS_all,en,2024-03-28 04:04:36.065547
decd782dcbc07c0623ef5005145d30e636a03e2831ae8a0f792220750cb8469d,variety.com,variety.com,"Bruce LaBruce's Bold Film 'The Visitor' Acquired by Utopia Label Circle Collective for U.S., U.K. (EXCLUSIVE)",2024-03-26,https://variety.com/2024/film/global/bruce-labruce-the-visitor-utopia-circle-collective-us-uk-1235952251/,en,2024-03-28 03:37:37.624470
b87447cb3dcd81bab7b46a6002d01531b68d3b1c728d66f51038b74c5af81c3f,cbsnews.com,cbsnews.com,"Rhino, the 1-year-old Pit Bull, is looking for his forever home",2024-03-26,https://www.cbsnews.com/losangeles/video/rhino-the-1-year-old-pit-bull-is-looking-for-his-forever-home-pet-of-the-week/,en,2024-03-29 01:06:03.585535
2a76296e6ab913c67d772f49cc6b0869231580f471e11f73855cc6d19dcce840,cbssports.com,cbssports.com,"College football QB battles to watch in spring: Michigan, Ohio State, USC among intriguing competitions",2024-03-26,https://www.cbssports.com/college-football/news/college-football-qb-battles-to-watch-in-spring-michigan-ohio-state-usc-among-intriguing-competitions/,en,2024-03-28 01:05:44.381026
906620253d5936203d39a8295e6bef1077f6d39fbb99daf3f80326a425753543,bloomberg.com,bloomberg.com,"iPhone Shipments in China Fell 33% in February, State Data Show",2024-03-26,https://www.bloomberg.com/news/articles/2024-03-26/iphone-china-shipments-fell-about-33-in-feb-state-data-show?srnd=technology-vp,en,2024-03-29 07:49:59.457217
3a94da02248e7585647541fec430021a436bebf48419b864c13c9d5ba855f7fd,nbcnews.com,nbcnews.com,Argentinians push back against president's remarks on the Dirty War,2024-03-26,https://www.nbcnews.com/now/video/argentinians-push-back-against-president-s-remarks-on-the-dirty-war-207667269860,en,2024-03-28 01:05:51.993339
5f51bbfdde63d4ae8c17780e7108b356f16724f9beab95e1717dfd28daa84ae6,forbes.com,forbes.com,Public Employment Still Hasn’t Caught Up From The Great Recession,2024-03-26,https://www.forbes.com/sites/christianweller/2024/03/26/public-employment-still-hasnt-caught-up-from-the-great-recession-and-public-service-suffers-as-a-result/,en,2024-03-28 03:05:57.554198
2c819af43ba98a6dddfd8238457dff53d2f6ae79938318abc625c26bb8998ab3,nbcnews.com,nbcnews.com,The twisted wreckage in Baltimore stands as a memorial to people gathering to grieve,2024-03-26,https://www.nbcnews.com/news/us-news/twisted-wreckage-baltimore-stands-memorial-people-gather-grieve-rcna145129,en,2024-03-28 16:44:45.279495
2b718d780cbf5bd78ead46f51a88798a8c7b1e3feb1a13acfb6e50f1dae88bd5,cleveland.com,cleveland.com,"Bill Nighy, Michael Ward shine in Netflix’s Homeless World Cup crowd-pleaser",2024-03-26,https://www.cleveland.com/entertainment/2024/03/bill-nighy-michael-ward-shine-in-netflixs-homeless-world-cup-crowd-pleaser.html,en,2024-03-28 05:27:17.635993
caf4b01a9f495be3b42e423717c95fa660740190bb8165f0d0cf8d59b7458c2f,foxsports.com,foxsports.com,Jordan Montgomery reportedly agrees to one-year deal with Diamondbacks,2024-03-26,https://www.foxsports.com/stories/mlb/lhp-jordan-montgomery-reportedly-signs-one-year-deal-with-diamondbacks,en,2024-03-29 05:53:56.786762
bb6298b5e9eb949bdecb966273e03355bf15b1dec44aba293528200e3b3d69ea,forbes.com,forbes.com,Here’s Who’s Made The Most Defending Trump In Court,2024-03-26,https://www.forbes.com/sites/alisondurkee/2024/03/26/heres-whos-made-the-most-defending-trump-in-court/,en,2024-03-28 03:05:57.278067
878c0e22efb507dc91a5e14742c521e2556b336e008f20fe5e5f24b28b3b3180,thestreet.com,thestreet.com,Apple's WWDC 2024: Here’s everything you need to know,2024-03-26,https://www.thestreet.com/technology-1/apple-wwdc-2024-event-date-announced-ai-ios-18-june-10,en,2024-03-28 05:19:44.914808
53128cefea937cce2f9b1475b1587b2775c0858cf85778b4f22317c1b3108e82,fortune.com,fortune.com,DOJ accuses crypto exchange KuCoin of money laundering violations and receiving billions in suspicious funds,2024-03-26,https://fortune.com/crypto/2024/03/26/kucoin-criminal-crypto-binance-doj-cftc-justice-sdny/,en,2024-03-28 04:16:34.774808
a9d09534df48b3e0ded039e3e4c721ed0ecda2ba3eb8176f35deaff5f26c1ef4,eonline.com,eonline.com,Eva Mendes Reveals Why She Stepped Away From Acting,2024-03-26,https://www.eonline.com/videos/2323295811832/eva-mendes-reveals-why-she-stepped-away-from-acting,en,2024-03-29 12:58:08.395801
69c8a152fc30f71c003753453ca2e79ae50e4d77bf934109a196da827b2db003,pbs.org,pbs.org,WATCH: Maryland Gov. Wes Moore says mayday call helped limit traffic on collapsed Key Bridge,2024-03-26,https://www.pbs.org/newshour/nation/watch-maryland-gov-wes-moore-says-cargo-ship-mayday-call-helped-limit-traffic-on-collapsed-key-bridge,en,2024-03-28 05:23:41.385825
7d4d2f63e0f2de93c126f7dd65db7773328b5d293e93087a8e2b801e49bd40bf,benzinga.com,benzinga.com,Forecasting The Future: 8 Analyst Projections For Light Wonder - Light Wonder (NASDAQ:LNW),2024-03-26,https://www.benzinga.com/insights/analyst-ratings/24/03/37933181/forecasting-the-future-8-analyst-projections-for-light-wonder,en,2024-03-28 00:30:55.738384
1aa8f7405e10ac4c712b0b1dbfdcafec8d32a42ba86d7780d7195dded73c601c,nj.com,nj.com,"N.J. man, 76, charged with sexually assaulting child",2024-03-26,https://www.nj.com/bergen/2024/03/nj-man-76-charged-with-sexually-assaulting-child.html,en,2024-03-28 01:28:01.639365
9207223136ca9198c8feb39dd65c7055a2c4d1533157143f07fa2b0a675473fd,reuters.com,reuters.com,ボルティモア橋崩落、不明の6人死亡か 船舶立ち往生で供給懸念,2024-03-26,https://jp.reuters.com/world/us/76HTNM4QPVKOHPHNXADP2XFBH4-2024-03-26/,ja,2024-03-28 01:54:50.128101
