id,media_name,media_url,title,publish_date,url,language,indexed_date
052833458d0797bc582089037b1b2d18edf64e8afa582d45838fb35b7c5c903c,newsday.com,newsday.com,Good Samaritans help trooper struggling with attacker on Southern State,2024-04-23,https://www.newsday.com/long-island/crime/attack-southern-state-trooper-good-samaritan-ehfcyjqg,en,2024-04-24 17:32:36.770368
dec579b6a868e9c4dea21f5b31bca22d34ad5c7191926bbdd66132fe85cbfc33,nytimes.com,nytimes.com,Kamasi Washington Wants to Remain Unstoppable,2024-04-23,https://www.nytimes.com/2024/04/23/arts/music/kamasi-washington-fearless-movement.html,en,2024-04-24 16:41:36.645224
ff578d9766f8a9adcde8a2cf8d80fc715bdfb781a8698e6d8309d73b4766bfd6,nytimes.com,nytimes.com,You Can Sit There. Really.,2024-04-23,https://www.nytimes.com/2024/04/23/arts/design/denver-art-museum-mexican-chairs.html,en,2024-04-24 16:42:46.687275
e9ddd213e569ef5dec8e8c3ae62c4b5278976597048e1a8be908e1a0262573b9,abcnews.go.com,abcnews.go.com,A legal challenge over the UK's role in arms sales to Israel will go ahead,2024-04-23,https://abcnews.go.com/International/wireStory/legal-challenge-uks-role-arms-sales-israel-ahead-109536097,en,2024-04-24 03:37:59.974144
1598bdc737056f97f20f5b311ef40a851a86ad8011be7b69eea66c5d3f122d25,ocregister.com,ocregister.com,Shohei Ohtani hits ‘absurd’ 450-foot home run as Dodgers beat Nationals,2024-04-23,https://www.ocregister.com/2024/04/23/dodgers-offense-arrives-late-but-backs-bullpen-in-victory-over-nationals/,en,2024-04-24 18:23:25.491945
ecb3c7c418b4c6e05bfdcca66cf6eb97f9a7073a1b04f4b131c5a03bdfcc24ec,eonline.com,eonline.com,Kellie Pickler Returns to the Stage for First Time Since Husband Kyle Jacobs’ Death,2024-04-23,https://www.eonline.com/videos/2331123779984/kellie-pickler-returns-to-the-stage-for-first-time-since-husband-kyle-jacobs-death,en,2024-04-24 08:41:18.447533
73227471d704246ccc27a53aca24e92497c00ac42fd36177108375bee138bf3e,forbes.com,forbes.com,‘Death Becomes Her’ Cast And Creators On Turning The Film Into A Musical,2024-04-23,https://www.forbes.com/sites/jeffconway/2024/04/23/death-becomes-her-cast--creators-on-turning-the-film-into-a-musical/,en,2024-04-24 08:57:43.403721
028c46b8be6bb27edd18e1c810170fd08f70588c51514a8d1b0c3be607b77f3d,sportingnews.com,sportingnews.com,AFL Teams Round 7: Chopping Block,2024-04-23,https://www.sportingnews.com/au/afl/news/afl-teams-round-7-chopping-block-injury-news-suspensions/b9f37feea169af318e255819,en,2024-04-24 17:55:30.256379
72149e2274531b9112185c85c1a77146483294efaa110b065f652b6051270adc,sportingnews.com,sportingnews.com,"FanDuel promo code for NBA playoffs odds: Get $150 in bonus bets for Mavericks vs. Clippers, Pacers vs. Bucks, Suns vs. Timberwolves",2024-04-23,https://www.sportingnews.com/us/betting/news/fanduel-promo-code-nba-playoffs-odds-04-23-24/b6573a92a17beac84083154d,en,2024-04-24 13:52:58.737275
07952c825551c9b3b4ea4e436d4f807268466faad4f38918dbd543edff720ace,benzinga.com,benzinga.com,Premier luxury hotel The Global Ambassador partners with global guest technology provider SONIFI,2024-04-23,https://www.benzinga.com/pressreleases/24/04/n38379314/premier-luxury-hotel-the-global-ambassador-partners-with-global-guest-technology-provider-sonifi,en,2024-04-24 06:22:23.887787
9ee3539b441bde08aa75a92c2cfad6e9d4a0094b8e21f1af9fd3c243b87bfa07,sun-sentinel.com,sun-sentinel.com,Fourth arrest made in Homestead woman’s fatal carjacking investigation,2024-04-23,https://www.sun-sentinel.com/2024/04/23/fourth-arrest-made-in-homestead-womans-fatal-carjacking-investigation/,en,2024-04-24 05:46:31.673967
216ec56f94854e2ee3b5a077e64a46960e99d8dbb218cebe964d2378a5ad4426,techradar.com,techradar.com,Microsoft unveils mini-model AI for small businesses,2024-04-23,https://www.techradar.com/pro/microsoft-unveils-mini-model-ai-for-small-businesses,en,2024-04-24 01:33:38.999693
4062d1ae396b4288f1f7d667de677162bfc83f18192776d9f2b4511b803b30b6,businessinsider.com,businessinsider.com,"I tried 6 protein bars to find the best-tasting options at the grocery store, and there are only 2 I'd buy again",2024-04-23,https://www.businessinsider.com/what-is-best-protein-bar-at-grocery-store-review-taste-2024,en,2024-04-24 03:45:18.855726
52f4467ed736ca97c3787105c1cf11df26106efae7bc02200a39ad4da9e8986b,fortune.com,fortune.com,Beijing says U.S. criticism of Chinese overcapacity is ‘naked economic coercion and bullying’,2024-04-23,https://fortune.com/asia/2024/04/23/beijing-us-criticism-china-overcapacity-naked-economic-coercion-bullying-secretary-state-blinken/,en,2024-04-24 13:09:45.636071
e2564ef03dc4964d6ea1bd393ec36d053abb4f003b55738c365d68b4c7498649,ibtimes.com,ibtimes.com,Binance Executive Who Fled Nigerian Custody Has Been Arrested: Report,2024-04-23,https://www.ibtimes.com/binance-executive-who-fled-nigerian-custody-has-been-arrested-report-3730336,en,2024-04-24 12:57:53.617304
1c8050ca067e2e384eba7f1c604b4a08132cf9e642720eed432dd5ae290bdb6c,ign.com,ign.com,"Stellar Blade si mostra in un nuovo video dietro le quinte, a ridosso dell'uscita su PS5",2024-04-23,https://it.ign.com/stellar-blade/210187/news/stellar-blade-si-mostra-in-un-nuovo-video-dietro-le-quinte-a-ridosso-delluscita-su-ps5,it,2024-04-24 18:20:57.439345
ec51c6787c9ba2d49097b2566dd1ca2642103d2cf941385561ce3cf7ec7cd8e9,forbes.com,forbes.com,Tesla Reveals Model 3 Performance And ‘Cybercab’ Amidst Earnings Slump,2024-04-23,https://www.forbes.com/sites/sashalekach/2024/04/23/tesla-reveals-model-3-performance-cybercab-amidst-earnings-slump/,en,2024-04-24 18:02:13.518049
0696bacdadcd6457b80c6b61b0dd13fdab4669151101fdaca7c0da1e1bec8e9b,usatoday.com,usatoday.com,Photo of Stormy Daniels in mushroom dress is altered,2024-04-23,https://www.usatoday.com/story/news/factcheck/2024/04/23/stormy-daniels-mushroom-dress-altered/73427074007/,en,2024-04-25 02:00:03.268224
6abbe7dc2e5a75ad176a90da6698bd097339f60d729a554a5ecfd668f66d1b00,newsweek.com,newsweek.com,Video: Ukrainian drone destroys T-72 tank and other Russian equipment,2024-04-23,https://www.newsweek.com/video-ukraine-drone-destroys-t72-tank-russia-1893464,en,2024-04-24 02:29:02.127040
97273cde15acf81075cb9fde2e0aca87341137e281bb419037be1cdd51b2fa14,livescience.com,livescience.com,"Fake Botox injections have sickened 22, hospitalized 11, CDC warns",2024-04-23,https://www.livescience.com/health/medicine-drugs/fake-botox-injections-have-sickened-22-hospitalized-11-cdc-warns,en,2024-04-24 18:53:10.577406
dfb7695584ea8ef7549bb45a792da61bdb46ca3d954bfc81228024df2da906bf,chicagotribune.com,chicagotribune.com,Starbucks takes on the federal labor agency before the U.S. Supreme Court,2024-04-23,https://www.chicagotribune.com/2024/04/23/starbucks-federal-labor-agency-supreme-court/,en,2024-04-24 07:53:47.108169
e44ef4a87bbd13cabe61bfc15df5bea9a22b3b0053fd6dd76b56393dfe557ae1,buzzfeed.com,buzzfeed.com,"Kim Kardashian Addressed Rumors About Herself, Jimmy Kimmel",2024-04-23,https://www.buzzfeed.com/morganmurrell/kim-kardashian-addresses-rumors,en,2024-04-24 07:08:23.580779
c0a039c5ffdd20a9f8a2cae0685bb22c993b0d2a98c46e1005c9ec3b39c7704d,theguardian.com,theguardian.com,Designer Nancy Gonzalez sentenced to prison for smuggling crocodile and python handbags,2024-04-23,https://www.theguardian.com/fashion/2024/apr/23/designer-nancy-gonzalez-sentenced-to-prison-for-smuggling-crocodile-and-python-handbags,en,2024-04-24 13:01:05.905404
2ef9222c5360589912d00f93b381240aa173a83a6099eb612c5eb98d8f0c3003,theconversation.com,theconversation.com,"Can a drug like Ozempic help treat addictions to alcohol, opioids or other substances?",2024-04-23,https://theconversation.com/can-a-drug-like-ozempic-help-treat-addictions-to-alcohol-opioids-or-other-substances-224959,en,2024-04-24 13:51:37.164137
57b3b67ac57b3b77d5f0ccd6f09f02cd0af656ccc5743c2c49ed3ecb2da479a9,ibtimes.com,ibtimes.com,New US Home Sales Pick Up In March,2024-04-23,https://www.ibtimes.com/new-us-home-sales-pick-march-3730387,en,2024-04-24 12:05:52.792466
ff9b58aac1c70ab87d13657dc6209c39ea945aae273bd29f761e8a0fe6f833ac,npr.org,npr.org,How voters from different economic sectors see the 2024 election,2024-04-23,https://www.npr.org/2024/04/23/1198911313/american-indicators-voters-2024-election-perspective-biden-trump-values,en,2024-04-24 12:54:51.378810
52520e510736d8225d12f3a591f2e8e08068b16dc5167042692fa059ab2d93f6,uproxx.com,uproxx.com,Rihanna’s Iconic Instagram Profile Picture Is Gone After A Decade And Fans Are Mourning The Tragic Loss,2024-04-23,https://uproxx.com/music/rihanna-instagram-profile-picture-change-reactions/,en,2024-04-24 13:57:48.314800
b71728aaa8ec72d0dce842c64cd16ecdc9e39b1c6b9d5777a5ec2d7c8cc7ed30,usmagazine.com,usmagazine.com,Kate Hudson Recalls Glee Being a ‘Very Dramatic Set’,2024-04-23,https://www.usmagazine.com/entertainment/news/kate-hudson-recalls-glee-being-a-very-dramatic-set/,en,2024-04-24 13:36:28.459245
ec6cf03a4cb9be565502012a47a8c42569b6bb9e9ed898614005a1d8e9b2d63c,dailykos.com,dailykos.com,GOP lawmakers vote to arm teachers a year after Nashville shooting,2024-04-23,https://www.dailykos.com/stories/2024/4/23/2235768/-A-year-after-Nashville-school-shooting-GOP-lawmakers-only-solution-is-to-pass-bill-to-arm-teachers?pm_campaign=blog&pm_medium=rss&pm_source=,en,2024-04-25 00:06:44.378221
642d706e59b6caa1181923e2a29d7a0fb7edaf4c1696742f3e12d63e79e469b1,ocregister.com,ocregister.com,What can a judge do if someone is really disruptive in court? Ask the lawyer,2024-04-23,https://www.ocregister.com/2024/04/23/what-can-a-judge-do-if-someone-is-really-disruptive-in-court-ask-the-lawyer/,en,2024-04-24 11:16:03.867429
b4a74609f74f75aa13494583b0a22b7eb0cbcbbc840be9327eea400bb94aba44,cbsnews.com,cbsnews.com,"Popular coffee shop ""Foxtrot"" abruptly shuts down permanently",2024-04-23,https://www.cbsnews.com/texas/video/popular-coffee-shop-foxtrot-abruptly-shuts-down-permanently/,en,2024-04-24 14:48:56.719301
c8a3fa6c3c2e9c155f706a21d110a4865d7cd18d305a9e25e9c323aa14fb9394,cbsnews.com,cbsnews.com,"Most voters don't know Biden's climate change policies, poll says",2024-04-23,https://www.cbsnews.com/video/most-voters-dont-know-bidens-climate-change-policies-poll-says/,en,2024-04-24 06:10:24.564460
6d065dc78e1cabae61b443cd8d76634bfe23d10b537563a795b7b58245c36d57,ibtimes.com,ibtimes.com,How UK's Biggest Water Supplier Sank Into Crisis,2024-04-23,https://www.ibtimes.com/how-uks-biggest-water-supplier-sank-crisis-3730381,en,2024-04-24 12:57:28.461033
250e92b47faf3c6dd24768222b66f9ef65780641f07d808553683b46c0692fbf,cbsnews.com,cbsnews.com,UC Berkeley to celebrate newly hatched peregrine falcon chicks with Hatch Day festivities,2024-04-23,https://www.cbsnews.com/sanfrancisco/news/uc-berkeley-to-celebrate-newly-hatched-peregrine-falcon-chicks-with-hatch-day-festivities/,en,2024-04-24 18:28:28.141253
8ffac973149bdb8caf39dbaec2baf096da71d489c5d002886822d0152537215b,reuters.com,reuters.com,米、ウクライナに10億ドルの追加支援 緊急予算案成立後＝当局者,2024-04-23,https://jp.reuters.com/world/ukraine/DJ2BJPVBNBJGXFQL5TVPI3OULM-2024-04-23/,ja,2024-04-24 11:41:26.134876
a6db074eb63f4ab55fffa2599d3b31cf546b3bbeea9005fee62ef9b4a106b09e,dailycaller.com,dailycaller.com,CHARLIE KIRK & REBECCA WEBER: Boomers And Gen Z Must Work Together To Save America,2024-04-23,https://dailycaller.com/2024/04/23/charlie-kirk-rebecca-weber-boomer-gen-z-work-together-save-america/,en,2024-04-24 08:09:07.286962
2ea95f93423602a24cec40dca929663c97fbdb5bb4536c2371124d1bc284d2c4,observer.com,observer.com,‘Challengers’ Review: Zendaya Serves Up a Psychosexual Tennis Flick,2024-04-23,https://observer.com/2024/04/challengers-review-zendaya-serves-up-a-psychosexual-tennis-flick/,en,2024-04-24 02:56:58.362356
41258b9d2364a93fb444e05641f61b53cf55893d0de5654459b22913de74dc45,fortune.com,fortune.com,Céline Dion says she may never tour again amid battle with stiff person syndrome. Here’s what to know,2024-04-23,https://fortune.com/well/2024/04/23/celine-dion-stiff-person-syndrome-symptoms/,en,2024-04-24 12:53:25.263727
7757dd8f9ca8ec45e9db1ebcd5902955bd9a949a76b748438ad80dedc7cfc950,foxnews.com,foxnews.com,Teen may have set Ohio fishing record for 101-pound blue catfish: 'Bigger than we ever imagined',2024-04-23,https://www.foxnews.com/lifestyle/teen-may-have-set-ohio-fishing-record-for-101-pound-blue-catfish-bigger-than-we-ever-imagined,en,2024-04-24 21:21:34.376296
4f0f78ca4a0ea27981bf95d99c369af2724682e28424f3d65b832842e8cbf1fe,dailysignal.com,dailysignal.com,"Judge Is Imposing Double Standard on Trump, Legal Experts Say",2024-04-23,https://www.dailysignal.com/2024/04/23/judge-is-imposing-double-standard-by-gagging-trump-but-giving-michael-cohen-free-rein-legal-experts-say/,en,2024-04-24 19:04:00.807419
34cef67a58eb013f9949eb55e1905cde745f094e42f3ab924ec860854312169b,dailykos.com,dailykos.com,Senate Republicans finally forced to do the right thing on Ukraine aid,2024-04-23,https://www.dailykos.com/stories/2024/4/23/2236818/-Senate-Republicans-finally-forced-to-do-the-right-thing-on-Ukraine-aid?pm_campaign=blog&pm_medium=rss&pm_source=main,en,2024-04-24 06:44:45.551878
8f2c4e3044f9b54db08556cd7a474f44615eaf50ead8dd5fe68de55f7cf9cc40,nbcnews.com,nbcnews.com,N.Y. teens take advantage of a day off from school to watch Trump's hush money trial up close,2024-04-23,https://www.nbcnews.com/politics/donald-trump/new-york-teens-take-advantage-day-school-watch-trumps-hush-money-trial-rcna148978,en,2024-04-24 08:12:39.213563
21ba0d5ff4a0263af835c6c47cc26ff234ac9fffc45bfcf4b3af47ef8010d7ac,foxsports.com,foxsports.com,UFL 2024: Every touchdown from Week 4,2024-04-23,https://www.foxsports.com/stories/ufl/ufl-2024-every-touchdown-from-week-4,en,2024-04-24 12:20:49.853775
098dd64adec34a0d276661f8f7d50ffa2ec9c9fa81bce70d705e2c753123bf20,cbssports.com,cbssports.com,"2024 NHL Playoffs bracket: Stanley Cup Playoffs schedule, standings, games, TV channels, times",2024-04-23,https://www.cbssports.com/nhl/news/2024-nhl-playoffs-bracket-stanley-cup-playoffs-schedule-games-standings-tv-channels-times/,en,2024-04-23 14:45:37.429667
b78c506216a9d515e46055a2df353f52af282aba675eea17704fe8dbb36cf885,startribune.com,startribune.com,"Alligator on runway at MacDill Air Force Base in Florida captured, released into nearby river",2024-04-23,https://www.startribune.com/alligator-on-runway-at-macdill-air-force-base-in-florida-captured-released-into-nearby-river/600361085/,en,2024-04-24 06:44:49.916136
2e69abdc06f04a3cc725bff4c9bc923e2f327f73271859f7283f489c3744dfc5,buzzfeed.com,buzzfeed.com,32 Best Reality Shows That Bring The Drama,2024-04-23,https://www.buzzfeed.com/kelsiehammond1/best-reality-shows,en,2024-04-24 05:18:24.136925
7cfa987c3cb4f1e41b30977eb215eab4f0185921aab5a8ea545afe69069bc8b4,nytimes.com,nytimes.com,Clashes Over Gag Order and Tabloid Testimony in the Trump Criminal Trial,2024-04-23,https://www.nytimes.com/video/nyregion/100000009430318/trump-criminal-trial-gag-order-tabloid-testimony.html,en,2024-04-24 18:02:12.632489
42733e6bd8d07951d16f39bf150a915cb335844abba0a3d2cfa19f86c1df2af9,benzinga.com,benzinga.com,"Who's Winning In Weed? Analyst Looks At Cannabis Market's Big Players, Where Are The Best Bets?",2024-04-23,https://www.benzinga.com/analyst-ratings/analyst-color/24/04/38386324/whos-winning-in-weed-analyst-looks-at-cannabis-markets-big-players-where-are-the-be,en,2024-04-24 07:52:40.234724
1629bba6949479a1343161780c19de0075cb04ef719daa619388a285e720f3ef,billboard.com,billboard.com,"A Decade After Hozier's Breakthrough, How Did 'Too Sweet' Become His First Hot 100 No. 1?",2024-04-23,https://www.billboard.com/music/chart-beat/hozier-too-sweet-number-one-five-burning-questions-1235664276/,en,2024-04-24 11:07:32.687449
235c3e3e4c8ae0dac1878db7a52a04d304a975d00017d71b2c3f0e4c8f556b30,abcnews.go.com,abcnews.go.com,Dean Phillips gains his first delegates. Here’s why they’ll likely vote for Biden at the convention,2024-04-23,https://abcnews.go.com/Politics/wireStory/dean-phillips-gains-delegates-heres-theyll-vote-biden-109549169,en,2024-04-24 17:56:23.220228
dce4ff641d3341eaf233d817367ea9e7e819c369c82493f2923f76ae425ae3c4,cbsnews.com,cbsnews.com,Oberweis Dairy finds potential buyer,2024-04-23,https://www.cbsnews.com/chicago/video/oberweis-dairy-finds-potential-buyer/,en,2024-04-24 19:10:02.665014
08c195a8f1b3ef2cf182d9cd5af15cea366970e61d3fc0075908128c04fd6fc2,nj.com,nj.com,"Senate passes bill forcing TikTok’s parent company to sell or face ban, sends to Biden for signature",2024-04-23,https://www.nj.com/news/2024/04/senate-passes-bill-forcing-tiktoks-parent-company-to-sell-or-face-ban-sends-to-biden-for-signature.html,en,2024-04-24 18:28:53.089380
39a2b02692ad0e4045ccc43c8c5ab03a707a50ed49d8ea4bc404f091f08b20bc,newsbusters.org,newsbusters.org,"New German Law Says Parents Can Change Child's Gender, Fines for ‘Deadnaming’",2024-04-23,https://www.newsbusters.org/blogs/culture/tierin-rose-mandelburg/2024/04/23/new-german-law-says-parents-can-change-childs,en,2024-04-24 07:58:40.516113
a617070778a53ba91e1303d1c7ac0015c8fad37dc2e0e3bad935ac795a00fc39,businessinsider.com,businessinsider.com,"I was happy in the UK and dead against moving to New York. When my partner was made redundant, it felt like our only option.",2024-04-23,https://www.businessinsider.com/london-vs-new-york-city-differences-parenting-british-mom-culture-2024-4,en,2024-04-24 04:14:07.750298
9caa966938c94dab63adccbecbd7b0dac5bd70e4ca70c1a80a39c3c3b044c85b,politicalwire.com,politicalwire.com,Judge Torches Team Trump’s Gag Order Defense,2024-04-23,https://politicalwire.com/2024/04/23/judge-torches-team-trumps-gag-order-defense/,en,2024-04-24 09:53:37.094313
4bf1fdb7ef9adfc010b96bd6d38e3ea32bd6e4aeb72e2c4b1b8cd108329feda3,forbes.com,forbes.com,Why Expectation Drives Customer Satisfaction,2024-04-23,https://www.forbes.com/sites/forbesagencycouncil/2024/04/23/why-expectation-drives-customer-satisfaction/,en,2024-04-24 09:23:59.542373
bb64715a99c8419d6c5270337feae47e6a72b7324550a37ccdfa7b34cbaeecf0,businessinsider.com,businessinsider.com,New Marine One helicopters the US spent $5 billion on aren't allowed to carry the president because they could scorch the lawn,2024-04-23,https://www.businessinsider.com/new-marine-one-helicopters-cant-carry-president-biden-report-2024-4,en,2024-04-24 07:08:43.511772
9fa470e10a5a58361a601b210eb5b8c4825b93de58ba7902e1d79b9f3f176873,forbes.com,forbes.com,Rising WNBA Stars Illuminate Inequities And Spark New Calls For Change,2024-04-23,https://www.forbes.com/sites/lindseyedarvin/2024/04/23/rising-wnba-stars-illuminate-inequities-and-spark-new-calls-for-change/,en,2024-04-24 08:09:04.355452
ef3cded353988480cd04b793d03e69b76da020d2f49164f4568dcab1b5c2a561,forbes.com,forbes.com,Why Cornell’s New SAT Policy Is More Complex Than Other Ivies,2024-04-23,https://www.forbes.com/sites/marlenacorcoran/2024/04/23/5th-ivy-league-university-cornell-moves-toward-favoring-sat/,en,2024-04-24 08:57:02.461435
c3df96260e7c1e448e261d84d51fe3444b616ebd4348957db2f0469c708a319b,cbsnews.com,cbsnews.com,Judge holds off on ruling if Donald Trump violated gag order,2024-04-23,https://www.cbsnews.com/newyork/video/judge-holds-off-on-ruling-if-donald-trump-violated-gag-order/,en,2024-04-24 13:40:21.884500
d906722ad3de8c9ef7ce7950b8b03012a5355cc9d7b038736ef737a241eb697e,theguardian.com,theguardian.com,"Sampha, Yussef Dayes and Daniel Pemberton top Ivor Novello award nominations",2024-04-23,https://www.theguardian.com/music/2024/apr/23/sampha-yussef-dayes-daniel-pemberton-top-ivor-novello-award-nominations,en,2024-04-24 12:27:29.224924
0d8edb1760cdaf8fc4db133d5d1aa76741c8150a776576195ec0b0eaff5250d9,uproxx.com,uproxx.com,Jamal Murray Tore The Lakers Hearts Out With A Game-Winning Buzzer-Beater In Game 2,2024-04-23,https://uproxx.com/dimemag/jamal-murray-game-winning-buzzer-beater-lakers-nuggets-highlight-video/,en,2024-04-24 13:33:54.265483
503e29cd54ceb786cfd8a160392e0656c7c5aee8c6fed0627d3049723e03f688,startribune.com,startribune.com,Garland speaks with victims' families as new exhibit highlights the faces of gun violence,2024-04-23,https://www.startribune.com/garland-speaks-with-victims-families-as-new-exhibit-highlights-the-faces-of-gun-violence/600361131/,en,2024-04-24 17:51:32.374660
9b373754680643f353f30d6f6bc33ca2f6f9f3d32540b24d9047ef776d1ffae4,foxsports.com,foxsports.com,Nikola Jokić's brother reportedly involved in altercation after Nuggets' win,2024-04-23,https://www.foxsports.com/stories/nba/nikola-jokics-brother-reportedly-involved-in-altercation-after-nuggets-win,en,2024-04-24 12:18:40.848157
d5119befb1c115fde9eeed1fa547dce8b7df4e52d6eebd6bd4e5eebd21f60f54,nj.com,nj.com,North Hunterdon girls lacrosse beats rival Voorhees for 1st time since 2018,2024-04-23,https://www.nj.com/highschoolsports/2024/04/north-hunterdon-girls-lacrosse-beats-rival-voorhees-for-1st-time-since-2018.html,en,2024-04-24 19:00:41.126683
75bd564ef7ef332b7e6649ecd132d1e9b12eb800f6929327fc474edcbe2fffb8,ibtimes.com,ibtimes.com,Top Price Predicted For Long-lost Klimt Portrait At Vienna Auction,2024-04-23,https://www.ibtimes.com/top-price-predicted-long-lost-klimt-portrait-vienna-auction-3730436,en,2024-04-24 18:24:24.340382
749d78fbb3cf90fcd2c0864d957f5a828a113a728c5a6b7ab3f084839956a440,uproxx.com,uproxx.com,The Knicks Went On An 8-0 Run In The Final 27 Seconds To Stun The Sixers And Win Game 2,2024-04-23,https://uproxx.com/dimemag/knicks-beat-sixers-game-2-2024-nba-playoffs-highlights-videos/,en,2024-04-24 13:34:19.289577
10115c1a8f9e2e2cdac56584b2c45c8409b656f25a8116ce0b2038330fd01752,theguardian.com,theguardian.com,‘Games are more important to Apple than ever’: what’s next for Apple Arcade?,2024-04-23,https://www.theguardian.com/games/2024/apr/23/apple-arcade-future-alex-rofman-interview,en,2024-04-24 07:37:57.076571
5d21fab1c54bc264f786f4044003cb0902829f098ec6f86e54c8b7c1393a4652,nypost.com,nypost.com,Broncos have NFL Draft interest in Bo Nix after Zach Wilson trade,2024-04-23,https://nypost.com/2024/04/23/sports/broncos-have-nfl-draft-interest-in-bo-nix-after-zach-wilson-trade/,en,2024-04-24 19:03:40.278730
38c6cd3a3e87be3e8b26d47ccb4dd99037b8d68451b92022c8e116a1bf9e810a,newsweek.com,newsweek.com,"""Total shock"" as mom finds what 5-year-old did when left alone for minutes",2024-04-23,https://www.newsweek.com/mom-left-shock-when-she-finds-child-bathroom-1893152,en,2024-04-24 01:52:05.361508
4aeee845504a90d8f684aa4c66222a6974df57f5158d39f7d29facdfb18acf2f,arkansasonline.com,arkansasonline.com,"Arkansas strawberries: Where to find them, how to care for them and 4 recipes to enjoy them",2024-04-23,https://www.arkansasonline.com/news/2024/apr/23/arkansas-strawberries-where-to-find-them-how-to/,en,2024-04-24 15:15:53.457156
6fc131e9afe7be4eb5e42d8b4839777a0e47ac0a11509ae57cc06671379a4a03,espn.com,espn.com,Justice Dept. to pay $138.7M to Nassar victims,2024-04-23,https://www.espn.com/olympics/story/_/id/40008233/larry-nassar-victims-receive-1387m-fbi-handling-case,en,2024-04-24 14:12:23.955522
8db1415d646923bd5387b80fe288d294ca404b863599026cabc7a3e23187b183,benzinga.com,benzinga.com,Spotlight on NRG Energy: Analyzing the Surge in Options Activity,2024-04-23,https://www.benzinga.com/insights/options/24/04/38391194/spotlight-on-nrg-energy-analyzing-the-surge-in-options-activity,en,2024-04-24 18:49:35.569825
806e07640fc8cbf09c711dc76af9d008fca9c6425001fc349536ea8df6696df6,rawstory.com,rawstory.com,FTC chief says tech advancements risk health care price fixing,2024-04-23,https://www.rawstory.com/ftc-health-care/,en,2024-04-24 21:53:27.675956
0f03a6c2ca4fc46ae047402185160747ce18acc1eb11ea10bcb030b9c0c05fc5,reuters.com,reuters.com,アルゼンチン第1四半期は財政黒字に転換、ショック療法機能と大統領,2024-04-23,https://jp.reuters.com/markets/japan/funds/Q7WRSMPQJBPVTMIUYWB7HN7NMY-2024-04-23/,ja,2024-04-24 10:06:45.044054
5c1147117d7d7d3010dd1dba78d076c794fd07220749c22a485c434484ebd8b7,benzinga.com,benzinga.com,"Sulphur Pastilles Market worth $1327 million by 2028 Globally, at a CAGR of 6.3%, says MarketsandMarkets™",2024-04-23,https://www.benzinga.com/pressreleases/24/04/g38394039/sulphur-pastilles-market-worth-1327-million-by-2028-globally-at-a-cagr-of-6-3-says-marketsandmarke,en,2024-04-24 18:06:49.544059
2d2db2fd54558fccf441af77866197be598f4844deba6ab13b35c0c7e5f79186,eonline.com,eonline.com,"Why Anne Hathaway Says Kissing Actors in Chemistry Tests Was So ""Gross""",2024-04-23,https://www.eonline.com/news/1399954/why-anne-hathaway-says-kissing-actors-in-chemistry-tests-was-so-gross?cmpid=rss-syndicate-genericrss-us-top_stories,en,2024-04-24 08:24:33.106876
75a5de3b1f2e411c44481a253fb712268c8f709cfbfd086f6b4258d23a3048bd,denverpost.com,denverpost.com,"Jamal Murray’s greatest shot: Before buzzer beater to stun Lakers, Murray needed encouragement from Nuggets",2024-04-23,https://www.denverpost.com/2024/04/23/lakers-nuggets-game-2-jamal-murray-shot-buzzer-beater/,en,2024-04-24 05:34:50.891486
2d61f7ea84f56fa77ba3e6c8f151c393303852141e4260a93c4e97cce6b5b7cf,cnet.com,cnet.com,"Best CD Rates Today -- Don't Wait to Snag APYs Up to 5.35%, April 23, 2024",2024-04-23,https://www.cnet.com/personal-finance/banking/cd-rates-today-april-23-2024/#ftag=CADf328eec,en,2024-04-24 13:39:35.687980
f09e2a7ee4464e833b9044e8a51c3b784da699e6b7119f0c06633b5dffb7218b,mlive.com,mlive.com,Zeke Berry seizing his opportunity in Michigan secondary,2024-04-23,https://www.mlive.com/wolverines/2024/04/zeke-berry-seizing-his-opportunity-in-michigan-secondary.html,en,2024-04-24 15:11:42.961114
d2aae0fc5684dfb3c229665c24402026025caebdf5111325ba8116ff83c67b69,rttnews.com,rttnews.com,Eurozone Private Sector Growth Strongest In Almost A Year,2024-04-23,https://www.rttnews.com/story.aspx?Id=3440799,en,2024-04-24 11:48:26.829658
75e72b3e7bd1932bbe1c3f72227110ca1a1d3098a9e96e9cdf114c2ad6eedf8f,uproxx.com,uproxx.com,All The Best New R&B Music From This Week,2024-04-23,https://uproxx.com/music/all-the-best-new-rb-music-from-this-week-lucky-daye-jorja-smith-vedo/,en,2024-04-24 17:57:04.652914
