id,media_name,media_url,title,publish_date,url,language,indexed_date
fa8b8b9eaa574d609be01bdcd90bc491f1f96b3c7d042fb77ba16929bb470822,seattletimes.com,seattletimes.com,Denver Broncos introduce new uniforms for first time since 1997,2024-04-23,https://www.seattletimes.com/nation-world/denver-broncos-introduce-new-uniforms-for-first-time-since-1997/?utm_source=RSSutm_medium=Referralutm_campaign=RSS_all,en,2024-04-24 12:41:30.076165
d101c8d576580c5ac18a7e2fbb733dae404db82919d7c8947e8dc9f0795dec56,newsday.com,newsday.com,Biden administration finalizes rule to grant overtime for millions more salaried workers,2024-04-23,https://www.newsday.com/business/overtime-eligibility-salaried-workers-biden-q78189,en,2024-04-25 05:18:15.869539
e57b434345d8fad5a6586048181b0a6f90b8718749deff07a6ca9f24cee7feee,inquisitr.com,inquisitr.com,When 'Teen Mom' Jenelle Evans’ Children Felt 'Embarrassed' About Their Mom Having an OnlyFans Account,2024-04-23,https://www.inquisitr.com/teen-mom-jenelle-evans-children-feel-embarassed-about-their-mom-having-a-only-fans-account-656458,en,2024-04-24 04:39:45.521687
6bed7c94887b3192adc101c8f42d80d6be5b652f912e331343392a616c707a2d,rawstory.com,rawstory.com,Explosive evidence revealed tying Trump to election conspiracy in hush money case,2024-04-23,https://www.rawstory.com/trump-hush-money-trial-2667859202/,en,2024-04-24 10:22:20.826311
d955e936c2053575714a9d23d290352afb563028d1e0aecd2288bf614656809d,abcnews.go.com,abcnews.go.com,"Webb Simpson offers to resign from PGA Tour board. But only if McIlroy replaces him, AP source says",2024-04-23,https://abcnews.go.com/Sports/wireStory/webb-simpson-offers-resign-pga-tour-board-mcilroy-109545374,en,2024-04-24 05:53:51.151045
6ae4d0d414a77e911c039b05b6e52cd2be5225cdb7140946de36049e8242e8e1,rttnews.com,rttnews.com,South Africa Leading Index Rises In February,2024-04-23,https://www.rttnews.com/story.aspx?Id=3440833,en,2024-04-24 11:48:21.402380
40925fd2fe06a43bfd9a08321fe623838a7e0df12db6b8344dc76f2db393598c,salon.com,salon.com,Costco's expanding California footprint,2024-04-23,https://www.salon.com/2024/04/23/californias-newest-costco-will-be-one-of-the-biggest-in-the-world/,en,2024-04-24 01:31:39.893583
bbac127f5ca2b7c80e9b6020785cf321d1a9b04693276a4683c7ac82b0a87d43,eonline.com,eonline.com,Victoria Beckham’s New Collaboration with Mango Is as Posh as It Gets - Here Are the Best Pieces,2024-04-23,https://www.eonline.com/news/1399904/victoria-beckhams-new-collaboration-with-mango-is-as-posh-as-it-gets-here-are-the-best-pieces?cmpid=rss-syndicate-genericrss-us-top_stories,en,2024-04-24 01:06:12.894452
ca53fcc577680b14a12b50ecb19ad5d789042a2f89343a1bca5d0599c8f17567,zdnet.com,zdnet.com,どのレベルでもユーザーが求めるサービスを提供できる--オラクルのキャッツCEOが基調講演,2024-04-23,https://japan.zdnet.com/article/35218063/,ja,2024-04-24 04:09:05.162763
3167dea302242392b7c9dbfa33366c6f57cd5845118e61cb27da2b5a51ab3441,cbsnews.com,cbsnews.com,Kennywood knew Steel Curtain would be closed before asking people to buy season passes: lawsuit,2024-04-23,https://www.cbsnews.com/pittsburgh/news/kennywood-class-action-lawsuit-steel-curtain-roller-coaster-season-pass-sales/,en,2024-04-24 10:16:47.988746
3447bb260cff45ce6e681e03b869c893ed6c2758bd6c56746ab94a606bc786c0,newsweek.com,newsweek.com,Why Credit Is Key to Financial Health for Many This Year,2024-04-23,https://www.newsweek.com/why-credit-key-financial-health-many-this-year-opinion-1892328,en,2024-04-24 02:26:14.959226
4bc67b8aaea6ceef6223c1836b79e0af7525a4c2e4c3e307c98cd26b2081dc9b,cnn.com,cnn.com,"CNN’s John Berman and Sara Sidner Serve Up Coverage of the 2024 White House Correspondents Dinner on CNN, CNN International & Max – Bringing Viewers to Washington’s Premiere Gala on Saturday, April 27",2024-04-23,https://cnnpressroom.blogs.cnn.com/2024/04/23/cnns-john-berman-and-sara-sidner-serve-up-coverage-of-the-2024-white-house-correspondents-dinner-on-cnn-cnn-international-max-bringing-viewers-to-washingtons-premie/,en,2024-04-24 02:25:06.738939
25ca19fb82949c1e052c77e8a323f40009e9a11d15d7b534ca0c686140f0fc5d,npr.org,npr.org,Talks for a plastic pollution treaty are stalling. Could the U.S. be doing more?,2024-04-23,https://www.npr.org/2024/04/23/1246293403/plastic-pollution-un-treaty-negotiations-waste-fossil-fuels-climate-change,en,2024-04-24 06:15:00.948979
4d63f9ab8914cfba509a7f7731734901598fccf3829ff78a6f5f1dcacdcc839e,rttnews.com,rttnews.com,"Pre-market Movers: ABEO, HWH, IBRX, HIBB, AGBA…",2024-04-23,https://www.rttnews.com/story.aspx?Id=3440814,en,2024-04-24 11:48:22.890194
c56f421233dbcdd483edd32f31380f4468a244b8a15306dadd7473c358e81313,cbsnews.com,cbsnews.com,"L.I. romance scam victim who lost $468,000 says she was scammed again while looking for help",2024-04-23,https://www.cbsnews.com/newyork/video/l-i-romance-scam-victim-who-lost-468000-says-she-was-scammed-again-while-looking-for-help/,en,2024-04-24 14:49:51.534696
2ef661985d77a73ebd92473a9f4f2095aceeec611d0a188ddf59423990931d47,marketwatch.com,marketwatch.com,Why gold’s 3% dip may help fuel a run to fresh record highs,2024-04-23,https://www.marketwatch.com/story/why-golds-3-dip-may-help-fuel-a-run-to-fresh-record-highs-bdc4d197?g=d7d93dec-c8a0-43a6-a469-1d548c92112d&mod=mw_rss_bulletins,en,2024-04-24 03:42:08.292775
88249a1313799a65b50ea471a52afa618a3673fd2c79029cb090a6093f3e5a49,newsday.com,newsday.com,Three of soccer's top clubs need a new coach. Unai Emery off the market after Aston Villa extension,2024-04-23,https://www.newsday.com/sports/soccer/unai-emery-contract-extension-aston-villa-p27791,en,2024-04-24 19:25:56.567970
caec771ec54f04777db9c7dd4398747c7dce93cd57752d9e594416d0d5b5a75b,buzzfeed.com,buzzfeed.com,まるで「イカみたい」！？ 板谷由夏のドラマ衣装に「爆笑です」「こんなキレイなイカはいません」と反響,2024-04-23,https://www.buzzfeed.com/jp/ayahoshino/yukaitaya-ikamitai,ja,2024-04-24 06:58:42.296431
e5218fec3e6774c73d338d117863a0879fd1850e3cf481d21907041d4b13f74a,sportingnews.com,sportingnews.com,Nick Nurse says referee ‘looked right at me’ but did not award timeout during chaotic final sequence vs. Knicks,2024-04-23,https://www.sportingnews.com/us/nba/news/nick-nurse-timeout-sixers-knicks-referee/7902793d55b8a255844bd637,en,2024-04-24 13:31:15.629089
a1c9ca4557b53a574406a0d7bcc32956bda1f7e7fdd51d42d03c1c2a3e3606dd,stltoday.com,stltoday.com,Feds to require more staff in nursing homes. Most in St. Louis area don’t meet the bar.,2024-04-23,https://www.stltoday.com/news/local/business/feds-to-require-more-staff-in-nursing-homes-most-in-st-louis-area-don-t/article_d25f0b72-00b9-11ef-ac5f-af09878ffb06.html,en,2024-04-24 04:36:56.166722
008f631634cbe688f018fb63c161ef1d16b2db5fc0543564102aaeb1f2a6a278,wsj.com,wsj.com,BOE Chief Economist Pill Says Key Rate Cut Is Some Way Off,2024-04-23,https://www.wsj.com/economy/global/boe-chief-economist-pill-says-key-rate-cut-is-some-way-off-279c82fb,en,2024-04-24 02:06:42.219522
a298e8cc6566be20be4f3e613cc8ea4d4b0ca646b32175c3e72cfa1e19f51161,hollywoodreporter.com,hollywoodreporter.com,Inside The New York Times' Next Big Bet: 'The Interview' (Exclusive),2024-04-23,https://www.hollywoodreporter.com/business/business-news/the-interview-new-york-times-podcast-1235878889/,en,2024-04-24 12:08:06.890228
1ecc56d058ab81b86cb0b79b2574e33d23b187f2f319fc1ae7af99b736711b72,cbsnews.com,cbsnews.com,L.A.'s Heritage Square to host Spooky Swap Meet,2024-04-23,https://www.cbsnews.com/losangeles/video/l-a-s-heritage-square-to-host-spooky-swap-meet/,en,2024-04-24 18:13:03.887837
b2dc09452ae84ccd5bb36325dcdae6dd8774fe6eda2d82375e2bdbc2656f6bd5,ign.com,ign.com,Lunar Lander: Beyond - Official Launch Trailer,2024-04-23,https://www.ign.com/videos/lunar-lander-beyond-official-launch-trailer,en,2024-04-24 12:33:49.857169
cd7915c73ed61c3f150c137109cc448fd3ef30225081e5d07ad872568109fa7b,buzzfeed.com,buzzfeed.com,Best Taylor Swift Asylum Where They Raised Me Memes,2024-04-23,https://www.buzzfeed.com/kristenharris1/taylor-swift-lyrics-asylum-memes,en,2024-04-24 06:10:03.842864
63a5cf478907d044b4a8d31f82b1c231ef15d11df0f51395efa15f7d0db18b58,seattletimes.com,seattletimes.com,Ukraine aid in the light of history,2024-04-23,https://www.seattletimes.com/opinion/ukraine-aid-in-the-light-of-history/?utm_source=RSSutm_medium=Referralutm_campaign=RSS_all,en,2024-04-24 13:04:15.508734
88b9f9ac95af8daf94f82f08f222dd55dcaf3d3b485179ba25b5a83c4bd43b6f,benzinga.com,benzinga.com,"ROSEN, TOP RANKED INVESTOR COUNSEL, Encourages Sonder Holdings Inc. Investors to Secure Counsel Before Important Deadline in Securities Class Action First Filed by the Firm – SOND",2024-04-23,https://www.benzinga.com/pressreleases/24/04/g38387213/rosen-top-ranked-investor-counsel-encourages-sonder-holdings-inc-investors-to-secure-counsel-befor,en,2024-04-24 07:52:52.577281
cecd186aa0fafeaffbf1d7e0928d1c4c80381b76e81f100db968194736e43ce4,businessinsider.com,businessinsider.com,The handbag wars have begun after the US sued to block the merger of Coach and Michael Kors,2024-04-23,https://www.businessinsider.com/ftc-sues-tapestry-capri-coach-michael-kors-kate-spade-2024-4,en,2024-04-24 05:00:47.872663
5c01eaa83812ecce035644cf7fd7ae2fec85eb9ed18915bad1c5ec37493eb237,arkansasonline.com,arkansasonline.com,Supreme Court to take up ghost guns case,2024-04-23,https://www.arkansasonline.com/news/2024/apr/23/supreme-court-to-take-up-ghost-guns-case/,en,2024-04-24 14:55:21.878060
1581fad8be99fc7e3915ef5de919b7f75b8fc73fd3d488f44a4ee2655805ff84,cbsnews.com,cbsnews.com,"Bebe Neuwirth returns to Broadway in ""Cabaret"" revival",2024-04-23,https://www.cbsnews.com/video/bebe-neuwirth-returns-to-broadway-in-cabaret-revival/,en,2024-04-24 06:00:06.759363
4874b6c126abe4cc98b7afed4991384a99fe4345703a9a357ecfcf11c3a5c3da,cnet.com,cnet.com,Adobe Firefly Update Promises AI-Generated Images Without Any Weirdness,2024-04-23,https://www.cnet.com/tech/services-and-software/adobe-firefly-update-promises-ai-generated-images-without-any-weirdness/#ftag=CAD590a51e,en,2024-04-24 05:01:12.921691
1fdaef7fcec8707a854ea9a395b8c9fb43198972f39b51ace6afae03879bca9e,thestreet.com,thestreet.com,Amazon launches genius new subscription product,2024-04-23,https://www.thestreet.com/retail/amazon-launches-genius-new-subscription-product,en,2024-04-24 18:11:22.077719
f03c8e66e1b2cfa57e3cb337126f99e395e5cd8f9af41b2186bad64374bea1e3,latimes.com,latimes.com,Anne Hathaway recalls 'gross' chemistry tests from the early 2000s: 'Now we know better',2024-04-23,https://www.latimes.com/entertainment-arts/movies/story/2024-04-23/anne-hathaway-gross-chemistry-tests-auditions,en,2024-04-24 11:21:51.276639
076ed7c26008b7fee34a3fbe47479508598c4709e7fcbcb540eb9c011722911a,seattletimes.com,seattletimes.com,Defensemen injuries are already piling up early in the NHL playoffs,2024-04-23,https://www.seattletimes.com/sports/hockey/defensemen-injuries-are-already-piling-up-early-in-the-nhl-playoffs/?utm_source=RSSutm_medium=Referralutm_campaign=RSS_all,en,2024-04-24 13:03:55.471981
432dc75577e672baa2a58b3380126eaddfd516cbf63431cdc20d16465843950b,newsday.com,newsday.com,Pentagon set to send $1 billion in new military aid to Ukraine once Biden signs bill,2024-04-23,https://www.newsday.com/news/nation/Ukraine-Russia-Pentagon-weapons-congress-k76415,en,2024-04-24 17:31:20.736115
10f407a4a84ad4b1a133ca1c8b30be46b74706b339aabe666346dbd9adc10041,benzinga.com,benzinga.com,The Vita Coco Company Announces the Formation of The Vita Coco Community Foundation,2024-04-23,https://www.benzinga.com/pressreleases/24/04/g38390582/the-vita-coco-company-announces-the-formation-of-the-vita-coco-community-foundation,en,2024-04-24 18:22:59.409026
c584f468831e714cc462ee4f65c181df8dc029ed8b6a0e07bc51249e879266e1,usmagazine.com,usmagazine.com,Taylor Swift Loves This Simple Black Tee – Get It for Under $50,2024-04-23,https://www.usmagazine.com/shop-with-us/news/rumored-be-mine-top/,en,2024-04-24 07:11:39.008138
3c7e8fee79edec891bdb000039bb36496f23f08cd03557bdd1b0b57f190a3e23,dailycaller.com,dailycaller.com,‘Really F*cked This Up’: Ben Stiller Admits To Feeling The Pressure Of His ‘Zoolander’ Failure,2024-04-23,https://dailycaller.com/2024/04/23/ben-stiller-bad-reviews-zoolander-critics/,en,2024-04-24 09:32:43.420076
dc91d2c4c45cbca95d35671761ba81ef55f4ecabcc8fa82a106b607c3f000c2d,benzinga.com,benzinga.com,Forecasting The Future: 13 Analyst Projections For NICE,2024-04-23,https://www.benzinga.com/insights/analyst-ratings/24/04/38376647/forecasting-the-future-13-analyst-projections-for-nice,en,2024-04-24 17:00:24.899671
1b41b2588302f58753ca5845827e43ed982b9c148621ae3c8b4096be048f4efb,cbsnews.com,cbsnews.com,"Pitchers Kyle Hendricks, Drew Smyly put on injured list by Chicago Cubs",2024-04-23,https://www.cbsnews.com/chicago/news/hendricks-put-on-il-chicago-cubs/,en,2024-04-24 18:09:48.919869
66d905f013ab9ca9a63aaddea0c6102ff449078f2f53cd897f8916e86591db56,benzinga.com,benzinga.com,Automotive Seating Maker Adient To Slash Jobs In Europe,2024-04-23,https://www.benzinga.com/markets/equities/24/04/38374678/automotive-seating-maker-adient-to-slash-jobs-in-europe,en,2024-04-24 05:56:03.902956
b8844e881724984f7eb890b426b9e4b0f4f77e14783d02f09c7380b67ff2f50e,nj.com,nj.com,"Penn Relays, 2024: Complete N.J. girls 4x400 relay preview",2024-04-23,https://www.nj.com/highschoolsports/2024/04/penn-relays-2024-complete-nj-girls-4x400-relay-preview.html,en,2024-04-24 09:02:06.584658
65bae13a6ce0d002fd978591e7b6e5ff50750ac4350db0be41f98aea379a1bd5,npr.org,npr.org,PEN America cancels awards ceremony after writers protest,2024-04-23,https://www.npr.org/2024/04/23/1246578813/pen-america-cancels-awards-ceremony-writers-protest-gaza-response,en,2024-04-24 09:02:43.411783
adf98e58817440ec84616472b64458b1780f817a06e928ba3b2f4be06d014f4b,theguardian.com,theguardian.com,Central Coast Mariners star Angel Torres charged with sexual assault and stood down from A-League,2024-04-23,https://www.theguardian.com/football/2024/apr/23/central-coast-mariners-star-angel-torres-charged-with-sexual-assault-and-stood-down-from-a-league,en,2024-04-24 12:26:54.352938
38a7d3b3d7aa8bb7e6c78c47d4999445f7d38144bd7eac14f55a1bd37bfababe,benzinga.com,benzinga.com,"Enterprise video market worth $35.8 billion by 2029, growing at a CAGR of 8.6%: Report by MarketsandMarkets",2024-04-23,https://www.benzinga.com/pressreleases/24/04/g38380523/enterprise-video-market-worth-35-8-billion-by-2029-growing-at-a-cagr-of-8-6-report-by-marketsandma,en,2024-04-24 05:55:34.835345
e4a8809ea90b1c914df688154ef6ebca232a00e22affa5c976ec9a06948631fc,bleacherreport.com,bleacherreport.com,"Cowboys' Jerry Jones: 'I'm Not Ready to Go' on Prescott, Lamb, Parsons Contracts",2024-04-23,https://bleacherreport.com/articles/10118260-cowboys-jerry-jones-im-not-ready-to-go-on-prescott-lamb-parsons-contracts,en,2024-04-24 05:38:29.228215
6a4520e9ebaa511e7de8b709a1bb3f4d3a4cd4272dd32cc5d120ab10b25542c7,baltimoresun.com,baltimoresun.com,Visit St. Joseph’s Monastery Church while you still can,2024-04-23,https://www.baltimoresun.com/2024/04/23/st-josephs-monastery-church/,en,2024-04-24 02:51:22.530961
1325bdda66e219b49d26bc03e802b81a13a2e6199075e2d4163df7db451dc135,marketwatch.com,marketwatch.com,‘Extraordinary’ U.S. government debt may mean prolonged bond-market volatility,2024-04-23,https://www.marketwatch.com/story/extraordinary-u-s-government-debt-may-mean-prolonged-bond-market-volatility-18c491a4?mod=mw_rss_topstories,en,2024-04-24 15:10:39.937440
caba00212f0af5d21288e7806c4137ba3237a2767ec0cc247805160261a73127,cbsnews.com,cbsnews.com,Pro-Palestine protests continue across U.S. campuses,2024-04-23,https://www.cbsnews.com/video/pro-palestine-protests-continue-across-u-s-campuses/,en,2024-04-24 18:17:34.538082
35caa1c9060e6211a85cbe37acab133c864528745786884b72f7560e1278db72,chicagotribune.com,chicagotribune.com,South Side man gets 3 years for possession of ‘Trump gun’,2024-04-23,https://www.chicagotribune.com/2024/04/23/i-never-seen-a-gun-like-it-south-side-man-gets-3-years-for-possession-of-trump-gun/,en,2024-04-24 09:54:31.067654
429be4a1cb342df888e2577ed457cc963395e949423448b1e8c2807ccb8f79b5,theguardian.com,theguardian.com,Baltimore bridge collapse: city says ship was ‘unseaworthy’ before leaving port,2024-04-23,https://www.theguardian.com/us-news/2024/apr/23/baltimore-bridge-collapse-ship-lawsuit,en,2024-04-24 15:59:09.906565
c90407f623ee99d3edd73b6b84704ec8b3b54e12b80c7cbb2c691430d938441a,ibtimes.com,ibtimes.com,"UK's Sunak Announces Raised Defence Spending, New Ukraine Aid",2024-04-23,https://www.ibtimes.com/uks-sunak-announces-raised-defence-spending-new-ukraine-aid-3730395,en,2024-04-24 12:05:17.819787
c8485e18aa4eb620f4011151366633b5ddce94aee7bcd33709d85b31d362280c,billboard.com,billboard.com,Megadeth Announce Destroy All Enemies 2024 Fall U.S. Tour Dates,2024-04-23,https://www.billboard.com/music/rock/megadeth-destroy-all-enemies-2024-fall-us-tour-dates-1235663845/,en,2024-04-24 10:29:44.176330
8655080b8c43bfa1685435db3d0b634b62fbf1d5bf7b0c25b852c8a894a4443b,usatoday.com,usatoday.com,Baltimore says Dali owner knew ship was 'unseaworthy' before collapse,2024-04-23,https://www.usatoday.com/story/news/investigations/2024/04/23/dali-ship-unseaworthy-baltimore-bridge-collapse/73426706007/,en,2024-04-24 12:12:01.445687
bd346c1a5b35c8996bc0b519a05cb60cf5c0341150e6250fe2941d6d84676e15,wsj.com,wsj.com,Title-Insurance Reform Is Waiting for a Good Lawsuit,2024-04-23,https://www.wsj.com/articles/title-insurance-reform-real-estate-ee7334f6,en,2024-04-24 01:55:27.801404
13fd1e24da5596e1efaab19c422d4de08f0cf3eb4baa04fca5131b41744a4351,forbes.com,forbes.com,Meta's Release Of Llama3 Changes Everything,2024-04-23,https://www.forbes.com/sites/alexzhavoronkov/2024/04/23/metas-release-of-llama3-changes-everything/,en,2024-04-24 09:33:10.921547
a178578116ee9958125f35752608f43e571327ecf22ca199dd354470c44c807b,politicalwire.com,politicalwire.com,Senate Ready to Pass Bill That Could Ban TikTok,2024-04-23,https://politicalwire.com/2024/04/23/senate-ready-to-pass-bill-that-could-ban-tiktok/,en,2024-04-24 10:06:04.793977
882338d09b77c783f4be6db2f16c95f5c5f59b0cabb8dbdab6a63b3c2fc0b88c,nytimes.com,nytimes.com,中国经济放缓，拼多多实现“逆袭”,2024-04-23,https://cn.nytimes.com/business/20240423/china-pinduoduo-temu/?utm_source=RSS,zh,2024-04-24 09:13:58.457028
83b7b69e92ae4d0f55f46c1c3f5a26a3e8eafe1a3c86e24f06e96b3a685b672c,nypost.com,nypost.com,Swiss Air jet almost collides with four other planes in near-catastrophe on JFK runway,2024-04-23,https://nypost.com/2024/04/23/us-news/swiss-air-jet-nearly-collides-with-four-other-planes-on-jfk-runway/,en,2024-04-24 15:08:11.343180
957739f86003b4a0a6341511955bfd45096d207c23e72729107b811c2f3d7d57,foxnews.com,foxnews.com,Some of 49 migrants flown to Martha’s Vineyard by the state of Florida are now able to legally work in US,2024-04-23,https://www.foxnews.com/politics/some-of-49-migrants-flown-to-marthas-vineyard-by-the-state-of-florida-are-now-able-to-legally-work-in-us,en,2024-04-24 11:50:26.871926
55f6ee7ae4a39a3ff2285d0a34ade6feea787038ef5b694f58eda1aa1d1189ae,twincities.com,twincities.com,How couples can share the mental load of money management,2024-04-23,https://www.twincities.com/2024/04/23/how-couples-can-share-the-mental-load-of-money-management/,en,2024-04-24 09:46:10.393616
847e291d1988008e43b2b70a504ab71fc13c5e5e517f9d8649c234d73404e7bb,newsday.com,newsday.com,Ex-Rep. George Santos abandons bid to run for Congress as independent,2024-04-23,https://www.newsday.com/news/nation/george-santos-congress-wont-run-hcszdykj,en,2024-04-25 05:55:20.187714
2786a7f86e75c3f1ae6bdb66fe4a330cd2a540931e9a4dc3a98e0789e11fc02c,newsday.com,newsday.com,"Minnesota senator wanted late father's ashes when she broke into stepmother's home, charges say",2024-04-23,https://www.newsday.com/news/nation/Minnesota-senator-arrested-legislature-h94231,en,2024-04-24 17:32:32.495702
05a1c03685f996c4b0b472c3e878ed979f2ad064826e3b0a586fe8f3c6b84617,syracuse.com,syracuse.com,"Ryan Blackwell, former Syracuse player and Liverpool boys basketball coach, takes assistant job at Siena",2024-04-23,https://www.syracuse.com/orangebasketball/2024/04/ryan-blackwell-former-syracuse-player-and-liverpool-boys-basketball-coach-takes-assistant-job-at-siena.html,en,2024-04-24 05:20:24.164630
d155f2febe3f3a6ce329cecd6a0d37329cc949d68c90977ad12d468d7c10ca76,uproxx.com,uproxx.com,All The Best New Indie Music From This Week,2024-04-23,https://uproxx.com/indie/best-new-indie-pearl-jam-menomena/,en,2024-04-24 17:55:55.579982
6ae02b77ae25bc29ea0a906b02474c5c7a66f63805d43f12b4e9e48b52785b62,variety.com,variety.com,Variety's 'Actors on Actors' Wins Two 2024 Webby Awards,2024-04-23,https://variety.com/2024/digital/news/2024-webby-awards-variety-actors-on-actors-1235978016/,en,2024-04-24 14:32:02.453138
809da26dd276aece72a678681617bda6651b3a7c2b0b40052d7f59536f2c8e0e,cbssports.com,cbssports.com,"Timberwolves vs. Suns TV channel, how to watch Game 2 online, live stream, odds, prediction for NBA playoffs",2024-04-23,https://www.cbssports.com/nba/news/timberwolves-vs-suns-tv-channel-how-to-watch-game-2-online-live-stream-odds-prediction-for-nba-playoffs/,en,2024-04-24 08:52:57.527385
1f394385943024aba3da4b43c26c0024aac8d3e9b6a9fc24c678079aefd87847,tmz.com,tmz.com,"Mike Tyson Pummels Trainer, Looks Violent In New Workout Video",2024-04-23,https://www.tmz.com/2024/04/23/mike-tyson-pummels-trainer-looks-violent-in-new-workout-video/,en,2024-04-24 11:54:49.044525
135234108bf340c1dd046f3d23d80645c9ab36c055ad8febefa85940a37d5049,cbsnews.com,cbsnews.com,Cook County Sheriff's task force cracks down on retail crimes,2024-04-23,https://www.cbsnews.com/chicago/video/cook-county-sheriffs-task-force-cracks-down-on-retail-crimes/,en,2024-04-24 18:09:53.934248
03d2780b699feda654b9f6142aca1a6569881de611fac61c3f7c860cf652a065,hollywoodreporter.com,hollywoodreporter.com,Jennifer Lopez Battles Simu Liu's AI Villain in Latest 'Atlas' Trailer,2024-04-23,https://www.hollywoodreporter.com/movies/movie-news/atlas-trailer-jennifer-lopez-simu-liu-ai-villain-1235879465/,en,2024-04-24 02:43:45.443623
0b8ff4a47ef986837afea9c1d53a9beb91d8e1fd897b32194e6dec39dd3a44e5,benzinga.com,benzinga.com,Baum Family Investments Embarks on Triple Net Lease Strategy with $250 Million Acquisition Goal,2024-04-23,https://www.benzinga.com/pressreleases/24/04/n38389807/baum-family-investments-embarks-on-triple-net-lease-strategy-with-250-million-acquisition-goal,en,2024-04-24 15:15:43.463173
5059ab014efb1f309b8675827b1a5abdcc6fb365c6a0d6e092db849ebbd88b2e,hotair.com,hotair.com,"Once Again, With Feeling: Decolonize Academia Now!",2024-04-23,https://hotair.com/ed-morrissey/2024/04/23/once-again-with-feeling-decolonize-academia-now-n3787087,en,2024-04-24 18:13:36.377826
7778a796c8a41f9b2226e873306836c26cd5a963f2e286f087d73e61fe6ea994,breitbart.com,breitbart.com,Illegal Alien Charged with Fatally Stabbing Man at Central Florida Hotel,2024-04-23,https://www.breitbart.com/politics/2024/04/23/illegal-alien-charged-with-fatally-stabbing-man-at-central-florida-hotel/,en,2024-04-24 18:16:46.678429
965f53630ebbf15a2c080c00496194038f1251ea8031e4904c7d3fb30c57e3da,latimes.com,latimes.com,"Kings' penalty kill, a strength all year, becomes weakness in deflating loss to Oilers",2024-04-23,https://www.latimes.com/sports/hockey/kings/story/2024-04-23/kings-edmonton-oilers-power-play-penalty-kill-game-1-analysis,en,2024-04-24 14:02:03.083348
9f0dbd315dc4e3db6dded4a1af0fd58853280575d745fedb5aa79060a0a01df4,benzinga.com,benzinga.com,Oregon Pacific Bancorp Announces First Quarter 2024 Earnings Results,2024-04-23,https://www.benzinga.com/pressreleases/24/04/b38390593/oregon-pacific-bancorp-announces-first-quarter-2024-earnings-results,en,2024-04-24 19:15:24.895187
5ed23f1ece939903c522892ab489f76ff0510ac2201bca99b493966c35241014,dailycaller.com,dailycaller.com,GORDON CHANG: Biden’s Warnings Fall Flat As China Swarms Key US Ally’s Waters,2024-04-23,https://dailycaller.com/2024/04/23/gordon-chang-everyone-is-watching-china-vs-taiwan-instead-we-should-be-watching-china-vs-philippines/,en,2024-04-24 08:22:49.648290
c089ebfba9706b46409b81c7fe6405a969692cf0a325aa213e0aa104e63ffa6d,startribune.com,startribune.com,An Isanti wedding venue closed without warning. Now these couples have 'nowhere to go.',2024-04-23,https://www.startribune.com/circle-b-wedding-venue-closed-isanti/600361024/,en,2024-04-24 07:50:58.805205
0158143a71ca08574cd0f861025a8910a03248af6589bc86ad704aaa32f34434,cnet.com,cnet.com,マイクロソフト、顔写真と音声からリアルな動画を作るAI--ラップするモナ・リザも,2024-04-23,https://japan.cnet.com/article/35218112/,ja,2024-04-24 10:56:38.513875
40269ee9e60155afdfb866f266a9173c741b74efd3842befb2c21a3ba293c237,marketwatch.com,marketwatch.com,Do Car Insurance Companies Check Your Credit?,2024-04-23,https://www.marketwatch.com/guides/insurance-services/do-car-insurance-companies-check-your-credit/,en,2024-09-06 23:35:49.734567
4dcc7ebf5827fbc0515b0ae01eac851c6299b4e293035ca4aa4b5902cc653e63,abcnews.go.com,abcnews.go.com,"With public universities under threat, massive protests against austerity shake Argentina",2024-04-23,https://abcnews.go.com/International/wireStory/argentina-governments-austerity-plan-hits-universities-provokes-student-109548524,en,2024-04-24 03:37:14.778666
9fbf92ad068662d559e94873e96b482cfdbc63a0c06ac3dceb362d318b95e3d3,arkansasonline.com,arkansasonline.com,"OPINION | JOHN BRUMMETT: Bold, brave, unfailingly nice",2024-04-23,https://www.arkansasonline.com/news/2024/apr/23/bold-brave-unfailingly-nice/,en,2024-04-24 14:56:16.885197
