id,media_name,media_url,title,publish_date,url,language,indexed_date
8902df14067ca6b8bbe3925313306dac2b468b9a6a715ebbfa3e10acc02fc130,benzinga.com,benzinga.com,Mayo Clinic Diet Survey Spotlights Important Correlation Between Weight Loss Medication and Behavioral Support Programs,2024-04-23,https://www.benzinga.com/pressreleases/24/04/n38377672/mayo-clinic-diet-survey-spotlights-important-correlation-between-weight-loss-medication-and-behavi,en,2024-04-24 13:27:35.312532
e37ce908f6bdc55f92eb103d3b2bb6bad34cbf3325901f7a9b7b229aa7b5f48f,cleveland.com,cleveland.com,"Cleveland Guardians, Boston Red Sox starting lineups for April 23, 2024: Game No. 23",2024-04-23,https://www.cleveland.com/guardians/2024/04/cleveland-guardians-boston-red-sox-starting-lineups-for-april-23-2024-game-no-23.html,en,2024-04-24 04:43:21.172186
05ea5f059b335f06f44ed0b5f21e60b9963fed5679cef42e4f33a7b1385c5d3b,dailycaller.com,dailycaller.com,How to Find the Best Vet in Your Area,2024-04-23,https://dailycaller.com/2024/04/23/how-to-find-the-best-vet-in-your-area/,en,2024-04-24 09:13:15.339787
97a14de465f9bf3f49f405ab063d0b5bf738587d3092164f286b1c976c5a2efc,dailykos.com,dailykos.com,"With no cameras allowed, Trump trial is proving power of live blogs as news tools",2024-04-23,https://www.dailykos.com/stories/2024/4/23/2236713/-With-no-cameras-allowed-Trump-trial-is-proving-power-of-live-blogs-as-news-tools?pm_campaign=blog&pm_medium=rss&pm_source=,en,2024-04-25 00:07:27.811199
a46be75ad05efd87c86efd7aa4069cb78182ef2acfb7b7f4b1ec4f877c2b4278,sportingnews.com,sportingnews.com,Knicks-76ers Last Two Minute Report: NBA admits to missed foul calls before New York’s game-winning basket,2024-04-23,https://www.sportingnews.com/us/nba/news/knicks-76ers-last-two-minute-report-nba-missed-foul-calls/7311961bf636ac71ea3e61cb,en,2024-04-24 13:40:25.635829
d4c17e453592ba4a4d9933ddf9157381321451f9ae458ae19c3fb8ff274df9ae,nypost.com,nypost.com,Find the best North Carolina betting promos and sites this week,2024-04-23,https://nypost.com/2024/04/23/sports/best-north-carolina-betting-promos-and-sites-this-week/,en,2024-04-24 04:18:29.509076
75559296a3ece3bd29a92083f77eb87569f079cb565525e96750aa3befe11bbe,variety.com,variety.com,Curtis LeGeyt Extends Contract as President and CEO of National Assn. of Broadcasters Through 2029,2024-04-23,https://variety.com/2024/tv/news/curtis-legeyt-nab-contract-extend-1235980075/,en,2024-04-24 18:04:58.862029
207f4cf73875d37deb0c53e1385d0b42523ef24206f899f263679f99c92035bd,schwartzreport.net,schwartzreport.net,Universities Are Making Billions Gatekeeping Your Meds,2024-04-23,https://www.schwartzreport.net/2024/04/23/universities-are-making-billions-gatekeeping-your-meds/,en,2024-04-24 06:44:00.425534
d06ef89a6de579fab2756f547b5a4231fb3443d1f417855dd21b0bec80417ce5,cbsnews.com,cbsnews.com,PTL taste tests Frios Gourmet Pops,2024-04-23,https://www.cbsnews.com/pittsburgh/video/ptl-taste-tests-frios-gourmet-pops/,en,2024-04-24 11:22:53.559952
907825c5e97a16e3f9f8a89ff0355a9beeb704b837fed40cb5cc406e800e0cae,npr.org,npr.org,"Through genetics, researchers track ancestors of unknown enslaved people in Maryland",2024-04-23,https://www.npr.org/2024/04/23/1246546168/through-genetics-researchers-track-ancestors-of-unknown-enslaved-people-in-maryl,en,2024-04-24 10:19:40.364963
0e5ded82adf3010dc6d425443a50de7717e44bf89753b77300b4694b397cc5ad,ign.com,ign.com,Thank God X-Men '97 Remembered the Melodrama,2024-04-23,https://www.ign.com/articles/thank-god-x-men-97-remembered-the-melodrama,en,2024-04-24 09:13:26.433227
af349720584e9d8075bc8cfb3dad256db368fd3d63d704fedc59b0d9f7a6defc,benzinga.com,benzinga.com,"CleanTech Strategies Selected by U.S. Department of Energy to Advance Innovations in Flow Batteries, with Close Industry Collaboration",2024-04-23,https://www.benzinga.com/pressreleases/24/04/n38391563/cleantech-strategies-selected-by-u-s-department-of-energy-to-advance-innovations-in-flow-batteries,en,2024-04-24 13:27:05.150797
e03db69251dddb734446c7fb0720fcf95bf0bb41f2a55553a80722488c2d6031,benzinga.com,benzinga.com,Press Release: Rilzabrutinib LUNA 3 phase 3 study met primary endpoint in immune thrombocytopenia,2024-04-23,https://www.benzinga.com/pressreleases/24/04/g38369341/press-release-rilzabrutinib-luna-3-phase-3-study-met-primary-endpoint-in-immune-thrombocytopenia,en,2024-04-24 06:33:27.234138
7d181129999a07044b11ee0ef2170ab080b2b2177e31d9896510dc91f1eaa2ac,seattletimes.com,seattletimes.com,Kawhi Leonard returns to the Clippers’ lineup for Game 2 against Luka Doncic and the Mavericks,2024-04-23,https://www.seattletimes.com/sports/nba/kawhi-leonard-is-returning-to-the-clippers-lineup-for-game-2-against-luka-doncic-and-the-mavericks/?utm_source=RSS&utm_medium=Referral&utm_campaign=RSS_all,en,2024-04-24 18:23:21.859192
1b4278e9ffa64d48b03de5accf48aceb715fd1bef4635e6e210d8197d7cded83,benzinga.com,benzinga.com,Why Is GE Aerospace Stock Trading Higher Today?,2024-04-23,https://www.benzinga.com/news/earnings/24/04/38379318/why-is-ge-aerospace-stock-trading-higher-today,en,2024-04-24 06:22:13.874354
268f8df9e49aff17fdcd11febd15be2dc361b0029248751dfa275a3d29008f9c,zdnet.com,zdnet.com,Samsung begins mass production of 9th-gen NAND with 50% upped bit density,2024-04-23,https://www.zdnet.com/article/samsung-begins-mass-production-of-9th-gen-nand-with-50-upped-bit-density/#ftag=RSSbaffb68,en,2024-04-24 09:31:52.092536
00f3b97ef8e59f5e6a48740cb29c75f4c5d90b8fdadfa2394fdbd28d5748436e,seattletimes.com,seattletimes.com,More deaths in the English Channel underscore risks for migrants despite UK efforts to stem the tide,2024-04-23,https://www.seattletimes.com/nation-world/world/human-rights-groups-condemn-uk-plan-to-send-asylum-seekers-to-rwanda-after-parliament-backs-new-law/?utm_source=RSS&utm_medium=Referral&utm_campaign=RSS_all,en,2024-04-24 04:03:43.984682
209f96e965422ec169a74cf081adb3a8ae3b7bcb7329d1e780da7afa280755f1,benzinga.com,benzinga.com,Glancy Prongay Murray LLP Reminds Investors of Looming Deadline in the Class Action Lawsuit Against VinFast Auto Ltd. (VFS) - VinFast Auto (NASDAQ:VFS),2024-04-23,https://www.benzinga.com/pressreleases/24/04/b38385792/glancy-prongay-murray-llp-reminds-investors-of-looming-deadline-in-the-class-action-lawsuit-agains,en,2024-04-25 03:37:58.513013
f3b80fcacfdcef04881999a07fee6f943bbd1d9e2324aa252cdc3062aec6268d,seattletimes.com,seattletimes.com,"NASA leaders discuss global challenges, solutions with Mexico president, lawmakers and students",2024-04-23,https://www.seattletimes.com/nation-world/nation/nasa-leaders-discuss-global-challenges-solutions-with-mexico-president-lawmakers-and-students/?utm_source=RSS&utm_medium=Referral&utm_campaign=RSS_all,en,2024-04-24 18:10:03.375982
649ecddc9f3ccf945a131c6951410effba47429a74b5b1203e509d5c169e2095,billboard.com,billboard.com,"HYBE Begins Audit of NewJeans' Label ADOR, Asks CEO Min Hee-Jin to Step Down",2024-04-23,https://www.billboard.com/business/record-labels/hybe-audit-newjeans-label-ador-asks-ceo-min-heejin-step-down-1235663575/,en,2024-04-24 10:20:45.365624
f53261850182ed1bcf2cf2bc4989752fcb23145849054023e5331764ebcbfebf,cbssports.com,cbssports.com,"Steelers GM says it's not 'realistic' for team to draft a QB in Round 1, but 'we have to be open to it'",2024-04-23,https://www.cbssports.com/nfl/news/steelers-gm-says-its-not-realistic-for-team-to-draft-a-qb-in-round-1-but-we-have-to-be-open-to-it/,en,2024-04-24 08:30:54.429786
249fdd938244e0149dd77c7125c58160db5754b4451dad0dacbd865bc745d86f,nypost.com,nypost.com,Isaiah Hartenstein was unheralded hero with two plays that saved Knicks in Game 2,2024-04-23,https://nypost.com/2024/04/23/sports/isaiah-hartensteins-two-unsung-plays-saved-the-knicks-vs-76ers/,en,2024-04-24 15:46:35.816668
9fadcff9037004ea58bec4d8c705d3df0fdbcdee1524344dc29addb3950fa065,bleacherreport.com,bleacherreport.com,"NFL Coaches Question Marvin Harrison Jr.'s Speed, 'He Comes Across as Casual'",2024-04-23,https://bleacherreport.com/articles/10118119-nfl-coaches-question-marvin-harrison-jrs-speed-he-comes-across-as-casual,en,2024-04-24 05:54:18.640654
b6e73d9338ba586b53b603a6adf4bca4604cb0ceab87b458cf90cdc52fd7914d,benzinga.com,benzinga.com,Patient Data Compromised - UnitedHealth Group Admits Ransom Payment in Cyberattack,2024-04-23,https://www.benzinga.com/news/large-cap/24/04/38388554/patient-data-compromised-unitedhealth-group-admits-ransom-payment-in-cyberattack,en,2024-04-24 05:46:52.627840
313eda9bb180ec9f2c2e410493deb3eb66b68c9b3f60661614b79bd7bc9bcc6c,recorder.com,recorder.com,Kim George: National Volunteer Week — hospice needs you,2024-04-23,https://www.recorder.com/Letter-to-the-editor-54648443,en,2024-04-25 02:41:30.913894
fb86f7c87d3397e15d3e2dd62db950b96736807939626e3c30ab63282e8420ff,sbnation.com,sbnation.com,2024 NFL Draft: 3 kickers and a punter to look at,2024-04-23,https://www.sbnation.com/nfl/2024/4/23/24126350/2024-nfl-draft-best-kickers-punters-ranking,en,2024-04-24 04:52:01.787610
ea1525847cce906a2bed4c55880457689dc520695eba432041ad51bafb89c2f3,nbcnews.com,nbcnews.com,Seattle hospital won’t turn over gender-affirming care records in lawsuit settlement with Texas,2024-04-23,https://www.nbcnews.com/nbc-out/out-politics-and-policy/seattle-hospital-wont-turn-gender-affirming-care-records-lawsuit-settl-rcna148939,en,2024-04-24 09:46:23.038520
aebad8aac92d05da7e021f2a8f4b139b633d1f624022ff008edad4f4f1ec5a8f,variety.com,variety.com,"Senate Passes TikTok Ban Bill, Setting Up Legal Battle Between App and U.S. on First Amendment Issues",2024-04-23,https://variety.com/2024/digital/news/senate-passes-tiktok-ban-bill-first-amendment-1235979220/,en,2024-04-24 18:16:52.406476
0ab1ca087ad3199bf7e641e3181a5d7d41e26e784b3e23ea9777f12a5f9df381,benzinga.com,benzinga.com,David Pecker Testifies To National Enquirer Buying Stories That Could Damage Donald Trump: 'Potential Embarrassment To The Campaign',2024-04-23,https://www.benzinga.com/general/politics/24/04/38392485/david-pecker-testifies-to-national-enquirer-buying-stories-that-could-damage-donald-trump-potent,en,2024-04-24 18:07:12.092476
efbe576daa06652cf5097a562e63d85b3fbb8b5d9fec86e497b50cf3fcc00363,newsday.com,newsday.com,Alec Baldwin smacks phone of anti-Israel harasser,2024-04-23,https://www.newsday.com/entertainment/celebrities/alec-baldwin-free-palestine-osoj93qo,en,2024-04-24 17:31:30.150554
4e68128e360cd90ab9c26250b8225d9a69a4df760da545f013ff28010c8bbf7b,sandiegouniontribune.com,sandiegouniontribune.com,County warns of counterfeit Botox after San Diego woman contracts botulism,2024-04-23,https://www.sandiegouniontribune.com/news/health/story/2024-04-23/county-warns-of-fake-botox-after-san-diego-woman-contracts-botulism,en,2024-04-25 02:57:10.859444
c6074c384367d9410dd635dc1ec87e94afbe87e50312d23dbea9ea842cf34db7,theguardian.com,theguardian.com,Soiled nappies and karate: AI-rendered Putin biopic to be released,2024-04-23,https://www.theguardian.com/film/2024/apr/23/putin-ai-biopic-readies-for-release-besaleel,en,2024-04-24 11:04:46.951730
b47ad4cd6098c57840a1798dc0e44fd9ed7f05478e4ce4374fb501a0447b92eb,arstechnica.com,arstechnica.com,You can now disable some of Fortnite’s most toxic emotes,2024-04-23,https://arstechnica.com/gaming/2024/04/you-can-now-disable-some-of-fortnites-most-toxic-emotes/,en,2024-04-24 07:17:02.980900
55b7466b5ee805e34c553fb4e3761725982da0e6bec1701317ffb6ee7fa98457,benzinga.com,benzinga.com,"Stubbs Alderton Markiles, LLP Forges Strategic Alliance with Pegasus Angel Accelerator to Propel Los Angeles Startup Ecosystem",2024-04-23,https://www.benzinga.com/pressreleases/24/04/n38387043/stubbs-alderton-markiles-llp-forges-strategic-alliance-with-pegasus-angel-accelerator-to-propel-lo,en,2024-04-24 06:58:45.567563
1c057a45f345d769a4ce42b1c78925f5cd09c1ceee97745fb60efa1df5275a3a,seattletimes.com,seattletimes.com,Garland speaks with victims’ families as new exhibit highlights the faces of gun violence,2024-04-23,https://www.seattletimes.com/nation-world/nation/garland-speaks-with-victims-families-as-new-exhibit-highlights-the-faces-of-gun-violence/?utm_source=RSS&utm_medium=Referral&utm_campaign=RSS_all,en,2024-04-24 18:09:36.291209
623314bfb73c5815491b366de2e3f667412f0c54c9738922d521b46d5193b6b8,sun-sentinel.com,sun-sentinel.com,Bnei Menashe Indian community celebrates Passover,2024-04-23,https://www.sun-sentinel.com/2024/04/23/bnei-menashe-indian-community-celebrates-passover/,en,2024-04-24 07:50:00.054953
47d9f70d8b0270e70f3946681f683e6e9e11caa1dd4a31dd0484b776e06ddec4,redstate.com,redstate.com,LIVE UPDATES: Trump Manhattan Trial,2024-04-23,https://redstate.com/smoosieq/2024/04/23/live-updates-trump-manhattan-trial-day-6-n2173182,en,2024-04-24 12:24:59.316350
c07835b3d75cb35ec77b03658b87c2a2768e0b2c53b8e230c4ab32038fe6e074,abcnews.go.com,abcnews.go.com,"Baltimore port to open deeper channel, enabling some cargo ships to pass after bridge collapse",2024-04-23,https://abcnews.go.com/US/wireStory/baltimore-port-open-deeper-channel-enabling-ships-pass-109533789,en,2024-04-24 07:41:57.912350
62d10e5607ebdaaaf1f15d5ae50ae3f49e99fd202a0675c899f3388c75528ad7,mercurynews.com,mercurynews.com,Thieves shoot at man after stealing his truck,2024-04-23,https://www.mercurynews.com/2024/04/23/suspects-shoot-at-man-after-stealing-his-truck/,en,2024-04-24 05:56:44.332296
5508629d01fbc0e9528d8bf45f08f38ce6867659cfe4f771d2784375073b4e63,newsweek.com,newsweek.com,"Moment 160lb guardian dog's instincts kick in to ""protect"" newborn kittens",2024-04-23,https://www.newsweek.com/giant-dog-protects-tiny-kittens-1892843,en,2024-04-24 01:15:26.751833
002812a0819ebae487d84add38110831f2f9cce2f3ffc4e4471dd78151c38cd5,reuters.com,reuters.com,午前の日経平均は続伸、米ハイテク株高を好感 伸び悩む場面も,2024-04-23,https://jp.reuters.com/markets/japan/funds/A65QCZI575ML5MFMBPVELEILQQ-2024-04-23/,ja,2024-04-24 10:51:05.835410
f1db897ba80ff43e97b991f10bed958d6ebc0e08cb8487d67af1907fb7766e4f,hollywoodreporter.com,hollywoodreporter.com,'Daily Show' Audience Has Stuck Around Since Jon Stewart's Return,2024-04-23,https://www.hollywoodreporter.com/tv/tv-news/daily-show-ratings-stay-high-after-jon-stewart-return-1235879473/,en,2024-04-24 13:23:19.325254
1cc0ac5c04d4340225ea00d3269bf3d95bf9b0267517fc8b904e77302ea4a2c7,benzinga.com,benzinga.com,Yieldmo Announces Lindsey DiGiorgio as New Chief Marketing Officer,2024-04-23,https://www.benzinga.com/pressreleases/24/04/g38378602/yieldmo-announces-lindsey-digiorgio-as-new-chief-marketing-officer,en,2024-04-24 06:20:42.546025
89c6f991f15ba636dad90a99f7df396ddc0bd46e6aff144adcb851c7c6556acc,forbes.com,forbes.com,Columbia Says It’s ‘Grateful’ To Robert Kraft After Billionaire Pulled Funding,2024-04-23,https://www.forbes.com/sites/jamesfarrell/2024/04/23/columbia-says-its-grateful-to-robert-kraft-after-billionaire-pulled-funding/,en,2024-04-24 08:18:59.392752
e6fc62dc9b1c815ca2061daede104bc6b898e89b67ab32acae76fb8a150842a3,startribune.com,startribune.com,Spain reopens a probe into a Pegasus spyware case after a French request to work together,2024-04-23,https://www.startribune.com/spain-reopens-a-probe-into-a-pegasus-spyware-case-after-a-french-request-to-work-together/600360975/,en,2024-04-24 05:56:35.103474
d4da42a4aa3d14e0bf082c5149bd299d00e4028d4929211af9f13df9e1bd671d,mashable.com,mashable.com,Apple confirms May 7 event: We're expecting new iPads and 2 other products,2024-04-23,https://mashable.com/article/apple-ipad-event-announcement-2024,en,2024-04-24 01:36:46.198010
4f3631bb1793a843d03dabce5b2566b3b6ed05b140dcc582ac83ccbaeba11fe5,foxsports.com,foxsports.com,2024 NFL Draft: Do the Bills need to trade up for a WR1?,2024-04-23,https://www.foxsports.com/stories/nfl/2024-nfl-draft-do-the-bills-need-to-trade-up-for-a-wr1,en,2024-04-24 12:40:19.916385
289fe8f4b6b77400d9249fef9e45cde523ada610605b24d1d1879db4eda2e0b1,theguardian.com,theguardian.com,Harry Kewell’s redemption arc nears completion in Asian Champions League,2024-04-23,https://www.theguardian.com/football/2024/apr/23/harry-kewell-asian-champions-league-yokohama-f-marinos-coach-redemption-arc,en,2024-04-24 01:15:26.353808
7c841213dbffcc9a13fd575c33ff0a036cd3925c22df9eee8d2eadf11b915a2a,benzinga.com,benzinga.com,Jeff Bezos-Backed REIT Adds New Single-Family Rentals To Its Portfolio,2024-04-23,https://www.benzinga.com/real-estate/reit/24/04/38387699/jeff-bezos-backed-reit-adds-new-single-family-rentals-to-its-portfolio,en,2024-04-24 17:40:19.482789
fd699c23e1ee97e2ae4543cb20ffe7e1042fb3b77dd038d9071ab1765b3fac61,arkansasonline.com,arkansasonline.com,"U.S. Department of Transportation awards the University of Arkansas $548,492 grant to revitalize downtown Pine Bluff",2024-04-23,https://www.arkansasonline.com/news/2024/apr/23/us-department-of-transportation-awards-the-university-of-arkansas-548492-grant-to-revitalize-downtown-pine-bluff/,en,2024-04-24 13:51:56.277478
1c1bd28df9f2f9fe26bb2e97e3e6563a1fd69906c76523869f23397da6cb55b0,newsweek.com,newsweek.com,Joe Biden Just Had His 'Charlottesville' Moment,2024-04-23,https://www.newsweek.com/joe-biden-charlottesville-moment-israel-1893145,en,2024-04-24 01:25:27.697304
85776927337389ff446cc2cb7d3d2d1f85728dda6d044b38cc66929a94566e57,sportingnews.com,sportingnews.com,Lions' Jared Goff clarifies comments about Detroit media's negativity,2024-04-23,https://www.sportingnews.com/us/nfl/news/lions-jared-goff-detroit-media-negativity-clarifies/18d237ce45e0e6dbf7b55ffc,en,2024-04-24 15:03:18.190580
be64b1b001d4cd9b5a37dd48a536347e359d1717fc1a01847e808e7078e9e6f0,cbsnews.com,cbsnews.com,"Don Steven McDougal indicted in murder, attempted kidnapping of 11-year-old Audrii Cunningham",2024-04-23,https://www.cbsnews.com/texas/news/don-steven-mcdougal-indicted-audrii-cunningham-murder-kidnapping/,en,2024-04-24 14:49:11.501034
be3315e148b3b16c740c5abe84cf39b118101576ea56c406f9d2c2fad78bbf9f,mlive.com,mlive.com,"Wolverine Confidential: Michigan spring game, QB competition, recruiting",2024-04-23,https://www.mlive.com/wolverines/2024/04/wolverine-confidential-michigan-spring-game-qb-competition-recruiting.html,en,2024-04-24 15:03:03.026045
1c1e83b0b468ba0c6ae3f2b52de21c9188c692e69f60b57222a9873e50cbbb7f,seattletimes.com,seattletimes.com,Ex-police officer pleads guilty to punching man in custody about 13 times,2024-04-23,https://www.seattletimes.com/nation-world/nation/ex-police-officer-pleads-guilty-to-punching-man-in-custody-about-13-times/?utm_source=RSSutm_medium=Referralutm_campaign=RSS_all,en,2024-04-24 12:29:18.807725
c0ec3a2dc8a10b812e5b719524f5e211f8044df0a787ff42dcdc12482ee6e659,npr.org,npr.org,Schools try to balance freedom of speech and security during student protests,2024-04-23,https://www.npr.org/2024/04/23/1246682974/schools-try-to-balance-freedom-of-speech-and-security-during-student-protests,en,2024-04-24 18:57:07.971088
f636936fa14f562b13c8879bd230803243a32548fe954163f802240daa0de586,benzinga.com,benzinga.com,DOL Finalizes Plans for Fiduciary-Only Regime,2024-04-23,https://www.benzinga.com/pressreleases/24/04/r38389359/dol-finalizes-plans-for-fiduciary-only-regime,en,2024-04-24 21:16:35.056786
a6f88ef9dec36746be6f39387520da3d63ad729727db0c2fbe6e77f12b810743,mercurynews.com,mercurynews.com,Gilroy: Suspect sought in grocery store parking lot shooting,2024-04-23,https://www.mercurynews.com/2024/04/23/gilroy-suspect-sought-in-grocery-store-parking-lot-shooting/,en,2024-04-24 18:10:37.259233
b964a9f28f982d834d1c5f0969cc8ff7f5d8a5240e299216711dc9d1b5dfd054,benzinga.com,benzinga.com,Celebrating the Spirit of the Doolittle Raid: Sino-American Cultural Exchange Marks 82nd Anniversary,2024-04-23,https://www.benzinga.com/pressreleases/24/04/n38387044/celebrating-the-spirit-of-the-doolittle-raid-sino-american-cultural-exchange-marks-82nd-anniversar,en,2024-04-24 20:00:09.008681
0a34afb3bbb38bd739c96a3747f12a322b321c503196be3d768f1beedf08afa7,nypost.com,nypost.com,14 bathrobes he’ll actually wear in 2024,2024-04-23,https://nypost.com/shopping/best-mens-robes/,en,2024-04-24 15:44:27.106874
8b4d9e621771b642e5fdde198b74b077223f7143767463a09109e81d981341a6,nytimes.com,nytimes.com,Here’s the latest on the trial.,2024-04-23,https://www.nytimes.com/live/2024/04/23/nyregion/trump-hush-money-trial-news/trump-trial-testimony-gag-order,en,2024-04-24 11:26:58.181318
c0d090fd0f491fa11d8c9efa3c7111512e987c39969f22421e6ccc8c87654bea,forbes.com,forbes.com,In Photos: Comet Seen During The Total Solar Eclipse Vaporizes Hours Later,2024-04-23,https://www.forbes.com/sites/jamiecartereurope/2024/04/23/in-photos-comet-seen-during-the-total-solar-eclipse-vaporizes-hours-later/,en,2024-04-24 08:22:07.097409
45378ad85c1ce1cd58dce7d5d2392e7dfeb180747d157d3d04af2af2e370d9a4,cbsnews.com,cbsnews.com,Summer Lee defeats Bhavini Patel in Pennsylvania's 12th Congressional District primary,2024-04-23,https://www.cbsnews.com/news/summer-lee-bhavini-patel-pennsylvania-12th-congressional-district-election-news/,en,2024-04-25 03:44:26.460435
17c963d302744d03eae0169c88be0e58baee12099aced251630b0f69ee463110,espn.com,espn.com,Transfer Talk: De Jong to Bayern could hinge on salary,2024-04-23,https://www.espn.com/soccer/story/_/id/40001064/transfer-talk-bayern-getting-de-jong-depend-salary,en,2024-04-24 14:26:45.546790
9bfc0b8c9a755534bb48e615a42ad0aed91f78526f6c364a1e8f20baade1fc5a,nbcnews.com,nbcnews.com,Koch network group works to engage voters early in key Senate race,2024-04-23,https://www.nbcnews.com/politics/2024-election/koch-network-group-works-engage-voters-early-key-senate-race-rcna148868,en,2024-04-24 08:13:04.177144
ff005df93ac2495e4682243824839fa0e68dd172a595fbe60575ff3d70b50004,startribune.com,startribune.com,"From pop to politics, what to know as Sweden prepares for the 2024 Eurovision Song Contest",2024-04-23,https://www.startribune.com/from-pop-to-politics-what-to-know-as-sweden-prepares-for-the-2024-eurovision-song-contest/600360920/,en,2024-04-24 05:53:13.598632
b9fd7ddc1e5855098343b9a8c81bdc8990f55ea6fdf553a44af58b13e89e03b8,baltimoresun.com,baltimoresun.com,New Hampden festival with a ‘hyperlocal’ focus hopes to fill HonFest’s shoes,2024-04-23,https://www.baltimoresun.com/2024/04/23/hampden-festival-replaces-honfest/,en,2024-04-24 02:47:05.706296
553f66afa389fab5cc5b3c61cacc11e272b9e613f26458476cb767ff5beaef41,cnn.com,cnn.com,"أمريكا تعلق على ""توقيت"" استهداف قواتها بسوريا من ميليشيا موالية لإيران",2024-04-23,https://arabic.cnn.com/middle-east/article/2024/04/23/state-dept-condemns-attack-by-iran-aligned-militia-aimed-at-us-forces-in-syria,ar,2024-04-24 12:51:35.533367
294a5039f6e84df1d9b33511809d3ea2ee38a3c9e93949b1e0faaed7a5ab79a3,startribune.com,startribune.com,"AP Sports Week in Pictures: Pitcher Randy Vazquez, Olympic flame and Nelly Korda's pond splash",2024-04-23,https://www.startribune.com/ap-sports-week-in-pictures-pitcher-randy-vazquez-olympic-flame-lit-and-nelly-kordas-pond-splash/600360951/,en,2024-04-24 06:36:45.618488
73aaebb2d0ff0a28450e554f961ac2e8f18c8b99297fb1ed97e3b0a9c50d610e,latimes.com,latimes.com,Supreme Court skeptical of siding with L.A. man denied visa over tattoos,2024-04-23,https://www.latimes.com/politics/story/2024-04-23/supreme-court-los-angeles-visa-tattoos,en,2024-04-24 03:35:29.120561
d2a5ee0f00aa0c73e92f54138b12d74cb0df9abf57da226dcbdeadb4160d6df1,benzinga.com,benzinga.com,"ROSEN, RECOGNIZED INVESTOR COUNSEL, Encourages Compass Minerals International, Inc. Investors to Inquire About Securities Class Action Investigation – CMP",2024-04-23,https://www.benzinga.com/pressreleases/24/04/g38394058/rosen-recognized-investor-counsel-encourages-compass-minerals-international-inc-investors-to-inqui,en,2024-04-24 18:07:37.298782
06c6ac5f911b3dd12e12d73d82427c392bb8f1184edc04fb4c8122e92047e524,factcheck.org,factcheck.org,"Q on Reducing COVID-19 Risk for Elderly, Immunocompromised",2024-04-23,https://www.factcheck.org/2024/04/scicheck-qampa-on-reducing-covid-19-risk-for-elderly-immunocompromised/,en,2024-04-24 02:53:35.613110
0a9c0e3257211401d98e952ae3ec8e67e0deb399246ba85623dcd35494e03ea9,startribune.com,startribune.com,"Georgia prison officials in 'flagrant' violation of solitary confinement reforms, judge says",2024-04-23,https://www.startribune.com/georgia-prison-officials-in-flagrant-violation-of-solitary-confinement-reforms-judge-says/600361042/,en,2024-04-24 07:00:01.381143
73ad5de5b0794f1029cb8d7241a091c2b39fb43dac4c73ad7b610e689c2423d7,theguardian.com,theguardian.com,Jerry Seinfeld says the movie business is over: ‘No longer the cultural pinnacle’,2024-04-23,https://www.theguardian.com/film/2024/apr/23/jerry-seinfeld-says-the-movie-business-is-over-pop-tarts-unfrosted,en,2024-04-24 07:38:22.220260
31602cd81e09100b15e49b8698d8847038f63ca3b188e9c408a8a18244ec541b,newsweek.com,newsweek.com,"Dog's reaction to puppies' dad labeled relatable: ""How all new moms feel""",2024-04-23,https://www.newsweek.com/mama-dog-has-relatable-reaction-when-dad-tries-coming-over-1893353,en,2024-04-24 01:39:21.434297
16d7e17e5e708f5fb59d6738508aa24f7dbe05581388c7ddfab85176f4edafae,theverge.com,theverge.com,Anker’s minimalistic home backup batteries are ready for blackout season,2024-04-23,https://www.theverge.com/24136932/anker-solix-x1-home-battery-powerwall-alternative-specs,en,2024-04-24 09:56:09.274249
eb218096afdaededcba6d520e04aca67d9916b3d7b89ad747c323822b46415ca,cbsnews.com,cbsnews.com,TikTok prepared to fight legislation pushing for ban,2024-04-23,https://www.cbsnews.com/chicago/video/tiktok-prepared-to-fight-legislation-pushing-for-ban/,en,2024-04-24 04:11:55.330135
32687149b75ba7cf6d042b87aa3d93a35d4497ad015cb3a5306468b9145f4232,theguardian.com,theguardian.com,Victoria Beckham’s collaboration with Mango shows how far designer has come,2024-04-23,https://www.theguardian.com/fashion/2024/apr/23/victoria-beckham-collaboration-high-street-mango,en,2024-04-24 13:13:25.359862
