id,media_name,media_url,title,publish_date,url,language,indexed_date
68ecb41811131643ccc1707070815538c77f914b8ca474a53d5933cf1b927f13,nypost.com,nypost.com,Looking for a good night’s rest? You should head to this sunny state,2024-01-23,https://nypost.com/2024/01/23/lifestyle/looking-for-a-good-nights-rest-you-should-head-to-this-state/,en,2024-01-25 00:20:20.000000
3b069b1867197c6ae4991f55bc105e1446efc7ba505408895d03823eabd4baea,upi.com,upi.com,SEC: 'SIM swap' used in X hack that led to early bitcoin ETF announcement,2024-01-23,https://www.upi.com/Top_News/US/2024/01/23/SEC-hack-SIM-swap/3681706010628/,en,2024-01-25 04:48:57.000000
80608d522c63748cf8481cb13eef8f6d99cc3f39e44ecc65166a425836dffda2,businessinsider.com,businessinsider.com,Jack in the Box went through 60 different versions of its new burger before landing on the final recipe,2024-01-23,https://www.businessinsider.com/jack-in-the-box-new-burger-development-2024-1,en,2024-01-25 00:53:51.000000
3cd1ec8c7c3fe848fa4f39d2ac26ac382c001650651301b602c3f94306c17f36,reuters.com,reuters.com,米国株式市場＝Ｓ＆Ｐ、3営業日連続で最高値更新 ダウは反落,2024-01-23,https://jp.reuters.com/markets/us/3XB7Y5RTVJP7XAQXLCEJWIBMZI-2024-01-23/,ja,2024-01-25 02:54:30.000000
836ba98799df68ca6225e33674660374ce25a4ada4d1150e87f25812b01a6a9e,cbsnews.com,cbsnews.com,"Economy is most important issue for New Hampshire primary voters, CBS News exit poll shows",2024-01-23,https://www.cbsnews.com/video/economy-is-most-important-issue-for-new-hampshire-primary-voters-cbs-news-exit-poll-shows/,en,2024-01-26 01:07:47.000000
04eb33a88747615ab4d7bf901ff167187604c2a689f2154ced62cdaa8704f5e6,abcnews.go.com,abcnews.go.com,3 people arrested in the Netherlands on suspicion of violating EU sanctions with exports to Russia,2024-01-23,https://abcnews.go.com/International/wireStory/3-people-arrested-netherlands-suspicion-violating-eu-sanctions-106603174,en,2024-01-25 02:21:00.000000
69dbce4aaf58b92329e3c416fc2f7e4561d04cf647a9ef8b8c22bdea10bb6e69,techradar.com,techradar.com,5 things the Pokémon games need to learn from Palworld,2024-01-23,https://www.techradar.com/gaming/5-things-the-pokemon-games-need-to-learn-from-palworld,en,2024-01-25 09:07:00.000000
1cdf392a5a574d7c6bff6b0e54512e8ebf26de92a8a1fc45567473ba34b93db0,tmz.com,tmz.com,Chris Young Arrested After Alleged Altercation With Officials At Nashville Bar,2024-01-23,https://www.tmz.com/2024/01/23/country-singer-chris-young-arrested-nashville-bar-alleged-confrontation-tabc-agents/,en,2024-01-25 03:20:05.000000
6004f527db8a3cb3f8b831d7e58a28e6fb39a63fd67b47bd43c96eccb195c5f1,newsday.com,newsday.com,Oliver North says NRA reacted to misconduct allegations like a 'circular firing squad',2024-01-23,https://www.newsday.com/news/nation/Oliver-North-NRA-Wayne-LaPierre-k32235,en,2024-01-26 04:10:37.000000
cbd730805da10a5f915fe34e2cd6d36f15e7f05b903dd0912501503c4945e989,buzzfeed.com,buzzfeed.com,37 Cool Things From This Month That Are Living In 3024,2024-01-23,https://www.buzzfeed.com/hannahmarder/cool-things-from-this-month-living-in-3024,en,2024-01-25 01:15:57.000000
b57c265f301af5f7ed17f6d7f4ce8be233e4f0c6067ec72da61cac181a3bd63b,oregonlive.com,oregonlive.com,Albina Vision Trust proposes swap: Portland Public Schools headquarters for downtown building,2024-01-23,https://www.oregonlive.com/education/2024/01/albina-vision-trust-proposes-swap-portland-public-schools-headquarters-for-downtown-building.html,en,2024-01-25 01:56:15.000000
eff2c7642885468b3901c7bcc139bd202ff709d785cc541d695bf7111d20ad14,politicalwire.com,politicalwire.com,Trump Wins New Hampshire Primary,2024-01-23,https://politicalwire.com/2024/01/23/trump-wins-new-hampshire-primary/,en,2024-01-26 03:47:08.000000
09194a280f4ee128ebe86e24d3284b2f0c91073cead0564326186f294de1ae3c,oann.com,oann.com,"Ongoing Manhunt For 2 Inmates, 1 Held For Murder, Who Escaped Arkansas Jail",2024-01-23,https://www.oann.com/newsroom/ongoing-manhunt-for-2-inmates-1-held-for-murder-who-escaped-arkansas-jail/,en,2024-01-25 03:43:01.000000
0c31e12998a68e56fac5c4323b8565db6bd5034ced00f1492e8a9a36e1e32b5a,marketwatch.com,marketwatch.com,How To Get a Home Equity Loan With Bad Credit,2024-01-23,https://www.marketwatch.com/guides/home-equity/get-a-home-equity-loan-with-bad-credit/,en,2024-09-06 23:28:14.767113
e15d5182f02bf1f27dc9ccb5a8aceeb00ca1c202f5ab1949af0bd4ec67dc5486,tmz.com,tmz.com,'Star Trek' Star Gary Graham Dead at 73,2024-01-23,https://www.tmz.com/2024/01/23/star-trek-star-gary-graham-dead-dies/,en,2024-01-25 03:20:05.000000
4fdfeb3c6a9523cb2794e0d1f2839feeb96a8b06e55643fcd857ae44da790bb6,seattletimes.com,seattletimes.com,"Mocked as ‘Pokémon with guns,’ Palworld becomes an instant hit",2024-01-23,https://www.seattletimes.com/business/technology/mocked-as-pokemon-with-guns-palworld-becomes-an-instant-it/?utm_source=RSS&utm_medium=Referral&utm_campaign=RSS_all,en,2024-01-25 08:09:19.000000
102af8aca5f85cdd54d2145e400ac903c31c1cf6e543b75153a82ddf46e9262f,mlive.com,mlive.com,"Bay City area roundup: Senior steps off 2-hour bus ride, hits three 3-pointers",2024-01-23,https://www.mlive.com/highschoolsports/2024/01/bay-city-area-roundup-senior-steps-off-2-hour-bus-ride-hits-three-3-pointers.html,en,2024-01-26 02:20:50.000000
33ef42b8fbe2ecad326506076ef206f7fc59067d771ce2a3cb73dd3f7bdf4a66,bleacherreport.com,bleacherreport.com,Stefon Diggs and 5 Other NFL Stars Who Might Get Traded in 2024 Offseason,2024-01-23,https://bleacherreport.com/articles/10106215-stefon-diggs-and-5-other-nfl-stars-who-might-get-traded-in-2024-offseason,en,2024-01-25 05:35:47.000000
8790f820292220eeac715f5dfd43c64785e7326a1f194a0c42648d2955f89574,nypost.com,nypost.com,"Brooklyn Fare owner claims famed chef looted $500K worth of wine, ‘caviar spoons’ in bitter legal feud",2024-01-23,https://nypost.com/2024/01/23/business/brooklyn-fare-owner-claims-famed-chef-cesar-ramirez-looted-500k-worth-of-goods/,en,2024-01-25 00:20:20.000000
99952801ee1aa8259a7f9ef183c6bf3418fbaa0f5516f0eca5d3d25024e77be2,nj.com,nj.com,Quick offensive combos lead No. 5 Oak Knoll past No. 2 Immaculate Heart,2024-01-23,https://www.nj.com/highschoolsports/2024/01/quick-offensive-combos-lead-no-5-oak-knoll-past-no-2-immaculate-heart.html,en,2024-01-26 00:41:09.000000
70f21e93db7d09f1dcd843ebbe2bf7feca0b1c6fa27e578969609fe76cd4d32d,cbsnews.com,cbsnews.com,Doomsday clock remains set at 90 seconds to midnight,2024-01-23,https://www.cbsnews.com/video/doomsday-clock-remains-set-at-90-seconds-to-midnight/,en,2024-01-26 01:07:47.000000
a86588924d16eba5cba60d74d1248fe5d0dd2b22cccf3c9169901e8b5fc41027,cbsnews.com,cbsnews.com,Satan Club at Orange County elementary school stirs controversy,2024-01-23,https://www.cbsnews.com/losangeles/news/satan-club-at-orange-county-elementary-school-stirs-controversy/,en,2024-01-26 01:07:50.000000
cf6975db3a04c68922f53e7c5a248d749b2ab9b0d5fb9f839aa51c53d879419e,foxnews.com,foxnews.com,"Clint Eastwood biography returned to library 38 years late, mystery borrower avoids $6K in fees",2024-01-23,https://www.foxnews.com/lifestyle/clint-eastwoods-biography-returned-library-38-years-late-mystery-borrower-avoids-6k-fees,en,2024-01-26 01:30:04.000000
135299d5500767bcd55ee517b5ff9c4adcf55859fc06d9c2d037348c0e0876cb,theverge.com,theverge.com,Netflix’s new Avatar: The Last Airbender trailer has cute critters and dramatic battles,2024-01-23,https://www.theverge.com/24047888/avatar-the-last-airbender-trailer-netflix,en,2024-01-25 04:59:22.000000
8cb2edd96ba4c9abd2ad2a0bb8ba4baf518bbdef9c744409d42b260ac549b81c,newsweek.com,newsweek.com,South Pacific sees US-China tussle as Beijing secures new ally,2024-01-23,https://www.newsweek.com/south-pacific-beijing-secure-ally-ma-us-china-tensions-1863035,en,2024-01-25 01:44:16.000000
d90eb0efd6a2a655df1bd2a1f3ed8d562b2588b8f10b687d064cc461f70609fd,marketwatch.com,marketwatch.com,"Dow ends lower, S&P 500 closes at third record high this year as earnings season ramps up",2024-01-23,https://www.marketwatch.com/story/s-p-500-futures-hold-at-record-highs-as-earnings-season-ramps-up-netflix-eyed-after-the-close-de2923e4?g=db1cd18e-07dc-47f0-b6c2-35c132b62fdd&mod=mw_rss_bulletins,en,2024-01-26 03:04:49.000000
f1aee229032dda4f7f06f17683dfd04eda56b43bbcaeccfcfdd0a68672f1ead1,nj.com,nj.com,Hanover Park girls basketball rings up seventh straight win,2024-01-23,https://www.nj.com/highschoolsports/2024/01/hanover-park-girls-basketball-rings-up-seventh-straight-win.html,en,2024-01-26 00:41:06.000000
6c876712ce8656e7f975d15275cae5b55b367f4eeb8575ada351f6c2af80155f,newsweek.com,newsweek.com,Senior dog greets old friend he'd see on walks like 'no time has passed',2024-01-23,https://www.newsweek.com/senior-dog-greets-old-friend-hed-see-walks-like-no-time-has-passed-1863131,en,2024-01-25 01:44:17.000000
521fc0b3cd995ad7defb5a59d222d0bdd9660efda0c294dfa986dd760094db18,chicagotribune.com,chicagotribune.com,"Lockport’s Claudia Heeney takes heed, shuts down for a few weeks. How’s her comeback going? ‘She’s relentless.’",2024-01-23,https://www.chicagotribune.com/suburbs/daily-southtown/sports/ct-sta-gwr-lock-heeney-st-0124-20240123-dcp7coadordh7pq4rraeju3gea-story.html,en,2024-01-25 01:52:41.000000
af2c887460f73d7b30ba30359908a89d17684bb74ac474845f9a4c7398882b25,cbssports.com,cbssports.com,"Rory McIlroy, Max Homa, Rose Zhang and Lexi Thompson to square off in The Match 2024 golf event",2024-01-23,https://www.cbssports.com/golf/news/rory-mcilroy-max-homa-rose-zhang-and-lexi-thompson-to-square-off-in-the-match-2024-golf-event/,en,2024-01-25 01:36:05.000000
5d4728327e877aed2f9f964bdc4ccf2a5aec6db080d5d8628cba3f7c79ad98ec,armytimes.com,armytimes.com,Supreme Court says Texas Guard can’t block federal agents from border,2024-01-23,https://www.armytimes.com/news/your-army/2024/01/23/supreme-court-says-texas-guard-cant-block-federal-agents-from-border/,en,2024-01-25 10:41:21.000000
a37cbcfe08eba1d82137cc0c82b68b596b2bd8af6badd791fa6c13f0384b58f8,theguardian.com,theguardian.com,Australia sanctions Russian Aleksandr Ermakov over Medicare hack – video,2024-01-23,https://www.theguardian.com/australia-news/video/2024/jan/23/australia-sanctions-russian-aleksandr-ermakov-over-medicare-hack-video,en,2024-01-25 01:15:57.000000
fc544264a5ac4123c8671daf2fad5052697381eda8d17f2d58eebc8324708439,newsday.com,newsday.com,"Dwayne 'The Rock' Johnson gets rights to one of the most famous nicknames in entertainment, his own",2024-01-23,https://www.newsday.com/business/TKO-WWE-UFC-Rock-Teremana-ZOA-board-o97179,en,2024-01-26 04:11:16.000000
f4733990d7004b7bb54020aab00953cb135fabcdac07599796af0564f3c2024e,ocregister.com,ocregister.com,This week’s bestsellers at Southern California’s independent bookstores,2024-01-23,https://www.ocregister.com/2024/01/23/this-weeks-bestsellers-at-southern-californias-independent-bookstores-109/,en,2024-01-26 03:51:49.000000
f046b2c560870990840e1ec47ce5dab10bc00d77bd473df388befc68cb8ac5f4,nytimes.com,nytimes.com,"In Vietnam, Star-Crossed Lovers Brave the Tides of War",2024-01-23,https://www.nytimes.com/2024/01/23/books/review/andrew-pham-twilight-territory.html,en,2024-01-25 00:09:33.000000
d83702501553ed8f19173eb9d9366fd919a8fdb6ecd36d268d6c7ff9ecd2286e,ign.com,ign.com,Tekken 8 Review,2024-01-23,https://www.ign.com/videos/tekken-8-review,en,2024-01-25 08:14:45.000000
95b3d68fafc3f13a0e1cd35e8b2e9bdb1a3065081b8ecfa233c142e6d156a2b4,alternet.org,alternet.org,Dean Obeidallah: Trump’s mental gaffes 'raise red flags' about his 'cognitive abilities',2024-01-23,https://www.alternet.org/nikki-haley-is-100-percent-correct-to-raise-red-flags-about-trumps-mental-fitness-radio-host/,en,2024-01-25 05:30:23.000000
30371c44c1ade6e165d4f7480d89bc8a7c508c320432ec2452b28d6c07f6ec7e,newsday.com,newsday.com,Hofstra beats Stony Brook with second-half rally in 'Battle of Long Island',2024-01-23,https://www.newsday.com/sports/college/stony-brook/hofstra-stony-brook-d8eji98g,en,2024-01-26 04:11:33.000000
f4dec00e87aa7fe153c2da50fb019947e45d4caaffef7b6435c05e52a6d80ac9,sun-sentinel.com,sun-sentinel.com,New Hampshire takeaways: Trump’s path becomes clearer. So does the prospect of a rematch with Biden.,2024-01-23,https://www.sun-sentinel.com/2024/01/23/new-hampshire-takeaways-trumps-path-becomes-clearer-so-does-the-prospect-of-a-rematch-with-biden/,en,2024-01-26 05:18:37.000000
b66c35c29a9a2e7cbb2b35859c89b9dd870ac1f396e0de65101dec870d5c0c8f,latimes.com,latimes.com,The town where nobody knows your address (because nobody has one),2024-01-23,https://www.latimes.com/california/newsletter/2024-01-23/the-town-where-nobody-knows-your-address-because-nobody-has-one-essential-california,en,2024-01-25 02:49:37.000000
c2ebe1eb8c8bdf90eef31d2cbccaa56871e3d3e585343631756b0b7d6d917abf,dailycaller.com,dailycaller.com,"MLB Adds Legends Beltre, Helton and Mauer To Hallowed Hall Of Fame",2024-01-23,https://dailycaller.com/2024/01/23/mlb-legend-adrian-beltre-joe-mauer-todd-helton-hall-of-fame/,en,2024-01-26 05:41:38.000000
981901f1e8f15c3dd5081a061fa0481ec99ae06e4ad498f24fb9f70a05cceefe,upi.com,upi.com,Jury finds N.Y. man guilty in mistaken driveway slaying case,2024-01-23,https://www.upi.com/Top_News/US/2024/01/23/Kaylin-Gillis-murder-guilty/6601706050461/,en,2024-01-26 03:01:47.000000
733d0c378d881b514bffef57c863d1a7bcb7912a682172d6e97439bd47f26347,reuters.com,reuters.com,アジア・ジェネシスがヘッジファンド閉鎖、中国と日本で大幅損失,2024-01-23,https://jp.reuters.com/markets/japan/funds/2R4EKX5XE5JPPNORAPS23UQENA-2024-01-23/,ja,2024-01-25 02:54:18.000000
e966aba3cc06f7f7d9dbb6cb9340bc8fdeb30d98be99eb9ee48da0aa00c1d1f4,mercurynews.com,mercurynews.com,Letters: Solano County,2024-01-23,https://www.mercurynews.com/2024/01/23/letters-1580/,en,2024-01-26 04:00:57.000000
3dcb3e36f0b586e97accffa4a18313300f35fb4fa2af3c410070884593014db4,foxnews.com,foxnews.com,McConnell says NH primary of 'great interest' but declines to endorse Trump amid mounting pressure,2024-01-23,https://www.foxnews.com/politics/mcconnell-says-nh-primary-great-interest-declines-endorse-trump-mounting-pressure,en,2024-01-25 04:01:07.000000
87450b779ccf6305f9656c56ef24edea3780ac9941407b5351ad2ffee0d1af9f,buzzfeed.com,buzzfeed.com,What's My Taylor Swift Love Story? Taylor Swift Love Quiz,2024-01-23,https://www.buzzfeed.com/bergespuyolucya/taylor-swift-love-style-lyric-quiz,en,2024-01-27 02:45:44.000000
5f7de41667e308e11983a309e09e6fb5c9d08323b874b4522cc66b1ff8fc00db,nj.com,nj.com,Guidetti leads Rumson-Fair Haven past Colts Neck- Girls basketball recap,2024-01-23,https://www.nj.com/highschoolsports/2024/01/guidetti-leads-rumson-fair-haven-past-colts-neck-girls-basketball-recap.html,en,2024-01-26 00:40:30.000000
2f8d38b2e57f69b989a3b624386d7cc43f905f44e9c23d450ba7f544df496ec7,nypost.com,nypost.com,Why you need to clear your path forward during 2024’s full Wolf Moon in Leo,2024-01-23,https://nypost.com/2024/01/23/astrology/january-full-wolf-moon-in-leo/,en,2024-01-25 00:20:17.000000
97eb488213521f2235cd54c8e159a951d29fd573ef191c23da88a698d22ed355,centralmaine.com,centralmaine.com,Commentary: The gig economy sucked in millennials like me. Will we ever get out?,2024-01-23,https://www.centralmaine.com/2024/01/23/commentary-the-gig-economy-sucked-in-millennials-like-me-will-we-ever-get-out/,en,2024-01-25 05:41:24.000000
3040f3fafbcf1aae6c7cb7fac3bc1e6f085681343770c68856bdb368835e679e,politicalwire.com,politicalwire.com,House Ethics Probe Into Matt Gaetz Heats Up,2024-01-23,https://politicalwire.com/2024/01/23/house-ethics-probe-into-matt-gaetz-heats-up/,en,2024-01-25 05:47:19.000000
c181f4869aa752945678ebc224866ece089723d04c81d4e91375042fde1cf5d2,benzinga.com,benzinga.com,Weatherford International Insider Trades Send A Signal,2024-01-23,https://www.benzinga.com/insights/news/24/01/36739148/weatherford-international-insider-trades-send-a-signal,en,2024-01-25 00:29:38.000000
13f93dde3772dfbd919711cc22694c9523052907dde43a289636e20cacbcf9eb,orlandosentinel.com,orlandosentinel.com,Gambling risks rise for young people. How to lower the stakes,2024-01-23,https://www.orlandosentinel.com/2024/01/23/gambling-risks-rise-for-young-people-how-to-lower-the-stakes/,en,2024-01-25 05:19:28.000000
1195e8af73c39b41359c4e0ad44b93f7e751f07ee3df50f07d1f68260e1cc5d0,newsday.com,newsday.com,Real Sociedad defeats Celta Vigo 2-1 to return to Copa del Rey semifinals,2024-01-23,https://www.newsday.com/sports/soccer/celta-vigo-real-sociedad-copa-del-rey-k68076,en,2024-01-26 04:10:21.000000
4530729e699c8c9eb05d28fe8e74d7bcf04cfb9d4bc148b0ef0dc614e00eb3ee,benzinga.com,benzinga.com,12 Health Care Stocks Moving In Tuesday's Intraday Session,2024-01-23,https://www.benzinga.com/insights/movers/24/01/36743051/12-health-care-stocks-moving-in-tuesdays-intraday-session,en,2024-01-25 00:26:23.000000
befae138033792b99e96f47c6ae653673e521808af64434294b0eaed141aa9c0,nytimes.com,nytimes.com,January May Be the Best Month to Get Married. Here’s Why.,2024-01-23,https://www.nytimes.com/2024/01/23/style/slow-wedding-season-january.html,en,2024-01-25 00:09:41.000000
4f5b346603b1f510f1c8746b7b5b07a387398648b1be631199fbe0b1d39f550a,nypost.com,nypost.com,Nearly 1K manatees spotted in record-breaking swim at Florida park,2024-01-23,https://nypost.com/2024/01/23/news/nearly-1000-manatees-spotted-in-record-breaking-swim-at-florida-park/,en,2024-01-25 00:20:21.000000
407d30a71fa901bffd5dbf993c2aa47e241fc8f5acbc6b645f8fdd78a1dcebb5,usmagazine.com,usmagazine.com,Becca Kufrin Tries on Pre-Pregnancy Clothes After Giving Birth to Son,2024-01-23,https://www.usmagazine.com/celebrity-moms/news/becca-kufrin-tries-on-pre-pregnancy-clothes-after-giving-birth-to-son/,en,2024-01-26 03:49:09.000000
02b3f04f09699af69f4188b204550ac9275de69339b7364c26befe9804ffc51d,benzinga.com,benzinga.com,Dynamic Light Assist Technology Market Demand to Reach USD 4.8 Billion by 2032 | Amid Growing Need for Advanced Automotive Safety Solutions,2024-01-23,https://www.benzinga.com/pressreleases/24/01/g36733820/dynamic-light-assist-technology-market-demand-to-reach-usd-4-8-billion-by-2032-amid-growing-need-f,en,2024-01-25 00:22:18.000000
de903d33c7a42a3f304ec1a31a747771ce0deb744213b0dd0c9883135127dfa6,benzinga.com,benzinga.com,"Vanillin Market Projected to Surge at 9.3% CAGR, Reaching US$ 7.29 Billion by 2033, Persistence Market Research",2024-01-23,https://www.benzinga.com/pressreleases/24/01/g36742797/vanillin-market-projected-to-surge-at-9-3-cagr-reaching-us-7-29-billion-by-2033-persistence-market,en,2024-01-25 00:26:00.000000
9d7160c576dca845e67c7af85bb41b7858f4eefa27f01fad9aff31cf910a440e,mlive.com,mlive.com,Kombucha’s on tap at a new ‘fresh and funky’ West Michigan wellness bar,2024-01-23,https://www.mlive.com/news/grand-rapids/2024/01/kombuchas-on-tap-at-a-new-fresh-and-funky-west-michigan-wellness-bar.html,en,2024-01-25 01:45:00.000000
44c4fb59ad92051ff2e3877f202ff8ddd8005d35b02a3a26e46d20a066ce52ca,baltimoresun.com,baltimoresun.com,"Tripadvisor’s top 10 trending destinations include Napa, St. Petersburg and Homer, Alaska",2024-01-23,https://www.baltimoresun.com/2024/01/23/tripadvisors-top-10-trending-destinations-include-this-wine-country-gem/,en,2024-01-25 05:42:50.000000
e2798bc074e24f9366923cfc5070f00a5f16a9037d7088c8115479c7c4276dbf,tmz.com,tmz.com,Madonna Sings Happy Birthday to Daughter Onstage During MSG Concert,2024-01-23,https://www.tmz.com/2024/01/23/madonna-sings-happy-birthday-daughter-mercy-onstage-concert-msg/,en,2024-01-25 03:20:05.000000
bda5c14820290e27d596bd3996862731701d116ce47abe2ab19b2a6f0f5a2d2c,sportingnews.com,sportingnews.com,Nick Kyrgios and Novak Djokovic: Aussie given hilarious Grand Slam advice at Australian Open,2024-01-23,https://www.sportingnews.com/au/tennis/news/nick-kyrgios-novak-djokovic-australian-open-grand-slam/98e785b8488dc43361621ba0,en,2024-01-25 05:04:11.000000
60f13f918d978eebd369262af2567ef3793b5d05a0dbc1b3b7c8734a9b89d92b,buzzfeed.com,buzzfeed.com,32 Skincare Products Reviewers In Their 30s Swear By,2024-01-23,https://www.buzzfeed.com/jenae_sitzes/skincare-items-people-over-30-love-an,en,2024-03-06 23:21:01.314295
ee2b1f7ae4d3c43188ae8277ec374f8ff2e8ca9233a4962073fe8da2996b27d9,hollywoodreporter.com,hollywoodreporter.com,"Gary Graham, Star of ‘Alien Nation,’ Dies at 73",2024-01-23,https://www.hollywoodreporter.com/tv/tv-news/gary-graham-dead-alien-nation-1235804804/,en,2024-01-25 05:27:34.000000
78937d725f80c2b192530fa7fd52a1658bb22d144f039fcd1276b33f16cd3637,foxnews.com,foxnews.com,Italian Jewish leader slams use of Holocaust survivor quote by group planning anti-Israel protest,2024-01-23,https://www.foxnews.com/world/italian-jewish-leader-slams-use-holocaust-survivor-quote-group-planning-anti-israel-protest,en,2024-01-25 04:01:09.000000
936e4a3de622872c4ce7b5c6a4cd1747edc5a48247530c57019ab088250ce2ea,cleveland.com,cleveland.com,"‘Doomsday Clock’ 2024 closer to midnight than ever before, Bulletin of Atomic Scientists says",2024-01-23,https://www.cleveland.com/news/2024/01/doomsday-clock-2024-closer-to-midnight-than-ever-before-bulletin-of-atomic-scientists-says.html,en,2024-01-25 02:15:24.000000
39139caa37fc6fee85405cae96cd3f8a603276ebdf312d8fc4961d290cfc7ddc,inquisitr.com,inquisitr.com,Harry Potter Fans Are Upset Over J.K. Rowling’s ‘Iron Grip’ on the New HBO Max Series,2024-01-23,https://www.inquisitr.com/harry-potter-fans-express-frustration-over-j-k-rowlings-iron-grip-on-the-new-hbo-max-series,en,2024-01-25 07:35:49.000000
301611501e07d891e9780851806cb53def8f027305d9bc3583ed4b21c738c051,denverpost.com,denverpost.com,"PHOTOS: Todd Helton, a Colorado Rockies icon through the years",2024-01-23,https://www.denverpost.com/2024/01/23/todd-helton-rockies-career-photos/,en,2024-01-25 06:53:40.000000
2d2ede4dd5c5052bc97e4ae71880db3f3feab87a494035eebf6e448a103b21b9,techradar.com,techradar.com,Subway reportedly hit by LockBit ransomware,2024-01-23,https://www.techradar.com/pro/security/subway-reportedly-hit-by-lockbit-ransomware-but-is-it-half-baked-speculation,en,2024-01-25 09:07:00.000000
6fb1e059357cb22bbb61139d8a0a132abca786ebd1ad36baf9e0a7e12373b3e2,nytimes.com,nytimes.com,"Gary Graham, ‘Alien Nation’ and ‘Star Trek: Enterprise’ Actor, Dies at 73",2024-01-23,https://www.nytimes.com/2024/01/23/arts/television/gary-graham-dead-alien-nation-star-trek.html,en,2024-01-26 02:16:49.000000
0ee066ad3125555d3f6332be206697634a989a66a9285bea538a244bc5a362f8,benzinga.com,benzinga.com,Catheter Precision And 2 Other Stocks Under $2 Insiders Are Buying,2024-01-23,https://www.benzinga.com/trading-ideas/long-ideas/24/01/36735892/catheter-precision-and-2-other-stocks-under-2-insiders-are-buying,en,2024-01-25 00:28:56.000000
859029cf61a969721b156d360b788fb1b34b69035c833b5788fb52ef1a0098d2,upi.com,upi.com,"U.S., Australia, Britain sanction Russian cybercriminal behind Medibank attack",2024-01-23,https://www.upi.com/Top_News/US/2024/01/23/Australia-Britain-sanction-Russian-cybercriminal/2291706065624/,en,2024-01-26 03:01:49.000000
6e1f90a7cabaaa16b5f7e50761a37fa4b8f827c8f9d9cd7a1404747b48561dbb,mercurynews.com,mercurynews.com,Sharks defenseman ‘out for a little bit’ with lower body injury,2024-01-23,https://www.mercurynews.com/2024/01/23/sharks-defenseman-to-be-out-for-a-little-bit-with-lower-body-injury/,en,2024-01-25 02:22:20.000000
bb8d29e687482f685ca871b242f46c68ddc047e30c0c1186997ac3189385b926,variety.com,variety.com,'Morning Dew' for Your Morning Brew: This Grateful Dead Bear Mug Is Back in Stock,2024-01-23,https://variety.com/2024/shopping/artists/grateful-dead-mug-cup-buy-online-1235884020/,en,2024-01-25 02:58:43.000000
5f805e00f6cfa769fdeb80271c007f270f501451e9592aaf3bdf94e14283c34a,nbcnews.com,nbcnews.com,Florida anger management specialist accused of fatally shooting homeless man,2024-01-23,https://www.nbcnews.com/news/us-news/florida-anger-management-specialist-accused-fatally-shooting-homeless-rcna135174,en,2024-01-25 05:31:06.000000
2d9b1af3614f3695dd4cb5e6a2efa4130a4eb5c889d6e6f3e10448b09ff76511,reuters.com,reuters.com,ＮＡＴＯ、11億ユーロの砲弾調達契約調印 一部ウクライナ向け,2024-01-23,https://jp.reuters.com/world/ukraine/BPOTO6YCNJLLHGPW7TWB5PYVEI-2024-01-23/,ja,2024-01-25 02:54:24.000000
b6cf7cfe32c413fd4312a66f4cfd2dee4fa39bc6f13bd9a3272b0978041b05f1,abcnews.go.com,abcnews.go.com,Racially diverse Puerto Rico debates bill that aims to ban hair discrimination,2024-01-23,https://abcnews.go.com/International/wireStory/racially-diverse-puerto-rico-debates-bill-aims-ban-106606062,en,2024-01-25 02:20:59.000000
33026423c0def30a6de76f6a22d8d433d02f88a5ba6d43654873916365ddd5c8,post-gazette.com,post-gazette.com,Ray Fittipaldo's Steelers chat transcript: 01.23.24,2024-01-23,https://www.post-gazette.com/sports/steelers/2024/01/23/ray-fittipaldo-s-steelers-chat-01-23-24/stories/202401220099,en,2024-01-25 03:34:12.000000
a4146457d42294ecbde14066798e3463efb07c68061bfab5a4be3658be2dc038,thedailybeast.com,thedailybeast.com,"Britney, Paris, and the 2000s Tabloid Era of Terror",2024-01-23,https://www.thedailybeast.com/toxic-women-fame-and-the-tabloid-2000s-book-highlights-britney-paris-and-more,en,2024-01-25 03:26:52.000000
af1f1533862ffbf97ba4e136bf9801f00a7ea43a8c503cdeaf0044eac76598c8,hollywoodreporter.com,hollywoodreporter.com,"'Rob Peace' Review: Chiwetel Ejiofor Crafts a Conventional but Stirring True Story of Talent, Struggle and Tragedy",2024-01-23,https://www.hollywoodreporter.com/movies/movie-reviews/rob-peace-review-chiwetel-ejiofor-1235803332/,en,2024-01-25 05:27:30.000000
5da9f3a93bfadd0172adeefb27924ed10acbe279bacbfadc60a7ba5d15fc2689,dailycaller.com,dailycaller.com,Court Upholds Ruling Banning Pharma CEO Martin Shkreli For Life,2024-01-23,https://dailycaller.com/2024/01/23/court-uphold-lifetime-ban-martin-shkreli-letitia-james/,en,2024-01-26 05:41:40.000000
28bb4bea14482825ba1463ceb29c8aa13f62ae389b296fee73237f11a0f5e720,ign.com,ign.com,Helldivers 2 - Official Gameplay Overview Trailer,2024-01-23,https://www.ign.com/videos/helldivers-2-official-gameplay-overview-trailer,en,2024-01-25 08:15:02.000000
