id,media_name,media_url,title,publish_date,url,language,indexed_date
ab1920d01a153f5d01f458cef9c94ead9f4c8151d3e179e85c5de18f180b1c7b,nj.com,nj.com,"Penn Relays, 2024: Complete N.J. boys 4x400 preview",2024-04-23,https://www.nj.com/highschoolsports/2024/04/penn-relays-2024-complete-nj-boys-4x400-preview.html,en,2024-04-24 08:45:42.037808
f3cc3154139d2d60522ba23c2cc37491d93a6682b991ff2da309074c74f75c83,gizmodo.com,gizmodo.com,New Vegas' Director Doesn't Mind Whatever Fallout Has Planned With It for Season 2,2024-04-23,https://gizmodo.com/fallout-tv-show-amazon-new-vegas-ending-obsidian-1851429343,en,2024-04-24 07:51:35.985974
b8f4c9748922e6727c2890ada5c2147fdbcad8f1a5ab61ba6b97e8a3e500c960,reuters.com,reuters.com,米ＵＰＳ、利益が予想上回る コスト削減で需要の弱さ相殺,2024-04-23,https://jp.reuters.com/markets/world-indices/A4NTDOXLSBI5PFBHNLDMGBRHIU-2024-04-23/,ja,2024-04-24 11:41:46.026480
775ace28a88e75b05420fde956bca6a06b683ba22bce6c17e1a8ac25774d1fb6,newsbusters.org,newsbusters.org,The Empires Begin to Strike Back,2024-04-23,https://www.newsbusters.org/blogs/nb/cal-thomas/2024/04/23/empires-begin-strike-back,en,2024-04-24 07:59:19.859191
7552b6cc226e6a25ad085a8fe72aba6b0150a330907c87c8e93da976bfadb79c,gizmodo.com,gizmodo.com,Google Pixel 8a: Everything We Know So Far,2024-04-23,https://gizmodo.com/google-pixel-8a-specs-release-rumors-1851427631,en,2024-04-24 07:52:00.980979
9fec8c073281a3a4c803c0e1d76007a9705e97e9cbe46b927d11294f0423c5c2,foxnews.com,foxnews.com,"Fake James Bond trailer with Henry Cavill, Margot Robbie goes mega-viral",2024-04-23,https://www.foxnews.com/entertainment/fake-james-bond-trailer-with-henry-cavill-margot-robbie-goes-mega-viral,en,2024-04-24 10:27:54.664120
0f44d2cf68d911271b43143b8a7423a8d3b8bd4b4d8b142c0c87857ffbafc1c5,businessinsider.com,businessinsider.com,Trump may be held in contempt Tuesday after hush-money DA cites at least 10 gag-order violations,2024-04-23,https://www.businessinsider.com/trump-contempt-of-court-finding-looms-in-hush-money-case-2024-4,en,2024-04-24 07:24:17.332548
7102ffd09af0b848db43f827e581f43c27413195fe86dc20a5e22731069d8edf,rollingstone.com,rollingstone.com,Orville Peck's 'Stampede' Tour: Here's Where to Buy Tickets Online Before They Sell Out,2024-04-23,https://www.rollingstone.com/product-recommendations/lifestyle/buy-orville-peck-stampede-tour-tickets-online-1235006770/,en,2024-04-24 12:40:05.860642
d1d5ad200fae14bc9f78a61ab7d14fced466d3cd341ba017fe20912d294cf5d4,uproxx.com,uproxx.com,"Stephen A., Who Was Courtside, Thought Tyrese Maxey ‘Got Mugged’ At The End Of Game 2",2024-04-23,https://uproxx.com/dimemag/stephen-a-tyrese-maxey-mugged-sixers-knicks-game-2-video/,en,2024-04-24 13:57:28.131432
03ba33cc2e0c771f5a3af933f3afe580b253b19f0e9f3fb7d6016149d2f85883,nbcnews.com,nbcnews.com,Watchdog group asks 5 attorneys general to investigate crisis pregnancy center privacy practices,2024-04-23,https://www.nbcnews.com/health/health-news/watchdog-group-asks-5-attorneys-general-investigate-crisis-pregnancy-c-rcna148188,en,2024-04-24 08:12:59.232095
19c572dd4135ac0607c9111fb4efb5bd0129c13a54ae63b851b618aa9ea448a7,businessinsider.com,businessinsider.com,Here's why the internet keeps telling people to look at their keyboards,2024-04-23,https://www.businessinsider.com/look-between-letters-meme-keyboard-trend-social-media-2024-4,en,2024-04-24 02:41:23.544721
3a764aedb08c87a023e4ac07cd81e42ae1ce6fa931303ec142cf63f8ec89aa9a,npr.org,npr.org,"AP reporter held captive for years, Terry Anderson, dies at 76",2024-04-23,https://www.npr.org/2024/04/23/1246546203/ap-reporter-held-captive-for-years-terry-anderson-dies-at-76?ft=nprml&f=,en,2024-04-24 04:01:51.733393
0e871f579230ddd7ed3607e647828aca3ae3882b290aa1bd586b1d9561554839,post-gazette.com,post-gazette.com,Protesters at Pitt demand university disclose ties to Israeli organizations,2024-04-23,https://www.post-gazette.com/local/city/2024/04/23/palestine-protest-pitt-israel-gaza-college-campus/stories/202404230078,en,2024-04-24 03:02:47.131609
01c44939290b1e8cfb0aa819a5707b34d710ee378146b3c27637929c34bebfe8,forbes.com,forbes.com,Mindfulness: The Winning Edge In Business Leadership,2024-04-23,https://www.forbes.com/sites/forbesbusinesscouncil/2024/04/23/mindfulness-the-winning-edge-in-business-leadership/,en,2024-04-24 08:11:03.831876
14a86991dbc6dd3de21cb796379ad22bbd650367d92a916ec4b45edf571cd1d9,reuters.com,reuters.com,ガザ病院敷地内から数百人の遺体、国連当局者「恐怖を覚える」,2024-04-23,https://jp.reuters.com/world/mideast/PAMYJ4ZZEVOS3NULSNBKZGEHD4-2024-04-23/,ja,2024-04-24 10:43:56.509420
9532f4e4a3d7bc4bc7b7c0c2a29afba55f6eae3964c182bbf84367403ee1d374,abcnews.go.com,abcnews.go.com,What to know in the Supreme Court case about immunity for former President Trump,2024-04-23,https://abcnews.go.com/Politics/wireStory/supreme-court-case-immunity-former-president-trump-109520842,en,2024-04-24 14:27:49.560033
4deab264e72f43f71d9f140ca87ad60561b81734da4f9c07bf0f1345c548a38f,dailykos.com,dailykos.com,4 years ago today: Trump tried to make Clorox great again,2024-04-23,https://www.dailykos.com/stories/2024/4/23/2236286/-4-years-ago-today-Trump-tried-to-make-Clorox-great-again?pm_campaign=blog&pm_medium=rss&pm_source=,en,2024-04-25 00:06:36.161757
b776390c998339e1aea4fb0f994d1acb77a3a7fe3abd699d4a4461138a8ba3e4,arkansasonline.com,arkansasonline.com,"Pulaski County judge orders landlord Imran Bohra to pay $20,000 penalty",2024-04-23,https://www.arkansasonline.com/news/2024/apr/23/pulaski-county-judge-orders-landlord-imran-bohra/,en,2024-04-24 19:58:24.145962
7c611876d908f6bd2ecec13681a0d791ebc86b76593b3cac05cd9b673af64f7d,benzinga.com,benzinga.com,Why Capri Holdings And Tapestry Shares Are Falling Today,2024-04-23,https://www.benzinga.com/markets/equities/24/04/38385769/why-capri-holdings-and-tapestry-shares-are-falling-today,en,2024-04-24 06:07:19.354089
2dfd304cceeb80b86c03e3f327accc5536fcb12658b720ffaa6530d7ff0d06cb,abcnews.go.com,abcnews.go.com,A memorial opens on the site of a Nazi concentration camp for Roma after a pig farm was removed,2024-04-23,https://abcnews.go.com/International/wireStory/memorial-opens-site-nazi-concentration-camp-roma-after-109530159,en,2024-04-24 03:29:35.417143
d27c1e54a01b2a62f9d5b1c4cb9483ce017a6e661fb7e8464da402fde46b0e83,pbs.org,pbs.org,Analysis: Supreme Court will weigh whether Trump is immune from prosecution. Here's what to watch,2024-04-23,https://www.pbs.org/newshour/politics/analysis-what-to-watch-as-supreme-court-weighs-whether-trump-is-immune-from-prosecution,en,2024-04-24 11:17:05.663875
f7ee61245d92214e05496cc5eea2bda121bb2dda59406e8ceac45c8edbab266c,gazettenet.com,gazettenet.com,Guest columnist Jena Schwartz: Things I have not said,2024-04-23,https://www.gazettenet.com/Jena-Schwartz-Things-I-have-not-said-54675514,en,2024-04-24 18:16:13.266629
706d97d02951d883e4115d8010f7ede8682181c3b105679e05ce0cf79b9000f5,cbsnews.com,cbsnews.com,6 things long-term care insurance covers that you may not have known about,2024-04-23,https://www.cbsnews.com/news/things-long-term-care-insurance-covers-that-you-may-not-have-known-about/,en,2024-04-24 06:23:49.429045
045e55d59222034ce8aba62477371cf785d8b4465e770db5985c9fec9dd95654,salon.com,salon.com,Lake of cooling lava discovered on Jupiter's moon Io,2024-04-23,https://www.salon.com/2024/04/23/lake-of-lava-smooth-as-glass-discovered-on-jupiters-moon-io/,en,2024-04-24 11:08:07.519892
9d7d66902a14fcd2f99b95c367d8aa385cb3c2b286a2ed5f93584614c260a22a,startribune.com,startribune.com,"Facing pressure from rights groups, World Bank suspends funding for Tanzania tourism project",2024-04-23,https://www.startribune.com/facing-pressure-from-rights-groups-world-bank-suspends-funding-for-tanzania-tourism-project/600360923/,en,2024-04-24 06:25:44.757020
f66d53cb7b4435fe54dc38afb78c8a2e2294f676adc3a4ecbb7255b1ac04452f,startribune.com,startribune.com,It began with defiance at Columbia. Now students nationwide are upping their Gaza war protests,2024-04-23,https://www.startribune.com/protests-roiling-us-colleges-escalate-with-arrests-new-encampments-and-closures/600360955/,en,2024-04-24 05:33:53.251523
f3e39d85b383df91d7422a6b6975b4c37d3b8207f0f4e011a59f2f59139c00f8,nytimes.com,nytimes.com,New York Court System to Publish Daily Transcripts of Trump’s Trial,2024-04-23,https://www.nytimes.com/2024/04/23/nyregion/trump-transcripts-hush-money-trial-court.html,en,2024-04-24 12:21:15.828636
99bf98e5ddc570480099faa50ad021d8a193c19f733ea3a08178942a5cff7382,courant.com,courant.com,‘Unverified’ threat directed at American School for the Deaf in West Hartford under investigation,2024-04-23,https://www.courant.com/2024/04/23/unverified-threat-directed-at-american-school-for-the-deaf-in-west-hartford-under-investigation/,en,2024-04-24 05:14:43.027456
a7e3742818c601a8ebbe4a0237d6a695f89aff4712041ea91bf4c905ea001be9,benzinga.com,benzinga.com,Why Roblox Stock Is Up Today,2024-04-23,https://www.benzinga.com/general/gaming/24/04/38390960/why-roblox-stock-is-up-today,en,2024-04-24 17:42:08.502757
e59c65879b4b89d5b6b15a88feb802dd4217ed7595a9b70820e2c3be8c2989ac,theguardian.com,theguardian.com,"Ex-Post Office boss sought ‘non-emotive words’ for Horizon bugs, inquiry hears",2024-04-23,https://www.theguardian.com/uk-news/2024/apr/23/ex-post-office-boss-paula-vennells-searched-for-non-emotive-words-to-describe-horizon-bugs-inquiry-hears,en,2024-04-24 08:39:32.569740
5a4d994be272b86ac0d1f20b096a035fddca170f014bb46fb827bae962f16305,cbsnews.com,cbsnews.com,Newly uncovered photo of Titanic iceberg up for auction,2024-04-23,https://www.cbsnews.com/video/iceberg-picture-titanic-sinking-1912/,en,2024-04-24 06:56:15.949803
d6ed5fd3dac672690910b6e0d0917da77ad06bb7b0363e2f0e046ba5b5a2df5d,benzinga.com,benzinga.com,Cryptocurrency dogwifhat's Price Increased More Than 7% Within 24 hours,2024-04-23,https://www.benzinga.com/insights/cryptocurrency/24/04/38388356/cryptocurrency-dogwifhats-price-increased-more-than-7-within-24-hours,en,2024-04-25 03:53:29.834300
f2c0d810ec061d6b757d2ce8748b0b94feb66a5bfbb81634424ea82622d57ab0,cbsnews.com,cbsnews.com,"Don Steven McDougal indicted in murder, attempted kidnapping of 11-year-old Audrii Cunningham",2024-04-23,https://www.cbsnews.com/news/don-steven-mcdougal-indicted-audrii-cunningham-murder-kidnapping/,en,2024-04-24 06:09:44.797320
3765e5ca1b0bda6ee9df6279eae42adbdd2dba468b189e74fc5fea80911eda06,espn.com,espn.com,How Rudy Gobert made peace with being the NBA's most ridiculed player,2024-04-23,https://www.espn.com/nba/story/_/id/40002092/nba-playoffs-2024-why-do-many-players-beef-rudy-gobert,en,2024-04-24 03:52:54.832244
ec712dd6aaac2e94129bc4c7a165bf380f20b2461fe67fb1e90e9fe200a8a6ac,newsweek.com,newsweek.com,Toddler insists on kissing each toy car goodnight in sweet bedtime routine,2024-04-23,https://www.newsweek.com/toddler-kissing-cars-goodnight-bedtime-routine-1893221,en,2024-04-24 01:46:46.292966
d0cf2e43ea75512587c593723cdf31b2e9a03ef87fb416fb66d2163b2ae1ac20,forbes.com,forbes.com,Strategies For Fostering Customer Loyalty To Support Franchise Success,2024-04-23,https://www.forbes.com/sites/forbesbusinesscouncil/2024/04/23/strategies-for-fostering-customer-loyalty-to-support-franchise-success/,en,2024-04-24 08:58:06.011996
10bc365416d72777238f9690c720ece2f11de59bffd7ed090a86e023d3b8f62f,newsweek.com,newsweek.com,Protesters disrupt Tennessee Capitol after guns for teachers bill passes,2024-04-23,https://www.newsweek.com/protesters-tennessee-state-capitol-after-bill-passes-allowing-teachers-carry-guns-1893482,en,2024-04-24 18:15:50.300948
c4f016dec03a79150cf42dd8a4de6aa53e1e68619b41a8e8b8d8cef4f773c694,thedailybeast.com,thedailybeast.com,‘Losing All Credibility’: Judge Rips Trump Team at Tense Gag Order Hearing,2024-04-23,https://www.thedailybeast.com/losing-all-credibility-judge-juan-merchan-slams-trump-team-at-tense-gag-order-hearing,en,2024-04-24 08:17:22.023184
e9c95ddff6c8385d07c72453f644076a945758e4653f7eabaaac629857d48f2f,rttnews.com,rttnews.com,Swiss Market Ends On Bright Note,2024-04-23,https://www.rttnews.com/story.aspx?Id=3440845,en,2024-04-24 04:14:33.244122
c985f6a8886e48c66535bfcc77e8faaf1cbac24a055e17197029924bf8a31330,benzinga.com,benzinga.com,"Decorated Apparel Market Size is expected to reach USD 70.4 billion by 2031, growing at a CAGR of 11.4%: Straits Research",2024-04-23,https://www.benzinga.com/pressreleases/24/04/g38381671/decorated-apparel-market-size-is-expected-to-reach-usd-70-4-billion-by-2031-growing-at-a-cagr-of-1,en,2024-04-24 05:57:44.986599
0c79e45ad846a2d815383834d5616a8eff2a332448789c35925b54ebf2d1c743,oann.com,oann.com,Russian Court Rejects Evan Gershkovich’s Appeal,2024-04-23,https://www.oann.com/newsroom/russian-court-rejects-evan-gershkovichs-appeal/,en,2024-04-24 01:09:07.413501
106e937f0fba51bf0a6378fd396eb71a5b0c4004817c582129950d3b2041056d,foxnews.com,foxnews.com,"NFL stars give crucial advice to incoming rookies, warn how league 'can eat you up'",2024-04-23,https://www.foxnews.com/sports/nfl-stars-give-crucial-advice-incoming-rookies-warns-how-league-can-eat-you-up,en,2024-04-26 10:29:40.137165
fb40254e7332f9ae10dff8a3e260dd055bffe28961c1b944352686b3c16fb023,marketwatch.com,marketwatch.com,Trump Media steps up war on short selling with advice for retail investors,2024-04-23,https://www.marketwatch.com/story/trump-media-offers-steps-for-retail-investors-to-take-to-avoid-their-shares-being-lent-out-by-brokers-to-short-sellers-c93ee381?mod=home-page&g=d929bdd4-f04a-4b53-b8b7-14da15748fcb&mod=mw_rss_bulletins,en,2024-04-24 04:32:56.142632
8bed4dde1c5b8f0bf01239026358561118c6b8453d8c6364ecfc99e94d40dda9,radaronline.com,radaronline.com,‘Insolvent’: Anne Heche’s Son Reveals Actress Left Behind Few Assets and Memoir Failed to Sell as He Works to Settle $6 Million in Creditor Claims,2024-04-23,https://radaronline.com/p/anne-heche-son-reveals-actress-left-behind-few-assets-memoir-failed-to-sell-6-million-court-thomas-jane-claims/,en,2024-04-24 04:55:42.456300
4adbba8299d92f5c22a63958781ee7d319f8830d6d8e854d082a5f1ab0d804df,sandiegouniontribune.com,sandiegouniontribune.com,"All the News That's Fit: Straight talk about hand dryers, human hairballs and the history of hearing aids",2024-04-23,https://www.sandiegouniontribune.com/news/health/story/2024-04-23/all-the-news-thats-fit-hand-dryer-hype-human-hairballs-and-hearing-aid-history,en,2024-04-24 06:02:58.791201
034f9eb31dc9dfead8548ba5daed4a011427756bf2d06edc14c1728ec533defe,benzinga.com,benzinga.com,Boeing Foresees Slower 787 Production Ramp-Up Due To Supplier Shortages: Report,2024-04-23,https://www.benzinga.com/markets/equities/24/04/38369584/boeing-foresees-slower-787-production-ramp-up-due-to-supplier-shortages-report,en,2024-04-24 06:33:17.174658
109b11ff3bf7a61cd2bf553e7d01a32bd79ca7d8fcb2f35b571f37eb2fe174c2,orlandosentinel.com,orlandosentinel.com,How often and why do NFL teams misfire on drafting QBs?,2024-04-23,https://www.orlandosentinel.com/2024/04/23/nfl-teams-often-misfire-on-drafting-qbs-but-how-often-do-they-fail-and-why/,en,2024-04-24 08:10:34.364283
ace6926a929800ff805e4a2cff685a96b2e63326dd65b9605451ff131f354b03,cbsnews.com,cbsnews.com,First Alert Weather: Passing showers on Wednesday,2024-04-23,https://www.cbsnews.com/newyork/video/first-alert-weather-passing-showers-on-wednesday/,en,2024-04-24 14:49:46.683481
be3860f94ae6dd388fa291ef365594a89b42dc1150563b41bb8069015649e253,cbssports.com,cbssports.com,"Brandon Aiyuk could still be traded during NFL Draft, 49ers want 2024 first-round pick, per report",2024-04-23,https://www.cbssports.com/nfl/news/brandon-aiyuk-could-still-be-traded-during-nfl-draft-49ers-want-2024-first-round-pick-per-report/,en,2024-04-24 09:14:48.137473
ff0c8e9079686f6c2290cde95ae9435e8953b25407accc53751a982189a6ad9a,marketwatch.com,marketwatch.com,"U.S. economy takes a step backward in April, S&P surveys show, as demand weakens",2024-04-23,https://www.marketwatch.com/story/u-s-economy-takes-a-step-backward-in-april-s-p-surveys-show-feb89e82?g=9858e419-bd72-4c65-8d1a-2b787102cdb4&mod=mw_rss_bulletins,en,2024-04-24 03:29:18.400721
aa49c5e7f3e43b9862721def53c5b550c31819362e19eb851c8cd41412151c1e,latimes.com,latimes.com,School athletic trainer gets 36 years for sexually assaulting 12 female students,2024-04-23,https://www.latimes.com/california/story/2024-04-23/l-a-school-trainer-pleads-no-contest-to-sexual-assault-of-students,en,2024-04-24 19:52:44.528590
31895f4bff03860ea04974f868d8e4af52bfbaf2acb3d9ea61195d4d48f40051,tmz.com,tmz.com,Maycee Barber Nearly Forced To Fight Unhinged Lady In Parking Lot,2024-04-23,https://www.tmz.com/2024/04/23/maycee-barber-demi-bagby-crazy-incident-ufc-fighter-mma/,en,2024-04-24 11:54:54.032619
659a6f9b92ce9d0fda74183bdc9d53460f4ad3d43234d93cd437b545e744c564,newsday.com,newsday.com,"Oklahoma police say 5 found dead in home, including 2 children",2024-04-23,https://www.newsday.com/news/nation/Oklahoma-City-five-dead-children-c42540,en,2024-04-24 17:30:55.559388
e8a7891ca6dc1b8d82264d24357e2657d5ea9021494cee2eeb60eaee6e071695,gizmodo.com,gizmodo.com,Apple Vision Pro Gets a Reality Check,2024-04-23,https://gizmodo.com/apple-vision-pro-reality-check-1851429764,en,2024-04-24 05:34:04.835245
d5a1498ad5081d303fa3b520e1d63e776e5c8ef3620e669f33c84b9f228197fe,syracuse.com,syracuse.com,Man faces up to life in prison for attempting to buy drugs in Syracuse to sell,2024-04-23,https://www.syracuse.com/crime/2024/04/man-faces-up-to-life-in-prison-for-attempting-to-buy-drugs-in-syracuse-to-sell.html,en,2024-04-24 10:02:07.723438
4200ef8539b7d609c04825ddb5d34e973853e0f751e154ae592b8ead307c3bef,forbes.com,forbes.com,The Four ‘Be’s’ Of Communicating Layoffs,2024-04-23,https://www.forbes.com/sites/forbesbusinesscouncil/2024/04/23/the-four-bes-of-communicating-layoffs/,en,2024-04-24 09:07:04.625695
24bda438cd6d4bf50d2fe8da9e9340f345dc36c4c6ae335914551a0f355e9e9f,reuters.com,reuters.com,仏ルノー、第1四半期は金融事業好調で増収 通年予想維持,2024-04-23,https://jp.reuters.com/business/autos/HRYG7VSIHBNJLKNJSZYCX2JKRA-2024-04-23/,ja,2024-04-24 11:23:28.401940
af46a4705113d02e7eea6329e24f87a0c8e25f6405b31b729894ce164e7a94b9,stltoday.com,stltoday.com,Recap: Brentwood ties Hancock,2024-04-23,https://www.stltoday.com/sports/high-school/baseball/recap-brentwood-ties-hancock/article_01aea272-fb22-5b42-bf8d-8a20b26785b6.html,en,2024-04-24 07:14:28.674839
385140189ee8df5d6480cfd8a49c438ca9fcc34564a74a65906b280d333d4e71,marketwatch.com,marketwatch.com,Novartis shares jump as drugmaker boosts outlook,2024-04-23,https://www.marketwatch.com/story/novartis-shares-jump-as-drugmaker-boosts-outlook-dc77ff57?mod=mw_rss_topstories,en,2024-04-24 14:05:08.842563
663057c89283357866b4f3e248a1af2cf14929e808dd81e88bd01fb726b3f230,twincities.com,twincities.com,"Timberwolves dispute between Taylor and Lore, Rodriguez over ownership moves to mediation",2024-04-23,https://www.twincities.com/2024/04/23/timberwolves-dispute-between-taylor-and-lore-rodriguez-over-ownership-moves-to-mediation/,en,2024-04-24 18:11:32.196203
f7df6f89112f9240d12d585fd63423477cc256d297fb318eaee3a4c4668b5da6,startribune.com,startribune.com,DFL state Sen. Nicole Mitchell charged with first-degree burglary in break-in at stepmother’s home,2024-04-23,https://www.startribune.com/dfl-state-senator-charged-with-first-degree-burglary-after-breaking-into-stepmothers-home/600360981/,en,2024-04-24 05:59:20.589740
6745f5a8ca0ba11054fd274f8e7084ac33939b16279d17726f8460741b375762,cbsnews.com,cbsnews.com,Justice Department to pay $138 million settlement to Larry Nassar victims,2024-04-23,https://www.cbsnews.com/chicago/video/justice-department-to-pay-138-million-settlement-to-larry-nassar-victims/,en,2024-04-24 18:09:14.685118
3c18670993c5993d5e8eb8de582d9a96d50916e9d88986be0a2275e917e030ed,syracuse.com,syracuse.com,"Senate passes bill forcing TikTok’s parent company to sell or face ban, sends to Biden for signature",2024-04-23,https://www.syracuse.com/us-news/2024/04/senate-passes-bill-forcing-tiktoks-parent-company-to-sell-or-face-ban-sends-to-biden-for-signature.html,en,2024-04-24 18:55:12.622133
43ebd2592f782dd5d9c3858b8bae261f236ef2e62795f2e79ae2b637ad7cc7bf,post-gazette.com,post-gazette.com,Lawsuit: Kennywood withheld Steel Curtain closure to boost season pass sales,2024-04-23,https://www.post-gazette.com/life/recreation/2024/04/23/kennywood-steel-curtain-lawsuit/stories/202404230057,en,2024-04-24 05:25:57.994832
1e8a04135052017d498465808ec56657c9c016e29d17d3e3808fe88318044d65,benzinga.com,benzinga.com,REITs Q1 Earnings Begin On Solid Note,2024-04-23,https://www.benzinga.com/real-estate/reit/24/04/38385082/reits-q1-earnings-begin-on-solid-note,en,2024-04-24 14:37:52.104822
a642019fc147037802bff79d636a984c8c49090400fe7f46508253f6b8d4acb0,nytimes.com,nytimes.com,"Tesla’s Profit Fell 55%, Adding to Concerns About Its Strategy",2024-04-23,https://www.nytimes.com/2024/04/23/business/tesla-earnings-first-quarter-elon-musk.html,en,2024-04-24 02:50:18.929871
44b8d38f5988a6dd9d8a716256ac422b2e88183ee76fda009f5c09a65eecba0c,nypost.com,nypost.com,"2024 NFL Draft: Odds, prediction for J.J. McCarthy to go top five",2024-04-23,https://nypost.com/2024/04/23/sports/2024-nfl-draft-odds-prediction-for-j-j-mccarthy-to-go-top-five/,en,2024-04-24 04:42:43.402809
98879945426d727f21bc9a7c735f032f043ff903f3c860ffa906888281a1bda4,theverge.com,theverge.com,"You don’t know your K-pop persona, do you?",2024-04-23,https://www.theverge.com/2024/4/23/24138370/spotify-launches-k-pop-persona-quiz,en,2024-04-24 12:19:09.919264
6d7d549588c0e82645aa511069c38138e98dff6e628ef70331290dfe9f0360e5,cbsnews.com,cbsnews.com,"Man wrestles gator with bare hands, came from hockey game",2024-04-23,https://www.cbsnews.com/miami/video/man-wrestles-gator-with-bare-hands-came-from-hockey-game/,en,2024-04-24 07:42:39.090987
8d5e277a0a3409063efef680d4ddd0a38151c119bf8acab38baeafde9b561e37,mercurynews.com,mercurynews.com,Bay Area housing complex lands key loan despite sour real estate scene,2024-04-23,https://www.mercurynews.com/2024/04/23/real-estate-house-home-build-real-estate-bay-area-peninsula-millbrae/,en,2024-04-24 05:50:54.634149
b306af5934cfbaab1ca8ea4003474eb0179b9cc01f2950c256a83c83c8e5c45f,nypost.com,nypost.com,Far-left ‘Squad’ Rep. Summer Lee wins Pennsylvania House primary election,2024-04-23,https://nypost.com/2024/04/23/us-news/far-left-squad-rep-summer-lee-wins-pennsylvania-house-primary-election/,en,2024-04-24 19:04:20.282695
a1d3a8e571dfee768c11470a7f62cff083ff2d5a9695b1578baf91f4c0e0a42a,cbsnews.com,cbsnews.com,Massive fire rips through Latrobe shopping plaza,2024-04-23,https://www.cbsnews.com/pittsburgh/video/massive-fire-rips-through-latrobe-shopping-plaza/,en,2024-04-24 10:21:31.201119
12a9ea1b00ccf0ae8a9d7bc0e6d15ae8ca6a8718648a25893be76519a2377c2e,cbsnews.com,cbsnews.com,Deadly overnight house fire in SW Miami-Dade home,2024-04-23,https://www.cbsnews.com/miami/news/fire-erupts-in-sw-miami-dade-home-one-dead/,en,2024-04-24 07:48:20.582118
d43eff6b3a38c2cc233dbebf5b5657374d1308c1b2e4eef054522e72daca7be9,newsday.com,newsday.com,Knicks score eight points in final 27.4 seconds to take 2-0 lead over 76ers,2024-04-23,https://www.newsday.com/sports/basketball/knicks/knicks-76ers-game-2-ctxhbsvs,en,2024-04-24 17:29:11.288190
05cee414221417a8bcd6a31d13af7dcb5d4efaf74fa47be962a486a30de2cfab,staradvertiser.com,staradvertiser.com,Hawaii businessman Dennis Mitsunaga to remain in jail during trial,2024-04-23,https://www.staradvertiser.com/2024/04/23/hawaii-news/hawaii-businessman-dennis-mitsunaga-to-remain-in-jail-during-trial/,en,2024-04-24 10:05:46.909795
ff1c340b4aca9c8108ab2c681c20c14d528a2d816f3c280a6e043011ee842fc0,cleveland.com,cleveland.com,"Cleveland-Cliffs is still interested in U.S. Steel, but at a much cheaper price",2024-04-23,https://www.cleveland.com/news/2024/04/cleveland-cliffs-is-still-interested-in-us-steel-but-at-a-much-cheaper-price.html,en,2024-04-24 04:29:28.029260
17aa3fe4d57a787d59bcc4ef356d15a6d9630590db5ec89f369a106dbf42bdec,theguardian.com,theguardian.com,Set It Up: the 2018 Netflix romcom that became a classic of the genre,2024-04-23,https://www.theguardian.com/film/2024/apr/24/set-it-up-netflix-romcom-cast-glen-powell-zoey-deutch-best-streaming-movies,en,2024-04-24 15:59:39.691680
e9c6940f59efb11062c3afb461ff6bd04de826c99d755c62c14650808badbc9c,espn.com,espn.com,"Suggs injures knee, returns as Magic fall to 0-2",2024-04-23,https://www.espn.com/nba/story/_/id/40001786/orlando-magic-jalen-suggs-helped-left-knee-strain-game-2-cleveland-cavaliers,en,2024-04-24 03:52:39.524666
feb2f15a2092d5f5f24fa3b85c1c58971ab1b371bbcb23fb9dd3f6b234aa44bd,startribune.com,startribune.com,US Justice Department agrees to $138.7M deal with Larry Nassar victims over the FBI's bungling of assault allegations,2024-04-23,https://www.startribune.com/us-justice-department-agrees-to-1387m-deal-with-larry-nassar-victims-over-the-fbis-bungling-of-assault-allegations/600361019/,en,2024-04-24 07:51:28.099021
1e59289279707ef76efe3a8c614bb476549cb6380c45773e2f05c6cb46a2ac68,theconversation.com,theconversation.com,Curious Kids: who makes the words? Who decides what things like ‘trees’ and ‘shoes’ are called?,2024-04-23,https://theconversation.com/curious-kids-who-makes-the-words-who-decides-what-things-like-trees-and-shoes-are-called-224263,en,2024-04-24 14:11:41.894928
bd08a6e37f015b16028803260591d3b74d477043cc8f59b196d5a53bb6592ce9,newsday.com,newsday.com,Minnesota and other Democratic-led states lead pushback on censorship. They're banning the book ban,2024-04-23,https://www.newsday.com/news/nation/book-bans-censorship-LGBTQ-gender-race-libraries-d04961,en,2024-04-24 16:42:46.591356
f886545025bcc2c697e155def704c4d6b03031ea1cfbd4b60d5956bd12473c10,theguardian.com,theguardian.com,Police clash with St George’s Day protesters at central London rally,2024-04-23,https://www.theguardian.com/uk-news/2024/apr/23/police-clash-with-st-georges-day-protesters-at-rally-in-central-london,en,2024-04-24 16:40:51.738496
