id,media_name,media_url,title,publish_date,url,language,indexed_date
5e917daf29056f690b6f8520d66355400d322cef2bd631d36110a3ee3181f22b,elnuevodia.com,elnuevodia.com,Ejército israelí confirma nuevos bombardeos en Beirut contra objetivos de Hezbollah,2024-10-01,https://www.elnuevodia.com/noticias/mundo/notas/ejercito-israeli-confirma-nuevos-bombardeos-en-beirut-contra-objetivos-de-hezbollah/,es,2024-10-02 06:33:09.400171
a6b831c34e0a11160ac4b49ae65c2d3052e06b1d7b18d57fb2de78130ba24b62,theguardian.com,theguardian.com,Buffalo Bills’ Von Miller suspended four games for personal conduct violation,2024-10-01,https://www.theguardian.com/sport/2024/oct/01/buffalo-bills-von-miller-suspended-personal-conduct-violation,en,2024-10-02 05:31:15.081823
c5cb536d4b9378c4146a5f9bd9751514f8a6960fff86782af54f6bc1ec99e41d,cbsnews.com,cbsnews.com,Baltimore steel business president details potential impact of port workers strike,2024-10-01,https://www.cbsnews.com/baltimore/news/baltimore-steel-business-president-details-how-dockworkers-strike/,en,2024-10-02 13:32:32.815719
2c5090162c1d307f76ca4b7986becc632006a7212c1a02a9d184b9968814dcb5,stltoday.com,stltoday.com,Recap: STEAM Academy at MS-Berkeley trounces McCluer,2024-10-01,https://www.stltoday.com/sports/high-school/softball-fall/recap-steam-academy-at-ms-berkeley-trounces-mccluer/article_63f3eb2a-20f4-5b31-bdc0-98423712d571.html,en,2024-10-02 16:36:32.427530
e4d644039a3f63a4687ca2aee4892c4bce16dd55e640c5fc2d6425557b6e248d,usatoday.com,usatoday.com,How to buy Penn State Nittany Lions vs UCLA Bruins college football tickets,2024-10-01,https://www.usatoday.com/story/sports/ncaaf/2024/10/01/penn-state-vs-ucla-college-football-tickets-october-5-2024/75455032007/,en,2024-10-02 03:31:18.034934
c62d848a26d2c516b786cdef216e663adf5f58f2852a4f0bf05e94b9939f9b82,foxnews.com,foxnews.com,"To reduce cancer risk, researchers recommend adopting these 4 healthy habits",2024-10-01,https://www.foxnews.com/health/reduce-cancer-risk-researchers-recommend-adopting-healthy-habits,en,2024-10-02 10:20:50.804787
d9fc996837b86463c94c5e0c56b7fd3e10ce29753737cf8228602aa91f314d63,nytimes.com,nytimes.com,"Brewers pull Freddy Peralta early, then watch as bullpen plan goes up in smoke",2024-10-01,https://www.nytimes.com/athletic/5811569/2024/10/01/brewers-bullpen-freddy-peralta-pat-murphy/,en,2024-10-02 04:33:52.000231
513a85f4ece6f759d42dd55076f89e8d27d68bb07f040b398513aed5c57f313b,benzinga.com,benzinga.com,JD Vance And Tim Walz Lock Horns Over Trump's 2020 Election Defeat: 'Jan. 6 Was Not Facebook Ads',2024-10-01,https://www.benzinga.com/news/24/10/41134206/jd-vance-and-tim-walz-lock-horns-over-trumps-2020-election-defeat-jan-6-was-not-facebook-ads,en,2024-10-02 04:23:59.845665
a2337a6692fe2f83d55a70ff4d6b3b1b544c33090a6c93dac95cf6fd5148f522,ncregister.com,ncregister.com,Trump-Harris Race is Razor-Close — Even At Notre Dame,2024-10-01,https://www.ncregister.com/news/notre-dame-poll-trump-harris-elections,en,2024-10-02 06:31:57.144887
b7147c75dd37a8a7a417213331aac9f1d93e0fdd56bb28cb572b76126616a6e9,benzinga.com,benzinga.com,TARTE COSMETICS HOSTS 2024 #STORMOFLOVE TIKTOK LIVE WITH CONTENT CREATORS,2024-10-01,https://www.benzinga.com/pressreleases/24/10/n41118112/tarte-cosmetics-hosts-2024-stormoflove-tiktok-live-with-content-creators,en,2024-10-03 11:37:20.020665
0b8efb4a01355be822b5b3e7f4f32c44c246e6ac335d18a55e25c462a9ad80ab,forbes.com,forbes.com,Watch The Vice Presidential Walz-Vance Debate Live Here,2024-10-01,https://www.forbes.com/sites/antoniopequenoiv/2024/10/01/watch-the-vice-presidential-walz-vance-debate-live-here/,en,2024-10-02 02:26:29.856035
f191aa58e2b86bbe23f1910bc837ee188ef4a23ce0eba4e93998266e97f04f49,benzinga.com,benzinga.com,Treasure Global Inc Announces Termination of its At-The-Market Offering Program,2024-10-01,https://www.benzinga.com/pressreleases/24/10/g41129273/treasure-global-inc-announces-termination-of-its-at-the-market-offering-program,en,2024-10-03 11:19:38.346884
9912f1445fa0983e682b69cc2ad20fac9d44dfc9b8bc47fd5ce7ea49f2191e80,cleveland.com,cleveland.com,"1 dead, 1 injured in fiery crash on Interstate-480 in Cleveland, police say",2024-10-01,https://www.cleveland.com/news/2024/10/1-dead-1-injured-in-fiery-crash-on-interstate-480-in-cleveland-police-say.html,en,2024-10-25 15:31:23.304938
8cd4b3f9a3fdaacbab4ecaa19ba6c4589c988ecf44c7f80753f96b05952865ad,realclearpolitics.com,realclearpolitics.com,"Watch Live: JD Vance vs. Tim Walz, Vice Presidential Debate, Hosted By CBS News",2024-10-01,https://www.realclearpolitics.com/video/2024/10/01/watch_live_jd_vance_vs_tim_walz_vice_presidential_debate_hosted_by_cbs_news.html,en,2024-10-02 12:30:23.513730
6dd7000929e53844249d479a0f35d11c50bfa7cb58914cc221b2be8e34e4aaa7,cbsnews.com,cbsnews.com,Dockworker strike could cause supply chain disruptions,2024-10-01,https://www.cbsnews.com/newyork/video/dockworker-strike-could-cause-supply-chain-disruptions/,en,2024-10-02 05:17:26.520272
f337f68bc5a89c9c0839e2f9a729f2c4a83469de25c5082ff8a2c0bca166ae95,cbsnews.com,cbsnews.com,Bay Area Democrat draws inspiration from family history to mobilize youth vote,2024-10-01,https://www.cbsnews.com/sanfrancisco/news/democratic-organizer-draws-inspiration-from-family-history-to-mobilize-youth-vote/,en,2024-10-02 05:19:10.568888
f0fba6b63f8cf6d84933b484d2b9eea4e37c125a6cc07df06a4d68599624e0e1,stltoday.com,stltoday.com,Recap: Lafayette topples Northwest Cedar Hill,2024-10-01,https://www.stltoday.com/sports/high-school/softball-fall/recap-lafayette-topples-northwest-cedar-hill/article_2b4401f1-ba1f-56ee-a6e1-4effabffb254.html,en,2024-10-02 16:40:39.252589
c1765b033bcc528ef1e5b3e6294b9bd962372c888a05cd098f77309528857c2b,nj.com,nj.com,"Conway, Napolitani have big days as Hoboken beats Memorial",2024-10-01,https://www.nj.com/highschoolsports/2024/10/conway-napolitani-have-big-days-as-hoboken-beats-memorial-girls-soccer-recap.html,en,2024-10-02 05:21:13.030503
75d82b1939cc523ea27fa66ee32af9f7e5003607a1e3d647a701ca8c390116a8,nj.com,nj.com,‘American Pickers’ star antique hunter dead at 60,2024-10-01,https://www.nj.com/entertainment/2024/10/american-pickers-star-antique-hunter-dead-at-60.html,en,2024-10-02 05:20:04.069873
cdc506742e9874d11542ad7260245928a23722b819e153cfa23247fb2a8d04e9,espn.com,espn.com,James won't put 'expectations' on new-look Lakers,2024-10-01,https://www.espn.com/nba/story/_/id/41557447/lebron-james-unfair-put-expectations-new-look-lakers,en,2024-10-02 05:18:55.972488
0ac7cee29dbfc2c0f69deffed293a072ded8f7069a9dd996a948d2a706e38267,nypost.com,nypost.com,"Trump, McCormick grow leads with older voters in battleground Pennsylvania: ‘Extremely motivated to vote’",2024-10-01,https://nypost.com/2024/10/01/us-news/trump-mccormick-grow-leads-with-older-voters-in-battleground-pennsylvania-extremely-motivated-to-vote/,en,2024-10-02 05:17:10.533442
761a46af0eb67fcd7f1a12a9162a1ace6ccc23d938e84960858619206a0810b8,theguardian.com,theguardian.com,"Gavin Creel, Tony award-winning Broadway star, dies at 48",2024-10-01,https://www.theguardian.com/stage/2024/oct/01/gavin-creel-dies-broadway,en,2024-10-02 05:17:30.892134
fbd1abc7087953e4a2023a2d32f12f174371c9560e917a27511e12be8b6a6544,theguardian.com,theguardian.com,Tim Walz’s midwestern charm boosts Harris – can he help sell her economic vision?,2024-10-01,https://www.theguardian.com/us-news/2024/oct/01/tim-walz-debate-jd-vance,en,2024-10-02 05:18:40.090564
7c50d0fe388ecb168dc87b748ccfd323e52b31fa391706a2a817e3edd6d23a24,usatoday.com,usatoday.com,How to buy USC Trojans vs Minnesota Golden Gophers college football tickets,2024-10-01,https://www.usatoday.com/story/sports/2024/10/01/usc-vs-minnesota-college-football-tickets-october-5-2024/75461902007/,en,2024-10-02 03:32:43.007596
ccaa060dd1c50f38367d1a4679acee492147f8742250f6d0abb3ca3ea2a09324,foxnews.com,foxnews.com,Kentucky sheriff seen in footage shooting at judge in shocking preliminary hearing,2024-10-01,https://www.foxnews.com/us/kentucky-sheriff-seen-footage-shooting-judge-shocking-preliminary-hearing,en,2024-10-02 04:20:27.670842
9f0598ba70ee78fb7f7e5838e0296248c504406ffab7e4d51f20dc5f6be1bc64,nj.com,nj.com,CBS slammed for Walz-Vance debate: Why did it take 88 minutes to get to ‘very important moment’?,2024-10-01,https://www.nj.com/news/2024/10/cbs-slammed-for-walz-vance-debate-why-did-it-take-88-minutes-to-get-to-very-important-moment.html,en,2024-10-02 05:19:09.279596
df57d20f4ffc3d0a767893d5b09c2ee8e2b6e4770cac282456de371ca9ba0406,postandcourier.com,postandcourier.com,Decena completes Google internship,2024-10-01,https://www.postandcourier.com/journal-scene/community-news/decena-completes-google-internship/article_afda4ec8-8065-11ef-b9ec-b729137405e0.html,en,2024-10-02 05:21:29.207245
608bd5dfd40884eecb2da1953dec7b4f9d054f8ba0608bf3849c5e0b1e7dd087,rttnews.com,rttnews.com,South Korea Inflation Slows To 1.6% On Year In September,2024-10-01,https://www.rttnews.com/3478880/south-korea-inflation-slows-to-1-6-on-year-in-september.aspx?type=alleco,en,2024-10-02 08:33:42.078403
a8bca44485bbdc9a6db491b1f3ac72a3c90a392e1459e4f573e1c234a4be2311,ign.com,ign.com,Save 20% off the Interactive LEGO Technic Planet Earth and Moon in Orbit,2024-10-01,https://www.ign.com/articles/lego-technic-planet-earth-and-moon-in-orbit-42179-deal,en,2024-10-02 01:27:07.356792
b9e8848b27ff003794f8c37cd3cdaa175f70e0d541701044d747e848367e8ddc,ign.com,ign.com,Save 30% Off Final Fantasy VII Rebirth for PlayStation 5,2024-10-01,https://www.ign.com/articles/final-fantasy-vii-rebirth-for-playstation-5-deal,en,2024-10-02 11:27:37.099288
0805912ccf229cda45e94fec360378880b608b66f44b0f6c8bd727e41662b0b9,usatoday.com,usatoday.com,"Jordan Montgomery signing was 'horrible mistake,' D-backs owner says",2024-10-01,https://www.usatoday.com/story/sports/mlb/2024/10/01/jordan-montgomery-arizona-diamondbacks-ken-kendrick/75471427007/,en,2024-10-02 03:24:56.422721
1859f854e729bd7e096b99542d14293f4c8de98005107d7309df127f0dcb85c0,nytimes.com,nytimes.com,Borussia Dortmund could face action for ‘UEFA Mafia’ banner displayed in Champions League,2024-10-01,https://www.nytimes.com/athletic/5810503/2024/10/01/dortmund-uefa-mafia-banner/,en,2024-10-02 04:28:09.603499
60d9379cbf815cb8c437b897ab352c44bd0b164c51b0af3bc707dde2175a63b6,cbsnews.com,cbsnews.com,Santa Clara County residents voting in historic Board of Supervisors race,2024-10-01,https://www.cbsnews.com/sanfrancisco/video/santa-clara-county-residents-voting-in-historic-board-of-supervisors-race/,en,2024-10-02 09:17:18.424691
a6bc0809796d0f72027e5fa26bce5878eda3ec029602f9195f320f86252269a3,dailykos.com,dailykos.com,Montana senator slams GOP opponent for ‘total bunk’ abortion lies,2024-10-01,https://www.dailykos.com/story/2024/10/1/2274107/-Montana-senator-slams-GOP-opponent-for-total-bunk-abortion-lies?pm_campaign=blog&pm_medium=rss&pm_source=,en,2024-10-02 16:31:43.084137
ad3c9a9f75b8144ac257a0d30649bf22b53daf6f26d8cd757f2b0fb02906f9b6,usatoday.com,usatoday.com,How to buy Texas A&M Aggies vs Missouri Tigers college football tickets,2024-10-01,https://www.usatoday.com/story/sports/ncaaf/2024/10/01/texas-a-m-vs-missouri-college-football-tickets-october-5-2024/75455025007/,en,2024-10-02 03:24:36.909573
c8ed5e0e93c4c1b075aa6644212595ed98835888671d1bd053064b137f4568f4,nytimes.com,nytimes.com,Second baseball fan files lawsuit over possession of Shohei Ohtani’s 50th home run ball,2024-10-01,https://www.nytimes.com/athletic/5810002/2024/10/01/shohei-ohtani-50-home-run-ball-second-lawsuit-update/,en,2024-10-02 04:34:33.885618
dbfdcdd11cec66850bd0443c9f8e2d1b417c380cf35322856d0b8a8e541a20a3,rttnews.com,rttnews.com,Indian Markets Closed For Gandhi Jayanti,2024-10-01,https://www.rttnews.com/story.aspx?Id=3478889,en,2024-10-02 10:19:28.055913
a71a322c09a0ee6f86fb2dc29d3214454a6c5674dcc7a6aa6d9c258a2e165bf0,benzinga.com,benzinga.com,"STELLANTIS SHAREHOLDER ALERT BY FORMER LOUISIANA ATTORNEY GENERAL: KAHN SWICK FOTI, LLC REMINDS INVESTORS WITH LOSSES IN EXCESS OF $100,000 of Lead Plaintiff Deadline in Class Action Lawsuit Against Stellantis N.V. - STLA - Stellantis (NYSE:STLA)",2024-10-01,https://www.benzinga.com/pressreleases/24/10/g41134049/stellantis-shareholder-alert-by-former-louisiana-attorney-general-kahn-swick-foti-llc-reminds-inve,en,2024-10-03 01:20:38.106991
ff832c6eea7d5ccceba04ef5b7a144b2d1b82c933bb6bfe005a33aafb23c618b,fansided.com,fansided.com,AsÃ­ fue el encuentro entre LeBron y su hijo Bronny James en el campamento de Lakers,2024-10-01,https://fansided.com/es/posts/encuentro-lebron-bronny-james-campamento-lakers,es,2024-10-02 03:31:32.204001
511f0d6fd60d136fac47438e0c73323656bed256ff5a17dc2749fb788b7939a1,cbsnews.com,cbsnews.com,San Jose nonprofit revitalizing St. James Park using music concerts,2024-10-01,https://www.cbsnews.com/sanfrancisco/video/san-jose-nonprofit-revitalizing-st-james-park-using-music-concerts/,en,2024-10-02 09:17:50.977865
9b893a411818d914157d3b6cefd4f75dd2ab43c22377f1e47e8a6bf8a90dd2a2,staradvertiser.com,staradvertiser.com,Lynx stifle Sun in Game 2 to even series,2024-10-01,https://www.staradvertiser.com/2024/10/01/sports/sports-breaking/lynx-stifle-sun-in-game-2-to-even-series/,en,2024-10-02 07:32:20.945709
bf0204e9e7ee16973b7c9d31ef82d0fa41f5767d163816d2fe6237744c1dbe3b,nypost.com,nypost.com,Liberty can use length to their advantage against WNBA champion Aces,2024-10-01,https://nypost.com/video/liberty-can-use-length-to-their-advantage-against-wnba-champion-aces/,en,2024-10-02 05:30:41.372829
582c056f7d2529645ecfc58d215e748810a1f41e83fc328016458bf8b8d84d52,cnet.com,cnet.com,JubileeTV Review: A Set-Top Box That Simplifies TV for Seniors,2024-10-01,https://www.cnet.com/tech/home-entertainment/jubileetv-hands-on-a-set-top-box-that-simplifies-tv-for-seniors/,en,2024-10-02 05:20:10.708742
36f8fe2db54175bb5dde858c72f76ad75ebb9492228bd0e0d532c177f79d7e48,abcnews.go.com,abcnews.go.com,Israeli military says Iran has fired missiles at Israel,2024-10-01,https://abcnews.go.com/International/wireStory/israeli-military-iran-fired-missiles-israel-114391340,en,2024-10-02 04:28:53.366644
19d172220eaa31c02f9e3c3c9c539de62f91710ccea8ccf02b084ae7221a7faa,abcnews.go.com,abcnews.go.com,Lauryn Hill sued by Fugees bandmate for fraud over tour. She says the lawsuit is 'baseless',2024-10-01,https://abcnews.go.com/Entertainment/wireStory/lauryn-hill-sued-fugees-bandmate-fraud-tour-lawsuit-114405717,en,2024-10-02 09:22:35.990087
e124ef7f7bc7964c529b2c5226c3ce92ee58b9289d977823b7fa57fa2733da3b,cbsnews.com,cbsnews.com,Pennsylvania Turnpike emergency number down,2024-10-01,https://www.cbsnews.com/philadelphia/news/pennsylvania-turnpike-emergency-number-down/,en,2024-10-02 20:17:40.334358
17911bd9889cf6412e45bc042df6bfe3abf7afd528474682fe411d966ecb924f,latimes.com,latimes.com,"Dortmund anota 7 goles. Victorias de Barcelona, Man City y Arsenal en la nueva Champions",2024-10-01,https://www.latimes.com/espanol/deportes/articulo/2024-10-01/dortmund-anota-7-goles-victorias-de-barcelona-man-city-y-arsenal-en-la-nueva-champions,es,2024-10-02 11:42:41.561004
7234cbda84f286760d34a7aab9c1aca54d89920e90e0f9fb121037b3b45ec2e2,benzinga.com,benzinga.com,Manulife Investment Management Expands Active ETFs with Three New ETF Series Focused on Return Potential and Income Generation,2024-10-01,https://www.benzinga.com/pressreleases/24/10/n41116122/manulife-investment-management-expands-active-etfs-with-three-new-etf-series-focused-on-return-pot,en,2024-10-02 11:38:47.489190
d03e7be4bb470b105e000c74c7959d36cf7a4f17351ca60565d966bd7efced9e,thrillist.com,thrillist.com,I Spent 4 Days at Dollywood with My Kids and This Is What It Cost,2024-10-01,https://www.thrillist.com/travel/nation/dollywood-pigeon-forge-cost-vacation-spending,en,2024-11-05 10:35:33.542893
6bedd2c4a6a5d1829992993c482eab947c657718854b7c7a80cf366d6dd8b5a8,nj.com,nj.com,Verona over Cranford,2024-10-01,https://www.nj.com/highschoolsports/2024/10/verona-over-cranford-field-hockey-recap.html,en,2024-10-02 03:18:11.171555
c778724fb0c49679e0b8fccf5868c82f97b8e57b79d7c6fdbff46eeb6b6f3b68,abcnews.go.com,abcnews.go.com,"Book Review: Ta-Nehisi Coates visits Senegal, South Carolina and the Middle East for 'The Message'",2024-10-01,https://abcnews.go.com/Entertainment/wireStory/book-review-ta-nehisi-coates-visits-senegal-south-114386715,en,2024-10-02 09:21:33.023107
6cb979e95e232e5d5507cd7156627216627e6d9483bc7cd7322ecd4bba48977a,salon.com,salon.com,"From ""Orphan X"" to AI: How community keeps storytelling alive",2024-10-01,https://www.salon.com/2024/10/01/from-orphan-x-to-ai-how-community-keeps-storytelling-alive/,en,2024-10-02 02:17:28.814318
bb81aaabec3557c22a097b286e4a50047f3aa883deaea526131747c712d3c852,dispatch.com,dispatch.com,2 Ohio cities where child care costs more than rent. What to know,2024-10-01,https://www.dispatch.com/story/news/2024/10/01/ohio-cities-child-care-costs-more-rent-what-to-know-toledo-dayton-cincinnati-columbus/75466163007/,en,2024-10-02 05:18:51.842537
8525c0b2eb8be0833c3ca5a85459393589a95c1cfdd6ffac98b12caae224db6e,cnn.com,cnn.com,This drugstore hair care is a must-have for giving volume to limp locks,2024-10-01,https://www.cnn.com/cnn-underscored/reviews/not-your-mothers,en,2024-10-02 04:27:25.331578
9c56a00860901fd626a5425d546312f4c83987dc0762c91b1bc26b70d4dc14c1,forbes.com,forbes.com,How AI Can Help Generate Market And Property Insights,2024-10-01,https://www.forbes.com/councils/forbestechcouncil/2024/10/01/how-ai-can-help-generate-market-and-property-insights/,en,2024-10-02 04:27:57.209007
8f0fbb83eb74fa98787e750b704535509fdb05a99c3cb78ed5b4ea31b6e81a4c,latimes.com,latimes.com,Santa Margarita football coach Anthony Rouzier placed on administrative leave,2024-10-01,https://www.latimes.com/sports/highschool/story/2024-10-01/santa-margarita-football-coach-anthony-rouzier-placed-on-administrative-leave,en,2024-10-02 03:20:04.785174
0c4ef8e5895669586c91763085b278271c8408193c2e76dd34606e2bc874d5fb,usatoday.com,usatoday.com,How to buy Chicago Bears vs Carolina Panthers NFL tickets,2024-10-01,https://www.usatoday.com/story/sports/nfl/2024/10/01/bears-vs-panthers-nfl-tickets-october-6-2024/75472028007/,en,2024-10-02 03:24:01.464328
6929f9b78b2f3bf455c6e425d3b1552af49b00e1a22e570de2c8fe883f567fc8,nytimes.com,nytimes.com,"Noah Gragson on growing up in Las Vegas, his College Football 25 skills and more: 12 Questions",2024-10-01,https://www.nytimes.com/athletic/5801273/2024/10/01/noah-gragson-noah-gragson-college-football-25-12-questions/,en,2024-10-02 04:28:00.949424
f6384dd2e2e80a92433bbde971e7a800f4b3fda9776b66b293ad65fe39c72740,hotair.com,hotair.com,One Year Ago: Jake Sullivan Said Middle East Was at Peace,2024-10-01,https://hotair.com/david-strom/2024/10/01/one-year-ago-jake-sullivan-said-middle-east-was-at-peace-n3795251,en,2024-10-02 04:27:29.832665
1e3e60b6f7948b148ca3245cb02f695556a4f137e6de6f52d3d2ce09899ee7bd,dailysignal.com,dailysignal.com,Fact-Checking Claims Made in Vance-Walz Debate,2024-10-01,https://www.dailysignal.com/2024/10/01/fact-checking-claims-made-in-vance-walz-debate/,en,2024-10-02 13:25:56.654228
bed3d39a0712d7f5d7959ae123eea29d5adab9e322754e30d53b743d6184d804,forbes.com,forbes.com,Mics Cut As Candidates Spar Over Springfield—Ohio City Facing False Pet-Eating Claims,2024-10-01,https://www.forbes.com/sites/saradorn/2024/10/01/mics-cut-as-candidates-spar-over-springfield-ohio-city-facing-false-pet-eating-claims/,en,2024-10-02 04:19:03.112021
1bc8407064a7131d1f7c138bfd94617c128b4ea5e1e62f4ba184cc234a0fd49c,freep.com,freep.com,Justin Verlander left off Astros wild-card roster vs Detroit Tigers,2024-10-01,https://www.freep.com/story/sports/mlb/tigers/2024/10/01/justin-verlander-houston-astros-wild-card-roster-vs-detroit-tigers/75466695007/,en,2024-10-02 06:17:09.542255
aebaa3887fb42ece435c6be9a2fa5a2b310b6f766084818a050384cce5b42c8d,latimes.com,latimes.com,Will Ethan Garbers play for UCLA vs. Penn State? 'He's going to try',2024-10-01,https://www.latimes.com/sports/ucla/story/2024-10-01/ucla-football-ethan-garbers-injury,en,2024-10-02 03:17:34.818603
4a56cc6b64f4adcf73ee3028c4488664d6f868b735f1d3a032f68a49033dfb06,benzinga.com,benzinga.com,"STOCKHOLDER ALERT: The M Class Action Firm Investigates the Mergers of SMAR, TOWN and BRZH - Breeze Holdings Acq (OTC:BRZH), Smartsheet (NYSE:SMAR)",2024-10-01,https://www.benzinga.com/pressreleases/24/10/n41130521/stockholder-alert-the-m-a-class-action-firm-investigates-the-mergers-of-smar-town-and-brzh,en,2024-10-02 02:27:40.369563
57146f023f7bc659b011bd8fe03c658884407d1ca12e5d05e31e932ffa0735b8,ibtimes.com,ibtimes.com,Dortmund And Adeyemi Hand Celtic Brutal European Reality Check,2024-10-01,https://www.ibtimes.com/dortmund-adeyemi-hand-celtic-brutal-european-reality-check-3745198,en,2024-10-02 03:20:27.264069
366c3e8640db0190ad7b86eb23806b26c4978baf0b6c83fecc6e58cf9a771b86,cnn.com,cnn.com,"Gobierno de EE.UU., ante el reto de ayudar a los damnificados por el huracán Helene",2024-10-01,https://cnnespanol.cnn.com/video/eeuu-gobierno-federal-damnificados-ayuda-helene-dusa-tv-fast,es,2024-10-02 04:29:30.313581
d89e03070260a0c28be674179d3f6f4ef6585916ad882d1f2c265c7a1ea09fec,breitbart.com,breitbart.com,"Watch Live: JD Vance, Tim Walz Face Off in Vice Presidential Debate",2024-10-01,https://www.breitbart.com/politics/2024/10/01/watch-live-jd-vance-tim-walz-face-off-in-vice-presidential-debate/,en,2024-10-02 15:30:39.998993
3a51af3ec09e1e4386cc950271e3263b27ac4b5aa0f66c70d75ba236599085a7,breitbart.com,breitbart.com,"Vance: Past Opinions of Trump Were 'Wrong', I 'Believed' Media's Lies",2024-10-01,https://www.breitbart.com/politics/2024/10/01/vance-admits-past-opinions-trump-wrong-believed-media-lies/,en,2024-10-02 06:17:34.896535
8db981608b22cac9c54c65b29c12a96ba5d8b02eb5f9725cfcce6a00be4c73b0,freep.com,freep.com,"UAW striker killed, 4 others hurt while picketing at Eaton Aerospace",2024-10-01,https://www.freep.com/story/money/business/michigan/2024/10/01/uaw-striker-killed-4-others-hurt-while-picketing-at-eaton-aerospace/75464590007/,en,2024-10-02 06:18:50.168475
10bb542bb4d706ffd62555632ab507a2ff3c1277157faeee4e0dcfd79d89b7e7,cbsnews.com,cbsnews.com,NYC officials taking steps to protect Jewish New Yorkers after Iran's attack on Israel,2024-10-01,https://www.cbsnews.com/newyork/video/nyc-officials-taking-steps-to-protect-jewish-new-yorkers-after-irans-attack-on-israel/,en,2024-10-02 05:18:54.935717
31483b0cffdd26a3a9c48af665ec25cad79d5ea65df419e7f747135e5035da82,thenation.com,thenation.com,"Jimmy Carter, at 100, Is Best Honored by Listening to His Advice About the Middle East",2024-10-01,https://www.thenation.com/article/politics/jimmy-carter-100-interview/,en,2024-10-02 01:26:48.472527
d556468a6511b5bf22b50143f159dc9340c287be32ea8fa76d1ec3600247c914,cbsnews.com,cbsnews.com,Michigan voters share who they think won the VP debate,2024-10-01,https://www.cbsnews.com/video/michigan-voters-on-who-won-the-cbs-news-vice-presidential-debate/,en,2024-10-02 05:21:39.739968
08c2e7b32ddd9e2b4d0ae6542247756abca8dc37f5bafb0601be2986aec596f2,redstate.com,redstate.com,"HOT TAKES: Democrats, Media Seethe As Republicans Cheer After Vance Dominates Vice Presidential Debate",2024-10-01,https://redstate.com/sister-toldjah/2024/10/01/hot-takes-democrats-seethe-republicans-cheer-after-lively-vp-debate-n2180037,en,2024-10-02 09:24:31.796605
d429be443de2bad2ca62ab60c5b3d8d71cad4afb79c6e1af1a8197fa89e28fb3,realclearpolitics.com,realclearpolitics.com,"Walz Explains False Claim He Was In Hong Kong During Tiananmen Square Protests: ""I'm A Knucklehead At Times""",2024-10-01,https://www.realclearpolitics.com/video/2024/10/01/walz_explains_false_claim_he_was_in_hong_kong_during_tiananmen_square_protests_im_a_knucklehead_at_times.html,en,2024-10-02 12:31:25.609459
c7aed1cc2599e16745abe316f6e95af44107479f44acf8ffce45a59febf6435a,cnn.com,cnn.com,Panel on VP debate: ‘This is a game of inches”,2024-10-01,https://www.cnn.com/2024/10/01/politics/video/the-lead-vice-presidential-debate-jd-vance-tim-walz,en,2024-10-02 04:29:59.775878
2563689e91d4f90d36945b51404ad5a45d6413aac5f15fc55fb82faa4ce793be,nytimes.com,nytimes.com,A Davante Adams-Aaron Rodgers reunion? Why the Jets are a favorite to trade for the receiver,2024-10-01,https://www.nytimes.com/athletic/5810613/2024/10/01/davante-adams-trade-jets-raiders-aaron-rodgers/,en,2024-10-02 04:28:49.647824
45e2b47c65ad226ac8097215483b38e3ddf6c450b543c2fa563deb285aeb3861,usmagazine.com,usmagazine.com,Hailey Bieber Honors Late Designer Virgil Abloh With Wedding Dress Pic,2024-10-01,https://www.usmagazine.com/stylish/news/hailey-bieber-honors-late-designer-virgil-abloh-with-wedding-dress-pic/,en,2024-10-02 02:24:30.482321
74353f63e7e5cf6f355216b9559eca7d2d25f11c591343d3f2ad6af6d542209b,cincinnati.com,cincinnati.com,Fortnite's Fortnitemares Halloween event likely launching soon. What to know,2024-10-01,https://www.cincinnati.com/story/news/2024/10/01/fortnites-fortnitemares-halloween-event-likely-launching-soon-what-to-know/75465469007/,en,2024-10-02 06:27:25.616234
432adc98a68d0d25a9ab49462950627888f8e23a07febcd428614c8554d916e0,cbsnews.com,cbsnews.com,Turnberry on the Green Condominium president charged with embezzling over $1.5 million,2024-10-01,https://www.cbsnews.com/miami/video/turnberry-on-the-green-condominium-president-charged-with-embezzling-over-1-5-million/,en,2024-10-02 02:20:58.677317
1b032a11722f296932b2162d31efd695ac1cd1ed9bc7b47e76fef40d91729f4f,buzzfeed.com,buzzfeed.com,Los mejores jugadores de la Champions League,2024-10-01,https://www.buzzfeed.com/mx/amaurysalyano/los-mejores-jugadores-de-la-champions-league,es,2024-10-02 10:27:58.613476
316866ddc57101731b571d89510047e7665f3bc84327aac96c339880b9701ae5,pbs.org,pbs.org,PBS News Hour full episode,2024-10-01,https://www.pbs.org/newshour/show/october-1-2024-pbs-news-hour-full-episode,en,2024-10-02 06:26:51.397061
