id,media_name,media_url,title,publish_date,url,language,indexed_date
03876857a69d3edb282e76a417d3c26c8ebad07ec58ebe2d6cdad97180368411,stltoday.com,stltoday.com,"Box: Francis Howell North 11, Kirkwood 0",2024-09-03,https://www.stltoday.com/sports/high-school/softball-fall/box-francis-howell-north-11-kirkwood-0/article_2f69d013-1280-5896-9feb-8f78f8cd2b74.html,en,2024-09-04 10:55:57.795007
57fe6301f20fd40ca45a6e4d4935d692abc4ccc9f7e99de9f9b5ea55c5a1e703,syracuse.com,syracuse.com,Federal judge rejects Donald Trump’s request to intervene in wake of hush money conviction,2024-09-03,https://www.syracuse.com/politics/2024/09/federal-judge-rejects-donald-trumps-request-to-intervene-in-wake-of-hush-money-conviction.html,en,2024-09-04 07:29:02.635250
3131c0c39520aa8f56140b6abeceb741c2de728bbc207d23362c265b52ca0014,newsday.com,newsday.com,"East Enders soak up 'Tumbleweed Tuesday' after exodus of summer tourists, traffic and crowds",2024-09-03,https://www.newsday.com/long-island/towns/tumbleweed-tuesday-hamptons-cb3se792,en,2024-09-04 11:16:39.201710
f92f94a9af4c2a3aca4486f25abfdacecb9ba5700f5126079fa0b9fbe170c27d,upi.com,upi.com,"Trump Media shares hit new low, slip below $18 for first time",2024-09-03,https://www.upi.com/Top_News/US/2024/09/03/Trump-Media-shares-hit-new-low-slip-below-18-for-first-time/8001725410524/,en,2024-09-12 10:57:18.568927
7ce3e3cfdb9ba48968067b236297def0176c7601ddfa5b979d457073d3337443,foxnews.com,foxnews.com,'Reagan' movie beats box office expectations on opening weekend,2024-09-03,https://www.foxnews.com/media/reagan-movie-outperforms-expectations-box-office-opening-weekend,en,2024-09-04 11:33:14.390076
eeeeeaaeb3dfa149c587cbe48a673cebd10af61a3277c565e43cac3b04b370e8,nj.com,nj.com,Keegan lifts Wall past Brick Township,2024-09-03,https://www.nj.com/highschoolsports/2024/09/keegan-lifts-wall-past-brick-township-boys-soccer-recap.html,en,2024-09-04 08:32:45.273740
447c2f4482e9880e2cb3279ff14ac224a54435176a30ed34737acded6eaa4927,benzinga.com,benzinga.com,AerCap Holdings N.V. Announces Pricing of $2.4 Billion Aggregate Principal Amount of Senior Notes,2024-09-03,https://www.benzinga.com/pressreleases/24/09/n40695818/aercap-holdings-n-v-announces-pricing-of-2-4-billion-aggregate-principal-amount-of-senior-notes,en,2024-09-05 00:20:28.115613
739dae1270e2301bb123d0fe01230588eb39e4644a1f8eb9154156e6b4ff8a66,espn.com,espn.com,AP poll reaction: What's next for each Top 25 team,2024-09-03,https://www.espn.com/college-football/story/_/id/41056216/ap-college-football-poll-reaction-next-top-25-team,en,2024-09-04 15:34:16.101665
fc05c8fc8a4bc8c476398d9f918972807c43a764f6e5d8edb8635d77f5aa6c66,breitbart.com,breitbart.com,"11 Months After October 7, DOJ Charges 6 Hamas Leaders with Terrorism; 3 Already Dead, Killed by Israel",2024-09-03,https://www.breitbart.com/politics/2024/09/03/11-months-after-october-7-doj-charges-6-hamas-leaders-with-terrorism-3-already-dead-killed-by-israel/,en,2024-09-04 08:23:35.305219
6f622f74859190dbc740edcc9441fed93549407480f2244ec42b772a37335b0c,foxnews.com,foxnews.com,"Twins' Trevor Larnach hits line drive home run, drills fan in the face in win over Tampa Bay",2024-09-03,https://www.foxnews.com/sports/twins-trevor-larnach-hits-line-drive-home-run-drills-fan-face-win-over-tampa-bay,en,2024-09-04 11:34:13.358028
e8c4835a797f0ab6284fd5128902722d67c3ef3e7838b8fda0422a1e61d1bbbf,mlive.com,mlive.com,3 candidates vying for Ann Arbor-Jackson state House seat,2024-09-03,https://www.mlive.com/politics/2024/09/3-candidates-vying-for-ann-arbor-jackson-state-house-seat.html,en,2024-09-24 19:37:50.357700
9c437dcd04c6138cf464d741206bc8b433fd1a92addc3e7caf532c40aaa4cac0,benzinga.com,benzinga.com,Peering Into Simon Property Group's Recent Short Interest,2024-09-03,https://www.benzinga.com/insights/short-sellers/24/09/40693543/peering-into-simon-property-groups-recent-short-interest,en,2024-09-04 13:17:23.554381
c3a48f6ef0b8421eb5b12a5fc47e2b96212e12e153bf369d1f5b6e8929a278ca,benzinga.com,benzinga.com,AMH to Participate in BofA Securities 2024 Global Real Estate Conference,2024-09-03,https://www.benzinga.com/pressreleases/24/09/n40695888/amh-to-participate-in-bofa-securities-2024-global-real-estate-conference,en,2024-09-04 08:17:18.719859
257b61c4ad7501045e7299ea5b7bdf288622937c75612803947ee743cc93382f,saturdayeveningpost.com,saturdayeveningpost.com,"Listen Again: Billy Ocean's ""Suddenly""",2024-09-03,https://www.saturdayeveningpost.com/2024/09/listen-again-billy-oceans-suddenly/,en,2024-09-04 10:53:14.052656
8f79d3942d8285dc0b5489a9d999e7eb990cbcab955366c008e88e52f9a370c7,benzinga.com,benzinga.com,Will Intel Prove That An Old Saying Is True?,2024-09-03,https://www.benzinga.com/trading-ideas/technicals/24/09/40693841/will-intel-prove-an-old-wall-street-saying-true-what-to-look-for,en,2024-09-04 11:20:30.542548
8f739d368faa3f63f90df5207db0a75aadeeeba0a232ea24ab29dbd0a27d3bfa,foxnews.com,foxnews.com,"Kamala Harris new campaign hire attacks America as a 'cult,' 'bloodthirsty imperial beast'",2024-09-03,https://www.foxnews.com/media/kamala-harris-new-campaign-hire-attacks-america-cult-bloodthirsty-imperial-beast,en,2024-09-04 11:32:29.580995
95d2393d2660cddd90c742887524bbad5ce92803cc09b72b4762b38e2071a8df,foxnews.com,foxnews.com,‘Baywatch’ star Carmen Electra claims she was told to ‘lose some pounds’ while appearing on show,2024-09-03,https://www.foxnews.com/entertainment/baywatch-star-carmen-electra-claims-told-lose-some-pounds-appearing-show,en,2024-09-04 16:20:35.597634
3a94e21db17c7d376008e833a950e57ca1820f3c09fbd63783999b13ec3d9faa,foxnews.com,foxnews.com,SEE IT: Massive 'king of the neighborhood' gator strolls across the road,2024-09-03,https://www.foxnews.com/lifestyle/massive-king-neighborhood-gator-strolls-across-road,en,2024-09-06 03:18:30.467969
8bec7e184c4ca4708f1b0a4e63879478f55d4ebb0183be57da1be04f40e8ce2e,ajc.com,ajc.com,MLB postseason picture: Phillies clinch playoff spot; Braves still two out,2024-09-03,https://www.ajc.com/sports/atlanta-braves/mlb-postseason-picture-phillies-clinch-playoff-spot-braves-still-two-out/NUU2OLCGDJFSLI3BOLYORAD7CY/,en,2024-09-21 12:20:11.423874
7b8516fdf99214ba077137834ebcfb03c5f7a6d11129bec428b5970a3bfd3f06,newsday.com,newsday.com,Clearview AI fined $33.7 million by Dutch data protection watchdog over 'illegal database' of faces,2024-09-03,https://www.newsday.com/business/clearview-ai-facial-recognition-privacy-fine-netherlands-r21052,en,2024-09-04 11:01:48.966248
8627e1ed2707d10c21b2dd84238ff2f990c0ca94fbe3eba6dfe85e47a62c8a90,opednews.com,opednews.com,Hezbollah replies to Israel while preventing Netanyahu's plan for a regional war,2024-09-03,https://www.opednews.com/populum/page.php?f=Hezbollah-replies-to-Israe-Hezbollah_Israel_Israel-And-Palestine_Israel-Basic-Law-240903-772.html,en,2024-09-04 20:26:07.528435
c3124a86f3e498b1d1fefcda164211dad6759fb9014392c5379dfbc1c6de04ec,deadspin.com,deadspin.com,"After routing Florida, No. 12 Miami faces FCS foe Florida A",2024-09-03,https://deadspin.com/after-routing-florida-no-12-miami-faces-fcs-foe-florida-am/,en,2024-09-04 15:39:51.390250
60a0787454ad4843af4a385e90abacfd5c90cd324bf0664f42010296befdc7c7,denverpost.com,denverpost.com,Four easy dinners for a new school year,2024-09-03,https://www.denverpost.com/2024/09/03/four-easy-dinners-for-a-new-school-year/,en,2024-09-06 11:21:20.496151
cc9685c9ee653db16fcc57b047f0a01d9da6bf5c38712503c49d6a64f7eee5d5,latimes.com,latimes.com,"Seal Beach man arrested for allegedly assaulting officers, barricading self in business",2024-09-03,https://www.latimes.com/socal/daily-pilot/news/story/2024-09-03/seal-beach-man-arrested-for-allegedly-assaulting-officers-barricading-self-in-business,en,2024-09-04 11:33:40.802672
be63a8c46769680eae7c9dc5eddf72fee68c11e4ade04e87590cdceceeb285c4,marketwatch.com,marketwatch.com,The Complete CRM Buying Checklist 2024,2024-09-03,https://www.marketwatch.com/guides/business/crm-buyers-checklist/,en,2024-09-06 20:14:04.054679
3b44e505ad69545e24f1bd7b2ae63f417e26d5805d5ee7ffb68e5edef053b6aa,deadspin.com,deadspin.com,Maria Sharapova heads nominees for Tennis Hall of Fame,2024-09-03,https://deadspin.com/maria-sharapova-heads-nominees-for-tennis-hall-of-fame/,en,2024-09-04 15:38:07.138382
9408fee22fed9dde7f74cef9b18ac3e48f30c001d089212d0738774ac5356643,benzinga.com,benzinga.com,George Weston Limited to Issue $250 Million of Senior Unsecured Notes,2024-09-03,https://www.benzinga.com/pressreleases/24/09/n40697988/george-weston-limited-to-issue-250-million-of-senior-unsecured-notes,en,2024-09-04 08:18:17.631548
d8b0fab285a6b688d7095465132d6ec792e1819d27b15cc247e0926757325f42,tmz.com,tmz.com,Paris Hilton Injures Knee on Music Video Set After Recent Trailer Fire,2024-09-03,https://www.tmz.com/2024/09/03/paris-hilton-hurts-knee-music-video/,en,2024-09-04 08:17:28.453341
c9a9014a37fa792c1fd3e786c28d076e535fa3e1f2c064898a4275be4f47674c,breitbart.com,breitbart.com,Gold Star Father on Harris: 'Nothing on Her Record' Showing 'Leadership',2024-09-03,https://www.breitbart.com/politics/2024/09/03/afghanistan-gold-star-father-on-kamala-harris-nothing-on-her-record-that-shows-leadership/,en,2024-09-04 08:24:24.384968
38e5887f0a04ac17f464aef0bca79c24e0e44ddeea2b5d6372e9331b31152c73,rttnews.com,rttnews.com,"Indonesia Bourse May Give Up Support At 7,600 Points",2024-09-03,https://www.rttnews.com/story.aspx?Id=3472642,en,2024-09-04 10:18:26.222699
f71c4fc470a3d9be383b0535116cedb45736aa7d3b4a1d81b196ba7f566af6d2,benzinga.com,benzinga.com,Ease Expands Nationwide: Bridging the Gap in Pet Behavior Care in 18 States,2024-09-03,https://www.benzinga.com/pressreleases/24/09/g40699583/ease-expands-nationwide-bridging-the-gap-in-pet-behavior-care-in-18-states,en,2024-09-04 15:19:01.452872
188fadfbc106d97d101197d8b5b4aaa6ba884f8877977893151389faaff01116,newsday.com,newsday.com,"As Columbia resumes classes, student activists vow to carry on with protests against Israel",2024-09-03,https://www.newsday.com/news/nation/columbia-university-propalestinian-gaza-protests-t98392,en,2024-09-04 11:00:29.410413
10199b900a45d917fcf156d3b3c0708dc34d9fd3fd3cca7928579f8ab88fa3a0,deadspin.com,deadspin.com,No. 2 Ohio State prepares for tougher test from Western Michigan,2024-09-03,https://deadspin.com/no-2-ohio-state-prepares-for-tougher-test-from-western-michigan/,en,2024-09-04 15:36:51.835383
625c40eb8ee2d10363c90b51d68063f22cbd00f884750143a3b9dec380763a76,mlive.com,mlive.com,"3 vie for Michigan House seat covering a portion of Ann Arbor, northeast Washtenaw",2024-09-03,https://www.mlive.com/politics/2024/09/3-vie-for-michigan-house-seat-covering-a-portion-of-ann-arbor-northeast-washtenaw.html,en,2024-09-10 18:19:20.019861
c863c3a48773da89eb074c1aaa38a5f90e011f27c305ecfe8998e92b036436b6,startribune.com,startribune.com,Walz flies to Pennsylvania Wednesday on his first solo excursion for Harris ticket,2024-09-03,https://www.startribune.com/walz-flies-to-pennsylvania-wednesday-on-his-first-solo-excursion-for-harris-ticket/601137314,en,2024-09-04 11:24:14.534056
bcadbe76818e2947c20d007e94770cba25316f66319042238f3973df2628d572,opednews.com,opednews.com,Article: War and Language,2024-09-03,https://www.opednews.com/populum/page.php?f=War-and-Language-Russia_Ukraine-240903-879.html,en,2024-09-04 20:26:17.464372
757d2d234254531d8db07cb6d1f8512e5b21bce84cfdc6c141a755b457211a91,newsday.com,newsday.com,Islamic State group claims Kabul suicide attack that killed at least 6,2024-09-03,https://www.newsday.com/news/nation/afghanistan-taliban-islamic-state-attack-k43020,en,2024-09-04 10:19:05.829076
056450f701641c3128fe9576c002e670c0231e64b201a6540fc0fcca568d0e8f,sandiegouniontribune.com,sandiegouniontribune.com,Legislature unanimously approves resolution urging federal government to declare sewage crisis an emergency,2024-09-03,https://www.sandiegouniontribune.com/2024/09/03/legislature-unanimously-approves-resolution-urging-federal-government-to-declare-sewage-crisis-an-emergency/,en,2024-09-04 10:19:15.652962
50acdd42bd04b1c42d976d5553604bc350458c36cd627580628644e09a377890,newsday.com,newsday.com,4-year-old girl fatally shot inside a St. Louis house after children were left alone,2024-09-03,https://www.newsday.com/news/nation/child-killed-st-louis-n57759,en,2024-09-04 11:17:04.138649
4749ff0153a566b6d3202f4bc9efe81c9d7725ca9053aea55023e5bda371a2c0,nytimes.com,nytimes.com,Here’s Why Stock Indexes Sank on Tuesday,2024-09-03,https://www.nytimes.com/live/2024/09/03/opinion/thepoint/stock-market-nvidia,en,2024-09-04 21:27:54.002880
33827d2bbbe8092337c9b012bdce3ed4c6285236b3036b9c2253be9d87d2bec5,fansided.com,fansided.com,4 equipos que pueden darle un contrato multianual a Anthony Santander en 2025,2024-09-03,https://fansided.com/es/posts/4-equipos-pueden-darle-contrato-multianual-anthony-santander-2025,es,2024-09-06 22:05:54.871317
5a97cad67de1cd501bd38164b8c561fc09ce1a55a783d1c0407ec0c54697c319,fansided.com,fansided.com,Is Brandon Ingram going to holdout on the New Orleans Pelicans?,2024-09-03,https://fansided.com/posts/brandon-ingram-holdout-new-orleans-pelicans,en,2024-09-06 20:16:45.973169
c7c1e0426688f771e73dc875caeff0bc53212a7059b097a8d3b5b23ee500d1d5,newsday.com,newsday.com,"Florida State drops out of AP Top 25 after 0-2 start; Texas up to No. 3 behind Georgia, Ohio State",2024-09-03,https://www.newsday.com/sports/college/college-football/ap-top-25-e19905,en,2024-09-04 11:02:08.950389
bbb11809508a324d4d517c18741df5bb631eddc2e41a9c05e28e72b9d6372072,benzinga.com,benzinga.com,Intact Financial Corporation Chief Executive Officer Charles Brindamour to speak at Scotiabank Financials Summit,2024-09-03,https://www.benzinga.com/pressreleases/24/09/n40697077/intact-financial-corporation-chief-executive-officer-charles-brindamour-to-speak-at-scotiabank-fin,en,2024-09-04 11:40:26.144161
61c7a3a91471b28cbee2d377e8e330bb3c8761b03392e0a52239b0a9fdd21bc1,benzinga.com,benzinga.com,Highly Visible Packaging Market Size Expected to Reach USD 88.64 Bn by 2032,2024-09-03,https://www.benzinga.com/pressreleases/24/09/g40690130/highly-visible-packaging-market-size-expected-to-reach-usd-88-64-bn-by-2032,en,2024-09-04 10:46:08.976248
f14132b0df0e3af6877c7a340d59dca60b4d922068f3ae74e28f3c62e4d575df,fansided.com,fansided.com,Â¿CuÃ¡les son las nuevas reglas de la NFL para la temporada 2024-25?,2024-09-03,https://fansided.com/es/posts/cuales-nuevas-reglas-nfl-temporada-2024-25,es,2024-09-06 20:03:26.161433
1dbdf888a854dfed3716fd335131f9e18680a822058c20a637a66b0969a9e7b7,rttnews.com,rttnews.com,Lexicon Pharma: INPEFA Benefits Heart Failure Patients Regardless Of Diabetes Duration,2024-09-03,https://www.rttnews.com/3472563/lexicon-pharma-inpefa-benefits-heart-failure-patients-regardless-of-diabetes-duration.aspx,en,2024-09-04 09:25:52.910318
8aed58c4b613c44e71c03ec463a3387f7b6763e81b85e0939744ea2be18c4596,npr.org,npr.org,"Haircuts in Space, Tutus, and the Nasal Ranger",2024-09-03,https://www.npr.org/2024/09/03/1256914742/how-to-do-everything-haircuts-tutus-nasal-ranger,en,2024-09-05 04:23:08.948265
7a58c61c28088f7461f9cb2614c625338f29f72148fa8619ffe750414c0c3f6e,newsday.com,newsday.com,AP Player of the Week: Arizona's McMillan records first 300-yard receiving game since '22 Rose Bowl,2024-09-03,https://www.newsday.com/sports/college/college-football/ap-football-player-of-week-mcmillan-t98651,en,2024-09-04 11:01:28.758025
98980835b53adbe458a8d726a79cfac80d04d29748a60a4a6b278ca88b7858ed,newsday.com,newsday.com,FIFA says $6.5 billion of international spending in transfer window,2024-09-03,https://www.newsday.com/sports/soccer/fifa-transfer-window-fees-alvarez-s94365,en,2024-09-04 11:07:13.630244
9b8a2d4907514d6f3968225545b00a13583b1a39452fa63615d5b3d9defdc4b9,breitbart.com,breitbart.com,"Pro-Palestinian Protesters Return to Columbia: Vandalize Statue, Urge Boycott of Classes",2024-09-03,https://www.breitbart.com/education/2024/09/03/pro-palestinian-protesters-return-vandalize-columbia-statue-urge-boycott-of-classes/,en,2024-09-04 08:24:14.079794
7cf55a152b9b0cef552505c96ceec813f2be301c1126e3d2f426cbac8aeaad6b,sportingnews.com,sportingnews.com,"When does NBA 2K25 come out? Release date, early access, prices, and more to know about basketball video game",2024-09-03,https://www.sportingnews.com/au/nba/news/when-does-nba-2k25-come-out-release-date-early-access-price/cdb23d00121a7b997bfa90ce,en,2024-09-11 10:32:09.279989
1f3f452e1be564a9fc5a0bcbda3e84befe2d24831df4907aa1c9b23742d0b015,benzinga.com,benzinga.com,"MGM Resorts International Prices $850,000,000 in Senior Notes",2024-09-03,https://www.benzinga.com/pressreleases/24/09/n40695927/mgm-resorts-international-prices-850-000-000-in-senior-notes,en,2024-09-05 00:20:38.686645
38cea1bb66d1705adccfddfe41d2c1ea7009222571d07f809bcd32802518a48c,rttnews.com,rttnews.com,"Eminem, LL Cool J Join Forces On 'Murdergram Deux'",2024-09-03,https://www.rttnews.com/story.aspx?Id=3472550,en,2024-09-04 11:19:54.885422
496ae6fc1f1d20949dba4a039e505ffc48fd2a0b8fd69ed0d944fa93b7d00201,benzinga.com,benzinga.com,Verve Therapeutics Announces Inducement Grants under Nasdaq Listing Rule 5635(c)(4),2024-09-03,https://www.benzinga.com/pressreleases/24/09/g40695584/verve-therapeutics-announces-inducement-grants-under-nasdaq-listing-rule-5635-c-4,en,2024-09-04 17:27:17.098798
9213977adfb28966fd1b8eb30f7a0b22903b86550738c08c41c0a910fdecad52,dailykos.com,dailykos.com,Cartoon: Paying his respects,2024-09-03,https://www.dailykos.com/story/2024/9/3/2267485/-Cartoon-Paying-his-respects?pm_campaign=blog&pm_medium=rss&pm_source=,en,2024-09-04 16:29:17.546659
a4e69de329ecbc086aa5d6f533edd8efb0655c3dfcbbf54ca69e688602507cb1,newsday.com,newsday.com,Ex-doctor pleads guilty to manslaughter in connection with suicide of upstate New York woman,2024-09-03,https://www.newsday.com/news/nation/assisted-suicide-homicide-new-york-r59481,en,2024-09-04 10:22:45.916717
29f5a859dfbceb709df5c2cb37f287db52f208ba7b26d52a520990d17aff6dfe,orlandosentinel.com,orlandosentinel.com,Residents of St. Cloud mobile home park regularly go without water for hours,2024-09-03,https://www.orlandosentinel.com/2024/09/03/residents-of-st-cloud-mobile-home-park-regularly-go-without-water-for-hours/,en,2024-09-04 10:20:31.162756
df274b65e34bdd2b2bb3ac0e704aec8179ccf90f48a922dd474a00608d750a40,newsday.com,newsday.com,Prosecutors drop fraud case against Maryland attorney,2024-09-03,https://www.newsday.com/news/nation/jeremy-schulman-attorney-somalia-charges-dropped-l52403,en,2024-09-04 11:14:59.197246
68249696cebdd029d3cbee11f1420ea92a71fca0c2dcd6f515126e5372aa2858,opednews.com,opednews.com,"Tax On ""Unrealized"" Gains: Weird, Evil, and Stupid, But No Different In Principle",2024-09-03,https://www.opednews.com/populum/page.php?f=Tax-On-Unrealized-Gains-Taxation-240903-998.html,en,2024-09-04 20:26:57.478979
28c141173fbd8b51360b0952645a65307af511885bf93a2061062a9bc85637be,newsday.com,newsday.com,Mexican Kansas City Chiefs fans are eagerly awaiting the start of the new season,2024-09-03,https://www.newsday.com/sports/football/chiefs-kansas-city-mahomes-nfl-mexico-w96344,en,2024-09-04 11:49:47.839575
c0045187ecd6ac0be114e0c07080332ac6bd776de46469e4a57be076e4445a85,newsday.com,newsday.com,Remembering when 'Moondoggie' surfed a wave of popularity to LI,2024-09-03,https://www.newsday.com/entertainment/celebrities/james-darren-gateway-d7j2sc1a,en,2024-09-04 11:14:09.179660
42c9b0d333d704f0d083280d933a26b0e32f2f8f2b4b143b19a163f5a82427e8,fansided.com,fansided.com,LeBron James revela cÃ³mo afronta los momentos 'clutch' en los juegos,2024-09-03,https://fansided.com/es/posts/lebron-james-revela-como-afronta-momentos-clutch-juegos,es,2024-09-06 21:36:43.912728
2a19625e376306037cddfacc9c81ac5d4f61e28da453d3a47f5db26d6cefa4db,espn.com,espn.com,Florida St. drops out of AP Top 25 after 0-2 start,2024-09-03,https://www.espn.com/college-football/story/_/id/41109883/florida-state-drops-ap-top-25-poll-0-2-start,en,2024-09-04 15:33:47.810802
721a1139fcc14feb817705f4284c447b4387c803457139b20d4b1e7ed01dd302,dailydot.com,dailydot.com,Family spends $50 on Whataburger big box. Is it worth it?,2024-09-03,https://www.dailydot.com/web-stories/family-spends-50-on-whataburger-big-box-is-it-worth-it/,en,2024-09-06 19:30:24.252843
8f93282a7d42f3183f74cbbad3f4ac7516729e8c9c9e4df4656725fdfd41bbaa,newsday.com,newsday.com,Scottie Scheffler has a strong mind that will be put to the test as expectations rise: Analysis,2024-09-03,https://www.newsday.com/sports/golf/scottie-scheffler-tiger-fedex-cup-olympics-louisville-s25652,en,2024-09-04 11:14:14.149736
86d8af89c0de0cec2dcbf88180cfc3bbac7c8a71fa52a28da627438737e2d491,newsday.com,newsday.com,Iowa lieutenant governor resigns to take over state lobby group representing bankers,2024-09-03,https://www.newsday.com/news/nation/iowa-lieutenant-governor-resignation-f14693,en,2024-09-04 11:10:42.488682
5ea5c6ead3d996b2156bdde10662b68abd3ca347308c367a00246183b3b0918d,newsday.com,newsday.com,Rookie Bo Nix is next QB up for the Broncos after more than a dozen others failed post-Manning,2024-09-03,https://www.newsday.com/sports/football/denver-broncos-bo-nix-o07360,en,2024-09-04 11:17:11.530369
613f171c8ebdf23a3b2566d685b186d4b78c8c66b257c1645b26e931505b1b55,newsday.com,newsday.com,Best: Will Tom Brady be G.O.A.TV?,2024-09-03,https://www.newsday.com/sports/columnists/neil-best/tom-brady-fox-broadcast-yc4od5mu,en,2024-09-04 10:19:30.675005
d9b335420ba34a3bedf9a64adfc33599933dff7c8a42810dbc991928a9f9c919,syracuse.com,syracuse.com,3 takeaways from Bills-Cardinals: Josh Allen brings back the hurdle in win,2024-09-03,https://www.syracuse.com/buffalo-bills/2024/09/3-takeaways-from-bills-cardinals-josh-allen-brings-back-the-hurdle-in-win.html,en,2024-09-08 22:18:52.402251
5319c221892480c4bdbe80ae274cbf53d5f8650bd586d78b0ca5e1a984eb8823,fansided.com,fansided.com,"Stefon Diggs admits cold truth about being traded from Vikings, Bills",2024-09-03,https://fansided.com/posts/stefon-diggs-admits-cold-truth-about-being-traded-from-vikings-bills,en,2024-09-06 22:08:54.826550
21233d910dd9fb7f40800f709cd1800295a4d8508146dd6d7f0ef3ec1a4903bc,ajc.com,ajc.com,Review: Eclectic barbecue experience awaits at Gene’s in East Lake,2024-09-03,https://www.ajc.com/food-and-dining/dining/review-eclectic-barbecue-experience-awaits-at-genes-in-east-lake/3IY2AVMOKVCWTND64IISDG5GCY/,en,2024-09-04 18:19:31.037795
701ab9d22092d45d27bb730ae6a9f7d3a8436d42a50ab0333a2440435c34ef13,buzzfeed.com,buzzfeed.com,Pub Quiz Trivia Quiz,2024-09-03,https://www.buzzfeed.com/oatthegoat7/pub-quiz-trivia-quiz,en,2024-09-05 18:28:12.310942
d9386d71e0f795a8baf08789dad881f65c6ed5d716ea8afc90615b002a84f07b,chicagotribune.com,chicagotribune.com,Hinsdale 5-bedroom home with an in-law suite: $1.3M,2024-09-03,https://www.chicagotribune.com/2024/09/03/hinsdale-5-bedroom-home-in-law-suite/,en,2024-09-04 10:54:15.871738
3c438d2ed16e8f281d2c556022ccb04a79d8907069016c70fde9df7d847d052a,benzinga.com,benzinga.com,US Set To Impose Fresh Sanctions On Venezuelan Officials Involved In Nicolás Maduro's Reelection: Report,2024-09-03,https://www.benzinga.com/news/24/09/40684235/us-set-to-impose-fresh-sanctions-on-venezuelan-officials-involved-in-nicol-s-maduros-reelection-repo,en,2024-09-05 11:25:08.864807
b76bc250276a014f61f1e342cada057dbba4224aae096ce5afe889c8ac971bbf,newsday.com,newsday.com,"Iran's Supreme Court backs death penalty for Guard volunteer over 2022 protest killing, lawyer says",2024-09-03,https://www.newsday.com/news/nation/iran-mahsa-amini-protests-revolutionary-guard-j60250,en,2024-09-04 10:21:50.642019
e3f061dd44becbe262fa2a7aa27e84908b99979d8a3b95123b5d3b844a8cf58d,deadspin.com,deadspin.com,"No. 14 Tennessee, No. 24 NC State excited for primetime battle",2024-09-03,https://deadspin.com/no-14-tennessee-no-24-nc-state-excited-for-primetime-battle/,en,2024-09-04 15:43:09.955302
3c9aa42823853b18979fa231d083fbcecd3df3c6885803716d7bd3f7ccdb342c,foxsports.com,foxsports.com,Kyle Schwarber smacks his SECOND home run to cut Phillies' deficit against Blue Jays,2024-09-03,https://www.foxsports.com/watch/fmc-rr91j9ysopu7i261,en,2024-09-05 11:23:15.610235
d51b16eed2ecb838cee1d534ce6374f7ae68c40ac1dda8b2220bc071d591e3f8,newsday.com,newsday.com,Roger Federer is back at the US Open as a fan after speaking about Sinner's 'tricky' doping case,2024-09-03,https://www.newsday.com/sports/tennis/federer-sinner-nadal-us-open-2024-s73376,en,2024-09-04 11:09:57.826408
aad7196b264da412a7b4ed1394aa5e9a8eef2015d9f09c25736ebbeaecb7e9da,newsday.com,newsday.com,Man killed after allegedly shooting at North Dakota officers following chase,2024-09-03,https://www.newsday.com/news/nation/north-dakota-police-shooting-suspect-killed-f04779,en,2024-09-04 11:06:58.332821
2538f5af3c9753976d400388a8c2d1456380099b52be41d0244aec541062b3c3,newsday.com,newsday.com,Hedge fund Elliott Investment Management steps up pressure on Southwest Airlines' management,2024-09-03,https://www.newsday.com/business/southwest-airlines-elliott-management-proxy-fight-e05980,en,2024-09-04 11:17:16.431064
5ab1a773f06290e22661a495498d0d213f5656b3991a08cabb68b4b157c15b30,newsday.com,newsday.com,Grand Canyon pipeline repairs completed; overnight lodging set to resume,2024-09-03,https://www.newsday.com/news/nation/grand-canyon-national-park-pipeline-repairs-q07293,en,2024-09-04 11:09:37.659916
0290ec313b305db7194a04481e2dd8f25e390da0bebd3fecfba04c33b87c4ab4,nj.com,nj.com,Cedar Creek tops Vineland in overtime,2024-09-03,https://www.nj.com/highschoolsports/2024/09/cedar-creek-tops-vineland-in-overtime-boys-soccer-recap.html,en,2024-09-04 08:31:32.640568
bc7bf62faba166c97ba06f1db03c924c0800ef749ad6e8f4e8ed1fba76dbd1fa,ajc.com,ajc.com,MLB postseason picture: All scenarios for final two NL wild card spots,2024-09-03,https://www.ajc.com/sports/atlanta-braves/mlb-postseason-picture-all-scenarios-for-final-two-nl-wild-card-spots/NUU2OLCGDJFSLI3BOLYORAD7CY/,en,2024-09-29 09:29:07.193366
