id,media_name,media_url,title,publish_date,url,language,indexed_date
4403f71a8b08ecdf75f10a1058ab8ed3076f1b2f4ab16b320809a7e0edbc23b9,thestreet.com,thestreet.com,Nvidia shares buffeted by global security concerns,2024-10-01,https://www.thestreet.com/investing/stocks/nvidia-shares-buffeted-by-global-security-concerns,en,2024-10-02 06:30:54.947014
e830219909ab2872bb36e49b30b883520cc41c91c463f79fc9ac6470dfdd6300,ncregister.com,ncregister.com,Bishop Conley Pays Tribute to Archbishop Chaput — ‘A Prophet of Our Time’,2024-10-01,https://www.ncregister.com/commentaries/bishop-conley-tribute-to-archbishop-chaput,en,2024-10-02 06:30:59.913203
45de8dd3a23267bf8d581bc9c8ab82f0aa8d0dddd7198cd580675b4239cf84c4,sportingnews.com,sportingnews.com,Corinthians: Alex Santana e Talles Magno jogam contra o Flamengo?,2024-10-01,https://www.sportingnews.com/br/futebol-brasileiro/noticias/corinthians-alex-santana-talles-magno-jogam-contra-flamengo/e52802641793f2cdacbba92d,pt,2024-10-02 09:19:07.409191
8063a047fac4f2a4ca1b2cab118399a984221b06aa5ad55c0f074ca5f8485b1a,stltoday.com,stltoday.com,"Box: Granite City 4, Mascoutah 3",2024-10-01,https://www.stltoday.com/sports/high-school/boys-soccer/box-granite-city-4-mascoutah-3/article_dd1850f2-bed4-5ebf-beb3-6d319ec59601.html,en,2024-10-02 10:58:41.610027
dd38c03d1c6e1db11e9d9e2b66d9cc589cbf6690e20b87e9911ef9deda34bc46,dailykos.com,dailykos.com,Here's Tim Walz's perfect answer on immigration,2024-10-01,https://www.dailykos.com/story/2024/10/1/2274171/-Here-s-Tim-Walz-s-perfect-answer-on-immigration?pm_campaign=blog&pm_medium=rss&pm_source=,en,2024-10-02 16:31:27.790777
048ac236a03a12b4671f8c3f4c3fd396e7fcc6bf8db318ed3bdda959ec161371,nypost.com,nypost.com,"See Oscar winner Daniel Day-Lewis, 67, make his shocking return to acting 7 years after retiring",2024-10-01,https://nypost.com/2024/10/01/entertainment/daniel-day-lewis-seen-on-film-set-after-retiring-from-acting/,en,2024-10-02 05:19:15.358299
e4d5cec624a070bbffab5d0413ba45d2f5d30c3dd76636e91910057bef094c63,sandiegouniontribune.com,sandiegouniontribune.com,Tackling crossborder sewage crisis top of mind in Imperial Beach elections,2024-10-01,https://www.sandiegouniontribune.com/2024/10/01/tackling-crossborder-sewage-crisis-top-of-mind-in-imperial-beach-elections/,en,2024-10-02 03:25:05.724784
5acc31a055a8ebd29a2568e69f9e06ca8d4af537a991600b45e24e3b631905dd,nypost.com,nypost.com,‘American Pickers’ cast pay tribute to Frank Fritz after death at 60: ‘Godspeed Brother’,2024-10-01,https://nypost.com/2024/10/01/entertainment/american-pickers-cast-pay-tribute-to-frank-fritz-after-death-at-60/,en,2024-10-02 05:30:51.390447
9735a65b4697a2d2d5e7d8973db1ca1b767e4b51041618fe4b22fc724ca0d086,cbsnews.com,cbsnews.com,Chicago area mom is furious after boy riding bike was injured after hit-and-run,2024-10-01,https://www.cbsnews.com/chicago/news/elmwood-park-hit-and-run/,en,2024-10-02 02:27:37.481915
85c2febb1a7143815d4d8955c505cec92c3876d4e78f59c519ee3a4ccf12e55f,sportingnews.com,sportingnews.com,"Arsenal x PSG: resultado, gols e como foi o jogo pela Champions League",2024-10-01,https://www.sportingnews.com/br/futebol/noticias/arsenal-x-psg-resultado-gols-como-foi-jogo-champions-league/874e642a2a39ed25daf640f2,pt,2024-10-02 09:21:03.003913
7ae92a26b208dcfd914111693328e5775a373772ae6f01a8f279b0846b149839,dispatch.com,dispatch.com,Rascal Flatts to perform in Columbus on March 6,2024-10-01,https://www.dispatch.com/story/entertainment/music/2024/10/01/rascal-flatts-tour-life-is-a-highway-concert-columbus-on-march-6-nationwide-arena/75465401007/,en,2024-10-02 05:17:33.096365
f5cfb4aec6f1356aa0e670b015e0864e0d20b73cdfa14848b4630e3b067987b1,eonline.com,eonline.com,Nicole Kidman's Daughter Sunday Makes Bewitching Runway Debut at Paris Fashion Week,2024-10-01,https://www.eonline.com/news/1408044/nicole-kidmans-daughter-sunday-makes-bewitching-runway-debut-at-paris-fashion-week?cmpid=rss-syndicate-genericrss-us-fashion,en,2024-10-02 08:17:46.318696
5ec2e743af5fd0e43ddb25b85a5cdf7de62ec851924db4ed4bb40a2091b36816,baltimoresun.com,baltimoresun.com,Vance and Walz focus their attacks on the top of the ticket — not each other: VP debate takeaways,2024-10-01,https://www.baltimoresun.com/2024/10/01/vance-walz-vp-debate-takeaways/,en,2024-10-02 03:26:27.740517
b66de3413a9e118a7cef6809b113f5e5e3819842499b279341fac7032047a382,stltoday.com,stltoday.com,Recap: Troy Buchanan waltzes over Francis Howell North,2024-10-01,https://www.stltoday.com/sports/high-school/softball-fall/recap-troy-buchanan-waltzes-over-francis-howell-north/article_07bc3733-bb1b-50c2-928a-e588b405932b.html,en,2024-10-02 10:56:16.080771
e8af3f4d27c014dab19b3c47fb305b57d9385d61546fd2547a37d8f6416cfa56,stripes.com,stripes.com,Friendship society helps US military shoppers navigate Japanese grocery stores,2024-10-01,https://www.stripes.com/branches/marine_corps/2024-10-01/japan-off-base-grocery-shopping-15365890.html?utm_source=Stars+and+Stripes+Emails&utm_campaign=Daily+Headlines&utm_medium=email,en,2024-10-02 11:26:44.472192
022f158ebbbdb7a33db82dd9552f53aeb1656538c28b11b64253a21685b769ae,hollywoodreporter.com,hollywoodreporter.com,Erewhon Teams With Deodorant and Body Care Brand Salt & Stone for Surprising Smoothie Collab,2024-10-01,https://www.hollywoodreporter.com/news/general-news/erewhon-smoothie-collabs-salt-and-stone-1236017593/,en,2024-10-02 02:18:12.705240
fe5d89b32483c26b32d06296229883b0fbeb93fceaffc95b405c423efac281e1,cleveland.com,cleveland.com,Kenny Atkinson vows to keep Cavs as defense-first team,2024-10-01,https://www.cleveland.com/cavs/2024/10/kenny-atkinson-vows-to-keep-cavs-as-defense-first-team.html,en,2024-10-02 02:26:38.317234
c02e3067fd1298a76c0cd83df5b1216790d37ec87f22722ba3c4cd6cd3d21677,usatoday.com,usatoday.com,Trump's Hurricane Helene GoFundMe raises more than $2 million,2024-10-01,https://www.usatoday.com/story/news/politics/elections/2024/10/01/trumps-hurricane-helene-gofundme/75467364007/,en,2024-10-02 03:32:03.028152
00402507ceb217c97a0c47ce2089adadcc00c5340fe885abbcf0b1447f155e9b,elnuevodia.com,elnuevodia.com,"Fallece John Amos, de “Good Times” y “Roots” nominado al Emmy",2024-10-01,https://www.elnuevodia.com/entretenimiento/peliculas-series/notas/fallece-john-amos-de-good-times-y-roots-nominado-al-emmy/,es,2024-10-02 06:33:14.089990
1036c8bfefbe916fb69e1e5690fbc660c9155c4edc0318ac0aff0e49ad5a7dcc,stripes.com,stripes.com,Navy’s only laser-equipped destroyer en route to Japan for homeport shift,2024-10-01,https://www.stripes.com/branches/navy/2024-10-01/uss-preble-helios-laser-japan-15365682.html,en,2024-10-02 11:26:50.457694
7d5f87fcffc7fbd4eacbe51fc6f327ced1e0dceb63b9e8e8a61043a76cb0cb30,cbsnews.com,cbsnews.com,"Rapid weather changes, peak foliage and astronomical events on tap for October in New England",2024-10-01,https://www.cbsnews.com/boston/news/october-weather-foliage-frost-comet/,en,2024-10-02 23:24:28.248491
6a73df0f98cfba59f3a6bbfb88a51972eba98c06d45f4c0b17c7535c09273d76,nj.com,nj.com,"Girls volleyball roundup: Top 20 recaps from Tuesday, Oct. 1",2024-10-01,https://www.nj.com/highschoolsports/2024/10/girls-volleyball-roundup-top-20-recaps-from-tuesday-oct-1.html,en,2024-10-02 03:18:35.129025
7604b7bb23db121776d3121cd45a4b45ffb70b3897585b4ca1ebb6d6ef7e4d65,nytimes.com,nytimes.com,Walz Says His Son Witnessed a Shooting at a Community Center,2024-10-01,https://www.nytimes.com/video/us/politics/100000009735828/tim-walz-son-shooting-witness.html,en,2024-10-02 07:27:48.539341
53dfdcaff8f5daebf1678a07e570058da23a7fb8e70ea4d3ee6d82196a3901d7,nytimes.com,nytimes.com,"Why Dikembe Mutombo was larger than life. Plus, biggest NBA media day takeaways",2024-10-01,https://www.nytimes.com/athletic/5808884/2024/10/01/dikembe-mutombo-nba-media-day-draymond-green-the-bounce/,en,2024-10-02 04:32:33.917070
fc753803218234c808870327d3a464682007ca0d603dfa72f6031dca2151339a,cbsnews.com,cbsnews.com,Breaking down the vice presidential debate between J.D. Vance and Tim Walz,2024-10-01,https://www.cbsnews.com/newyork/video/breaking-down-the-vice-presidential-debate-between-j-d-vance-and-tim-walz/,en,2024-10-02 05:18:20.294858
0eee27651dee0f5f57d00d1099fa7a90f857930b5df6a4f24723de86b5a3e341,billboard.com,billboard.com,"Dexter Holland of The Offspring Talks New Album ‘Supercharged,’ 30 Years of ‘Smash’ & More",2024-10-01,https://www.billboard.com/music/music-news/dexter-holland-the-offspring-interview-new-album-supercharged-30-years-of-smash-1235789960/,en,2024-10-02 02:21:20.180984
c9bc37026887185106916fc11c66ca40e21bba828c248c8d1733822e9618efec,rttnews.com,rttnews.com,"Sensex, Nifty End Flat After Volatility",2024-10-01,https://www.rttnews.com/story.aspx?Id=3478629,en,2024-10-02 10:19:23.308023
909d0c897247c456a12702cf390da5f561b7030e08f7ebedf29738964786de90,salon.com,salon.com,Georgia judge to decide if the state's MAGA election board broke the law,2024-10-01,https://www.salon.com/2024/10/01/georgia-to-decide-whether-the-states-maga-board-broke-the-law-with-late-rule-changes/,en,2024-10-02 02:17:07.817184
bf0ff0d189cf59cfb2388d6a22ae031235cfbcc83bee992d218390e78ba6c601,benzinga.com,benzinga.com,"Fuel Cell Power System Market to Reach $15.2 Billion, Globally, by 2030 at 17.7% CAGR: Allied Market Research",2024-10-01,https://www.benzinga.com/pressreleases/24/10/g41118508/fuel-cell-power-system-market-to-reach-15-2-billion-globally-by-2030-at-17-7-cagr-allied-market-re,en,2024-10-02 09:31:53.177090
dab8a6802fad9927a93492f09420396b7c424b9f9d0b5ed258912bf51ae32f87,nypost.com,nypost.com,"Luke Weaver took long, winding road to become Yankees’ closer",2024-10-01,https://nypost.com/2024/10/01/sports/the-long-winding-road-that-brought-luke-weaver-to-yankees-closer-role/,en,2024-10-02 05:20:15.395540
1cf8083957e64338191a47c2ab58a3c37ffe3bf5d948a53c1e71da1f3124bb10,usatoday.com,usatoday.com,MLB playoffs streaming: How to watch wild card without cable,2024-10-01,https://www.usatoday.com/story/sports/mlb/2024/10/01/2024-mlb-playoffs-wild-card-streaming-tv-how-to-watch/75469662007/,en,2024-10-02 03:32:08.014621
94b13d4f999b9805c68deb384fd422b40b46a8c596620fe8d8efcfc36ccbc621,qz.com,qz.com,14 major East Coast ports affected by the dockworkers' strike,2024-10-01,https://qz.com/ila-dockworkers-strike-cities-ports-1851662106,en,2024-10-02 03:18:00.824887
41d26c870a37e5314743ea753a1f0a1320e55acec7bcde6ca32d39dee0e49958,oregonlive.com,oregonlive.com,"Man who threatened faculty, staff after he was dismissed from dental program gets home detention",2024-10-01,https://www.oregonlive.com/crime/2024/10/man-who-threatened-faculty-staff-after-he-was-dismissed-from-dental-program-gets-home-detention.html,en,2024-10-02 05:24:00.852655
f5dcdd9e4beb06cc4bb51af098f82cbe327ffa2bef075793b2f0a0806d1bb380,usatoday.com,usatoday.com,Hillary Clinton warns Kamala Harris of an 'October surprise',2024-10-01,https://www.usatoday.com/story/news/politics/elections/2024/10/01/october-surprise-trump-harris-election-hillary-clinton-warning/75464000007/,en,2024-10-02 03:29:32.991581
5b597778a1d6f295d72bef973e2ae4155c397b8f5d61e8c0c5d4819a980d14be,abcnews.go.com,abcnews.go.com,"Watchdog blasts DEA for not reporting waterboarding, torture by Latin American partners",2024-10-01,https://abcnews.go.com/US/wireStory/watchdog-blasts-dea-reporting-human-rights-abuses-foreign-114395546,en,2024-10-02 13:22:50.935204
b07155ff9fc27b94c97da6a29c5c9ebbc13aa4465a189a1a3cdfbd7d5d46f6f1,usatoday.com,usatoday.com,'Make the doors lock better': VP candidates debate school shootings,2024-10-01,https://www.usatoday.com/story/news/politics/elections/2024/10/01/jd-vance-school-shootings-debate-answer/75474721007/,en,2024-10-02 10:23:08.194289
e71d4550193496509c81549975e8a31c915340686683057db6b8b837e6d2044e,nytimes.com,nytimes.com,What we’ve learned about the L.A. Kings so far in training camp and preseason,2024-10-01,https://www.nytimes.com/athletic/5808608/2024/10/01/la-kings-nhl-training-camp-preseason-analysis/,en,2024-10-02 04:34:58.887757
f12cb07d04a48f745af05a75396176e23ecde3cdc59e2470eedda8783f844fda,cnn.com,cnn.com,Gianluigi Donnarumma errors help Arsenal to victory over Paris Saint-Germain,2024-10-01,https://www.cnn.com/2024/10/01/sport/arsenal-paris-saint-germain-spt-intl/index.html,en,2024-10-02 04:30:34.693004
d21b40e96f44f07642e3e0340326359f43669ac93a05344636ae7bbac054967a,nytimes.com,nytimes.com,"In aftermath of Pete Rose’s death, silence from Rob Manfred and Tony Clark",2024-10-01,https://www.nytimes.com/athletic/5810427/2024/10/01/pete-rose-death-rob-manfred-tony-clark/,en,2024-10-02 04:36:03.875076
15003866fd472c1872f76befa516286c0352b190f049508c6fbfcf500e082086,pbs.org,pbs.org,Asheville mayor on what North Carolina needs as flooding recovery process begins,2024-10-01,https://www.pbs.org/newshour/show/asheville-mayor-on-what-north-carolina-needs-as-flooding-recovery-process-begins,en,2024-10-02 04:27:31.795078
e400a5d9b648beeff47f09a05077d5778149c9d4bdffbf784ddb89e95ee3ac83,stltoday.com,stltoday.com,"Box: Jackson 8, St. Dominic 3",2024-10-01,https://www.stltoday.com/sports/high-school/softball-fall/box-jackson-8-st-dominic-3/article_9bf8aec8-e3c9-53b2-ade9-85bece8e6b88.html,en,2024-10-02 10:55:45.967365
4083cbdbf7df76ff722606abdbce2931ccf4b5e329c5dbf0d7a4aba0054755dc,breitbart.com,breitbart.com,"JD Vance Makes the Case for Tariffs to Protect American Jobs, Wages",2024-10-01,https://www.breitbart.com/2024-election/2024/10/01/jd-vance-makes-case-tariffs-protect-american-jobs-wages/,en,2024-10-02 12:24:36.664644
89c6f0094d56c151b631290e84901174191c8f30e04d4660c4021cb8dce67609,ign.com,ign.com,Daniel Day-Lewis Is Coming Out of Acting Retirement for His Son's Film,2024-10-01,https://www.ign.com/articles/daniel-day-lewis-is-coming-out-of-acting-retirement-for-his-sons-film,en,2024-10-02 01:26:41.363591
02e8bc78fcc3509f4fb07a415741ed84fa054e99a7b5034bb69753a21b9d3501,businessinsider.com,businessinsider.com,Mortgage Liens: What You Need to Know,2024-10-01,https://www.businessinsider.com/personal-finance/mortgages/what-is-mortgage-lien,en,2024-10-02 02:22:12.223649
d60365349b23072f0b57c7e1c9c21b860a8bbab295f411a3deb53fe3d8797cc9,benzinga.com,benzinga.com,"Bragar Eagel Squire, P.C. Reminds Investors That Class Action Lawsuits Have Been Filed Against Orthofix, Spire Global, DexCom, and Methode Electronics and Encourages Investors to Contact the Firm - Methode Electronics (NYSE:MEI), DexCom (NASDAQ:DXCM)",2024-10-01,https://www.benzinga.com/pressreleases/24/10/g41133562/bragar-eagel-squire-p-c-reminds-investors-that-class-action-lawsuits-have-been-filed-against-ortho,en,2024-10-02 02:21:48.028690
96ff554f17e5ad549a1001562098df7fc9baeb41d76908c9a67abbf6c8a11ebc,theroot.com,theroot.com,Remember That Black Pastor Who Got Arrested for Watering Flowers? He Just Got Some Good News,2024-10-01,https://www.theroot.com/remember-that-black-pastor-who-got-arrested-for-waterin-1851662298,en,2024-10-02 03:26:00.863843
eec41db9345119de6c42f37413f95e31f76448e745a67bf7bbfc5c06002562bb,buzzfeed.com,buzzfeed.com,Arma tu festival de K-Pop ideal y te diré exactamente de qué color es tu aura,2024-10-01,https://www.buzzfeed.com/mx/karenricoy/arma-tu-festival-de-k-pop-ideal-y-te-dire-exactamente-de,es,2024-10-02 10:27:33.586164
e2d531c9c4ab64214e06290dd0ae7706fcc550b7afd48cd7a9e8e899dd4dc031,cnn.com,cnn.com,GOP Rep.: Middle East ‘spinning completely out of control’,2024-10-01,https://www.cnn.com/2024/10/01/us/video/the-lead-vice-president-debate-tim-walz-jd-vance-iran-israel-hezbollah-jake-tapper,en,2024-10-02 04:28:04.892776
b2ea7999740c514dce5a5efb3d56e4fb7c124f5bda674a9da2d870f9c9660f31,sandiegouniontribune.com,sandiegouniontribune.com,Poway Unified expected to announce new superintendent on Oct. 10,2024-10-01,https://www.sandiegouniontribune.com/2024/10/01/poway-unified-expected-to-announce-new-superintendent-on-oct-10/,en,2024-10-02 03:25:56.094759
ee5e50f87b831e430d7759f95769dd8aa7def1a575a480ed88f4080a410cd1bb,latimes.com,latimes.com,SoFi Stadium embraces hosting high school football games,2024-10-01,https://www.latimes.com/sports/highschool/story/2024-10-01/sofi-stadium-embraces-hosting-high-school-football-games,en,2024-10-02 03:18:54.922077
d08fa2a91c68e31d26c09a133c03cce0b657c93f0161201e055b00bd62a61079,usatoday.com,usatoday.com,Lauryn Hill sued for fraud by Pras of The Fugees over canceled tour,2024-10-01,https://www.usatoday.com/story/entertainment/celebrities/2024/10/01/lauryn-hill-lawsuit-pras-fugees-tour-canceled/75469715007/,en,2024-10-02 03:29:37.998179
70c2972e67f02e1c30bbafa5f493be7480551cf575892f8fe7762e58034cfad2,spectator.org,spectator.org,The Spectator P.M. Ep. 80: John Kerry Laments That First Amendment Is ‘Major Block’ to Stifling Speech,2024-10-01,https://spectator.org/john-kerry-laments-first-amendment/?utm_source=rss&utm_medium=rss&utm_campaign=john-kerry-laments-first-amendment,en,2024-10-02 05:17:53.095318
41a5e20ee21c0de73f1db549c8b191e2d86366308054ce919ddbbabef3631353,oregonlive.com,oregonlive.com,Downtown Portland hotel foreclosure rescheduled to late October,2024-10-01,https://www.oregonlive.com/business/2024/10/downtown-portland-hotel-foreclosure-rescheduled-to-late-october.html,en,2024-10-02 05:23:35.879940
b58f59f5edc6fc927913c78113b0c884a621452431d5d7fc009e96a181b5f3a5,rttnews.com,rttnews.com,Ionis Pharma Says FDA Grants Fast Track Designation For Zilganersen To Treat Alexander Disease,2024-10-01,https://www.rttnews.com/3478706/ionis-pharma-says-fda-grants-fast-track-designation-for-zilganersen-to-treat-alexander-disease.aspx,en,2024-10-02 09:27:35.962350
0b241fecc5d0d099a8efdfbdcf027a843af90de151bc87a7f9e375daef571637,benzinga.com,benzinga.com,Options Exercise Update At Harmony Biosciences: Jeffrey Dierks Engages,2024-10-01,https://www.benzinga.com/insights/news/24/10/41121231/options-exercise-update-at-harmony-biosciences-jeffrey-dierks-engages,en,2024-10-02 11:37:24.712013
e02c9524f351b89ae100eab8c71c6a50068d274aebaf2090a25ba17bf373911a,cnet.com,cnet.com,Best Gifts for Gamers 2024,2024-10-01,https://www.cnet.com/gifts/best-gifts-for-gamers/,en,2024-10-02 05:18:31.709036
c4d44168664b302ab8bea40c1eb9da5d31b440719e290a32f622350cc22be060,theguardian.com,theguardian.com,McNeal review – Robert Downey Jr shines in muddled AI-themed play,2024-10-01,https://www.theguardian.com/stage/2024/oct/01/mcneal-robert-downey-jr-play-review,en,2024-10-02 05:29:30.163969
15b2c5903b63270ac2bbf9a084571aa4f30a083e1d44fa1fddfe0bec90c292e5,pbs.org,pbs.org,Claudia Sheinbaum sworn in as Mexico's first female president,2024-10-01,https://www.pbs.org/newshour/world/claudia-sheinbaum-sworn-in-as-mexicos-first-female-president,en,2024-10-02 11:23:17.577123
eab4cff0bc772ba16412640aaf4f1050a1e7d651c385178106d6ced0586b1cb0,postandcourier.com,postandcourier.com,"The grace period for student loan payments is over. What to know,",2024-10-01,https://www.postandcourier.com/the-grace-period-for-student-loan-payments-is-over-what-to-know/article_2b909604-8047-11ef-9692-1f1a7419dc87.html,en,2024-10-02 05:22:47.653989
c5ba4b9917807e41f099ed88223bec01a36f56bdf2f8952200fc2b92ab1425ab,rttnews.com,rttnews.com,PTC Therapeutics Reports Filing Acceptance For Sepiapterin,2024-10-01,https://www.rttnews.com/3478776/ptc-therapeutics-reports-filing-acceptance-for-sepiapterin-quick-facts.aspx,en,2024-10-02 09:28:58.040538
920ee26196ddbf98eba66d9b94a1a836249bc0489d10b825c71e58770ad340b4,cnn.com,cnn.com,California sues hospital for allegedly denying woman emergency abortion,2024-10-01,https://www.cnn.com/2024/10/01/health/california-emergency-abortion-lawsuit/index.html,en,2024-10-02 04:28:44.712846
0be2e82a8a721d77fd3039601a8318e3cb69ddfc68d025f636638616aaf67759,benzinga.com,benzinga.com,"Commercial Heating Equipment Market to Reach $25.6 billion, Globally, by 2032 at 5.2% CAGR: Allied Market Research",2024-10-01,https://www.benzinga.com/pressreleases/24/10/g41123801/commercial-heating-equipment-market-to-reach-25-6-billion-globally-by-2032-at-5-2-cagr-allied-mark,en,2024-10-02 09:31:30.936962
79711e7e3a332e5f4ea877495dc1ad5f99c183c104c4493c603b99f7aa6ba08d,benzinga.com,benzinga.com,"Inspired Entertainment Secures NHL License, Expands Portfolio of Premier Sports Assets",2024-10-01,https://www.benzinga.com/pressreleases/24/10/g41116067/inspired-entertainment-secures-nhl-license-expands-portfolio-of-premier-sports-assets,en,2024-10-03 11:36:25.058870
b627f3ef0b93c01bfcd889747e930ae569abca2d0cf39c5017a5216ea98e5414,upi.com,upi.com,"Stellantis recalls 154,032 Jeep Wrangler, Grand Cherokee hybrids for fire risk",2024-10-01,https://www.upi.com/Top_News/US/2024/10/01/Stellantis-recalls-154K-Jeep-Wrangler-Grand-Cherokee-hybrids-for-fire-risk/7291727818967/,en,2024-10-02 10:58:02.190246
2c9b1a8defabad4c9a1fa9e2f197029364f5cca959208f7572dbcdbd4a54049e,breitbart.com,breitbart.com,Fact Check: Tim Walz Misstates Free Speech Test Under the Constitution,2024-10-01,https://www.breitbart.com/politics/2024/10/01/fact-check-tim-walz-misstates-free-speech-test-under-the-constitution/,en,2024-10-02 15:30:35.764524
fee78316d9e57522816b608ace12e67e5064f4feb5cdf35c7b4f08cdd8723420,stltoday.com,stltoday.com,"Box: Vianney 4, Summit 1",2024-10-01,https://www.stltoday.com/sports/high-school/boys-soccer/box-vianney-4-summit-1/article_303d7517-9fe9-553b-acd6-adfec46fb471.html,en,2024-10-02 10:57:51.627078
7d07751440b7b2e3135deca54bd4f1b0614465d80fd51e3b6fc2a0bac3260490,cbsnews.com,cbsnews.com,Reward increased to $45K for information leading to whereabouts of Nikki Anderson,2024-10-01,https://www.cbsnews.com/minnesota/news/nikki-anderson-missing-reward-increase/,en,2024-10-02 09:20:26.273107
19277aa2754a59d58d357cbc95be9bff0bd77256c0f0c6836245836157f13a55,nytimes.com,nytimes.com,"Diamondbacks owner takes blame for signing Jordan Montgomery, says it was ‘biggest mistake this season’",2024-10-01,https://www.nytimes.com/athletic/5810360/2024/10/01/diamondbacks-owner-jordan-montgomery-signing-mistake/,en,2024-10-02 04:33:08.885674
c56f12857a403f519977e42ea0edbccd8b3159805210318e4029d4a234d67439,nytimes.com,nytimes.com,"NHL rumblings: CBA talks, cap estimate, expansion, McDavid extension and more from Board of Governors",2024-10-01,https://www.nytimes.com/athletic/5811099/2024/10/01/nhl-cba-salary-cap-expansion-bog/,en,2024-10-02 04:35:08.909755
04160e70653f9959d0c4f5501d13873990ea4cf9a6f6abacf6d23fdaa168de1d,cbsnews.com,cbsnews.com,Who do the Phillies play next? An NLDS matchup with Rhys Hoskins or the Mets on deck.,2024-10-01,https://www.cbsnews.com/philadelphia/news/phillies-playoffs-brewers-mets-nlds/,en,2024-10-02 03:26:29.566133
605a1113309631631e92c8eb4332aa964cdd508a8464797883125680cc6cc273,npr.org,npr.org,'I'm a knucklehead': Tim Walz says he 'misspoke' about Tiananmen Square visit,2024-10-01,https://www.npr.org/2024/10/01/nx-s1-5135678/tiananmen-square-tim-walz-debate-2024-jd-vance,en,2024-10-02 10:39:33.424351
0eff2c4218f6f3ecd664b834d5aef566088c9c71130b841469bb795ca8dd00c4,businessinsider.com,businessinsider.com,25 increasingly efficient stocks with profitability heading into the Q3 earnings season: Goldman Sachs,2024-10-01,https://www.businessinsider.com/stocks-to-buy-returns-on-equity-q3-earnings-goldman-sachs-2024-9,en,2024-10-02 02:22:22.099927
3e4ba4a34619964856b57dcbf7bbb5ba4a4170f280ae01a7bc647eb73f4c86a9,twincities.com,twincities.com,Some of the most notable quotes from the JD Vance-Tim Walz vice presidential debate,2024-10-01,https://www.twincities.com/2024/10/01/vance-walz-vp-debate-top-quotes/,en,2024-10-02 05:22:42.998066
fadaf73d938f01698d92e6242cbd76a47e1a814579b9d70ed0f6315a73cf5e0d,forbes.com,forbes.com,How Ray Dalio Saved My Career,2024-10-01,https://www.forbes.com/sites/forbesbooksauthors/2024/10/01/how-ray-dalio-saved-my-career/,en,2024-10-02 04:28:38.142900
18a35cd229627179527b56d5326b885efabab382d1759c3382668a87fb756d89,freep.com,freep.com,Detroit Tigers now one win away from ALDS appearance in MLB playoffs,2024-10-01,https://www.freep.com/story/sports/mlb/tigers/2024/10/01/detroit-tigers-now-one-win-away-from-al-division-series-appearance-houston-astros-mlb-playoffs/75472270007/,en,2024-10-02 06:17:14.731310
83f95ad8788e5daf7ff99104f61a0f35d6686ade2f6c0b493127b2735cd81334,sportingnews.com,sportingnews.com,Flamengo: qual a decisão surpreendente do Flamengo sobre futuro de Filipe Luís?,2024-10-01,https://www.sportingnews.com/br/futebol-brasileiro/noticias/flamengo-qual-decisao-surpreendente-flamengo-sobre-filipe-luis/9d8ad11c256553a3987288df,pt,2024-10-02 09:20:26.952670
68af581494d3a6b65788fe9bb99eeb88a725f7de3dc0cd684a798e4a8ca4b2c5,cbsnews.com,cbsnews.com,North Texas teen paralyzed after diving away from a wasp returns home from the hospital,2024-10-01,https://www.cbsnews.com/texas/video/north-texas-teen-paralyzed-after-diving-away-from-a-wasp-return-home-from-the-hospital/,en,2024-10-02 05:22:55.792252
e29f92e407699437e68105d8bf5c9b29d3e461f158daae53b0f89bf2217c6403,benzinga.com,benzinga.com,Nike Support Level Due To Important Market Principle,2024-10-01,https://www.benzinga.com/trading-ideas/technicals/24/10/41119716/stock-of-the-day-nike-support-level-due-to-important-market-principle,en,2024-10-02 11:25:42.638592
8746a4efa85520a86b6598f125c726e7e3bff9bd36864aa903f0c57a17efa823,theguardian.com,theguardian.com,"Small firms face near-30% rise in water bills, Ofwat letter reveals",2024-10-01,https://www.theguardian.com/money/2024/oct/01/small-businesses-water-bills-england-wales,en,2024-10-02 05:19:20.549858
630eee33049ce55abfc2bd2fdb9a4e2c271ceeb9fc02eb01719d1108f124368f,usatoday.com,usatoday.com,"John Amos dead: 'Good Times,' 'Coming to America' actor was 84",2024-10-01,https://www.usatoday.com/story/entertainment/celebrities/2024/10/01/john-amos-dead-good-times-coming-to-america-roots/75469945007/,en,2024-10-02 03:29:23.005112
9429bbd7eb80b569c6c5b5181327b4006d47921748a1967fe3d738656b8a4bfd,townhall.com,townhall.com,Antony Blinken's Op-Ed Got Obliterated in Real-Time,2024-10-01,https://townhall.com//tipsheet/mattvespa/2024/10/01/antony-blinkens-op-ed-dropped-at-the-wrong-time-n2645586,en,2024-10-02 02:23:09.427667
